"Restaurant_Ratings","Restaurant_Quotes","Restaurant_Reviews"
"ui_bubble_rating bubble_50","La solita ottima cucina in una nuova affascinante location","Sono tornato dopo qualche tempo a rivivere l'esperienza strepitosa della cucina di Lino Scarallo, chef di Palazzo Petrucci, che però non è più a palazzo Petrucci. Già, il ristorante che aveva sede nello storico palazzo di piazza San Domenico Maggiore da qualche mese si è trasferito a via Posillipo, proprio a fianco di Palazzo Donn'Anna. Certo la sala non ha il fascino delle antiche volte della vecchia sede ma il panorama che si gode della terrazze ne ripaga ampiamente la mancanza. Ci sono tornato un sabato a pranzo insieme ad un amico. Accoglienza, come sempre, professionale e cordiale, servizio inappuntabile e dopo pranzo a scambiare quattro chiacchiere con lo chef che è venuto personalmente al tavolo per salutarci. Abbiamo scelto il menù degustazione affidandoci completamente a Lino che ci ha deliziato con le sue pietanze ricercate, fantasiose e, soprattutto, buonissime. Non sto qui a descrivere le varie portate tra le quali ho difficoltà a scegliere quella che mi è piaciuta di più. Vorrei ricordare una zuppetta di lenticchie e calamari, delicatissima e assolutamente deliziosa, e un trancio di cernia alle erbette bruciate. Suggeriti dal sommelier, l'attento Sergio, abbiamo bevuto uno chardonnay siciliano del 2011, perfetto per abbinamento agli antipasti e al primo, e un calice di Borro 2005, dal profumo spettacolare che andava benissimo sulla cernia. Dessert e passito all'altezza. Conto in linea con il livello del ristorante."
"ui_bubble_rating bubble_50","Stellato ","Locale bellissimo situato nel posto giusto, stella meritata, portate di altissimo livello, rapporto qualità prezzo giusto. "
"ui_bubble_rating bubble_20","Delusione","Siamo stati al Palazzo Petrucci per una cena la scorsa settimana.Purtroppo pur avendo una stella Michelin non è stata una grande esperienza per noi.Il risotto era imbarazzante, la zuppa di pesce crudo/cotto era buona certo ma non stellare. Camerieri impacciati ed invadenti.Non credo proprio che tornerò."
"ui_bubble_rating bubble_50","le stelle sono tante milioni di milioni....","siamo stati a pranzo approfittando di una visita a questa splendida città. tengo a precisare che i miei giudizi prescindono,nel modo piu assoluto,dalle qualificazioni stellari che i critici assegnano:io sono critico di me stesso e dei miei gusti in base ai quali affermo che in un posto sto bene e mangio bene. concordo con i giudizi positivi sulla disponibilità e l'educazione di chi è addetto al servizio;concordo altresì con quelli che dicono che si mangia bene. mi limito ad una piccola critica...ovviamente dal mio punto di vista!!! la descrizione del piatto va bene,ma è un pò pesante...sembra una poesiola recitata noiosamente :io la farei diversamente,tipo: le caratteristiche di questo piatto sono la freschezza del ecc.ecc.e la qualità del ecc ecc ; lo chef ha voluto accostare il sapore del...ecc.comunque riconosco l'eccellenza del posto,la disponibilità del personale,l'alta qualità della cucina e,se mi permettete,la meraviglia di un tavolo ben apparecchiato su una terrazza favolosa....di conseguenza assegno il massimo del punteggio,ci tornerò ed invito i viaggiatori ad andarci."
"ui_bubble_rating bubble_30","Serata con amici","Ci siamo strati venerdì con amici Location fantastica servizio impeccabile ...... Crudi buoni ma non eccezionali primo risotto banale e insapore grosso errore della cucina nel servire uno dei due risotti con gamberi ghiacciati"
"ui_bubble_rating bubble_50","La stella è davvero meritata","Partiamo dal luogo: il posto è incantevole, consiglio il pranzo più della cena per godere al meglio del panorama del Golfo.I piatti sono davvero ottimi, il menù degustazione permette di avere un' ottima idea di quella che è l'offerta per poter poi magari ritornare per approfondire. Il personale preparato ma non invadente. Meravigliosa la lasagnetta di mozzarella e gamberi crudi, davvero geniale; così come i tubetti ai cavoli. Menzione speciale per la pastiera stratificata.Carta dei vini interessante, abbiamo preso uno Chablis Grand Cru servito a una temperatura corretta.Unica pecca forse l'assenza della carta delle acque minerali, e si dovrebbe forse lavorare un po'di più sui lievitati, giocando di più sui classici rustici napoletani.Si ha, comunque, una sensazione diffusa di piatti molto equilibrati, che rispettano la importante tradizione partenopea reinventandola ma non stravolgendola. Penso sia questa la dote maggiore del ristorante. Menù degustazione 80€ a persona. Ma si arriva facilmente a 120 con i vini.Consigliato davvero."
"ui_bubble_rating bubble_50","Finalmente quello che mancava a Posillipo","Non potevo sperare di meglio per la mia recensione n.100! Palazzo Petrucci: la nuova location è bellissima, direttamente sul mare dove si può mangiare ammira do dalle grosse vetrate uno dei panorami più belli e suggestivi del golfo. Interessante e stuzzicante la cucina a vista, nella quale lo chef Scarallo dirige magistralmente una giovane e competente brigata.I piatti degustati sono un perfetto mix di sapori della vera tradizione napoletana , rivisitata in maniera magistrale e nuova dallo chef. Il risultato è superbo. Carta dei vini con più di 750 etichette e servizio attento ed all'altezza, rendono questo ristorante assolutamente consigliato e tra i migliori di Napoli in assoluto. Stella Michelin più che meritata ed i prezzi non sono eccessivi rispetto a quanto offerto. Ci sono ancora delle cose da migliorare ma....Ad maiora!!! ADVISED!"
"ui_bubble_rating bubble_40","Servizio impeccabile","Il locale è bellissimo e il servizio molto gentile. Siamo rimasti molto soddisfatti. La qualità buona, forse ci aspettavamo qualcosa in più ma sicuramente non deludente.Lo consiglio."
"ui_bubble_rating bubble_30","Rimandato","La location è spettacolare. Il personale è estremamente gentile e molto preparato. Sarà che siamo andati carichi di aspettative altissime ma un po ci ha deluso. Qualche piatto non era al livello del ristorante. Nulla di grave ci mancherebbe, ma merita un'altra visita. Prezzi alti alti"
"ui_bubble_rating bubble_40","Buonissimo ma non perfetto","In breve:- piatti molto buoni, ma leggermente deludenti- bel locale, elegante e raccolto- ottima carta dei vini- servizio cortese ma con qualche neoIl rapporto qualità prezzo non è dei migliori, forse un po' troppo caro per quel che offre.Nel dettaglio:Quando vado in ristoranti stellati preferisco prendere il menù degustazione, per avere modo di assaggiare più piatti e farmi un'idea complessiva dell'idea di cucina proposta dallo chef. Anche in questo caso mi sono affidato al menù degustazione, che però è risultato un po' deludente, specie rispetto agli altri ristoranti stellati di Napoli. Intendiamoci, ho trovato tutti i piatti molto buoni, ma mi è parso sempre mancare qualcosa, uno sprint, un fattore wow, un quid che ti fa pensare che quell'abbinamento che sembrava azzardato in realtà in bocca esplode e ti lascia un buon sapore che due giorni dopo ti svegli e te lo ricordi e ti vien voglia di tornarci. Ecco, questo l'ho trovato negli altri (due) ristoranti stellati di Napoli ma non qui. Peccato. Il prezzo poi è abbastanza alto, quindi il rapporto qualità/prezzo non depone a suo favore. La carta dei vini è ricca e varia, orientata soprattutto al territorio partenopeo (com'è giusto che sia), forse con ricarichi leggermente alti. Mi sono affidato al consiglio del sommelier, che è stato bravissimo nel cogliere il tipo di vino che avrei apprezzato e mi ha pertanto consigliato un prodotto eccellente che non conoscevo.Il locale è bello, piccolo, raffinato arredato con gusto, con la cucina a vista. Purtroppo la vetrata è piccola e i tavoli attigui sono pochi. Non ho idea di come sia il terrazzo perché era chiuso.Il servizio è stato impeccabile, come si conviene a un locale di questo livello. Unico neo è che in fase di prenotazione avevo chiesto un tavolo con vista, vicino alla vetrata, e mi è stato risposto che non c'era problema, ma che tanto tutti i tavoli sono con vista (che se fosse l'Unico di Milano - ventesimo piano con vetrate su tutti i lati - potrei crederci anche, ma non è questo il caso). Arrivati al locale, il tavolo riservato non era vicino alla vetrata perché i tavoli alla vetrata sono prenotati da settimane. Non potevano dirmelo quando ho prenotato? Non mi è sembrato molto corretto.Nel complesso ho mangiato bene e forse potrei tornarci per vedere il famoso terrazzo, ma sono un po' incerto."
"ui_bubble_rating bubble_50","MERAVIGLIOSO","Ristorante meraviglioso situato a napoli cucina spettacolare a cura dello chef stellato lino scarallo. Ristorante bellissimo consigliato agli amanti della cucina ad alti livelli."
"ui_bubble_rating bubble_50","Lino Scarallo...SANTO!!!...SUBITO!!!","da molti anni sono un affezionato cliente, e ho constatato sempre una costante eccellenza in questo ristorante...ma questa volta il mitico Chef Lino Scarallo ha superato l'insuperabile ( ovverossia gli spaghettoni di Gragnano con ostriche e tartufo bianco!)...appena saputo che erano in arrivo i ricci di mare ho prenotato; Lino non è semplicemente uno Chef, è un artista, e come tale quando sa che il cliente apprezza i suoi virtuosismi...crea i piatti con la massima arte; ovviamente non ho ordinato alla carta...ho solo detto al Maestro di fare lui..il risultato:-fonduta di mozzarella di bufala, riccio di mare, zenzero, sakura;-pancetta croccante e calamaro alla carbonara di riccio di mare;-filetto al caffè, riccio di mare, in guazzetto di friariello;-spaghettoni alla camomilla, rafano e riccio di mare;-pescatrice al limone candito, alghe e riccio di mare;-bisquit all'olio d'oliva, olive nere disidratate, sorbetto al mandarino, cioccolato bianco al rosmarino, arancia caramellata e disidratata;la nuova location è semplicemente spettacolare...specialmente di giorno! si mangia praticamente in mezzo al golfo; impeccabile il servizio, superlativa la cucina sia come tecnica che come materie prime...ma la vera eccellenza è l'arte dello Chef, un vero artista!"
"ui_bubble_rating bubble_40","Buono","Location incantevole splendida vista sul golfo. Lasagnette di bufala e gamberi veramente buone anche particolare la zuppa di patate e le seppie, fidelini al caffè particolari e spaghetti all'acqua pazza da riprovare mentre i paccheri al ragù niente di particolare. Baccalà arrostito nella media mentre la zuppa di pesce buona. Dolci di buona fattura. Anche se manca quel tocco in più di un ristorante stellato. Ma da tornare sicuramente"
"ui_bubble_rating bubble_50","Cena del mio compleanno","Siamo stati in questo stupendo ristorante per la cena del mio compleanno. Tutto ha superato ampiamente le nostre aspettative: la location, il cibo raffinato e la gentilezza del personale. È stata una bellissima festa"
"ui_bubble_rating bubble_50","Meraviglioso","Location speciale , cucina di richiamo partenopeo e servizio cordiale . Se si cerca un percorso enogastronomico campano di alto livello è il ristorante giusto. Ottimi i suoi piatti tipici: la lasagnetta di mozzarella e gamberetti , il pacchero con ricotta e concentrato di ragù e la pastiera . Bellissima la location . "
"ui_bubble_rating bubble_50","sempre ottimo","per chi cerca un percorso enogastronomico ricercato questo è il posto giusto, nuova location con terrazza sul mare e cucina sempre spettacolare"
"ui_bubble_rating bubble_50","Cucina raffinatissima...stellare!","Dovevo ricevere un amico proveniente dalla Toscana, che mi chiedeva di accompagnarlo alla scoperta della  nuova cucina napoletana, quella  stellare per intenderci, per cui la scelta è caduta su  Palazzo Petrucci. Una vista paradisiaca, con un panorama mozzafiato! Pietanze raffinatissime e gustosissime ma, come si sa, con porzioni che erano per lo più  bocconi. Ottima la carta dei vini. Varia la scelta dei dessert. Stella meritata! "
"ui_bubble_rating bubble_50","Una stella nel Golfo di Posillipo","Straordinaria la nuova location di Palazzo Petrucci, sulla spiaggia del bagno Elena di Posillipo di fronte a sua maestà Palazzo Donn'Anna. Ambiente piacevole ma elegante con cucina a vista per poter ammirare l'estro e la maestria dello Chef Lino Scarallo stella Michelin unitamente alla sua brigata. Le pietanze incredibili per le sensazioni olfattive e gustative che ti donano grazie all'uso della materia prima di assoluta freschezza e qualità. Serata di assoluto relax da ripetere ancora ed ancora in un ambiente suggestivo."
"ui_bubble_rating bubble_50","Wow ci ritornerò per provare il resto del menù","Sono stato in questo bel ristorante. Ambiente discreto e senza eccessi (quasi minimale) . Cucina a vista che non guasta. Malgrado il ristorante fosse pieno il Servizio e' stato perfetto. Ho apprezzato molto i tempi tra una portata e l'altro che ho trovato giusti senza attesa ne fretta (evento raro oramai).Per antipasto abbiamo ordinato il crudo con abbinamento di terra e la lasagnetta di bufala con gamberi su salsa di cavolo. Adoriamo le sperimentazioni ed abbiamo trovato sublime l'accostamento del crudo con le salsine di confettura del piatto come anche quello della bufala con i gamberi.Abbiamo preso un primo del menù : Fidelini al caffe con crudo di scampi ed un piatto fuori menu (del giorno): spaghettoni al riccio. Decisamente di alta classe i fidelini (spaghetti molto sottili) mentre un po' aggressivi i spaghettoni al riccio.Per secondo la scelta e' andata al pescato del giorno (ombrina) ai sentori di brace con cavolo rosso marinato e lemon crud. Ottima la cottura (quasi crudo) lasciando cosi il sapore del pesce inalterato e succulento. Il retrogusto del sentore di brace lascia in bocca una gradita piacevolezza ed amarezza cosi il vino (Gewurztraminer riserva del 11 Baron de Pauli - notevole potenza olfattiva e gustativa) si abbina perfettamente pulendo la bocca con la sua acidità e dolcezza poli-alcoolica. Buoni anche i dolci : Stratificazione di pastiera Napoletana e Bisquit all’olio evo, olive nere disidratate sorbetto alle arance e vellutata al rosmarino. Forse un piccolo appunto va fatto alla stratificazione della pastiera. La crema pasticcera e' un pò eccessiva. Avrei apprezzato un miglior equilibrio."
"ui_bubble_rating bubble_10","GRANDE DELUSIONE","Location sicuramente favolosa ma non illuminata quindi sera non si vede assolutamente nulla, il mio tavolo era davanti ai maniglioni antipanico di un uscita di sicurezza, il cibo con un sapore incerto ,lo spaghetto con i ricci di mare tanto decantati dal cameriere come freschi sapeva di tutto tranne che di riccio ad un prezzo scandaloso...in definitiva lo sconsiglio vivamente ,avrei dovuto prenotare la cena del mio matrimonio li ma ho cambiato idea!!!!"
"ui_bubble_rating bubble_10","Stella...cadente!","La location non sarà tutto, ma è sicuramente molto!Palazzo Petrucci in Palazzo Petrucci, ovvero a Piazza San Domenico, nel pieno centro storico di Napoli aveva il suo fascino ed il suo perché.Ora in via Posillipo, per quanto incantevole possa essere la spiaggia di Palazzo donn'Anna, il nuovo sito è a dir poco scandaloso. Innanzitutto, perché era un vecchio locale utilizzato per matrimoni di provincia: questa impostazione è rimasta tutta, tant'è che sabato scorso ce n'era uno...frequentazione da codice penale, frastuoni indescrivibili, insomma uno SCANDALO.E in più a ciò aggiungasi che la sala destinata alla ristorazione è priva di accorgimenti acustici, tanto da non poter parlare con il proprio commensale seduto allo stesso tavolo.E ora passiamo al cibo: stessi piatti di sempre, ma con meno amore e, soprattutto, prezzi inadeguati (un piatto di spaghetti coi ricci 35 euro!).Personale, per quanto accogliente, sicuramente non all'altezza anche nell'utilizzo, palesemente forzato, di un lessico che non appartiene allo standing.Non ho mai creduto nelle stelle Michelin, ora men che mai: a mio avviso gli assegnatari dovrebbero essere soggetti a revisioni periodiche molto accurate...Io, di sicuro, non ci tornerò mai più!"
"ui_bubble_rating bubble_40","Non vedo la stella","Abbiamo riservato un tavolo esterno con un panorama mozzafiato tra Vesuvio e Palazzo donn'anna. Il personale è stato gentile ed attento: c'era una formica nel piatto e subito ci è stato cambiato. Abbiamo ordinato due antipasti: gamberetti e mozzarella e crudo di pesce. Da bere moët e chandon. Per primo abbiamo scelto gli spaghetti all'acqua pazza con salsa wasabi ed il risotto con erba cipollina e pannocchia di mare. La location è ottima ed il personale gentile, ok per gli antipasti. Forse ci ritorno per il percorso degustazione, per scoprire la stella michelin assegnata. "
"ui_bubble_rating bubble_50","Ottimo ristorante.","Ho cenato presso questo ristorante ed ho ordinato una pizza (buonissima). Assolutamente consigliato per assaggiare la vera pizza napoletana.Ristorante messo di fronte ad una bellissima piazza. Se possibile, consiglio di consumare il pasto all'aperto."
"ui_bubble_rating bubble_50","Il meglio a Napoli","Per la prima volta nella nuova affascinate location a Posillipo. Che dire? La cucina di gran qualità mi è già nota e non posso che confermarla, ma la nuova location è unica, straordinaria a affascinante! Che tu abbia in mente una cena romantica o di lavoro, i tuoi ospiti saranno soddisfatti e grati."
"ui_bubble_rating bubble_50","Tutto Perfetto","Eravamo in 2Tavolo all aperto a pochi passi dal mare e con vista sul golfoHo visto raramente un posto così bello.Lo staff è preparato e cordiale il cibo davvero buono.Da provare gli spaghetti con i ricci ed i friarielli e la pastiera stratificata.Considerando il luogo, il cibo ed il servizio, il conto è più che onesto.Non vedo L ora di tornarci."
"ui_bubble_rating bubble_50","Splendido","Bellissima vista, elaborazioni molto interessanti dei sapori tradizionali, personale professionale, simpatico, disponibile. Prezzi in linea con l'offerta di livello."
"ui_bubble_rating bubble_50","Che vista e che classe!","Ero stato nel ristorante nel centro di Napoli ma ora che si è spostato a Posillipo direttamente sulla spiaggia e mangiare con il rumore delle onde da sottofondo è imperdibile. Cortesia, raffinatezza e.... provatelo. Un consiglio: bevete i vini campani es. Colli di Lapio. prezzo per un pranzo sugii 80 euro (antipasto, secondo e coccole)"
"ui_bubble_rating bubble_50","Meraviglia","Cibo ,posto ,personale veramente stupendo tornerò e lo consiglio vivamente a tutti ,non ve ne pentirete!!"
"ui_bubble_rating bubble_20","il cambiamento non giova","Sono stato in questo ristorante nella vecchia sede due volte... e non miha entusiasmato. nella nuova sede ancor meno. Sicuramente la location è migliorata di gran lunga avendo guadagnato una terrazza sull'arenile più bello e ambito del mondo (posillipo-palazzo DonAnna) con un panorama da cartolina. Il servizio ha visto l'aumento del numero degli elementi ma di scarsa preparazione.L unica persona con cui poter parlare di food e beverage è il metrè che però si barcamena per i 10/14 tavoli (un pò troppo pur elogiando la sua buona volontà). Cibo: il crudo è insapore, ridotto in numero di specie rispetto al passato, con aggiunte di creme e cremine di dubbio gusto. i paccheri ripieni sono un primo ormai datato.. lo spaghetto ai ricci con friarielli non emoziona...troppi ricci e poco equilibrio! Baccalà molto buono ma tenuto troppo sulla piastra, arriva a tavola quasi bruciato da un lato..Carta dei vini medio scarsa. Da un ristorante stellato si cerca il diverso, qualcosa di più, la piazza napoletana è abituata al meglio...spero che possiate stupirmi per ciò che mangio e non solo per il panorama"
"ui_bubble_rating bubble_50","Meraviglioso ","Meraviglioso...Tutto perfetto servizio di sala ottimo mai invadente ma molto professionale Con le giuste attenzioni Passando alla cucina cosa posso dire meraviglioso lo chef con i suoi piatti ci ha deliziato tt ottimo!Ci ritorneremo presto!"
"ui_bubble_rating bubble_50","Incantevole","Ho scelto Palazzo Petrucci per festeggiare un importante ricorrenza.Location strabiliante ( vista mozzafiato con il golfo di Napoli che sembra baciare il Vesuvio!!).Ci siamo deliziati il palato con le creazioni dello chef L. Scarallo. Formidabile la lasagnetta di bufala coi gamberi e il risotto. Divina la zuppa crudo/cotto. Infinita ed ottima la scelta dei vini ( abbiamo testato Malvasia pugliese, Chardonnet dell'Alto Adige e bollicine piemontesi come bevanda di benvenuto).La pastiera stratificata e i vari assaggindi psticceria napoletana hanno rappresentato il giusto epilogo di una giornata da ricordare. Davvero il TOP.Unica nota dolente il fatto che mi era stato esplicitamente detto, come da mia richiesta, che saremmo stati in terrazzA e cosi non è stato. Tuttavia, questo non mutabdi nulla il giudizio.A presto."
"ui_bubble_rating bubble_50","Un’armonia di sapori con un servizio perfetto","Non potevamo avere regalo migliore dai figli per il nostro anniversario: voucher per una cena con “degustazione completa” presso il ristorante “Palazzo Petrucci” a Napoli.Complimenti allo Chef che attraverso le varie degustazioni proposteci ha saputo essere originale ed innovativo anche nel rispetto della tradizione.Cito alcune preparazioni che ci sono particolarmente piaciute: Ricottina di bufala campana con crambul impastato con alghe al profumo di limone, il tutto ricoperto da polpa di riccio fresco; Formatino con fette di Mozzarella di bufala con interposto e ricoperto da strati di gamberi crudi e salsa di broccoletti; Spaghetti di Gragnano con filetti di gallinella all’acqua pazza e pomodorini essiccati; Tranci di ricciola al sentore di brace, ecc. Ogni piatto presentato in maniera impeccabile e servito con vini appropriati. L’unica pietanza chi ci ha lasciati un po’ perplessi è stata una specie di zuppetta con pezzetti di sgombro affumicato in salsa a base di frutto della passione, accostamento on po’ azzardato!Nel complesso è stata una serata piacevole e da ricordare non solo per la raffinatezza delle pietanze, l’inappuntabilità del servizio ma anche per la splendida posizione del locale, a due passi dal mare e la vista da un lato, di Palazzo donn’Anna, e dall’altro lato la splendida costa di Napoli."
"ui_bubble_rating bubble_50","Un'ottima scoperta","Abbiamo cenato con mia moglie in questo splendido ristorante aperto da poco nella nuova location decisamente splendida. Siamo stati accolti e serviti da personale esperto cortese che ci ha fornito spiegazioni sul cibo e consigliato pietanze e vino. I piatti gustati sono stati tutti di ottimo livello molto dall'antipasto al dolce, molto gustosi e delicati. Prezzo giusto dato il contesto e la qualità. Torneremo certamente."
"ui_bubble_rating bubble_20","acustica e atmosfera deludenti, ma piatti ottimi e scenografici, servizio maldestro","Premetto che le aspettative per un locale di questo livello, già noto in città nella precedente sede, sono necessariamente alte e si riferiscono alla voglia di vivere una esperienza gastronomica e conviviale completa. Una conferma e una sorpresa sono i piatti, ottimi e scenograficamente bellissimi, dagli antipasti ai dolci.Purtroppo, l'acustica non aiuta a rendere l'esperienza piacevole: pur con un numero di tavoli non eccessivo, risultava difficile parlare con i propri commensali e finanche ascoltare il personale che, con cortesia, ha spiegato più volte i piatti. Parimenti l'illuminazione non contribuisce per nulla a creare una atmosfera, nè intima, nè suggestiva, nè particolare. Infine i tavoli sono apparecchiati in maniera minimalista, forse troppo.Ultima nota: una volta pronti con le ordinazioni, tentati da una proposta extramenù del maitre, alcuni di noi (3 su 6) hanno ceduto hanno richiesto un assaggio di primo tra gli antipasti e i secondi (scelta già adottata da tutti). Con grande sorpresa il maitre non ha celato il suo disappunto, e ha evidenziato come tale richiesta avrebbe reso difficile servire con ordine tutti i commensali. Solo dopo che abbiamo, non senza aver manifestato una delusione, con decisione rinunciato all'assaggio di primo, è stata po trovata quella che sarebbe dovuta essere la soluzione naturale e si è recuperata la gaffe."
"ui_bubble_rating bubble_10","Vergognoso!!!!!!!","Ristorante con 1 stella(??????) a dir poco vergognoso!!!!!! Abbiamo cenato la scorsa settimana con 2 coppie di amici e il giudizio è stato unanime: come è possibile che questo ristorante abbia avuto 1 stella!!!!!???????!!!!!!??!! Ambientazione discutibile, servizio scarso e cibo pessimo ....l'unico elemento che denota la stella e' il prezzo( carissimo ovviamente il conto!!!)!!! Presentazione dei piatti ridicola ma soprattutto la qualità della cucina e' stata imbarazzante: risotto assolutamente insapore, ricciola secca perché super cotta, spaghettoni al granchio impiantati come nella peggiore trattoria e per concludere in bruttezza dei dolci disgustosi!!! Insomma esperienza decisamente da non ripetere e da non consigliare neanche al peggior nemico!!!!"
"ui_bubble_rating bubble_40","Manca giusto un quid","La location di Palazzo Petrucci è la location che mancava a Napoli.in riva al mare con vista su una delle cartoline più belle,davvero notevole ed emozionante(immagino in estate cosa possa essere).si scende con l'ascensore nell'album sala di impostazione elegante moderno ma non impostato.la cena ci permette di assaggiare piû cose dal classico dello chef stellato tipo la lasagne tra di gamberi fino alla rivisitazione della pastiera.tutto molto buono senza però arrivare all'eccellenza(un po' di gusto in più) ma quello che mi ha deluso di più è il servizio in sala per nulla di rango.mi riprometto di ritornarci per un giudizio più approfondito.conto onesto"
