"Restaurant_Ratings","Restaurant_Quotes","Restaurant_Reviews"
"ui_bubble_rating bubble_50","Un elegante viaggio tra i sapori della tradizione","Ero a Napoli con la mia fidanzata per il week end e, leggendo le ottime recensioni, abbiamo deciso di scegliere Palazzo Petrucci quale ristorante per la cena di sabato sera, prenotando la settimana precedente alla nostra partenza.Il locale si affaccia su una piazza del centro storico, gremito di turisti e di persone di ogni età che passeggiano sino a tarda ora per le vie ed i vicoli circostanti.Appena arrivati l'accoglienza è ottima, il personale si prodiga per far sentire gli ospiti a proprio agio senza mai risultare invadente o, peggio, eccessivamente ed inutilmente cerimonioso.Mentre sfogliamo il menu ci viene offerto un calice di ottime bollicine rosé accompagnato da una selezione di grissini a lievitazione naturale e fatti in casa (mais, semi di papavero e semi di sesamo) e, a seguire, un intrigante assaggio di filetti di ricciola marinati con cavolo rosso e salsa al prezzemolo.Decidiamo di optare per il menu degustazione (5 portate in totale) che lascia allo chef totale libertà circa i piatti da proporre (occorre segnalare eventuali intolleranze o ingredienti non graditi) e abbiamo chiesto al sommelier di proporci un paio di vini al calice in abbinamento.Iniziamo dunque questo viaggio tra i sapori partenopei con una lasagnetta di mozzarella di bufala e gamberoni di Mazara del Vallo, impreziosita da una salsa ai semi di zucca.Ingredienti freschissimi e dal sapore vibrante, la delicata sapidità dei gamberi trova un connubio perfetto con la dolcezza a tratti acidula della mozzarella e la rotondità della salsa.Come secondo antipasto ci viene proposta una zuppa di cicerchie (un legume caratterizzato da un sapore misto tra fave e ceci) con seppioline e crostini al nero di seppia. Notiamo anche qui con piacere una grande armoniosità tra i sapori e le diverse consistenze: la rotondità dei legumi, la delicatezza del pesce e il croccante dei crostini.Il primo piatto non smentisce le attese create dagli antipasti: uno spaghettone di pasta di Gragnano con salsa di capperi, astice e crumble di pecorino. Oramai ricerchiamo in automatico i tre elementi gustativi-sensoriali ricorrenti, qui la rotondità è data dalla salsa ai capperi (morbida, avvolgente, intimamente legata alla pasta) mentre i frammenti di crumble e la polpa dell'astice seducono il palato grazie a note languide e sferzanti allo stesso tempo.Passiamo al secondo: filetti di triglia di scoglio con verdure croccanti. Pesce cotto alla perfezione nonostante e piatto cromaticamente molto d'impatto grazie al rosa/cremisi della pelle dei filetti a confronto con verde e giallo delle verdure.Unico appunto, ma si tratta di sfumature, l'interno di alcune patate era, per il mio gusto, non sufficientemente cotto.Dopo un pre-dessert a base di sorbetto al limone arriviamo al dolce, una rivisitazione della tradizionale pastiera napoletana realizzata stratificando in un bicchiere da Martini i diversi componenti-base della pastiera, dalla frolla alla crema.Esperimento ardito ma riuscito, un carosello di sapori e consistenze differenti che ha allietato il palato a coronamento di una cena superlativa.Grazie per questo viaggio nel gusto e nell'eleganza, ha reso speciale il nostro breve soggiorno a Napoli."
"ui_bubble_rating bubble_40","Serata stupenda","È la seconda volta che vado in questo ottimo ristorante tutto molto buono ambiente signorile personale eccellente cibo buono. Unico neo e' il primo piatto che è sempre un po' troppo delicato ( insapore ) Saluti alla prossima "
"ui_bubble_rating bubble_40","elegante ed accogliente","ottima location ottimo cibo veramente soddisfatto certo non economico ma il prezzo vale il servizio ed il cibo"
"ui_bubble_rating bubble_50","L'eccellenza del gusto","Ho cenato per la quarta volta in questo splendido ristorante dove: profumi,sapori,colori e cortesia si amalgamano in un piatto speciale dal gusto sublime.Il servizio eccellente,una fornita carta dei vini e prodotti di prima qualità rendono questo luogo speciale.L'unico neo è il conto forse un poco troppo elevato."
"ui_bubble_rating bubble_50","Qualità molto alta","Il locale, con ingresso e affaccio sulla bellissima piazza San Domenico Maggiore, è moderno con cucina a vista e piccola saletta al piano superiore.L'accoglienza e il servizio sono di buon livello, buona la carta dei vini.Il menù presenta piatti dagli accostamenti originali e intriganti: i piatti poi si presentano benissimo e sono anche porzioni adeguate, tranne forse gli antipasti.Personalmente ho provato la lasagnetta di crudo di gamberi e mozzarella di bufala, il risotto alle olive verdi burrata e acciughe e il petto d'anatra: tutto davvero molto buono e la qualità degli ingredienti usati si sentiva. Solo un personale appunto sul petto d'anatra: a mio avviso una delle fettine (che erano comunque 6-7) era troppo indietro di cottura, risultando anche molto difficoltosa da tagliare.Ho poi assaggiato anche altri piatti, mi hanno particolarmente colpito per la ricchezza dei sapori il ragù e l'agnello.Capitolo a parte per i dolci, davvero di ottimo livello e varietà, che spaziavano dai ricchi di gusto ai sapori delicati e originali. Nella prima categoria consiglio assolutamente la stratificazione di pastiera.Prezzi alti, sui 70 euro a persona compresa una bottiglia di vino da 35 euro, ma non altissimi e assolutamente rapportati alla qualità.Un avviso per chi è intrigato dal menù degustazione a 60 euro vini esclusi, non è possibile ordinarlo se non lo fanno tutti i commensali al tavolo."
"ui_bubble_rating bubble_50","Un viaggio nel gusto e nella qualità","Ci sono stato tre volte e il mio giudizio sul locale penso sia oggettivo.L'ultima volta in compagnia del mio Capo il 29 di luglio 2014.Il locale è curato benissimo, buona l'accoglienza e professionali il cameriere e il sommelier !Abbiamo preso due spaghettoni all'astice: piatto sublimedi secondo una triglia(era proprio una) e un piatto di formaggi misti: sublimi !Cassata e stratificazione di pastiera: non vi dico...... divine Alti, secondo me, i ricarichi sui vini per quanto la cantina consente un'ampia scelta !!!Il neo ? aggiungere una triglia o una fettina di formaggio non avrebbe guastato; è vero che è altissima qualità ma questo non deve significare che ti deve restare la voglia di mangiare ancora.IL LOCALE MERITA !!! I PREZZZI ALTI E COLLEGATI ALLA QUALITA'"
"ui_bubble_rating bubble_40","Ottimo il cibo","Abbiamo mangiato benissimo, tutto. Mozzarella di bufala con scampo crudo, passata di cicerchie, zuppa di cipolle, anatra, pacchero…. tutto ottimo, servito da personale molto cortese e professionale. Locale contemporaneo, ben arredato e colori rilassanti. Peccato la mancanza di finestre."
"ui_bubble_rating bubble_50","Merita !!!","Il palazzo è veramente fantastico! Mi ha colpito la cucina a vista ...e che dire delle portate? Semplicemente uniche...il personale gentile e preparato... tutto impeccabile! Forse non tutti possono permetterselo ....per ilcosto! Ma sinceramente merita anche per il prezzo!!! La qualità purtroppo si paga!!!"
"ui_bubble_rating bubble_40","Seppur buono, mi aspettavo di più da 1 stella michelin","Il ristorante Palazzo Petrucci si affaccia sulla splendida Piazza di San Domenico Maggiore.In qualche recensione vedo che si confonde questo ristorante con una pizzeria dal nome simile ma sono due posti completamente differenti.Già l'ingresso denota la caratteristica di locale dal bon ton.La saletta sul soppalco è intima e trasmette intimità anche se un pò poco climatizzata in estate, ma tutto sommato sopportabile. Anche le luci conferiscono un tono di intimità.Il menù è ambizioso e gli accostamenti riusciti.Materia prima, in particolare il pesce, di indubbia freschezza.Il menù degustazione, inclusa una particolarissima zuppa, è abbastanza chic e gustoso con un plauso alla presentazione dei piatti. Un ulteriore plauso va ai dolci, rivisti in una chiave degna del locale. Tuttavia non sono rimasto particolarmente colpito.Servizio buono ma con qualche pecca.Prezzo poco meno di 200 euro a coppia vino incluso e con qualche extra."
"ui_bubble_rating bubble_30","Da ritornare","Ho passato una bella serata in un luogo piacevole..........ci ritornerò.........serata passata in famiglia"
"ui_bubble_rating bubble_40","Eccellente","La piazzetta e ' strabiliante il ristorante non è da meno...assaggiato menù degustazione con alcuni piatti davvero ottimi : la mozzarella con i gamberi crudi, la pasta corta con zucchine provola fiori di zucca ed astice una squisitezza.... I dolci rivisitazione di classiche ricette - pastiera e cassata - e quello al cioccolato delle vere squisitezze. Sergio il maître sommelier e' di un competenza e gentilezza uniche. Consigliato davvero! "
"ui_bubble_rating bubble_50","Pizza napoletana ottima","Ristorante/Pizzeria in una piazzetta meravigliosa. Locale nuovo e pulitissimo. Camerieri molto gentili e cortesi. Pizza napoletana vera e buonissima. Conto assolutamente onesto. Consigliatissimo."
"ui_bubble_rating bubble_50","L'emozione del gusto","Non è facile provare emozioni intense attraverso il cibo, ma in questo ristorante è possibile. La presentazione dei piatti, gli accostamenti tra gli ingredienti, le cotture, gli aromi, le consistenze le scelte dei vini permettono di vivere un'esperienza emozionante. Abbiamo provato il menù degustazione dove è possibile gustare un antipasto, una zuppa, un primo, un secondo ed un dolce. Meritano una menzione la lasagnetta di mozzarella e crudo di gamberi, la passata di cicerchie con seppie e gli spaghettoni con salsa di cappero ed astice.Tutto il tavolo deve scegliere gli stessi piatti. Il prezzo è 60 euro a persona bevande escluse, ma li vale tutti. il locale è molto piacevole con la cucina a vista, il personale è estremamente professionale. Ottima la posizione nel centro storico di Napoli."
"ui_bubble_rating bubble_50","Mi manca, tornerò","A parer mio il miglior ristorante di Napoli, cucina e servizio impeccabili , ambiente adorabile e con la giusta compagnia diventa tutto praticamente perfetto! Consigliatissimo."
"ui_bubble_rating bubble_50","TOP!","A parer mio il miglior ristorante della città! Superlativa la cucina, ottimo il servizio, ottima la carta dei vini. Gentili, disponibili, professionali e alla mano allo stesso tempo. Insomma il TOP!"
"ui_bubble_rating bubble_20","Nulla-nulla- giustifica il prezzo..e la stella michelin","Come da titolo vi dico che per me nulla giustifica i prezzi stellari di questo ristorante. La location...a mio avviso lascia a desiderare, il servizio di certo non è dei migliori, la cucina è nel complesso buona ma nulla di autentico-eccezionale come si vuol far credere. Un tipo di cucina a mio avviso nn classificabile Cercano troppo il tocco di classe, la novitá..cercano di intonare note troppo difficili portando in scena piatti talvolta con poco senso compiuto. Se potesso consigliare direi di lasciare la novelle cousin per un po da parte e concentrare tutto sulla qualitá sulla completezza di un piatto..che spesso si compone di tanta tanta semplicitá. Insomma...lo boccio. Ci sono stato circa 3 volte due per lavoro.. E lo bocccio. Promuovo la PIAZZA DOVE E UBICATO. DI SERA E MAGICA."
"ui_bubble_rating bubble_30","mi aspettavo di più","ok servizio, bella carta vini, cucina gourmet ma niente di eccezionale, atmosfera un po' deludente, per come me ne avevano parlato in verità mi aspettavo di più, qualità prezzo troppo elevata...."
"ui_bubble_rating bubble_30","cena di laurea con sorpresa","Abbiamo deciso di festeggiare con i parenti (una ventina in tutto) la laurea di mia figlia un tranquillo mercoledi sera di luglio. L' addetto all'organizzazione dell' evento ci aveva garantito di riservarci la terrazza per offrire l' aperitivo se fossimo arrivati entro le 20-20,30 (dopo l' ambiente doveva essere convertito a pizzeria come già parte della piazza e gli ambienti coperti).I miei ospiti e io siamo arrivati con una puntualità quasi milanese per goderci tale piacere ed invece anche la terrazza era adibita a pizzeria ed a noi era riservato un angoletto dove abbiamo dovuto consumare in piedi tra tavoli apparecchiati, bambini che urlavano e correvano, cani languidamente sdraiati tra i tavoli e gente che arrivava abbigliata in maniera improbabile passando nel nostro gruppo vestito per la circostanza. Inatteso concetto di accoglienza da parte di Palazzo Petrucci!!!! Siamo fuggiti al ristorante dove lo chef ha cercato di farci dimenticare la pessima partenza. Che dire ???? Impensabile ed inqualificabile caduta di stile."
"ui_bubble_rating bubble_40","stellato...","ottimo per una cenetta romantica senza badare a spese... come tutti i ristoranti stellati i prezzi lievitano abbastanza. nulla da dire sulla cucina, i piatti della tradizione napoletana rivisitati dallo chef sono a dir poco sublimi, il personale è davvero molto cordiale, fatevi consigliare da loro per gli abbinamenti così da non mischiare i sapori per perdere il gusto. In due abbiamo preso 2 antipasti, 2 primi e 2 dolci con acqua e calice di vino per un totale di 95 euro a coppia, nemmeno tanto considerando il tipo di ristorante. unico appunto negativo sulla location, visto il targhet penso sia necessario un restailing della sala, troppo anonima, a mio parere, rispetto al gurmet."
"ui_bubble_rating bubble_30","Difficile mantenere lo standing","Siamo stati al Palazzo Petrucci richiamati dal prestigio della stella Michelin.Il ristorante si presenta all'altezza dello standing, per accoglienza, eleganza, sobrieta'.Tuttavia, non abbiamo vissuto una buona esperienza.La location e' prestigiosa, ma tutto sommato non panoramica come altri rinomati ristoranti napoletani (Il comandante, george's, sacrestia).Tutta la serata è stata segnata da piccole o grandi cadute di stile (sala in alto con aria condizionata accesa solo su nostra richiesta; ripetuta richiesta dell'acqua minerale che arriva con calma; vino arrivato al tavolo verso la fine dell'antipasto; ci portano pane alle nocciole, ne chiediamo dell'altro e ci dicono che è finito; il menu e' raccontato in maniera abbastanza frettolosa).Cibo buono e di stile stellato (vario, colorato, presentato in modo ricercato), ma non straordinario, seducente ma un po' manieristico: risotto non saporitissimo, manfredi con zucchine affumicate troppo poco). I piatti forti della carta, caprese con crudo di gamberetti e paccheri al ragu' sistemati in piedi come un timballo troppo simili a proposte di Iaccarino sentite al Gambero Rosso anni fa (di chi è il copyright dell'ottima idea?).Ma al di la' di questo, un episodio ci ha lasciati sconcertati: a fine serata abbiamo notato che la camicia bianca di un commensale si era completamente macchiata di nero all'altezza del gomito: colpa di riparazioni rabberciate alla gommalacca all'angolo del tavolo che, poi, abbiamo riscontrato essere presenti anche ad altri angoli dei tavoli affiancati su cui eravamo accomodati. Non e' tanto questo che ha stupito, quanto lo stile con cui e' stato gestito l'incidente ad essere stupefacente; anziche' scuse gentili e sperticate, ci siamo sentiti dire e' normale, non fa niente, non vi preoccupate la macchia si toglie. Esperienza vissuta da ristorante di segmento alto, ma alla fine non eccezionale e forse non all'altezza della rinomanza conquistata. Di conseguenza, è sato svantaggioso il rapporto qualita' / prezzo."
"ui_bubble_rating bubble_50","Vale il viaggio a Napoli","Sono stato a pranzo in questo ristorante in pieno centro a Napoli ed ho trovato un'eccellente cura del cliente, ottima location e piatti all'altezza della fama di un ristorante stellato. Abbiamo preso il menù a prezzo fisso (60 € a persona) ed oltre quello da noi scelto il cuoco ci ha voluto far testare una serie di piatti alcuni molto azzeccati altri ancora da definire. Premetto che sia io che l'amico che era con me siamo molto critici ed abituati a viaggiare e mangiare in ristoranti di tutti i livelli qualitativi, ma in questo era veramente difficile trovare una pecca. Non capisco i giudizi negativi.Complimenti allo staff."
"ui_bubble_rating bubble_50","Stella meritata","Prima di provare ho letto le recensioni su Tripadvisor, di cui alcune critiche.Poi un amico di Napoli che apprezza la buona e bella cucina me lo ha consigliato. Prenotare non e'stato un problema. Prima il Cristo Velato e Cappella Sansevero, San Gregorio Armeno, passeggiatina per Spaccanapoli. Poi accoglienza perfetta per cortesia. Alle 8:45 locale vuoto, poi arrivano altre persone. A Napoli si cena tardi.Il Patron di sala e'assai gentile e professionale, come il cameriere che assiste la mia cena. Ti illustra senza invadere, consiglia senza forzare, racconta i piatti, provenienze, inizia subito una gentile conversazione avviata da me, non forzata da lui. Cosi'puoi ordinare a ragion veduta. Ti da anche il giusto suggerimento sull'abbinamento del vino, che arriva a bicchiere e che, sia le bollicine sia il fermo, ti vien raccontato e presentato in modo che tu comprenda. E assaggio un fiano giovane di produttore e di produzione ed e'buonissimo.Arriva un bellissimo amuse bouche offerto bello da vedere perche'sono semplici alici crude, accompagnate da diversi condimenti che fanno del piatto una cosa bella da fotografare, cosa che io non amo fare, ma e'un piacere mangiare questo cibo semplice e speciale.Poi azzardo una sfida e prendo il cefalo arrosto e sono premiato dalla bonta' di un altro piatto di pesce povero che pero' e' di alto mare e ne ha il sapore, tanto che, cosa che non faccio mai, mangio oltre alla carne di perfetta cottura, la pelle arrostita. Il tutto su uno strato sottile di pomodoro cuore di bue campan ben marinato in sapiente condimento. Bello da vedere e armonia di sapori.Poi spaghettoni alla salsa di capperi dissalata e astice cotto e crudo. Anche qui vittoria su tutto il fronte. E poi dolcini e poi in un attimo comprende cosa intendo per un buon sigle malt e arriva una cosa preziosa e il caffe'. E cosi'si conversa ancora un po' sui piatti mangiati e sulla filosofia del buon mangiare. Due chiacchere anche con lo chef su esperienze comuni di altri luoghi del cibo.Poi pago 70 euro. Sacrosanti"
"ui_bubble_rating bubble_50","Tutta un altra storia....","Ristorante di livello internazionale... nulla da invidiare se non superiore ai nomi storici della costiera campana. Essendo in 4 abbiamo fatto un percorso di terra ed uno di mare... ed ogni pietanza era una scoperta di sapori.Servizio eccellente. Indimenticabile la pastiera liquida in un calice... dolci deliziosi e un ambiente raffinato e colto. Una eccellenza della nuova Napoli."
"ui_bubble_rating bubble_40","FANTASTICA PIZZA","In una location suggestiva, su un terrazzo a metà fra l'obelisco di Piazza san Domenico e la chiesa gotica di San Domenico Maggiore , abbiamo potuto gustare una delle migliori pizze di Napoli.Ottima la fritturina servita come antipasto, buona scelta di birre artigianali e, particolare non trascurabile nel panorama delle pizzerie napoletane, dove avere un buon dessert è un miraggio, abbiamo potuto gustare un dolce proveniente direttamente da Palazzo Petrucci ristorante e quindi semplicemente superbo.Ovviamente il prezzo è da rapportare alla qualità di quanto proposto.Superconsigliato."
"ui_bubble_rating bubble_50","Eccellente","Tutto perfetto....servizio,piatti,porzioni. Carta dei vini vasta e bene assortita con prezzi da stellato.....ottima la famosa pastiera scomposta....si paga ma ne vale sicuramente la pena"
"ui_bubble_rating bubble_50","Eccellente","Estrema cortesia dal primo momento in cui si varca la soglia del locale, mel pieno centro storico partenopeo. Una prima attesa iniziale, con immediate scuse cortesissime del direttore di sala, hanno lasciato spazio ad un gradevolissimo percorso di altissima cucina, dai sapori indimenticabili. Altamente consigliato."
"ui_bubble_rating bubble_40","Napli ce l'ha fatta.","Dalla spazzatura e dal degrado si aprono improvvisi squarci di bellezza e splendore;il ciarpame ed il chiasso dei decumani celano l'incomparabile bellezza del Cristo Velato o di Donnaregina : é Napoli.Piazza S.Domenico Maggiore con la possente abside medioevale della Chiesa che ospitò S. Tommaso d'Aquino e l'armoniosa facciata del Palazzo S. Severo del misterioso Principe di Sangro: il ristorante é in angolo. Da tanta bellezza non pupi che aspettarti il meglio e la legittima attesa non é delusa . La ricerca é svolta con gli ingredienti della tradizione on una piacevole sintesi di nuovo e classico. Una rivisitazione della tradizione ma con i sapori ed i colori di Napoli. Interessante la lista dei voni con ottimi prodotti del territorio. Simpatica la professionalità affabile del personale. Napoli ce l'ha fatta : é in cammino per ina nupva rinascita."
"ui_bubble_rating bubble_50","OTTIMO ristorante","non si può raccontare, bisogna solo andare di persona e lasciarsi coccolare dai sapori, dai profumi, dai colori dei piatti....ottimi i vini!"
"ui_bubble_rating bubble_10","che delusione !!!","Comincerei dalle luci del ristorante, troppo forti per creare un'atmosfera carina e rilassante rendono il locale freddo e poco accogliente. Abbiamo preso un misto di crudi molto deludente sia per la preparazione sia per la scelta dei tipi di pesce. Per secondo un semplicissimo baccalà con pomodoro completamente insapore con contorno di agretti molto salati. L'unica cosa che salvo è stata la mattonella di gelato anche se sicuramente ne ho mangiate di migliori. Tutto questo non giustifica affatto il conto molto elevato. Sicuramente è un ristorante da evitare"
"ui_bubble_rating bubble_50","Un viaggio....","Ci sono alcuni pranzi che rappresentano un viaggio nel dorato mondo dei sapori, un susseguirsi di emozioni che allontanano dalla realtà e ci conducono in un mondo parallelo...Questo è stato il nostro pranzo a Palazzo Petrucci....un menù degustazione con abbinamento di vini, ogni piatto una scoperta, ogni vino sapientemente scelto, tutto condito da professionalità e cordialità di camerieri e sommelier che forniscono indicazioni dettagliate su ingredienti delle pietanze, vitigni e tecniche di vinificazione...insomma un meraviglioso sogno ad occhi aperti..."
"ui_bubble_rating bubble_10","Pizza pessima","Il posto è incantevole , il servizio è pessimo personale scortese e senza dubbio una delle peggiori pizze mai mangiato in vita mia, ho mangiato una pizza in Romania superiore a quella che mi hanno servito qualche sera fa in questo locale .Sconsigliatissimo"
"ui_bubble_rating bubble_50","Stellato di nome e di fatto","Ci sono stato con la mia ragazza, è un ristorante caro ma ogni piatto vale ogni singolo centesimo speso, ho apprezzato molto la zuppa di patate trota affumicata e alghe fritte, in generale tutti gli accostamenti sono eccezionali, poi i vini abbinati ai piatti sono la ciliegina sulla torta, lo consiglio per le occasioni importanti."
"ui_bubble_rating bubble_40","Pizza al Top","Posso dire con assoluta certezza di aver mangiato la migliore pizza almeno finora. Non so se è la lievitizione (mi hanno detto 72 ore)l'acqua, la farina etc etc. ma è digeribilissima già mentre la mangi . Non mi è mai capitato , infatti, di ordinare una pizza e poi volerne un'altra. Leggerissima e di ingredienti buoni. Anche il tagliere di formaggi e salumi è stato apprezzato, ma meglio optare per un bis di pizza. Il locale è elegante e un pò sofisticato per una pizzeria anche se anche la pizza è un piatto nobile. Economicamente più conveniente optare per i vini rispetto alla birra poichè mentre per i primi c'è una scelta piuttosto ampia a seconda di quanto si vuole spendere , le birre sono solo artigianali (dunque buonissime ma molto care e piccole, al massimo 33cl). Ovviamente anche il conto non è da pizzeria del centro storico, ma il palato vi ringrazierà. Degno di menzione il personale, carino, attento e molto garbato."
"ui_bubble_rating bubble_50","Stelle a spaccanapoli","Abbiamo cenato a palazzo petrucci e siamo rimasti molto colpiti dall'eccezionale rapporto qualità prezzo che per un ristorante stellato si apprezza raramente. Aperitivo di benvenuto, antipasto di acciughe fritte ripiene di bufala, secondo di filetti di triglia su ortaggi e crema di mandorle,dolce, due bottiglie di vino e caffe: 60€ a persona. Cibo e accostamenti ottimi, servizio eccellente, la location manca forse un po di atmosfera. Da consigliare sicuramente"
"ui_bubble_rating bubble_30","Petrucci Pizzeria","Location magnifica in piazza san Domenico ma non direi la stessa cosa della pizza che non è migliore delle altre pizzerie in zona. Ottima disponibilità di birre artigianali.Gentili e simpatici i camerieri. Si paga caro il posto e il nome."
"ui_bubble_rating bubble_20","Esperienza pessima","Partita ricca di aspettative sono stata delusa su tutta la linea... Primo piatto salatissimo, secondi mal preparati e nell'antipasto a base di patate secondo me le patate erano acide. Discreto il dolce ma questo non salva il resto.Insensatamente caro.Bella la location e buono il servizio.In generale non tornerò e vi consiglio di non andarci!"
