"Restaurant_Ratings","Restaurant_Quotes","Restaurant_Reviews"
"ui_bubble_rating bubble_50","Una cena tra le stelle. ","In occasione del compleanno della mia ragazza, ho deciso di regalarle una serata speciale prenotando presso questo ristorante stellato, e speciale lo è stata per davvero. Premetto che ero alla mia prima esperienza in un ristorante stellato, ma è indescrivibile la sensazione di benessere e formale accoglienza che ci ha regalato il personale al nostro arrivo. Non appena scesi in ascensore nell'anticamera che da accesso al ristorante siamo stati accolti da personale giovane e cordiale che dal primo istante ci ha accompagnato con discrezione per tutta la serata. Location, inutile dirlo, fantastica, Via Posillipo il mare ed il golfo di Napoli, il tutto visibile dalla vista mozzafiato dell'ampia vetrata del ristorante. Abbiamo optato su consiglio del metre un menu degustazione, un percorso partito con assaggio di diversi tipi di pane, passando poi ad antipasti di mare e terra fusi alla perfezione come il tortino di gamberi e mozzarella di bufala. Non entrerò nello specifico di tutto ciò che il menù ci ha offerto, non renderei giustizia nella descrizione dei sapori, della presenzione e composizione di ogni singola pietanza. Ciò che posso raccontare è che per quanto neofita io possa essere, ho realmente avvertito, portata dopo portata, descrizione dopo descrizione, la sensazione di cosa sia un ristorante stellato. Ovviamente, mantenendo il filo di coerenza di questa recensione, il conto finale non poteva che essere stellato, spendere poco più di 100 euro a persona è qualcosa che, per le tasche economicamente poco arroganti di un dipendente statale risulta essere altisonante, per usare un eufemismo. Posso però dirvi che se potessi tornare indietro li spenderei nuovamente, perché hanno regalato, a me ed alla mia compagna di vita, emozioni di piacere misto a benessere che a distanza di quasi 5 mesi ancora ricordiamo, con un appagante sorriso sulle labbra. "
"ui_bubble_rating bubble_50","Anniversario Top","Che dire!!!! Sapori particolari mai provati dalla famosa lasagnetta di mozzarella e gamberi alle linguine con salsa al finocchietto e anguilla affumicata e agrumi....l'ombrina scottata in padella ma ai sapori di brace (genialata) con cavolo rosso è una salsa al lime spettacolare e per finire una stratificazione di pastiera sublime tutto condito da attenzioni e spiegazioni!!! Grande Chef Scarallo"
"ui_bubble_rating bubble_20","Peccato..","Purtroppo non posso dare un giudizio sulla qualità dei piatti serviti in quanto non ho mangiato in questo splendido ristorante. I fatti: ho telefonato giovedi 27/7 per prenotare un tavolo sulla terrazza, la ragazza che ha risposto mi ha spiegato che per poter mangiare in terrazza sarei dovuto arrivare fra le 20 e le 20, 30, dopo non mi sarebbe stato garantito il tavolo. Rispondo che andava bene e prenoto.Sabato mattina alle 11.40 vengo chiamato dal ristorante per chiedere conferma della mia prenotazione ( è la prima volta che mi capita..) e comunque confermo alla ragazza che sono già a Napoli e alle 20.30 mi sarei presentato puntuale al ristorante. Al mio arrivo (20.25) mi fanno accomodare in sala e io gentilmente spiego che avevo prenotato un posto in terrazza/veranda.Mi spiegano che tutti vogliono il posto in veranda e io, a mia volta, spiego che la mia era stata una richiesta specifica, bastava dirmi che non era possibile e io rimandavo la cena a Palazzo Petrucci alla prossima visita a Napoli.Per concludere , io capisco e accetto che ci possa essere stato un errore nel gestire le prenotazioni , ma un cenno di scuse da parte di qualcuno in sala forse era doveroso."
"ui_bubble_rating bubble_50","Alta qualità delle materie prime","Location suggestiva, pesce freschissimo servito con accostamenti spettacolari e ricchi di sapore. Dessert spettacolari. Consiglio la pastiera e la goccia. Personale molto professionale e preparato. Cantina fornitissima con ottimi pezzi di punta. Prezzi giusti in rapporto alla qualità di ciò che mangi. Tornerò sicuramente."
"ui_bubble_rating bubble_50","Un'ottima riconferma!","Con una improvvisata io e la mi fidanzata ci siamo recati al ristorante e nonostante non avessimo prenotato non hanno fatto alcun problema e ci hanno fatto subito accomodare. La sala era completa, tuttavia abbiamo atteso solamente 10 minuti scarsi per ordinare con tanto di scuse del personale per la lunga attesa da loro non contemplata in un ristorante del genere. Cena con percorso degustazione da 5 portate, cominciando ovviamente con l'entrèes (hanno avuto premura di servircene più di uno per farsi perdonare dell'attesa, che ripeto essere veramente breve). Lasagna di mozzarella e gamberi come antipasto, zuppa di patate e calamaro con caviale di aringa a seguire (provata in una precedente cena e trovata piacevolmente più saporita). Linguine con finocchio, liquirizia, arancia e anguilla affumicata, un piatto davvero particolare che letteralmente esplode di sapore al secondo assaggio, non fatevi ingannare dal primo morso che può sembrare non all'altezza. Filetto di ombrina scottato con erbette bruciate, parla da se. Infine pre-dessert e dessert a base di pastiera napoletana, presentata scomposta in un bicchiere da Martini. Il conto è in linea col ristorante. Da apprezzare l'accortezza che ha avuto il personale verso i clienti nel rimuovere la condensa dai bocchettoni dell'aria condizionata, tra l'altro è consigliata una chiacchierata col maître, davvero simpatico ed estremamente preparato. Cantina ottima. "
"ui_bubble_rating bubble_40","Una cena molto interessante","Abbiamo cenato in questo ristorante provando la cucina di chef Scarallo. Abbiamo cenato in veranda e la location non può che definirsi fantastica. Abbiamo scelto il menù di degustazione con crudita e devo dire che i piatti di crudo hanno certamente qualificato il menù. Qualità del pesce fantastico e ottimi abbinamenti. La cucina, nel suo complesso, mi ha certamente soddisfatto mentre quello che mancava per il voto pieno riguarda il servizio. Niente di eclatante ma in un ristorante stellato mi aspetto la massima cura verso il cliente. I ragazzi ci hanno invece semplicemente servito: poche spiegazioni sui piatti, più volte ci siamo versati noi da bere, ECC. Un po' di cura su questi particolari e credo che il ristorante possa avere belle soddisfazioni."
"ui_bubble_rating bubble_50","Ritorno sul luogo del delitto","Villa Caracciolo ospitò il nostro matrimonio e il per il giorno del nostro anniversario abbiamo scelto di prenderci una pausa dall'ordinario: siamo stati lautamente ripagati. La location è suggestiva e l'adiacente spiaggia dà una piacevole idea di vacanza, pur essendo in piena città. Lo staff è presente e discreto, professionale e affabile e accompagna in qualunque percorso ci si voglia incamminare. La carta dei vini assicura sempre il perfetto accostamento. Questa è la cornice in cui si matura quell'esperienza che abbiamo maturato nell'assaporare le portate, sia proposte dallo chef che scelte da noi. Non mi dilungo sui piatti - il lavoro dello chef Scarallo è ampiamente decantato su internet - vi dico semplicemente andateci con la massima fiducia: ne uscirete senza dubbio appagati. Un grazie a tutti per aver reso straordinario un giorno speciale e un particolare apprezzamento al ragazzo che mi ha aperto la cantina del ristorante: la passione con cui ha brevemente condiviso un po' di cultura del vino mi ha davvero colpito."
"ui_bubble_rating bubble_50","Esperienza da rifare","Cena di coppia, esperienza fantastica. sarà stato il panorama, sarà stato l ottimo servizio, sarà stato il prosecco freddo, sarà stato l ottimo cibo, sarà stato che me l ha data..."
"ui_bubble_rating bubble_30","Rapporto qualità-prezzo non adeguato","Intendiamoci, in tutti i ristoranti stellati di certo non mangi da scoppiare però se per mangiare assaggini molto ini ci metti anche dalle 3 alle 4 ore allora esci dal ristorante che hai già digerito e avendo la tasca vuota (il conto è comunque da ristorante stellato) non puoi nemmeno rimediare"
"ui_bubble_rating bubble_30","Sì può fare meglio","Per me non ci siamo proprio. La location in estate perde molto affacciando su un lido stracolmo. Menù molto corto ed opinabile quanto a risultati degli accostamenti. Prezzi assolutamente inadeguati. Servizio esageratamente didascalico. La parte migliore...una cantina di assoluto livello "
"ui_bubble_rating bubble_50","Sapori delicatamente incantevoli","Abbiamo fatto un percorso di menu degustazione ed è stato indimenticabile assaporare i sapori rivisitati della mia terra in modo delicato e professionale! Servizio ottimo, non troppo rapido, ma perfetto per gustare appieno del posto che offre il meglio del golfo di Napoli. È un ristorante stellato, non aspettatevi conti convenienti.."
"ui_bubble_rating bubble_50","Tutto ottimo e sofisticato ","Collocato in una zona molto bella e rinomata di Napoli, con una vista spettacolare sul mare e accesso diretto alla spiaggia. Location moderna, elegante e pulita.Si viene accolti e coccolati dal personale durante tutta la durata della permanenza. Il menù presenta una gamma di piatti con abbinamenti ben studiati e originali, accostando sapori di mare e di terra. Cibo ottimo e preparato con ingredienti di altissima qualità. Stupenda anche la cucina a vista da cui si può ammirare lo chef all'opera. "
"ui_bubble_rating bubble_50","Compleanno di classe e cibo ottimo","Ho prenotato per il mio compagno una cena per il compleanno. Non ero mai stata in questo splendido posto. Ci hanno accolto e fatto subito accomodare ad un tavolo vicino la vetrata che dava sulla spiaggia. Il servizio è impeccabile sempre attento! Abbiamo preso 2 menù degustazioni da 5 portate , con esplosione si carciofo, zuppa con carote e mandorle, dei tortelli con zucchine, pescato del giorno e una degustazione di dolci .... ! Lo chef unisce innovazione con la tradizione , i piatti sono giusti , equilibrati e tutti molto delicati . Il personale mi ha raccontato che loro provano i piatti personalmente e grazie a questi sanno esporli secondo le loro sensazioni ed emozioni. Gentilissimi . Forse l'unica nota che stona un po' (ma che risolveranno da settembre in poi) è l'illuminazione della spiaggia . Per il resto l'accesso alla spiaggia dal ristorante è incantevole. Serata magica e stellata. "
"ui_bubble_rating bubble_50","Semplicemente incantevole ","Quando si parla di ristoranti stellati è naturale aspettarsi qualcosa di particolare, ma , per esperienza dico che si corre anche il rischio di rimanere delusi, vuoi per le aspettative che esso comporta, vuoi anche per gli eccessi di alcuni chef che vogliono stupire a tutti i costi.Non è il caso di Palazzo Petrucci. Qui a stupire è senz'altro la location: un panorama mozzafiato tra i più belli al mondo ( per la mia esperienza il più bello in assoluto !)Notevole la cucina, un connubio di ricerca e tradizione, sempre equilibrata, mai eccessiva, un percorso sensoriale unico e avvolgente. Attento e cordiale il servizio, presente, professionale mai invadente. Giusto il prezzo! Abbiamo vissuto un'esperienza indimenticabile. Ci ritorneremo sicuramente! Meriterebbe almeno la seconda stella!"
"ui_bubble_rating bubble_20","No, delusione!","Delusione!Tutto molto sotto le aspettative: servizio ( a volte inadeguato e invasivo ), cibo ( ...., mi dispiace, ma non ho assaggiato qualcosa di particolarmente esaltante ), connubio<U+200B> di sapori ( credo che a volte non si dovrebbe far fatica a degustare ciò che si mangia; la semplicità aiuta tante volte! ), ....neanche la location mi è particolarmente piaciuta: anche, per esempio, la spiaggia davanti non è arredata a dovere ed è persino illuminata con lampioni da stadio e non con adeguata luce ( ..ad esempio candele...)! Mi ha semplicemente deluso.Mi dispiace."
"ui_bubble_rating bubble_50","Un compleanno top","Location pazzesca!la veranda direttamente sulla spiaggia di Posillipo rende ancora più gustosi i piatti già ottimi! Carta dei vini eccellente! Servizio scrupoloso e attento ma non invadente. Molto buoni gli antipasti in particolare la lasagna di bufala e gamberi e l'esplosione di carciofo! Tra i primi ottimo il risotto al latte cotto alla genovese con nero di seppia ! Dolci tutti buoni ma in particolare consiglio il cannolo allo zenzero! Sicuramente un locale esclusivo e costoso da scegliere per le occasioni speciali!Comunque top!"
"ui_bubble_rating bubble_30","Molto, molto raffinato.","Sulla qualità degli ingredienti, niente da dire: ineccepibile.Sulla loro carta dei vini, discorso identico.Servizio: vedi sopra.Quello che mi lascia un pochino perplesso è che alla richiesta: sono allergico ai crostacei, mi consigli qualcosa fuori menù perché quello inserito non mi alletta, il metre rimane un pò basito e cerca di convincerci ad ordinare comunque dal menù. Risultato: abbiamo ordinato dal menù, ma una caduta di stile da un ristorante così rinomato sinceramente non me lo aspettavo.Per il resto, dico davvero, nonostante io non sia affatto un amante dei crudi, e nonostante il menù ne è pieno, la qualità è davvero eccelsa. Prezzo €€€€.2 antipasti, 2 primi, 2 calici di vino, 2 acqua, 1 caffè 138 euro."
"ui_bubble_rating bubble_50","Fantastico","Un'esperienza culinaria fantastica in una location mozzafiato. Palazzo Petrucci si configura come il giusto posto per poter gustare i sapori del cuore di Napoli suggestionati dal panorama di Napoli. Consigliatissimo. Eravamo in due e abbiamo prenotato per le 20:00. Il personale è gentilissimo e molto preparato: ci hanno coccolato risultando socievoli e preparati ma non essendo mai invadenti. Abbiamo preso 2 antipasti (esplosione di carciofo e filetto di tonno) + 2 primi (entrambi il risotto) + 1 secondo (petto d'anatra) + 2 dolci e una bottiglia di falangina totale = 216€. Le porzioni sono molto abbondati e siamo usciti soddisfatti. La selezioni di pani offerti e l'entrée hanno fatto la giusta cornice alla cena. Davvero eccellente."
"ui_bubble_rating bubble_40","FAVOLOSO","Al di là dell'ottima qualità, lo chef è eccezionale e disponibile, piatti ben presentati e personale, molto giovane, ma preparato e gentilissimo, ho riscontrato quel qualcosa in più che non è facile trovare. Complimenti! La location che ospita il ristorante è splendida, dalla sala verandata si può scendere in spiaggia, poco curata, e, a parte la vista magnifica, è l'unica nota dolente però non imputabile al ristorante in quanto NON di loro proprietà. "
"ui_bubble_rating bubble_50","una piacevole scoperta ","per ben due volte con un gruppo di congressisti siamo andati a mangiare a Palazzo Petrucci, in due parole superlativo e spettacolare! solo la location varrebbe una visita, la spiaggia a portata di mano consente di fare un aperitivo in riva al mare, e che dire dei piatti, tutti superlativi, erano anni che non trovavo un ristorante in grado di stupirti senza invenzioni ed effetti speciali. grande cucina e cantina spaziale, quasi 30.000 bottiglie tra le due cantine. Bravissimi assolutamente da provare!"
"ui_bubble_rating bubble_50","Il top non c'è altro da aggiungere!","Recensire un posto così è davvero difficile, un ristorante stellato in una location particolare con una cura ai dettagli e al cliente.Scrivo questa recensione solo per consigliarvi la parmigiana di gamberi e mozzarella e la pastiera scomposta.Credetemi non c'è altro da aggiungere.Unico neo: il conto, ma si sa non ci si può andare a cena tutte le sere in un posto così.Se avete un'occasione da festeggiare non c'è scelta migliore.Fatevi riservare un tavolo esterno."
"ui_bubble_rating bubble_50","Favoloso ","Cena veramente indimenticabile. Location fantastica, qualità del cibo che conferma le attese che si hanno quando si prenota un ristorante stellato. Veramente bravi, complimenti."
"ui_bubble_rating bubble_50","Ottimo","Bellissimo locale . Ottimo sotto tutti i punti di vista. Qualità e cortesia. Assolutamente da consigliare."
"ui_bubble_rating bubble_50","Eccezionale ","Location suggestiva. È diventato il posto prescelto per le nostre cene di occasione. Personale gentilissimo e menù fantastico, compresi i piatti del giorno. Lo chef Scarallo è un direttore d'orchestra. "
"ui_bubble_rating bubble_50","confermo la positiva esperienza, anche se..........","tornato dopo qualche mese, confermo la positiva esperienza. Ottimo il ragu e lo spaghetto con l'anguilla. Cantina curata e all'altezza. Unica nota, comune a molti ristoranti specialmente a Napoli, l'acustica del locale che non è proprio all'altezza: con locale mezzo affollato, devi urlare per farti sentire dai tuoi compagni di tavolo"
"ui_bubble_rating bubble_50","Qualità e cortesia","Abbiamo festeggiato il battesimo di nostra figlia in questo noto ristorante napoletano. Noto per la qualità degli alimenti e per la splendida vista sul golfo con il Vesuvio sullo sfondo. Beh, che dire, sono stati in grado di confermare le nostre aspettative, con qualità, cortesia e competenza. Ogni piatto servito veniva spiegato con minuziosa cognizione del prodotto e delle sue origini. Ampia scelta di vini di qualità, con cantina a vista. Pienamente soddisfatti dalla location all'altezza dell'importanza dell'evento."
"ui_bubble_rating bubble_50","5 stelle perche la 6 non esiste...","esperienza da incorniciare,dalla a alla z,servizio inpeccabile e del cibo,che nella semplicita di cottura diventa indimenticabile."
"ui_bubble_rating bubble_50","Eccellente ","Posto incantevole. Cibo di qualità. Personale preparato e qualificato. Tutto ben curato nei minimi dettagli. 5 stelle meritate"
"ui_bubble_rating bubble_30","Senza infamia e senza lode","Cucina mediocre, buoni ingredienti ma niente di speciale. Personale gentile e disponibile. Bella location."
"ui_bubble_rating bubble_50","L'arte della cucina","Sono stato in questo ristorante in occasione di una cena di lavoro. Il locale, nella sua semplicità, è raffinato e molto ben arredato. Ci hanno servito una Lasagnetta di mozzarella di bufala campana, un tubettone con ragù di mare con praline di pesce scoglio ed un trancio di ricciola. Come dessert una goccia di cioccolato fondente ripiena di cioccolato bianco e cuore di lamponi. Tutto eccellente, ben presentato ed abbinato con vini di elevato livello qualitatitivo. Il servizio è stato impeccabile. Location eccellente per una cena indimenticabile! Lo consiglio vivamente."
"ui_bubble_rating bubble_40","Cena tra colleghi","Location spettacolare, servizio eccellente, aperitivo ed antipasto molto graditi, spaghetti con friarielli astice e rafano un abbinamento che non ci ha convinti, ombrina modesta, ci aspettavamo qualcosa di più. Pesce comunque cotto bene e fresco. Pastiera stratificata anch'essa poco convincente."
"ui_bubble_rating bubble_50","Stupendoooo!","Il posto è veramente meraviglioso, la posizione è magica, il panorama è mozzafiato! Difronte a palazzo Donn'Anna, siamo a Posillipo, non si può chiedere di più! La stella Michelin meritatissima, menù veramente ricco per tutte le esigenze. Personale delizioso, cosa chiedere di più ???"
"ui_bubble_rating bubble_50","Cena favolosa, location strepitosa","Sono stata a Palazzo Petrucci sotto consiglio di amiche (avevo comunque già letto recensioni molto positive) e devo dire che le aspettative sono state anche superate! A partire dal servizio che ho trovato eccellente; le pietanze ottime e presentate sempre con il massimo della cura; una cucina molto apprezzata perché si sentiva che le materie prime erano di gran qualità e preparate in modo sano; una location ovviamente stupenda che però da il suo massimo (secondo il mio parere) di giorno. Un locale raffinato ma non formale. Insomma mio marito ed io ci torneremo senz'altro!"
"ui_bubble_rating bubble_50","Una serata da favola!","Ambientazione favolosa: la sala è in pratica sulla spiaggia di fronte al palazzo Sant'Anna.Atmosfera calda e raffinata, con luci soffuse. Preparazione dei tavoli minimal ed elegante e portate fantastiche, perfetta sintesi dei sapori locali più autentici e dell'estro e della creatività dello chef! Perfino il pane, i grissini e i taralli proposti sono a prova di resistenza :-) Abbiamo cenato con antipasto di crudi di mare e calamaro scottato, poi io su consiglio del camerire ho preso linguine con anguilla, finocchio, liquirizia e arancia salata: uno spettacolo, era possibile sentire ogni singolo sapore senza che nell'insieme nessuno di loro fosse in contrasto con l'altro. ho dato anche una forchettata alla pasta (tre formati di conchiglie in un unico piatto) con patate e vongole veraci: stupende! Ho concluso con la pastiera destrutturata: anch'essa fenomenale.Che dire, tutto davvero all'altezza di una serata perfetta!"
"ui_bubble_rating bubble_50","Cucina di classe","La classe cucina napoletana rivisitata con un tocco di classe. Il locale e lo scenario meritano. Un paesaggio da cartolina in cui è avvolto questo locale molto raffinato. I patti sono ottimi e la qualità del cibo degna di nota. Il personale di sala molto gentile ed educato. Complimenti da uno chef stellato! Peccato per il parcheggio. Quando voglio stupire mia moglie so sempre dove portarla. A molto presto."
"ui_bubble_rating bubble_50","la perfezione","Napoli, senza dubbio una delle città più belle del mondo, e senza dubbio una delle città dove si mangia meglio al mondo. Palazzo Petrucci un esempio. Per gli amanti della cucina eccellente non fatevi mancare questo posto. Cucina rivisitata conservando sapore tradizionale. Vista mozzafiato. Andateci, e resterete senza parole. Rapporto qualita prezzo perfetto. Grazie"
"ui_bubble_rating bubble_40","Buona esperienza con qualche punto interrogativo","Sono stata in questo ristorante per una occasione speciale. la location è speciale, in riva al mare a posillipo. Non posso dire di essere rimasta pienamente convinta, ci sono state cose positive e cose meno. Intanto avevamo chiesto un tavolo vista mare, ma all'arrivo eravamo nel salone interno. Abbiamo provato la degustazione da 80 euro e siamo rimasti soddisfatti dalle materie prime veramente di alto livello ma non completamente soddisfatti dalla composizione dei piatti. Non tutti i piatti ci sono sembrati all'altezza della stella. Ottimi i gamberi di sicilia con mozzarella e la pasta alle acciughe di secondo un piatto a base di dentice. Meno soddisfatti del vino che costava molto. E stato servito troppo caldo almeno all'inizio e sinceramente non sembrava schiettissimo. Il servizio è comunque buono e abbastanza veloce."
"ui_bubble_rating bubble_20","Quando lo chef non c'è..","Sono stata da palazzo petrucci domenica scorsa, a pranzo, con il mio compagno. Ho prenotato con un paio di giorni d'anticipo chiedendo alla ragazza se fosse possibile un menu degustazione vegetariano per uno dei due ospiti. Mi è stato risposto di sì, che non c'era problema tanto basta togliere qualcosa dal piatto (testuali parole). La cosa mi ha lasciata un po' perplessa, perchè non è che funzioni proprio così, nell'equilibrio di un piatto non basta sottrarre. Ma ipotizzando che la ragazza che risponde al telefono non si occupi anche dei piatti, non ci ho dato tanto peso, confidando nella bravura dello chef Scarallo. Una volta arrivati al ristorante, guardando nella cucina a vista, noto che lo chef Scarallo non c'è, ma immagino che un ristorante stellato sia in grado di dare il meglio di se' anche in una situazione del genere. Al momento di ordinare, specifico al maitre la mia esigenza di un pranzo vegetariano, al che lui mi chiede se io mangi uova e latte con i suoi derivati, e gli dico di sì. Dopo le bollicine di benvenuto ed il pane, ci viene servito un piccolo entrée di benvenuto, e per errore anche a me viene portato del salmone crudo, sostituito dopo poco con una quenelle di melanzane a funghetto (fredde di frigo). Iniziano ad arrivare l'antipasto, la zuppa ed il primo, che stranamente sono 100% a base vegetale, non un ombra di uova o di formaggio di qualsiasi genere. E la cosa mi lascia un po' stranita. Mi arriva poi il secondo, anch'esso vegano (dei carciofi su una base di cous cous di broccolo romanesco), e a quel punto ci resto davvero male. Passa il maitre e mi chiede se va tutto bene, ed io gli faccio notare che il mio menu vegetariano si è trasformato senza motivo in un menu vegano. Al che lui mi dice: ma come? nemmeno un ombra di formaggio? niente niente?, io scuoto la testa e lui Allora vado subito in cucina, prima che come dolce le arrivi un sorbetto di frutta!. Insieme alla famosa stratificazione di pastiera napoletana, torna il maitre che mi dice: Eeehhh ha visto? Qui c'è ricoootta, uoooova! (come se così si compensasse il resto del pranzo) Guardi noi in cucina facciamo differenza tra menu vegetariano e vegano, ma lei sa come sono gli chef, quelli sono un po' pazzi! Magari la settimana prossima puo' tornare di nuovo a trovarci per darci un'altra possibilià!. Di scuse neanche a parlarne. Fosse stata una pizzeria o una trattoria, magari avrei potuto pensare di tornare. Ma visto il conto di 240 euro (che sarei stata BEN FELICE di pagare, se avessi mangiato ciò che avevo chiesto, perchè la qualità va pagata, e su questo non ci piove), non credo tornerò per tentare la fortuna, e sperare che stavolta tutto vada per il verso giusto."
"ui_bubble_rating bubble_30","Si può fare di più ","Pranzo di inizio estate in riva al mare. Peccato per la presenza di numerosi bagnanti, che alterano atmosfera e paesaggio. Abbiamo fatto un percorso degustazione di 5 portate, nessuna mi ha impressionato particolarmente, ma tutte comunque hanno un loro perché. Degna di nota la pastiera rivisitata, da provare. "
