"Restaurant_Ratings","Restaurant_Quotes","Restaurant_Reviews"
"ui_bubble_rating bubble_10","Ma di che vogliamo parlare?","Che l'impasto sia buono lo dicono gli esperti. Io dico che i tavoli sono attaccati, che gli ospiti si siedono e il tavolo non viene pulito, che il crocchettone dentro era freddo, che in bagno si deve andare con scarpe alte per l'urina sul pavimento, che gli ospiti sono accalcati all'ingresso, che il servizio e' scadente e sottodimensionato all'utenza, che tra i tavoli non ci si muove, che si deve sperare non ci siano mai emergenze perche sarebbe difficile uscire visti gli spazi minimi del corridoio. Era sabato a pranzo ma così non si dovrebbe lavorare!!"
"ui_bubble_rating bubble_40","Buona pizza. Attenti al super croquet (8euro!)","Personalmente tra Attilio e Al22 preferisco il primo. Locale piccolo (tempi attesa piuttosto lunghi). La pizza è buona particolare quella col cornicione ad 8 punte ripieno di ricotta. Mi son fatto portare anche il croquet gigante, ma sinceramente un'esagerazione 8 euro!La consiglio."
"ui_bubble_rating bubble_30","Nella media è la frase esatta.","Ci trovavamo in zona e per puro caso scegliamo di assaggiare la pizza da Attilio.Il locale è carino ed il personale è cordiale.Ordiniamo:Una cernevale (buona)Una pesto a filetto (un po' troppo pesante)Un acqua Conto in linea 17,5€La consiglio per chi si trova in zona, ma nulla di più."
"ui_bubble_rating bubble_30","buona pizza ma prezzi sopra la media","Nel cuore della Pignasecca, zona vicino Toledo ma piuttosto popolare di Napoli.La pizza è un po' più piccola della media ma l'impasto è buono ed è molto ben condita.Da provare il crocchettone, una crocchè gigante (da mangiare almeno in 2) con interno di friarielli, salsiccia e provola (oltre le patate).Locale molto piccolo e affollato nelle ore di punta, in gruppi numerosi (oltre 7-8 persone) potreste trovare difficoltà a trovare il tavolo.Unico neo evidente, prezzi un po' altini a differenza di altri posti neanche tanto distanti."
"ui_bubble_rating bubble_50","Ottimo impasto","Ottimo impasto del calzone Meravigliao che ho deciso di prendere. L'ho trovato del tutto digeribile. Buona la cassata napoletana cotta in forno.Mi era già stato segnalato come uno dei must della zona. Inoltre i prezzi davvero bassi (vengo da Roma!). 13.50 euro un calzone, una sprite e un dolce. Fate un po' voi!"
"ui_bubble_rating bubble_40","da provare","dopo aver letto il nome di questa pizzeria in tutte le classifiche delle migliori pizze, partenopee e non, domenica scorsa, dopo una lunga ed intensa mattinata di shopping abbiamo deciso, con moglie e figlia, di provare di persona. tutto quanto letto ampiamente confermato: davvero buona la pizza, una giardiniera malvano con al centro una margherita e le punte ripiene di ricotta, ottimo anzi sublime il crocchettone. personale gentilo e cortese. forse i prezzi un pochino sopra la media. sicuramente da ritornarci e da consigliare"
"ui_bubble_rating bubble_40","Da provare","Quello che conta nelle pizzerie è la capacità di mantenere un certo standard di qualità quindi è da riprovare. Recentemente ho valutato molto bene una pizzeria di via Caracciolo, ci sono ritornato e questa volta era pessima. Quindi anche qui tornerò anche perchè devo dire che il locale è delizioso e poi si trova all'inizio di una zona tra le più interessanti di Napoli.Il prezzo è decisamente buono in un rapporto con la qualità."
"ui_bubble_rating bubble_40","Pizza verace","ottimo il crostone di patate salsiccia e friarelli.La pasta della pizza è molto leggera e digeribile.Simpaticissima la proprietaria sempre col sorriso anche nel caos delle tante persone che si accalcano alla porta.Torneremo"
"ui_bubble_rating bubble_40","viaggio di piacere","le pizze sono buone veramente .con due piccole sale servizio veloce un personale disponibile simpatico veloce l'attesa 20 minuti x una margherita ed un ripieno una coca una minerale prezzo ok"
"ui_bubble_rating bubble_20","Una delusione","Locale storico presente nel quartiere Pignasecca, vicino l'Ospedale dei Pellegrini...era la prima volta che andavamo. Ci siamo subito accomodati perchè era presto. Locale con due piccole sale. Abbiamo preso due margherite (costo 5 euro ognuna), 2 coca (2 euro a pezzo), coperto 1 euro a persona, 2 crocchè (1,50 a pezzo). Pizza piccola, con poco olio e poca mozzarella (fior di latte).Crocchè solo con un pezzetto di mozzarella, poi prezzemolo e pepe. Prezzi alti per la qualità del prodotto e per il posto dove si trova. A via Tribunali avrei pagato il 30-40% in meno ma con una pizza molto superiore.Mi sarei aspettato molto di più da un locale storico e per di più presente sulle varie guide.Fanno la ricevuta fiscale."
"ui_bubble_rating bubble_30","Pizze piccole","Le pizze sono veramente buone e sottili ma sono più piccole del piatto e in aggiunta prezzi sopra la media locale. Servizio cortese e veloce."
"ui_bubble_rating bubble_40","ottimo, da ripetere","ottima scoperta in una delle strade più antiche di napoli. Contrariamente a quanto pensavamo ( dato quanto il posto è rinomato) l'attesa è stata media ( un 30 minuti) e onesta ( nessuno che passa avanti perchè è cliente fisso). La pizza è una assoluta delizia, tipica napoletana e non c'è molto da aggiungere, basta provarla. Servizio velocissimo ed impeccabile, c'è il cameriere che è un mito, veloce, efficiente, ricorda tutte le comande a memoria. Prezzo ben più che onesto. 10 euro per una pizza ( salsiccia e friarielli) e una coca"
"ui_bubble_rating bubble_50","Chef Gaetano Solito","Ho mangiato tante volte la pizza da attilio loro sono l esmpio della tradizione della vera pizza!!!Dove l arte e una ruttina giornalieraDove la passione e stampato nel dnaDove puoi gustare la vera pizza!!!Tolgo l occasione per salutare !!!!A tutto lo staf e dire grazie di tuttoChef Gaetano Solito"
"ui_bubble_rating bubble_40","Buona pizza!","Ho mangiato al volo una buona pizza Da Attilio, insieme a dei cari amici.... la consiglio! Ci ritornerò anche se a dire il vero per incomprensioni con i camerieri uno dei miei amici è rimasto un tantino deluso in quanto ha trovato la sua margherita un po' piccante (io l'avrei fatta tornare indietro), forse un errore di ingredienti ! Purtroppo a Napoli non tutti sanno fare una buona pizza ma credo che Da Attilio sia comunque buona...almeno la mia lo era! :D"
"ui_bubble_rating bubble_40","Una pizza al volo","Mi trovavo in giro da quelle parti e visto che ero solo di passaggio a Napoli, decido di concedermi una bella pizza. Guardando i prezzi l'ho trovata un tantino cara e sinceramente mi ha un po' delusa non a livello di impasto ma di condimento. La ricordavo diversa, ho ordinato una diavola e dopo un quarto d'ora mi è stata servita una pizza con poca mozzarella e annacquata, il salame galleggiava nell'olio al peperoncino fra l'altro non menzionato negli ingredienti della pizza. Ma non importa non credo proprio di ritornare."
"ui_bubble_rating bubble_50","Maestro pizzaiolo","Amo la pizza, a Napoli ho avuto la fortuna di mangiare in quasi tutte le migliori pizzerie e Attilio credo sia tra le migliori. L'impasto è fantastico digeribilissimo, gli ingredienti sono freschissimi e la qualità della pizza rispecchia a pieni voti la ricetta originale della tradizione napoletana. Lo consiglio assolutamente però cercate di evitare di andarci il sabato perché l'attesa per sedersi è lunga."
"ui_bubble_rating bubble_40","Buona buona buona!!!","Ho provato tantissime Pizzerie a Napoli ed é difficile trovare una cattiva pizza ma a volte un impasto troppo elastico rende la digestione poco piacevole.. Questa pizza invece è perfetta! La trovo buonissima! La consiglio!"
"ui_bubble_rating bubble_40","Pizza eccezionale","La seconda volta che ci sono stato ed ho sempre mangiato una pizza ottima con buoni anche gli antipasti unico elemento che non mi ha fatto inserire la quinta stella e' la zona essendo al centro e' difficile da raggiungere con auto o molto ... Ma la qualità della pizza compensa questa carenza..."
"ui_bubble_rating bubble_50","La pizza che preferisco","A pochi passi dalla centralissima via Toledo, questo storico locale, piccolo ma accogliente, è gestito sempre dalla stessa famiglia (interamente impegnata in sala e in cucina) e mantiene da anni una qualità costante. Tante, le pizze offerte nel menù, il cui segreto è la leggerissima pasta, ben lievitata e cotta a puntino. Quelle che io preferisco, sono: ricotta e cipolle, assolutamente da provare; zucca, noci e conciato romano, una delizia. Una menzione particolare merita l'ottima e profumatissima marinara. Insomma, un posto da consigliare, non solo per la bontà della pizza, ma anche per l'onestà dei prezzi e la grande cortesia dei proprietari"
"ui_bubble_rating bubble_40","Pizzeria di nicchia","Ottima pizza fatta con ingredienti genuini. Da provare la pizza carnevale. Ottimo rapporto qualità-prezzo. Rientra, a mio avviso, tra le migliori 10 pizzerie di Napoli. Tempi di attesa buoni. Consigliato! "
"ui_bubble_rating bubble_50","Altro che Report !!","nel cuore della Pignasecca a Napoli, la tradizione della buona pizza senza i riflettori della TV. Attilio e' la prova che una eccellente pizzeria non ha bisogno del palcoscenico televisivo. Oggi vi parlo del rotolo con funghi porcini e salsiccia, un trionfo del gusto con una ricotta finissima e fresca di giornata. La pasta leggera e la cottura perfetta fanno di questa pizza una prelibatezza da provare. Abbiamo concluso con il super crocche' dalla doppia impanatura; squisito. Prezzo: 12 euro cadauno con bottiglia di birra."
"ui_bubble_rating bubble_50","Pizza da sogno!!","Sono tornato da Attilio dopo qualche mese per riprovare la pizza e, come la volta precedente, ho bissato la favolosa pizza Sole con le punte ripiene di ricotta. Un'amica campana mi ha confermato che quella era la miglior pizza che mai avesse mangiato in vita sua...!"
"ui_bubble_rating bubble_50","Buonissima pizza con tradizione","Da napoletana che vive a Madrid sempre mi manca la pizza, la vera pizza!Da Attilio sempre trovo un'accoglienza familiare, una pizza buonissima, vera e tradizionale, con prezzo ottimo e questo è il motivo per cui torno sempre che posso e ho portato tutti i miei amici a godersi un momento di vera napoletanità.Se pensate di visitare Napoli è una meta che non deve mancare e non solo per la buona pizza ma anche per il servizio: i camerieri sono gentili e attenti, cosa che apprezzo moltissimo e credo sia di gran aiuto al momento di vivere una buona esperienza.Andateci e mi fate sapere!!"
"ui_bubble_rating bubble_10","Non ci ritornerò!","Sono stata qui oggi, 8 novembre, a pranzo, con dei miei vecchi compagni di classe. Eravamo in 13 e ci abbiamo messo un bel po' per entrare. Siamo venuti qui perché una mia amica conosceva il posto e ne aveva parlato bene e qui su tripadvisor ne parlavano bene. Abbiamo dovuto scrivere noi le ordinazioni su dei pezzi di carta... Nel locale faceva caldissimo. Ho deciso di provare due pizze dividendo a metà con una mia amica una margherita e una pizza crocchè. Nella mia metà di Margherita ho trovato un capello(che non era assolutamente mio perché era molto più corto dei miei capelli), il cameriere ha voluto vederlo prima di portar via la pizza. Mi ha detto che ne avrebbe portata un'altra, ma non si è più fatto vedere, e la pizza non è neanche stata detratta dal conto... Non capisco perché perdersi per una margherita da 5€. Inoltre, la pizza che poi ho assaggiato, non era neanche granché. Insomma: non lo consiglio, e non ci ritornerò!"
"ui_bubble_rating bubble_40","Signore e signori la PIZZA è servita!","Sono stato a Napoli di passaggio e sono capitato in via Toledo.Cercando una pizzeria su Trip ho scoperto questa piccola pizzeria molto modesta...ma non fidatevi delle apparenze...ho mangiato un ottimo fritto di crocchette e frittatine per iniziare per poi passare alla pizza.Tutto davvero molto buono,complimenti davvero...fritto asciutto e non oleoso e pizza napoletana DOC psta morbida e leggera!Consiglio vivamente questo locale."
"ui_bubble_rating bubble_50","Una Signora Pizza","Passeggiando per la colorita Pignasecca, abbiamo deciso di mangiare una pizza da Attilio. Siamo rimasti sorpresissimi: abbiamo mangiato una pizza ottima, leggera, servita da un cameriere molto cortese e professionale. Davvero penso che sia una Pizzeria dove andare per mangiare una Signora Pizza"
"ui_bubble_rating bubble_50","il meglio del meglio","A Napoli per lavoro,non potevo non pranzare da Attilio,raccomandato da miei clienti e devo dire che ho mangiato la pizza più buona della mia vita la migliore in assoluto e considerate le mie origini meridionali posso dire di essere un intenditore da ora tutti i giudizi sulle pizze avranno come metro di misura la favolosa pizza di Attilio.Consigliatissimo.Oltretutto anche economico."
"ui_bubble_rating bubble_40","Tra le migliori pizze a Napoli","La pizza e' sempre ottima, ben cotta, non bruciata, ben condita, non troppo oleosa. Se siete in zona pignasecca e' da provare assolutamente."
"ui_bubble_rating bubble_50","unica","locale tipico situato nella napoli centrale pizze speciali le migliori di napoli per me la n°1,prezzi nella media servizio veloce.Se siete a Napoli andare a mangiare la pizza a pranzo Da Attilio è la prima cosa da fare e solo dopo potete dire di aver visto Napoli."
"ui_bubble_rating bubble_50","Buona la prima!","Sono stato per caso in questa pizzeria verace napoletana, devo dire che secondo me è una delle più buone che ho mangiato fino ad oggi."
"ui_bubble_rating bubble_30","Almeno un gradino al di sotto","Sarò un po controcorrente ma la pizza di Attilio a me ha deluso molto. Presentata come una delle migliori pizzerie di Napoli onestamente credo abbia molto da invidiare ai grandi maestri della pizza.La pizza è piccola buona ma non eccellente. Quello che dico è che semplicemente a mio avviso non rientra nelle grandi pizzeria è nella media. Da provare la pizza stella, quella mi è sembrata la vera particolarità. Il locale, piccolo, ma caratteristico, tipico della città partenopea."
"ui_bubble_rating bubble_20","Deludente","Sono tornata in questa pizzeria a distanza di anni, per caso, sebbene non ne avessi un ricordo particolarmente positivo. Prendiamo un tavolo e ci fanno accomodare in una decina di minuti. La zona non è bellissima ma non particolarmente pericolosa, neanche la sera, il problema è il posto auto. Siccome il loro punto di forza è la pizza con le punte imbottite la mia scelta è andata alla giardiniera/Giardina, con le verdure. La delusione è stata forte quando è arrivata la pizza al tavolo: mi aspettavo verdure al Forno o fritte e mi sono trovato una pizza coperta grossolanamente da verdure sott'olio, tutte fredde, alcune gelide. L'impasto non era male, l'unica cosa che mi è piaciuta della pizza, ma il condimento era davvero terribile. Prezzi abbastanza elevati, una margherita 5euro non è poco, nella pignasecca poi, è anche le altre pizze sono abbastanza care. Il servizio non è molto preciso, il locale è piccolo ma pulito, con bagno microscopico.Sinceramente non prevedo di tornarci. "
"ui_bubble_rating bubble_50","Indimenticabile","La Pizza. Non credo ci siano tanti altri posti migliori di questo. L'impasto soffice e delicato, saporito ma leggero. La farcitura con ingredienti di un livello superiore. I bordi ripieni di ricotta sono da assaggiare perché è come provare un'emozione che il palato non dimenticherà. Il locale è piccolino ma assai caratteristico, conviene prenotare perché altrimenti scorre attendere un sacco. Ma sarebbe un'attesa ripagata al 100%. I prezzi sono assolutamente nella norma. Ricapitolando: ci tornerò! Non ve lo perdete. La Pizza con la P maiuscola. "
"ui_bubble_rating bubble_50","PIZZA OTTIMA","Sono andata in questa pizzeria a pranzo, è situata nella pignasecca (strada x andare a Montesanto). Quindi do sera non è molto consigliata. Abbiamo preso una bufala e la pizza degli appennini(a stella con le punte di ricotta). Impasto squisito,prodotti ottimi...consiglio pure la carnevale...Prezzi ottimi...max 10 euro a persona! "
"ui_bubble_rating bubble_30","Pizza buona…………ma la ricotta?","Locale nel cuore di Napoli, splendida l'idea del crocchettone (crocchè di patate gigante con salsiccia e friarielli); per le pizze c'è molta scelta e quella con otto punte ripiene di ricotta è molto originale. La pizza è buona e anche gli ingredienti, ma credo che finire la ricotta per una pizzeria che ha come pizza speciale quella con le punte ripiene di ricotta sia assurdo. Spero sia stato un caso!!!"
"ui_bubble_rating bubble_40","buonissima!!","Da Attilio è un altra pizzeria che produce le migliori pizze di Napoli..si trova nel cuore della pignasecca e la pizza è veramente saporita soprattutto quella col cornicione ripieno di ricotta. Servizio rapido, tempi di attesa un pò lunghi nei giorni feriali e prezzi bassi. Consigliato."
"ui_bubble_rating bubble_50","Rientra nelle top","Ho letto una classifica dove Attilio è menzionato addirittura al secondo posto come pizza migliore di napoli. La pizza è ottima, ingredienti eccellenti, ma non supera quella di Sorbillo né in gusto (questo però è un dato soggettivo) e né in prezzo (questa invece ...è un dato oggettivo). Attilio è più caro. Tuttavia ci si può andare, soprattutto per provare la pizza a 9 gusti, una sua specialità esclusiva"
"ui_bubble_rating bubble_50","attilio: la pizza","nato a napoli, vi abito e dopo aver mangiato la pizza in tanti locali, la conclusione è : Attilio sei unico; sapore, qualità, prezzo sono gli ingredienti. Vi renderete conto dell'ottima qualità quando la digestione non darà problemi, la pasta è realizzata con lievito madre; almeno 2 volte a mesedevo andarci, anche per l'odore e l'atmosfera: mio figlio quando rientra da Milano fa tre cose: vedere il mare, prendere un caffè e mangiare la pizza di Attilio."
"ui_bubble_rating bubble_40","Bravo Attilio","Locale semplice nel cuore di Napoli e tra le pizze ci sono delle idee molto originali e gustose. Attilio è un pizzaiolo per passione e si vede. Consiglio. ; )"
"ui_bubble_rating bubble_50","Eccellente pizza, solo un po piccola","Locale non molto grande, fortunatamente ci sono stato ad inizio settimana e mi hanno servito subito sennò non oso immaginare il bordello che si crea li fuori nel week end.Pizze di alto livello davvero Ottime, sopratutto l'impasto molto sottile e leggero ad alta digeribilità, non salate per niente cosa molto importante per una buona pizza, sennò si passa la nottata ad andare aventi e indietro dal frigorifero al bagno XD!Ingredienti usati tutti di buona qualità.Vi consiglierei come pizza Appennini, conciato e carnevale; come antipasto prenderei un bel crocchettone ripieno di provola, salsiccia e friarielli Eccezionale.Prezzi modici in 7 abbiamo pagato 75€ prendendo 7 pizze abbastanza costose, 1 crocchettone e 4 bottiglie d'acqua.Un unica piccola pecca secondo me è la grandezza potrebbe essere un po più grande non guasterebbe di certo XD, però per il resto ripeto ottima pizzeria."
"ui_bubble_rating bubble_30","Nella media","Sono stato a cena di sabato sera.Mi aspettavo qualcosina in più in generale la pizza è discreta Il crocchettone buono poi c'erano dei fagottini di pasta di pizza dei quali mi sfugge il nome che nn mi sono piaciuti per nulla ed erano pure freddi Anche se a una pizzeria storica è difficile chiederlo ma si potrebbe sicuramente dare di più"
"ui_bubble_rating bubble_50","Ottima pizza","Siamo capitati qui per caso con una coppia di amici e ne siamo rimasti stupiti.Personale simpatico,il locale rustico,niente di particolare.Ma la pizza è stata davvero strepitosa,in assoluto una delle migliori mangiate a Napoli!Da provare assolutamente anche il crocchè gigante ripieno.Prezzo nella media:per due cocacola,un'acqua grande,un crocchè gigante e 4 pizze elaborate abbiamo pagato 50 euro.da provare assolutamente!"
"ui_bubble_rating bubble_20","Molto rumore per nulla","Sinceramente fama non meritata, panzarotti pessimi, insapore e pizza mediocrissima. C'è ancora tanto tanto da lavorare, in un'altra città magari se la cava ma a Napoli davvero non arriva nemmeno alla sufficienza (anche per il rapporto qualità-prezzo).Dispiaciutissimo di stroncare, spero si tornarci e trovare una situazione migliore sia per il cibo sia per l'igiene (non ci hanno nemmeno messo una tovaglia, si mangia su plastica e non hanno nemmeno passato una pezza pulita tra i clienti precedenti e noi..)"
"ui_bubble_rating bubble_10","Mancanza di professionalità","Sabato sera dopo aver prenotato un tavolo per 9 persone alle 22 arrivo in pizzeria mi viene detto possiamo fare due tavoli?la mia risposta é no!! Alle 22.30 il tavolo ancora non é pronto mi viene solo detto dobbiamo aspettare....scelgo di andare via poco professionali"
"ui_bubble_rating bubble_50","wonderful ATTILIO ","Dopo tanto tempo io è mi moglie ci siamo concessi una serata da soli ed abbiamo scelto un posticino vicino casa e dato che abitiamo nel cuore di Napoli ossia la Pignasecca la nostra scelta è caduta dall'insuperabile ATTILIO. Abbiamo ordinato una 8 punte ripiene di ricotta ed al centro una salsiccia e friarielli ed una fritta completa e vi posso assicurare non c'è a Napoli centro e credo oltre due pizze così buone fatte con la vera passione del pizzaiolo Napoletano che oltre ha soddisfare il palato ti soddisfano Anke la mente, ossia Vi unisce i sensi del gusto e del tatto per raggiungere un 'apoteosi insuperabile. Per concludere e finire alla grande una bella frittura all'italiana. Un grande merito Anke a tutto lo staff cordiali gentili e disponibilissimi. Il conto?????? Vi stupirete "
"ui_bubble_rating bubble_40","una buona scoperta","Sono stata da Attilio un paio di mesi fa per la primo volta, non lo conoscevo, ci sono stata insieme ad amici che avevano già apprezzato la sua cucina...è stata davvero un'ottima scoperta! Pizza buonissima, superiore a tante pizze più rinomate a Napoli, leggera, gustosa e di dimensioni soddisfacenti, inoltre consiglio vivamente il crocchè gigante con patate e friarielli...una goduria!Ottima pizzeria della tradizione, ci tornerò molto spesso!"
"ui_bubble_rating bubble_30","Niente di che","Non so perché... Ma non ci ho trovato nulla di speciale nelle loro pizze. Però vorrei riprovare ad andarci per dare una seconda possibilita"
"ui_bubble_rating bubble_50","una delle più buone pizze di Napoli","la pizza è molto,molto buona, il servizio veloce e l'atmosfera bella. Il ripieno è insuperabile!!!!!!!"
"ui_bubble_rating bubble_40","Buona e da assaggiare","Sono andato con mia moglie e mio figlio neonato e ho trovato un servizio cortese e disponibile alle esigenze particolari di chi ha un bimbo in fasce. Locale grazioso, molto buona la pizza con pomodorini, salsiccia e cornicione con ricotta. Buonissime le fritture e, principalmente, i crocché. La zona è ben servita dai mezzi pubblici e non abbiamo fatto attesa (siamo andati prestissimo però). Da provare e ritornarci."
"ui_bubble_rating bubble_50","Pizza e crocchè spettacori!","Sono stata molto spezzo in questa pizzeria, sia a pranzo che a cena, il servizio è molto veloce e se si va di fretta si riesce anche a mangiare pizza e antipasti in 20 minuti, ma se invece ci si vuol godere il pasto si mangia in tutta tranquillità, senza clienti in piedi ti mettono fretta... il personale è molto gentile e simpatico, Attilio lavora a testa bassa e le pizze sono fatte proprio da lui, alza lo sguardo solo per accogliere i clienti con un bel sorriso. A parte il personale adorabile, la pizza è ottima ed è una delle poche che digerisco senza problemi (per chi non lo sapesse quando il lievito è usato male la pizza non si digerisce) e una chicca da provare assolutamente è il crocchettone con salsiccia e friarielli!!!"
"ui_bubble_rating bubble_50","La pizza piu speciale di Napoli","Ho mangiato in questa pizzeria consigliato da amici.Il locale è accogliete e il personale molto disponibile. Eravamo 3 e tutti abbiamo preso la specialità della casa cioè la pizza con le punte ripiene di ricotta. Io ho preso 'il sole nel piatto' i miei hanno preso l'apennina...Veramente la pizza più originale e ottima che abbia mai mangiato. La cameriera in seguito ci ha portato un enorme Crocchè anc'esso veramente ottimo. Penso sia Il Must di tutta Napoli...Tappa obbligata per i bongustai di passaggio a napoli!"
"ui_bubble_rating bubble_50","A Napoli la pizza è SOLO da Attilio!","Per quel che mi riguarda, pizza a Napoli=Attilio.Frequentare questo posto è una felice ricorrenza, Angela è una persona molto in gamba ed il suo staff vi saprà consigliare sul tipo di pizza da prendere.Ottimi anche i frittini(crocchè, panzerotti ecc)Ci torno sempre con molto piacere ed ogni volta è una lietissima conferma!"
"ui_bubble_rating bubble_40","Tra i migliori! ","Pizzeria storica della Pignasecca, vivace zona di mercato popolare a ridosso di piazza Carità. L'ho scoperta di recente e ne sono rimasto piacevolmente colpito. Locale spartano ma pulito, servizio essenziale ma garbato e informale. L'impasto della pizza ricorda molto quello delle pizze a portafoglio o  a libretto che si vendono in strada: gustosa, leggera e di buona digeribilità. Buoni gli ingredienti e il loro bilanciamento. Prezzi onesti. Molto simpatici e gentili i titolari Attilio e sua sorella. Mi sento di annoverarla tra le mie pizzerie preferite in città! "
"ui_bubble_rating bubble_40","Pizza spettacolare","In questa pizzeria ho mangiato una delle pizze più buone in assoluto.Locale semplice e molto frequentato.Pizza eccellente per non parlare della specialità di pizza con le punte ripiene di ricotta."
"ui_bubble_rating bubble_40","Pizza ok","Pizze buone, nella media delle pizzerie napoletane, i prezzi leggermente turistici. Locale piccolino ma non troppo affollato, camerieri cortesi (finalmente!). Da provare."
