"Restaurant_Ratings","Restaurant_Quotes","Restaurant_Reviews"
"ui_bubble_rating bubble_50","Eccellente a dir poco...","Sono della zona...La miglior pizzeria in assoluto...Pizza ottima personale super gentile cosa desiderare di più...!La mia pizza preferita ?! Fiocco tutta la vita ma nessuna pizza e meno delle altre!!!! "
"ui_bubble_rating bubble_10","Rispetto per il cliente","Premetto che la pizza e la qualità degli ingredienti è ottima, tutto sempre molto buono ! Sono stato un sabato sera in questa pizzeria per prendere due pizze da asporto per alle 20.30 pago e mi da il numeretto per l attesa, dopo 1 ora e mezza ancora non é arrivato il mio turno, capisco che sia sabato, ma il problema vero è proprio é Nicola che lascia passare troppi amici e conoscenti con i numeri avanti e non solo c è stata una persona che addirittura per scavalcare la fila grazie al amicizia con il pizzaiolo dopo la cassa é andato lui a portare l ordinazione al pizzaiolo, il tutto sotto il naso dei clienti che aspettano in maniera educata e rispettosa il proprio Turno.. oggi bisogna avere la raccomandazione anche per fare due pizze!! "
"ui_bubble_rating bubble_50","Grande pizzeria di quartiere!","Siamo originari di Soccavo, ottima pizza da sempre e buoni prodotti da sempre. famiglia molto calorosa che dispone di una pizzeria grande con molti posti a sedere.Buon servizio e prodotti sempre freschi! continuate sempre così!Un saluto staff Kest'è Valencia ristorante pizzeria napoletana."
"ui_bubble_rating bubble_30","Pizza da Asporto","Tutte le pizze sonno abbastanza buone considerato che abbiamo preso sempre da asporto e che non arrivavano caldissime"
"ui_bubble_rating bubble_50","Molta fila ...ma ne vale la pena","Pizza DOC a volontà. ...ho fatto più di mezz'ora di fila ma ci hanno servito la pizza in 4 minuti di orologio dopo l'ordine al tavolo. La pizza è ottima. Io ho preso pizza GiGINo. Ha i bordi ripieni e mozzarella DOC. Molto buona. Nel quartiere la pizzeria tira molto ed è sempre pieno. Doppio forno e 4/5 pizzaioli ai forni. Prezzi ottimi (3,5 euro la margherita). Soddisfatti!"
"ui_bubble_rating bubble_50","Pizza DOC","Ho scoperto questa pizzeria grazie al consiglio di un amico buongustaio.Devo fare i complimenti a tutta la famiglia che gestisce questa pizzeria con grande passione e professionalità.Il cliente percepisce subito una grande attenzione nella ricerca delle migliori materie prime trattate dai pizzaioli con equilibrio nel rispetto della tradizione ma anche con con una particolare vocazione all’innovazione.Eccellenti tutte le pizze assaggiate:la margherita, la Tonino (pom. Giallo, mozzarella e speck), la montanara ripassata al forno e la pizza ripiena di scarola fresca.Ideale anche per i bambini, infatti anche mia figlia ha gradito molto la pizza margherita ed il dolce.Ottimo il rapporto qualità prezzo.Ci tornerò certamente."
"ui_bubble_rating bubble_50","Il TOP della pizza a prezzo più che onesti.","Salve a tutti. Lo devo confessare e non posso farne a meno....UNA DELLE MIGLIORI PIZZE DI NAPOLI PER QUALITA' E CORDIALITA'...ci sono stato ieri sera con amici...e ho assaggiato una delle pizze speciali...era veramente buona, ingredienti saporiti...cotta in maniera eccellente...con un collaboratore in sala.. Mario..che è veramente bravo e garbato...se è vero, come è vero, che fa una ottima pizza, il tutto è reso ancora più garbato dall'onesta del conto...per nulla esoso....frittura 3 euro...birra 3 euro ...pizza 4/5 euro...con dieci euro passate una serata veramente gustosa....io ci sono stato e ci tornerò, .....convinto che sia tra le prime pizzerie di Napoli, grazie all'impegno del Maestro Pizzaiolo Nicola, all'ottimo Antonio ed all'inarrestabile, infaticabile, e garbatissimo Pasqualino. ..AD MAJORA!!!"
"ui_bubble_rating bubble_40","pizzeria","recandomi tutta la settimana in ufficio in quella zona, la pizza di Gigino e' d'obbligoNon mi ha mai deluso su nessun gusto...anche la fritta e' buona."
"ui_bubble_rating bubble_40","Una sorpresa!! ","Siamo stati in questo posto un paio di settimane fa. Abbiamo ordinato la rinomata “pizza chimica” che si è rivelata davvero sfiziosa, ottima e soddisfacente. Il personale è molto molto amichevole e cordiale...quasi ci siamo sentiti a casa!! Unica pecca la mancanza di spazio tra un tavolo e l’altro...ma sono sicura che questi ragazzi avranno modo di crescere e organizzarsi meglio! La consiglio!! "
"ui_bubble_rating bubble_50","Spettacolo","Da provare! Frittura buona e leggera. Impasto davvero eccezionale! Per una pizza fuori dal normale consiglio la chimica 4 spicchi diversi (dal ripieno fritto al ripieno al forno ed altri). Ingredienti freschi e di prima qualità."
"ui_bubble_rating bubble_40","Buono ","Abitando a Napoli ho assaggiato sicuramente di meglio però la pizza è ottima, unica pecca è il troppo olio. La location molto carina e accogliente, il personale rapido (fin troppo) ed educato. I prezzi sono accessibili a tutti infatti il rapporto qualità prezzo è notevole! "
"ui_bubble_rating bubble_50","Ottima pizza","Una pizza meravigliosa, abito qui è gusto la vostra fantastica pizza da sempre. Ingredienti e impasto ottimi!! Il menu da l'imbarazzo della scelta ma nel mio cuore (e nel mio stomaco soprattutto) c'è il ripieno, la stella e la chimica. Consigliatissima +++."
"ui_bubble_rating bubble_40","Originale nel proporre nuove pizze-Ma Sempre Tradizionali NAPOLI","Ho scoperto questa nuova pizzeria vicino casa mia, in passato essendo gestione diversa e prevalentemente friggitoria, non mi ero mai fermato. Con un gruppo di amici, e mio fratello Giorgio, ho fatto questa bella scoperta, è una pizzeria completa, pizza davvero eccellente nulla da invidiare alle pizzerie blasonate. Lo consiglio vivamente."
"ui_bubble_rating bubble_50","Serata stupenda","Ottima pizza leggera e con prodotti d.o.p.consiglio a tutti locale very good i piatti con le pizze sono vuoti abbiamo mangiato anche i cornicioni veniteci e vedrete"
"ui_bubble_rating bubble_40","Ottima","Ottima pizza un ambiente molto simpatico e cortese. Lo consiglio vivamente. Se si vuole apprezzare veramente il posto è meglio andarci nei giorni feriali. "
"ui_bubble_rating bubble_50","Pizzeria","Una delle pizze migliori che io abbia mai mangiato,consiglio vivamente a tutti di farci un salto e provarla"
"ui_bubble_rating bubble_40","Pizza DOC","È tra le pizzerie migliori della zona. Ottima la pizza, personale gentile e veloce. Per la prima volta abbiamo provato la DOC. Approvata!!! Bravi "
"ui_bubble_rating bubble_50","Pizza eccezionale!!","Pizza eccellente!! Rapidi, cortesi e piatti di alta qualità. La pizza vera napoletana, leggera e gustosa. Anche i fritti ed i dolci sono molto buoni. "
"ui_bubble_rating bubble_50","Semplicità e bontà ","Nella semplicità di una piccola pizzeria l esaltazione dei gusti napoletani....pizza stella il top da provare "
"ui_bubble_rating bubble_50","Il top del top","Pizza ottima e leggera, menù ricco ed invitante, ingredienti di prima qualità, locale pulito.Personale disponibile e simpatico.C'è solo un danno averla sotto casa: è una tentazione costante e giornaliera :P"
"ui_bubble_rating bubble_50","Ottimo","La nostra pizzeria preferita x tutto,prodotti di qualità,personale sempre attenti in tutto,cortesia,e poi una pizza eccezionale che consiglio a tutti di andare "
"ui_bubble_rating bubble_50","Bontà assoluta","Cortesia,qualità e bontà sono caratteristiche che contraddistinguono questa pizzeria e le loro pizze da tante altre che ci sono in giro.Non credo sia solo la mia di opinione, ma anche quella di tanti altri, vista la meritata affluenza che si trova andandoci.La consiglio a tutti !!!"
"ui_bubble_rating bubble_50","Senza spostarsi troppo","Tornati dal Trentino (dove purtroppo la focaccia viene identificata come pizza) avevamo un bisogno disperato di rifarci di tutti quei giorni senza la nostra amata PIZZA, stanchi e senza voglia di spostarci troppo, siamo andati vicino casa, da Gigino & figli, e allora si che ci siamo rifatti, davvero una buona Pizza, ottimo impasto, buona la qualità dei prodotti e buono anche il servizio, sicuramente continuerà ad essere un buon riferimento a Soccavo, grazie!!"
"ui_bubble_rating bubble_50","La miglior Pizza Napoletana ","Eravamo già stati clienti di questa pizzeria ma è d'obbligo scrivere una recensione perché si sono riconfermati i masterpizza di Soccavo e dintorni. Top la Gigino&Figli e la Carolina. Essendo emiliani, a detta dei ns amici della zona si contendono il primato questa pizzeria e la pizzeria Porzio a Fuorigritta.. ma devo dire che avendole provate entrambi, Gigino e Figli non ha non ha rivali in campo! Per di più sono anche cordiali e accoglienti con gli ospiti, qualità che non si trovano più ormai nel servizio clienti. Punto a favore, nell'attesa del tavolo ci hanno deliziato con zeppole e panzerotti fritti offerti dalla casa. Che dire, tappa fissa quando ci si ferma a Napoli! "
"ui_bubble_rating bubble_50","LA PIZZA!!!","Abito a Milano ormai da 8 anni...ma da Soccavese DOC ogni volta che torno a casa dai miei genitori la Pizza di Gigino è d'obbligo, da asporto o al tavolo, chimica o margherita, montanara o genovese è sempre un piacere riscontrare gusto e qualità dell'impasto e degli ingredienti.Per la pizza sono diventati un punto di riferimento per il quartiere...e ormai per tutta Napoli! STRA-CONSIGLIATO!!!"
"ui_bubble_rating bubble_40","pizza secondo la migliore tradizione napoletana","Su indicazione di amici mi sono recato da Giginoper mangiare una pizza secondo i canoni antichi.Giudizio positivo unanime,ottimo il fritto misto e la birra,buono il servizio,prezzi onesti,da consigliare."
"ui_bubble_rating bubble_50","Pizza TOP","Abito nelle vicinanze di questa pizzeria, quindi ci sono state tante volte, e la pizza è sempre ottima! Sempre pronti a proporre novità, nonostante la scelta tra le pizze sia già molto vasta; la frittura è ottima, sia da asporto che al tavolo e i dolci anche. Il prezzo è più basso di tante altre pizzerie secondo me, mentre la qualità dei prodotti è assolutamente sopra la media.La consiglio tantissimo, ci sono sempre tante persone in attesa ma ne vale la pena! "
"ui_bubble_rating bubble_50","Ottimo tutto ","Ottimo tutto ,dalla qualità dei prodotti , quindi un ottima pizza , alla cortesia e simpatia di tutto il personale . Consiglio vivamente a tutti di provarla . MC"
"ui_bubble_rating bubble_50","Ottimo cibo alto livello di cucina","Se volete mangiare la vera pizza napoletana venite da gigino e figli a soccavo troverete professionalità, prodotti sempre freschi e cortesia.L'unica pizza che si digerisce la troverete qui chi ama la pizza sa che se nn viena digerita bene e dovuta all' impasto e ai condimenti scadenti.Qui da gigino e figli troverete il top della qualita' i 3 responsabili NICOLA PASQUALE ANTONIO song e nummr 1."
"ui_bubble_rating bubble_50","Le specialità di Napoli","Davvero buona la pizza fatta come solo a Napoli la sanno fare.Tante varietà sfiziose accompagnate dai classici sfizi napoletani. Gli scugnizzi (listelle di pizza fritta) il fritto misto Napoli (zeppole, panzerotti, frittatine di pasta, frittelle alle alghe) e tanto altro.Sicuramente consigliato per chi ha voglia di una buona pizza anche a notte inoltrata."
"ui_bubble_rating bubble_50","un must","ormai io sono una cliente storica di questa pizzeria, ho visto muovere i primi passi a ragazzi che oggi sono grandi imprenditori, restando sempre umili e a stretto contatto con la loro clientela.in qualsiasi momento riesco a mangiare un ottima pizza, anche se incasinati da mille consegne sono sempre eccellenti e anche se qualcuno richiama x il ritardo mi sembra quasi una situazione normale vista la moltitudine di clienti che servono....sempre pieno tutti i giorni...ma loro sempre disponibili...lino un multitasking, Nicola che riesce sempre ad accontentare anche il palato più esigente e i ragazzi in sala sempre cordiali e gentili....io usufruisco quasi sempre del servizio a domicilio, ormai conosco i loro orari e mi anticipi nell'ordinare la pizza così da non dover aspettare....di ritorno dalla Sardegna ho prenotato un tavolo e mangiato una fresca pizza a modo nostro con tutti ingredienti freschi, dalla mozzarella al crudo... insomma loro sono il must della pizza napoletana....e chi dice il contrario dubito sia stato veramente ospite da loro..."
"ui_bubble_rating bubble_50","Eccellente","Eccellenza e qualità sotto tutti i punti di vista :Qualità eccellente Servizio perfettoCortesia estrema Una delle migliori pizze di Napoli... da Napoletano verace posso assicurarlo "
"ui_bubble_rating bubble_50","Il re' delle pizze","Sono anni che il sabato abbiamo l'appuntamento fisso con le pizze di gigino&figli.... un connubio perfetto tra arte e sapore . "
"ui_bubble_rating bubble_30","Pizza di ritorno dalle ferie..","Evidentemente abbiamo sbagliato serata: attesa lunghissima, errori nella presa in carico dell'ordine e 1 caos intorno da non riuscire a parlare con mio marito né al telefono! La qualità del cibo buona, per fortuna! "
"ui_bubble_rating bubble_50","Che pizza .","Abbiamo mangiato un'ottima pizza , una buonissima frittatina . Il servizio è molto veloce e poi ai tavoli c'è la presa usb. Consigliata la prenotazione."
"ui_bubble_rating bubble_40","Frittura e pizza buonissime! ","Ci siamo ritrovati in questa pizzeria seguendo le buone recensioni e non posso che confermarle. I proprietari sono simpatici, siamo entrati abbastanza velocemente essendo un tavolo da due. La frittatina era molto buona, c'è una vasta scelta di pizze e mi sono piaciute tanto quelle che ho preso sia per la qualità degli ingredienti, sia per il gusto e la cottura, ci ritornerò volentieri! "
"ui_bubble_rating bubble_40","Ottima pizza.","Per chi vuole gustare una buona pizza.Molte le varietà. Personale simpatico e disponibile,conduzione familiare."
"ui_bubble_rating bubble_50","Me and my brother...","Un locale carino...il quartiere in cui si trova è sicuramente fuori dai circuiti turistici ed è collocato in una zona un po' nascosta. Ci sono venuto con mio fratello ed abbiamo mangiato un'ottima pizza al filetto di pomodoro. Il servizio è perfetto e il personale gentilissimo...consigliatissimo."
"ui_bubble_rating bubble_50","Bravi !!!","Al di fuori dei classici giri turistici e delle classifiche reperibili ovunque in rete questa pizzeria si è rivelata una piacevolissima scoperta. Soccavo non è facile da trovare sulle guide eppure ho mangiato una delle migliori pizze nelle mie scorribande napoletane. Il locale è molto carino, il personale gentile ed efficiente (un saluto a Mario, Emanuele ed agli altri ragazzi) e il cibo veramente degno di menzione. Ho scelto la tanto citata pizza chimica che si rivelata all'altezza della fama. Impasto perfetto ed ingredienti di qualità ne fanno una alimento perfetto. Conto assolutamente senza sorprese. Tornerò sicuramente. Molto consigliata."
"ui_bubble_rating bubble_50","Una delle migliori pizze di Napoli","Una delle migliori pizze di Napoli, qualità eccellente, pizza chimica un esplosione di gusto, frittura sempre fresca e di ottima qualità. Possibilità di scelta di tantissime pizze sia classiche che complesse.Pizze top: Crocchè e chimica. Ma comunque anche le altre sono buonissime."
"ui_bubble_rating bubble_50","Freschezza e qualità degli ingredienti","Conosco questa pizzeria da ormai 15 anni e ho avuto la fortuna di assistere alla sua ascesa nel corso del tempo. La pizza è di pregevole fattura,appena un gradino sotto alle più famose e inarrivabili del centro storico,buona la frittura,rapido e tempestivo il servizio anche in situazioni di caos grazie alla presenza del secondo forno."
"ui_bubble_rating bubble_40","frittura doc","Ho provato la frittura ed è davvero buona e digeribile, fresca e crocchè di patate vere! le zeppole sono morbide e giganti..complimenti!"
"ui_bubble_rating bubble_50","Tutto troppo buono! ","Ci siamo stati per il nostro anniversario,C'è solo da dire bontà e qualità.. Le parole non rendono l'idea,da provare assolutamente <U+2764> "
"ui_bubble_rating bubble_50","Buona la pizza","Siamo stati a mangiare per la prima volta qui una pizza buona e digeribile e la prima volta che siamo venuti qui e ci ritorneremo bravi una pizza stupenda posto accogliente"
"ui_bubble_rating bubble_50","La pizza diventa una delizia","Da napoletano, ho sempre pensato che la pizza fosse l'esaltazione del pomodoro e del basilico e ho sempre considerato la margherita e la marinara come le due uniche pizze da mangiare e proporre. Mi sbagliavo!!Dalla pizza alla genovese a quella chimica dalla più complicata e sofisticata  e/o particolarmente dettagliata tutte le pizze sono eccezionali per la qualità dei prodotti usati e per la semplicità dei sapori che restano fedeli alla tipica e tradizionale cucina napoletana.Grazie di esserci pizzaioli siete la parte più genuina di NapoliGrazie per farci deliziare con i Ns saporiW la semplicità e le cose vereCi vediamo presto Pasquale F."
"ui_bubble_rating bubble_40","Pizza sole e simpatia","Breve pausa lavoro e pizza con colleghi. Ambiente molto accogliente pizza veramente buona ma soprattutto personale garbato discretamente socievole ed estremamente simpatico. Ci hanno servito con puntualità sempre presenti per eventuali esigenze ma non invadenti. Vasta scelta di pizze e ottimo il rapporto qualità prezzo "
"ui_bubble_rating bubble_50","Pizza ottima e personale gentilissimo","Sono stato in questa pizzeria per la seconda volta, e come la prima, la pizza è stata semplicemente perfetta. Una pizzeria che non capita di vedere sui soliti canali di marketing compulsivo che proclamano e supportano (chissà perchè) sempre le solite pizzerie. Ho apprezzato tantissimo la gentilezza del personale che è stato molto attento e cordiale, cosa che in molte pizzerie Napoletane spesso non si verifica, anzi la maggior parte delle volte si verifica il contrario.Concludo consigliando a chi ama la pizza di passare presso questa pizzeria, perchè la pizza è buonissima e leggerissima e non ha nulla in meno rispetto le altre super pubblicizzate.Dimenticavo i prezzi sono onestissimi, di certo non ti fanno pagare 11 euro una pizza, anzi.. e fidatevi che la qualità per me è stata la stessa per tutte e due le volte che ci sono stato."
"ui_bubble_rating bubble_50","TOP","Ottima pizza, in un ambiente accogliente....personale simpatico ed attento ad ogni esigenza,ogni volta che posso mi fermo sempre volentieri a mangiare un ottima pizza grazie fratelli."
"ui_bubble_rating bubble_50","Patrimonio dell'Unesco","Non esistono aggettivi qualificativi per descrivere la bontà delle pizze e dei ragazzi.Un ambiente dove la cordialità la fa da padrona,quando poi arrivano le pizze...che dire...il tempo sembra fermarsi,si vive in una favola...Non saprei suggerire un tipo di pizza da degustare, poichè sono tutte superlative.E' una tappa d'obbligo.A presto"
"ui_bubble_rating bubble_50","Felice di averla conosciuta. ","Ho conosciuto la pizzeria a pranzo. Colpito dalla qualità della pizza e dalla cordialità del cameriere Mario, ho deciso di ritornarci con la famiglia il sabato. L'impasto della pizza è molto leggero. Buono il condimento anche nella quantità. Abbiamo provato la pizza ripiena al vapore, una specialità simpatica. Inoltre sono rimasto colpito dalla gentilezza e disponibilità del capo sala Mario. "
"ui_bubble_rating bubble_50","Pizzeria Gigino e figli","Ottimo locale,pizza gustosissima e personale qualificato e garbato. Ideale per trascorrere una piacevole serata tra amici. Tornerò con piacere"
"ui_bubble_rating bubble_40","Cordialità e qualità","Una pizzeria di quartiere gestita con competenza e professionalità. E per giunta in locali nuovi, puliti anche se la clientela, piuttosto rumorosa, vanifica in parte i molti aspetti positivi del locale. Molto buone le fritture: arancini e crocché ben fatti (anche se leggermente scuri) e poco unti. La pizza - servita con grande velocità - ha un disco di notevoli dimensioni con cornicione piccolo (è stata evidentemente stesa bene). Gli ingredienti sono di buona qualità (ma la provola l'avrei preferita senza la pelle anche se dà più sapore) e soprattutto la pasta è leggera e caratterizzata dalla buona digeribilità. Buona la scelta di birre, ottimi i dolci e gli amari sono offerti. Un elogio particolare ai ragazzi in sala, premurosi, cordiali, efficienti ma senza essere mai invadenti. Prezzi decisamente competitivi. Da consigliare senza indugi."
"ui_bubble_rating bubble_50","Pizza da gigino","Siamo stati stasera 15 05 2017.... sono stata con amici la pasta della pizza era leggerissima, gli ingredienti di ottima qualità... ho assaggiato la stella strepitosa... poi ho mangiato metà di DA gigino... con cornicione ripieno una goduria..... infine straccetti con la nutella.....la consiglio.... ed anke il finale è stato meraviglioso...prezzi molto economici....ci ritornerò volentieri...."
"ui_bubble_rating bubble_30","Ottima Pizza","Sono stato in questa pizzeria sabato 13/05/2017 su consiglio di un amico non c'è che dire sulla pizza di buona qualità e di materie prime.Buona anche la birra ambrata.Il locale anche se ristrutturato risulta essere molto piccolo infatti i tavoli all'esterno risultano quasi uno addosso all'altro.Oltre alle pizze abbiamo preso 3 fritture da dividere a coppia solo che era molto misera composta da 2 zeppoline, 1 arancino piccolo, 1 crocchè piccolo, 1 frittatina di pasta piccola e una manciata di melenzane fritte. Ma il clou lo abbiamo avuto al conto il quale ci siamo trovati anche il coperto per mio figlio di 20 mesi. Chissà se ci ritorneremo."
"ui_bubble_rating bubble_50","Tradizione e innovazione..","Non è in una zona turistica, ma vale davvero la pena andarci. Ottime pizze, impasto leggero e ben fatte. Quello che mi ha stupito di più è l'originalità dell'utilizzo di ingredienti che non si trovano in tutte le pizzerie. E' da premiare, oltre il lavoro ben svolto, anche la voglia di innovazione pur comunque restando fedele alla tradizione napoletana. Da assaggiare assolutamente la pizza con la genovese e quella con i datterini gialli."
"ui_bubble_rating bubble_50","Una pizzeria che rappresenta perfettamente la vera Napoli","Nella semi-periferia di Napoli una pizzeria di elevata qualità sia per i fritti che per la pizza. Provate le loro pizze speciali, in particolare quella denominata Chimica, è un trionfo di veracità napoletana!Servizio rapido, prezzi contenuti, bel locale, pizza DOC, camerieri simpatici e pazienti.Nulla da eccepire! Tolleranti verso i bambini e richieste particolari."
"ui_bubble_rating bubble_50","Solo una parola...","Superlativa. Ho preso la pizza da loro per la prima volta, ho assaggiato la pizza stella e devo dire che è davvero buonissima! Consigliatissimo."
"ui_bubble_rating bubble_50","Eccellente ","Sono stato in questa pizzeria per caso insieme ai miei figli. Tutto eccellente dall'accoglienza al mangiare. Servizio veloce e camerieri sempre disponibili. Un plauso a Mario.....simpaticissimo!!!!Consigliatissimo"
"ui_bubble_rating bubble_40","Sapore ed abbondanza","Ho scoperto questa pizzeria per caso, e sono ritornata con la mia famiglia perché avevo avuto un'ottima impressione, che è stata confermata.La pizza è davvero buona: l'impasto è quello della pizza napoletana storica, gli ingredienti sono freschissimi, la varietà è enorme. Il locale è semplice è pulito. Il servizio è stato veloce e cortese, nonostante la folla del 25 aprile. La montanara fritta è ottima, così come la pizza chimica.Siamo usciti davvero sazi (con doggy cartone della pizza!) e soddisfatti.Il rapporto qualità prezzo è eccezionale.Peccato sia chiuso la domenica!!!"
"ui_bubble_rating bubble_50","Straordinario ","Location bella , pulita , accogliente Personale cordiale e veloce tutto veramente ottimo penso sia stata una delle pizze più buone che abbia mai assaggiato .Prezzi modici , qualità ottima tutti prodotti freschi e genuini dalla rosticceria alla pizza niente da ridire tutto veramente impeccabile . "
"ui_bubble_rating bubble_50","Un'altra bella serata","Ancora una volta, gentilezza, cordialità, qualità e simpatia, hanno caratterizzato la nostra serata; stasera devo rivolgere una particolare menzione al pizzaiolo che eccelle in professionalità' e bontà dei suoi prodotti."
"ui_bubble_rating bubble_50","Eccellente ","Ottima pizza ,soprattutto consiglio la cosiddetta Chimica: spettacolare!!! Consiglio vivamente di evitare il fine settimana, in quanto la rinomata bontà degli ingredienti usati richiama centinaia di persone...Ma vale la pena anche aspettare "
"ui_bubble_rating bubble_50","un appuntamento fisso","andare da Gigino e figli è oramai un rito, ci vado ogni settimana, pizza buonissima, personale davvero gentilissimo, l'unica pecca? il servizio un pò lento a causa della molta clientela, però quando arriva la pizza è davvero un piacere per gli occhi e per il palato. La consiglio a tutti davvero."
