"Restaurant_Ratings","Restaurant_Quotes","Restaurant_Reviews"
"ui_bubble_rating bubble_50","la vera pizza napoletana","Ormai Napoli è diventata una vera e propria attrazione turistica, come una città capitale e dalla storia millenaria merita. Di conseguenza il centro storico ha subito negli ultimi vent'anni una vera e propria trasformazione. Purtroppo sono spariti i piccoli artigiani, i rigattieri, gli ambulanti e tutto il microcosmo che ruotava loro attorno. Al loro posto sono proliferati i negozi di souvenirs (made in china), le rosticcerie, le friggitorie e le pizzerie. Difficile dunque per chi non conosce o non ha vissuto la Pignasecca e Spaccanapoli trovare il vero locale, genuino, originale e autentico, dove è la tradizione e l'esperienza a dettare le regole dell'eccellenza, piuttosto che le mode del momento. Da Attilio è una delle pizzerie storiche di Napoli, un patrimonio storico e gastronomico della città, che negli anni è solo migliorata pur mantenendo un approccio familiare verso la clientela. Posizione strategica, Pignasecca. Notevole l'arredamento delle pareti fatto di centinaia di dimostrazioni di affetto dei clienti, molto spesso espresse sui tovaglioli di carta, oppurtamente incorniciate. I tratti di personaggi famosi a fianco di bambini e studenti, perché in una pizzeria napoletana siamo tutti uguali."
"ui_bubble_rating bubble_50","pizza ECCELLENTE","credevamo che fosse la solita pizzeria con recensioni positive poi non comfermate invece........abbiamo mangiato un'OTTIMA pizza e un dolce DELIZIOSO servito direttamente dal proprietario Attilio!!!!!!!!!!!!!!"
"ui_bubble_rating bubble_50","Tutto ottimo.","Locale situato in punto strategico della città, tale da permettere di raggiungere le mete più interessanti a piedi.Servizio veloce.Pizze straordinarie, molto più buone di altre più blasonate pizzerie.Prezzi nella media.Personale davvero cortese ed efficiente.Ci torneremo certamente!"
"ui_bubble_rating bubble_40","Una buona pizza","la cosa che colpisce appena si entra in questa pizzeria nel cuore del caratteristico quartiere della Pignasecca di Napoli è la dimensione del forno, non molto grande, quasi di dimensioni casalinghe. In realtà le puzze arrivano molto velocemente spesso servite dallo stesso pizzaiolo, e sono pizze di tutto rispetto rispetto allo standard napoletano. Ottime le fritture, soprattutto crocche ' e frittatine di pasta. Prezzi davvero modici. Bravo Attilio..."
"ui_bubble_rating bubble_30","Finalmente da Attilio","Per la terza volta andiamo da Attilio per mangiare la pizza. Le prime due volte siamo stati scoraggiati da troppa gente in attesa di un tavolo. Stavolta alle 12,15 siamo i primi e veniamo accolti con cortesia e garbo dal personale. Le pizze che scegliamo, siamo in quattro, tutte diverse ed ottime con ingredienti genuini e freschi. Unico neo la pasta leg-germente gommosa, ma la attribuiamo al forno probabilmente ancora non completamente caldo, vista l'ora in cui siamo arrivati alla pizzeria. Dopo ci fanno assaggiare dei fagottini di pasta con all'interno ricotta, rucola e mozzarella molto saporiti.Il conto decisamente contenuto."
"ui_bubble_rating bubble_30","Buona Pizza, per Napoli nella media,","Buona Pizza, per Napoli nella media. Commensale: carne, niente di particolare, dessert: pastiera discreta, niente piú. prezzo: ok"
"ui_bubble_rating bubble_40","Una Sorpesa","Arriviamo a pranzo di sabato ...non aspettiamo i classici tempi che invece le Grandi Star della pizza qui a Napoli ti obbligano ad aspettare.La pizza è davvero buona, personalmente ho preso una margherita DOC dove si sentivano che olio e mozzarella erano di grande qualità, l'impatto della pizza è ben lievitato e rende la pizza leggera e facilmente digeribile. Il servizio è gentile e veloce...rapporto qualità prezzo sopra la media."
"ui_bubble_rating bubble_50","Pizza eccellente ","Sono state Da Attilio pizzeria già due volte ed ho mangiato una pizza buonissima ..ho provato più gusti oltre alla Margherita tra cui la pizza con crema di carciofi e quella al pesto ed erano tutte squisite! Ci sono andata con la mia famiglia e sono rimasti tutti molto contenti ! La consiglio vivamente ! "
"ui_bubble_rating bubble_20","Buona pizza, ma nella media","Sono andato a mangiare con grandi aspettative, per accorgermi che in Emilia ci sono ottime pizzerie senza bisogno di andare a Napoli, o almeno questa non mi ha fatto ricredere. L'atmosfera è molto intima, famigliare e lo staff gentilissimo. Però niente scontrino, per me imperdonabile."
"ui_bubble_rating bubble_40","Pizza buonissima e bellissima","Sono venuta in questo locale per assaggiare la famosa pizza con le 8 punte ripiene di ricotta, e sono uscita molto molto soddisfatta!!Locale molto semplice e personale gentile e cordiale, servizio veloce. La pizza a forma di stella a 8 punte aveva il cornicione ripieno di ricotta ed era spaziale.. la pasta morbidissima e leggera, facile da digerire! Gli arancini e i crocchè presi in seguito anche molto buoni!Super consigliato e rapporto qualità-prezzo fantastico!!"
"ui_bubble_rating bubble_40","Pizza napoletana DOC","Sono stata a cena da Attilio un mercoledì sera. L'ambiente è familiare e il personale è cordialissimo. La pizza buona e leggera. La mia Carnevale era speciale! Da consigliare!"
"ui_bubble_rating bubble_40","Familiare","Pizza di buona fattura, buoni gli ingredienti ,consiglio tutte quelle con gli angoli ripieni di una ricotta squisita, servizio veloce.ottima la posizione se si vuole vivere la Napoletanità tipica della Pigna Secca."
"ui_bubble_rating bubble_50","Una pizza che vola via","Lo diciamo col cuore e siamo tutte d'accordo: la pizza piu' leggera della nostra vita. Vabbe', viaviamo a Barcellona e non siamo foprse abituate al meglio ma io sono italiana e conosco bene la materia. Eravamo in sei e abbiamo preso dioeci oppizze, questo mi pare significativo. Sol,e nel piatto da urlo."
"ui_bubble_rating bubble_50","Storica eccellenza!","La pizza è ottima, così come il crocchè gigante con salsiccia, friarielli e provola; il personale è cordiale e disponibile, ed anche il servizio è molto veloce! Consiglio di recarsi sul posto non molto tardi, per evitare di aspettare troppo tempo!"
"ui_bubble_rating bubble_50","Senza dubbio una delle migliori pizzerie di Napoli","Mangio spesso la pizza da Attilio, prevalentemente nella pausa pranzo ed è sempre perfetta.Di recente ho visitato il locale con amici in una serata infrasettimanale. Abbiamo fatto una serata di degustazioni con pizze particolari suggerite da Attilio. Impasto a tre stelle e condimenti gourmet. Servizio attento. Ottimo rapporto qualità prezzo.La pizza fritta è meno buona delle altre."
"ui_bubble_rating bubble_40","ma solo la pizza!","se devo giudicare la pizza non ho nulla da dire, bassa di pasta e morbida, buoni gli ingredienti magari solo un pò cara, una margherita con pomodorini gialli e capperi 8 euro. Se invece devo giudicare il servizio direi scarso. Il personale ha preso l'ordinazione mentre masticava qualcosa che aveva da poco messo in bocca quindi pessima immagine, sono state servite pizze a persone entrate dopo di noi ( non abbiamo ordinato antipasti ) e all'ultimo alla cassa si sono dimenticati di dare il resto ... pessima figura.Personalmente non basta fare una buona pizza se poi viene tutto vanificato dal servizio."
"ui_bubble_rating bubble_40","Non ha deluso le aspettative ","Spinti dalle ottime recensioni e dai vari premi assegnati a questa pizzeria, ci proviamo sabato scorso. Arrivati intorno allle 21 ci accomodiamo dopo un'oretta.La sala un po' piccola, stile antica pizzeria napoletana. I camerieri non tutti cordiali, ma siamo stati ripagati dalla bontà delle pizze. Ordino una pizza carnevale e che dire : impasto leggerissimo ,ingredienti ottimi, una vera bontà , l olio (che è la cosa che più temo ) messo nella giusta quantità ,insomma merita il signor Attilio ad essere nella guida tre spicchi. Prezzi onesti. Avrei dato 5 punti se avessi ricevuto un sorriso in più dallo staff !"
"ui_bubble_rating bubble_40","Ma tu vulive a pizza","Indirizzo tra i top per la degustazione della pizza come dimostrano le svariate presenze in guide e blog gastronomici. Pranzo veloce, margherita e coca cola (7 euro e 50), e passa la paura. Pizza margherita che fuoriesce dal piatto, saporita ma assolutamente leggera. La prossima volta, con meno fretta, ci lanceremo verso altre tentazioni del menu per provare altre leccornie"
"ui_bubble_rating bubble_50","Da provare","Locale rustico ma con una pizza da urlo!!!Geniale l'idea della Stella con il bordi ripieni di ricotta!Ottimo impasto,saporito e digeribile! !"
"ui_bubble_rating bubble_50","Che bella scoperta!","Siamo finiti in questa pizzeria per caso; dall'aspetto spartano ma molto autentico, questo posto non delude le attese. Abbiamo mangiato una pizza fantastica che ha superato le nostre aspettative. Assolutamente da ripetere!"
"ui_bubble_rating bubble_40","Buona la pizza ma.....","Pizza buona, l'idea del sole con bordi ripieni di ricotta...grandiosa. Il locale è spartano, il personale è talmente odioso....che non sembra di essere a Napoli!"
"ui_bubble_rating bubble_30","Quel difetto che non ne esalta i pregi","Forno all'ingresso che da la possibilità ai pizzaioli di incantare gli avventori, tanto da rendere sopportabile l'attesa...Sale piccole ed arredamento spartano, ma la vasta scelta di pizze fa passare tutto in secondo piano.Scelgo una pizza che contempla tra gli ingredienti le scaglie di parmigiano chiedendo la cortesia di ometterne l'aggiunta. Arriva la pizza ma le scaglie di parmigiano la ricoprono interamente, il cameriere su mia richiesta la porta via ed in men che non si dica... Riporta la stessa pizza da cui era stato tolto il formaggio, ma non abbastanza bene... non avrebbero ingannato nemmeno un bambino!!! Va bene l'errore, ma la presa per i fondelli io non la tollero.Rimando il giudizio sulla qualità della pizza alla prossima visita... Peccato..."
"ui_bubble_rating bubble_40","Pizza Napoli ","Ha una location molto rustica e come pizzeria è ottima! È situata al centro di Napoli, ma il trattamento è davvero ottimo! Personale cortese e gentile, pizza favolosa! Lo coniglio molto volentieri! Soprattutto la pizza degli Appennini con zucchine,mozzarella,funghi e spuntoni ripieni di ricotta! "
"ui_bubble_rating bubble_50","Tra Michele e Kalò altro maestro ......Attilio","Sono andato in questa Pizzeria diverse volte. Inutile dire che l'impasto è da maestro della pizza. Da migliorare i fritti.La pizza è sicuramente di alto livello. Tra le migliori pizzerie di Napoli.Da provare un fantastico ed originale Limoncello."
"ui_bubble_rating bubble_40","Pizza da assaggiare ","Consigliato da un collega locale sono andato a mangiare da Attilio. Locale un po' piccolino ma pizza veramente ottima. Ho provato la pizza a 5 punte, Idea super il formaggio all'interno di ogni punta. Tornerò senza dubbio."
"ui_bubble_rating bubble_50","La vera pizza","Ottimo servizio e pizze gustose, in particolare quella con crema di carciofi. Location ideale x visitare il centro storico. ......da consigliare. .."
"ui_bubble_rating bubble_50","Ottima pizza!<U+0001F60B><U+0001F60B><U+0001F60B>","Ottima pizza. Alta digeribilità.Accoglienza cordiale.Posizione centrale.Quartiere caratteristico.Originale la pizza a forma di stella con le punte ripiene di ricotta."
"ui_bubble_rating bubble_50","Una delle migliori pizze di Napoli","Il locale, angusto ma suggestivo, con le pareti ricoperte di fotografie (non solo quelle classiche, in cui sono raffigurati i clienti celebri, ma anche quelle di famiglia), è situato alla Pignasecca, in una zona del centro storico colorata ed affollata di commerci. Ci ho pranzato nel periodo di Pasqua 2016 con mia moglie e mia figlia. I fritti - noi abbiamo preso crocché di patate e frittata di maccheroni - sono davvero buoni (e di dimensioni generose), Ma la pizza è addirittura superlativa, una delle migliori di Napoli, a mio avviso nettamente superiore a quella servita in altre più celebrate pizzerie di via Tribunali. L'impasto è leggero e viene steso in modo da rendere ancora più evidente questa caratteristica (sottilissimo al centro). Il condimento è di ottima qualità. Da provare assolutamente."
"ui_bubble_rating bubble_50","Vera pizza napoletana ","Pizzeria molto buona, si trova nella pigna secca.. Non ci ero mai andata, anche se i miei genitori me ne avevano parlato molto bene.. Persona gentile e sempre a disposizione.. La pizza ottima vera pizza napoletana.. "
"ui_bubble_rating bubble_50","Ottima","Sono stata a pranzo in questo luogo.Servizio veloce e pizza strabuona.Impasto lievitato benissimo.Consiglio di provare la pizza con il cornicione ripieno...è davvero squisita!"
"ui_bubble_rating bubble_40","Elevato standing qualitativo ","Vengo ormai da mesi in questa pizzeria con i colleghi, ed ogni volta esco carico di meraviglia impasto ed ingredienti doc! I ke Napl' "
"ui_bubble_rating bubble_20","Solo per la pizza","La pizza non male.....ma per i fritti solo i crocche....per i primi non ci pensate proprio non si possono fare......per i secondi solo un po' di polipo all'insalata....Un peccato"
"ui_bubble_rating bubble_40","Ottima Pizzeria tipica napoletana","Siamo stati in questa pizzeria a pranzo un sabato di febbraio e nonostante l'orario, le 14:00, abbiamo comunque atteso una 1/2 h.Il locale e piccolo ma accogliente e il personale di sala gentile ed allegro.Eravamo in due ed abbiamo preso una pizza fritta classica ed una margherita.Devo dire che le pizze erano veramente buon, di livello simile a quella di Sorbillo e Dei Decumani.Perchè andarci? Perchè l'impasto è veramente soffice e digeribile.Consigliato"
"ui_bubble_rating bubble_50","Tutto buono","Sono stato recentemente in questa pizzeria scoperta da pochi mesi, prima ne ignoravo l'esistenza ahimè. Il locale è un po' piccolo quindi potrebbe starci un po di attesa ma ne vale la pena: crocchettone ottimo e le pizze sono tra le migliori di Napoli davvero.Staff gentile e disponibile. Ci torneremo ancora."
"ui_bubble_rating bubble_10","Delusione ","Sono andato in questo posto per le tante recensioni positive ma credo che non siano veritiere. Servizio scadente , pizza buona , scaloppina nella medica , melenzane da vomito, il famoso panzarotto napoletano insapore, vino in calice scadente, niente ricevuta fiscale, prezzi alti per la media del posto, bocciato !!!"
"ui_bubble_rating bubble_50","L'arte della pizza","Il locale è piccolo e sempre molto affollato. Vale comunque la pena di aspettare per mangiare qui la vera pizza napoletana, fatta secondo la tradizione e con attenzione alle materie prime."
"ui_bubble_rating bubble_50","Una Pizza con la P maiuscola!","Locale non troppo grande, personale molto gentile e soprattutto una Pizza superlativa! l'impasto era molto leggero, la pizza soffice e con ingredienti di ottima qualità. Napoli è sicuramente famosa per la pizza, la vera pizza, ma non sempre la si mangia così buona.Beh... super consigliato! prezzi molto abbordabili.Andateci!"
"ui_bubble_rating bubble_40","Pizza eccellente ","Pizzeria pulita e ottima pizza, forse la migliore tra quelle mangiate a Napoli. Prezzi con la media di Milano.Unica nota negativa: controllate il conto sul posto, noi ci siamo trovati circa € 10 in più di consumazioni mai richieste e consumate"
"ui_bubble_rating bubble_40","pizza super e calda accoglienza in Pignasecca","Il locale è modestino e il bagno mal ubicato vicino alla cucina e solo a questo si deve il fatto che non lo abbia classificato come eccellente perchè il cibo lo è. A partire dale materie prime in bella mostra la provola e il fior di latte freschi, le verdure, I dolci della casa. La pizza è una delle migliori a Napoli e Attilio vi saprà guidare nella degustazione: dalle più classiche a quelle più sperimentali. Accompagnate con il super crocchè ai friarielli e salsiccia e concludete con un dolce casereccio alla ricotta. Pagherete con piacere il modesto conto "
"ui_bubble_rating bubble_50","Un'eccellenza","Cena di lavoro. La protagonista indiscussa è la pizza, la semplicità è la qualità che rende sublime e sofisticato questo locale in una delle vie più caratteristiche della città. Ottima materia prima ottimo servizio, un punto di riferimento. I prezzi sono un po' più alti della media ma mi sento di consigliarlo senza riserve."
"ui_bubble_rating bubble_50","Una certezza","Mi definisco un cliente abituale, da Attilio la pizza è a dir poco sublime. Ingredienti genuini, pasta leggerissima insomma una buonissima pizza. Assaggiate l'ultima pizza inventata con verdure e baccalà veramente unica. Se siete in zona ( ma anche se non lo siete) non potete non andare a mangiare La Pizza da Attilio. Complimenti a tutto lo staff. "
"ui_bubble_rating bubble_50","Sublime!!!","Location graziosa. La pizza buonissima, degna della vera tradizione napoletana. Ottimi anche i panzerotti napoletani ( crocché ). Consigliatissimo!!! "
"ui_bubble_rating bubble_50","Pizza eccellente come da pochi","Ho avuto modo di mangiare una pizza davvero eccellente per caratteristiche dell'impasto e qualità dei prodotti. Solo poche altre pizzerie offrono una pizza di alta qualità come quella mangiata in questa pizzeria. Locale e servizio nella media delle pizzerie napoletane a conduzione familiare."
"ui_bubble_rating bubble_50","Un gran luogo aristocratico","Ho mangiato solo la pizza, ed è forse la più buona di Napoli. Impasto delicato e lievitato per bene, farina buona e ingredienti di qualità. Sembra una pizzeria anonima, ma è un luogo aristocratico in cui si ritrovano i napoletani bene. Prezzi al di sopra della norma per la città, circa 7,50 margherita e coca. Non ti permettono di pagare con carta di credito per importi superiori ai 15 euro. Non lo trovo giusto."
"ui_bubble_rating bubble_40","Buono ","Ottimo impasto, pizza cotta bene, posto caratteristico, prezzi giusti unica pecca locale un po' piccolo..."
"ui_bubble_rating bubble_30","Pizza buona, il servizio meno","Crocchettone salsiccia e friarielli, dal costo di 8 euro, non è niente di speciale per la bontà. Due pizze buone, con ingredienti veramente buoni e impasto altrettanto gustoso. Il cameriere si è fatto conoscere dapprima criticando, ad alta voce ed in napoletano, una coppia di stranieri perché c'era stato un equivoco nell'ordinazione. Pessimo, ma ancora peggio quando l'abbiamo visto fumare in cucina e poi ci ha servito che odorava di fumo."
"ui_bubble_rating bubble_20","Delusione","Anche se arrivati presto siamo stati sistemati in un angolo stretto e attaccati ad altri clienti. Personale scortese e di pochissime parole. Pizza secca poco condita e molto fina."
"ui_bubble_rating bubble_40","Una pizzeria tipica","Locale tipico situato in una delle zone più caratteristiche di Napoli. La pizza è molto buona e leggera, sia per l'impasto che per gli ingredienti. Servizio rapido, ma talvolta un pò sbrigativo nei modi. Unica pecca sono i servizi igienici, che sono sicuramente da rivedere, dato il buon nome del locale."
"ui_bubble_rating bubble_30","Nulla di eccezionale","Siamo stati stamane in questa pizzeria. Pizza buona ma nulla di particolare; di sicuro non la migliore di Napoli. Impasto sottilissimo che in certi punti si sgretolava e cornicione bruciacchiato. Il locale e' molto piccolo,per cui l'attesa e' quasi d'obbligo. Il bancone dove vengono fatte le pizze si trova proprio all'entrata ed e' ben visibile...forse questo non sempre e' un bene. Proprio davanti ai nostri occhi e' tornata indietro ina pizza con rucola e parmigiano in quanto il cliente non gradiva il formaggio...il cameriere ha tolto la rucola ed il parmigiano a scaglie ed ha poi riciclato tali ingredienti per un'altra pizza...Una nota negativa meritano di sicuro i servizi igienici: Bagno minuscolo dove a stento c e' spazio per fare pipì...porte vecchissime e mal tenute. La carta nel bagno completamente assente...Tirando le somme se dovete andarci apposta non ne vale la pena."
"ui_bubble_rating bubble_50","Un gioiello nel cuore della Pignasecca!","Quando si parla di pizza a Napoli si pensa sempre ai grandi nomi dei decumani, ma qui alla pignasecca Attilio sforna pizze di livello forse anche superiore. Già solo vederlo lavorare ti fa capire che la pizza che mangerai sarà speciale! E infatti è proprio così! Impasto leggero, ingredienti selezionati e cottura perfetta! Un po' più piccola della media ma ne risenti solo perché è talmente buona che ne vorresti ancora! Da provare il crocchettone e la pizza carnevale!"
"ui_bubble_rating bubble_40","la Pizza .......","Il locale è in una delle zone piu' vive di Napoli, i profumi del pescato venduto fuori la strada e il vociare del quartiere si mescolano bene con il profumo delle ottime pizze sfornate con sapienza, è la vera pizza napoletana, sottile come un velo lievitata con pazienza e leggera, sopratutto leggera,buona,da provare quella con le  punte ripiene di ricotta.Il locale è un po' piccolino il servizio è veloce, il personale gentile e disponibile il prezzo è ben proporzionato alla qualità degli ingredienti.Lo consiglio."
"ui_bubble_rating bubble_40","Piacevolissima sosta per pranzo","Un napoletano e una bolognese in visita a Napoli e quest 'ultima che desidera mangiare una buona pizza ed i crocche'.accontentata !! in questo locale storico dove la storia è raccontata anche sulle pareti dove scorrono foto in bianco e nero, vecchi menu, riconoscimenti,attestati. Pizza,crocche e birra per 12,5 € a testa...prezzi che a Bologna sono introvabili! !!!!!!"
"ui_bubble_rating bubble_40","Pizza eccezzziunale veramente !!!","Via Pignasecca, sabato sera ore 22. Ci sono due pizzerie che si fanno guerra a pochi passi l'una dall'altra, entrambe con la coda fuori dal locale ... forse sarebbe stato meglio prenotare, ma non l'avevamo fatto...Il primo tavolo che si libera è quello di Attilio e ci fiondiamo all'entrata accolti da una gentile signora. L'attesa totale, forse anche perchè stavamo giocando su due fronti, è stata di appena 30 minuti. Locale piccolo ma accogliente, pareti tempestate da articoli di giornale, tovaglioli disegnati e qualche personaggio tipico della cultura napoletana.Cameriere gentile anche se poco chiaro. Alcuni fritti presenti nel menù sono terminati e ordiniamo le pizze (appennini e bufala), le crocchette con salsiccia e friarielli e due birre alla spina.Pizza eccezionale, soprattutto la appennini con le punte ripiene di ricotta...su tutto vince sicuramente la qualità delle materie prime, la bontà dell'impasto e il rispetto della tradizione napoletana.Prezzi onesti. Consigliatissimo"
"ui_bubble_rating bubble_20","Aspettando il crocché...","Sono stata ieri sera con degli amici, spinti dalla curiosità di provare questo famoso crocchè. Siamo arrivati sul tardi, abbiamo aspettato che entrassero due tavoli prima di noi e, nonostante il personale sembrasse molto incerto circa il farci entrare o meno, ci siamo accomodati. Prima grande delusione: i crocchè erano finiti. Non ci perdiamo d'animo e ordiniamo, comunque, le pizze. Queste ultime sono state un ulteriore delusione: fin troppo sottili e un po' asciutte, direi quasi anonime. Il servizio è stato molto scortese e frettoloso, tanto da spingerci a non provare proprio a chiedere il dolce. Sarà stata l'ora tarda a rendere l'atmosfera così spiacevole con un personale, probabilmente, stanco da una lunga giornata, ma ciò non toglie che eravamo clienti come tutti gli altri. Ciò non toglie che lo riproverò in futuro, sperando di poter scrivere qualcosa di meglio cominciando, magari, proprio dal famoso crocchè."
"ui_bubble_rating bubble_20","Nulla da segnalare","Siamo stati in questa pizzeria a gennaio, seduti al primo tavolo vicino alla porta e il numeroso viavai di clienti che lasciavano la porta aperta ci ha rovinato la cena perche' abbiamo dovuto cenare con le giacche per il freddo. Sarà magari una abitudine del sud di non chiudere le porte, ma provate a cenare con il freddo e poi mi dite. Sarà anche per questo motivo che non ho trovato nulla di particolare da segnalare pe rquanto riguarda il menu', mi spiace perchè sicuramente il locale aveva dei piatti buoni.Ci tornerò un'altra volta ,sicuramente d'estate per provarlo."
"ui_bubble_rating bubble_50","Una delle migliori pizze a napoli","La pizza da attilio e ottima molto leggera quindi molto digeribile e prodotti ottimi direi quasi gourmet a prezzi modici lascia un po a desiderare la frittura poi molte idea per il menu della pizza bravo attilio"
"ui_bubble_rating bubble_40","Che pizza!!!","Sono stato in questo locale su consiglio di un collega, il servizio è stato veloce e cortese, la pizza era leggera ben cotta e digeribile, ho fatto personalmente i complimenti al pizzaiolo per i capolavori che sforna, da migliorare la pulizia dei bicchieri e del bagno mancante di sapone per le mani, consigliato. "
"ui_bubble_rating bubble_40","Buonissima","Situata nel cuore del mercato della Pignasecca, questa pizzeria sforna delle pizze deliziose. La Attilio è una vera prelibatezza. Consigliatissimo"
"ui_bubble_rating bubble_40","Lo consiglio","Situato in zona pignasecca, Attilio offre una delle migliori pizze di Napoli. Ho provato una margherita con le punte di ricotta... favolosa è dir poco. Prezzi al di sopra della media."
