"Restaurant_Ratings","Restaurant_Quotes","Restaurant_Reviews"
"ui_bubble_rating bubble_50","UN'ESPERIENZA MISTICA!!!","Si sa che la pizza a Napoli è quasi sempre una garanzia, ma qui, il pizzaiolo ha davvero superato se stesso! Ne avrei mangiate due di fila! In più, il servizio è stato veloce ed efficiente. Spero di ritornarci presto!Ombretta"
"ui_bubble_rating bubble_30","Classica ma non il top","Premetto che non amo la classica pizza napoletana, anche se qui da Attilio, consigliatoci da una nostra amica napoletana, la pizza non è alta anche se rimane tristemente molle, almeno per i miei gusti. Le pizze sono tantissime, tutte sfiziose e ricche di ingredienti, come la mia Fiore (fiori di zucca, provola, pomodorini, pancetta croccante, pistacchi di Bronte) e la Giardiniera (8 punte ripiene di ricotta, al centro contorni misti di stagione, bocconcini di mozzarella e rucola), buone entrambe e sicuramente non pesanti, nonostante i condimenti. L'ambiente è caotico, nel rispetto della trazionale pizzeria, ma basta telefonare prima e presentarsi li armati di pazienza, che comunque almeno mezz'ora si aspetta. Un'altra mezz'ora buona l'abbiamo aspettata perchè il pizzaiolo (o il cameriere) si era perso la nostra comanda, ma le pizze sono arrivate 7/8 minuti dopo aver chiesto che fine avessero fatto.Una birra artigianale (10€) e un'acqua per 32€ di conto, servizio sbrigativo e poco cordiale. Alla fine così così.."
"ui_bubble_rating bubble_40","Buona pizzeria, ma a Napoli ci vuole di più per eccellere","Tornato tardi in hotel, causa lavoro, ci siamo fatti consigliare una pizzeria nei dintorni, e così abbiamo trovato Attilio, girando in mezzo a vicoli e vicoletti. Il locale non è niente di che, molto rustico e con un po' di confusione. Le pizze sono abbastanza buone ed assortite, ma considerando che a Napoli la pizza è buona quasi ovunque, sicuramente non mi sento di posizionare questo locale tra i top. Se dovessi tornare da quelle parti, cercherei altri posti nuovi, o tornerei dove ho già assaggiato pizze superlativo. Indeciso tra tre e quattro punti ..."
"ui_bubble_rating bubble_40","Una piacevole conferma","Non è la prima volta che pranzo da Attilio alla pignasecca ma non avevo mai incontrato tanti stranieri a novembre. Una piacevole conferma la pizza è sempre buonissima soprattutto per la qualità degli ingredienti adoperati e la leggerezza dell'impasto,ambiente è piccolo senza però essere oppressivo ,unico neo il bagno decisamente impraticabile."
"ui_bubble_rating bubble_50","La migliore pizza durante il nostro soggiorno a Napoli ","Piccola pizzeria consigliata da una amica, guida turistica locale. Servizio cortese e veloce. Pizza eccellente, con ingredienti di qualità, leggera e con cottura giusta. Tra le pizze (tante) mangiate a Napoli durante il nostro soggiorno questa è stata forse la migliore, superiore anche a diversi locali più famosi nella zona. "
"ui_bubble_rating bubble_40","Pizza di qualità ma occhio alle porzioni! ","A pochi passi dalla famosa via Toledo a Napoli mi sono trovato a pranzo per lavoro accompagnato da alcuni colleghi. Locale pulito e personale gentile ci accolgono all'interno della sala dove però (come del resto in molti locali famosi) si mangia gomito a gomito per la mancanza di spazio tra i tavoli. Sulla qualità degli ingredienti e della preparazione non si discute ma il rotolo, una delle specialità della casa, non si distingue certamente per l'abbondanza del piatto. Ho avuto la sensazione infatti che la pizza fosse farcita di più. Complessivamente a mio giudizio merita comunque le quattro stelle. "
"ui_bubble_rating bubble_30","Buona pizza, da migliorare accoglienza...","Siamo stati in questa pizzeria di sabato sera e come è normale che sia ci aspettavamo un poco di attesa. Quando abbiamo lasciato il nome la signora alla cassa ci ha informati che avremmo atteso “parecchio”, del tutto onesta ma i modi sarebbero d rivedere ... abbiamo comunque deciso di attendere e dopo circa un’ora e mezza ci siamo seduti. Abbiamo preso due crocche (giunti dopo le pizze, ma ci era stato chiesto per evitare di aspettare l’ordinazione di un tavolo da 8), una margherita e una pizza con fiori di zucca, pancetta croccante e pomodorini (entrambe buonissime). Unico appunto al servizio ( i ragazzi al tavolo per niente gentili) comprendiamo la stanchezza dopo una serata di lavoro ma un minimo di cordialità andrebbe sempre mantenuto..."
"ui_bubble_rating bubble_40","Pizza molto buona","Pizza molto buona e leggera quasi una delle mie preferite a Napoli. Questo posto c’è l’ha consigliato il proprietario del nostro hotel, situata in un vicoletto è una pizzeria piccola ma caratteristica buono anche il fritto che non è stato per nulla pesante.. se andate a Napoli e avete nelle vicinanze questa pizzeria provatela "
"ui_bubble_rating bubble_30","Buona, rispetto alla media.","Ho scelto una pizza, la margherita doc, che poi mi sono fatto personalizzare. Al posto del parmigiano e pecorino, che non mi piacciono sulla pizza, ho fatto mettere la ricotta di Vico Equense. L'insieme è risultato più gradevole.La dimensione della pizza non è abbondante, ma nel complesso l'impasto è gradevole."
"ui_bubble_rating bubble_40","Attesa lunga la pizza ottima","Siamo stati un sabato a pranzo, era orario di punta quindi abbiamo dovuto attendere un bel po' anche essendo solo in due. Ambiente fin troppo familiare, servizi igienici angusti ma puliti. La pizza invece molto buona, merita l'attesa. Impasto leggero, dimensioni non eccessive e possibilità di scegliere vari gusti. Materie prime di partenza ottime. Ritorneremo sicuramente trovandoci in quella zona di Napoli."
"ui_bubble_rating bubble_50","Il Top.","L' unico posto dove puoi mangiare una pizza buonissima, ad un prezzo veramente basso, in un ambiente pulito e con un personale gentile e veloce. Tutte queste cose insieme sono veramente rarissime da unire ma da Attilio tutto questo è la quotidianità. Unico."
"ui_bubble_rating bubble_40","C'è da attendere un po', ma...","Non è possibile prenotare a pranzo (ci si mette in lista d'attesa e si aspetta..), ma per chi ama la vera pizza napoletana ne vale la pena attendere un po'.Particolare la pizza con il bordo ripieno di ricotta.Bravi"
"ui_bubble_rating bubble_40","Fantastica pizza nel cuore di Napoli","Capisco che dire di un'ottima pizza a Napoli sia il un luogo comune ma questa mi ha veramente colpito. Fuori dai giri turistici. Ottimo l'impasto, speciali le pizze proposte, ottimo rapporto qualità prezzo. Da consigliare e da tornarci."
"ui_bubble_rating bubble_50","Pizza ottima in una cornice unica","La sola atmosfera della Pignasecca già fa tanto, ma questa piccola pizzeria è davvero un must per chi vuole assaggiare la vera pizza napoletana. Il locale è piccolo e semplice, il personale gentile e la pizza... è Pizza. Meno osannata delle più famose pizzerie napoletane, io la consiglio se di passaggio per via Toledo. Anche a portafoglio. "
"ui_bubble_rating bubble_50","VEDI NAPOLI E...VAI DA ATTILIO!","Poesia,tutto buonissimo,eravamo 3 amici. Locale familiare,personale simpatico e pizza ottima e ad alta digeribilità. Ci ritorneremo sicuramente."
"ui_bubble_rating bubble_40","Pizza napoletana molto buona","Locale semplice ma accogliente ed il personale gentile e simpatico. La pizza è molto buona sia la classica sia quella fritta. Ci tornerò di sicuro la prossima volta che sarò nuovamente a Napoli."
"ui_bubble_rating bubble_40","Ottima pizza e crocchettone.","Pizzeria nel centro di Napoli, un crocchettone molto buono e una pizza veramente speciale assolutamente da consigliare. Il locale è piccolo, nelle ore di maggior affluenza il personale è un po' affannato, ma è comprensibile. Buon rapporto qualità prezzo. Conto di ritornare."
"ui_bubble_rating bubble_30","Sufficiente","Buona pizza ma no eccezionale,personale all'altezza (forse un po' apatico)locale pulito e ben mantenuto ."
"ui_bubble_rating bubble_50","La frequentiamo da almeno 20 anni","Come detto è una nostra meta fissa, inizialmente perché abitavamo a due passi, adesso anke se viviamo fuori Napoli resta la nostra pizza preferita, sarà l’affetto che nutriamo per il posto ma Attilio for ever "
"ui_bubble_rating bubble_40","Ottima pizza ","Ho preso una semplice margherita con la bufala, buonissima!!!! locale semplice, personale gentile, prezzo adeguato... tempi di attesa un po' lunghi ma ne vale la pena ci tornerò."
"ui_bubble_rating bubble_50","vera pizza napoletana e crocchettone","pizzeria storica in zona centrale! Consigliatissima anche ai napoletani più esigenti: ci sono le ottome pizze tradizionali e quelle più elaborate e innovative! Ambiente familiare e personale simpatico. Da provare assolutamente il crocchettone!!!"
"ui_bubble_rating bubble_30","Pizza buona e gentilezza! ","Sono stata in questa pizzeria a cena col mio ragazzo. Nonostante siamo arrivati molto tardi (alle ore 23.30), ci hanno fatto accomodare e servito con estrema gentilezza! Abbiamo preso delle crocchette di patate come antipasto e due pizze. Tutto molto buono, anche se mi sarei aspettata l'impasto della pizza un po' più spesso: il cornicione era perfetto, morbido e gustoso, mentre il centro della pizza era un po' troppo sottile per i miei gusti. Ingredienti usati per il condimento: freschissimi! Buona anche la birra bionda alla spina! "
"ui_bubble_rating bubble_50","Ottima pizza,","Attilio si mantiene su altissimi livelli di qualità per pizza e gentilezza di servizio. A Napoli, una vera istituzione."
"ui_bubble_rating bubble_50","qualità ottima","Locale non grande e quindi meglio prenotare. Le pizze sono veramente ottime, leggere, con molti gusti raffinati. Servizio veloce e gentile. da consigliare assolutamente."
"ui_bubble_rating bubble_50","1^ pizza a napoli","Ottima pizza, classica con mozzarella di bufala, assaggiato anche pizza fritta completa (per errore di ordinazione) buonissima"
"ui_bubble_rating bubble_40","Pizza stellata","Una pizza da gourmet. Pizza classica con ingredienti originali e buone combinazioni di vegetali. Da assaggiare la pizza stellata con la ricotta nelle estremità. Buona la pizza funghi porcini e zucca. Notevole il crocchettone. Ambiente tradizionale. Da ritornarci."
"ui_bubble_rating bubble_30","Buona pizza","Sicuramente una buona pizza ma non come alcuni miei colleghi mi decantavano. L'unica cosa particolare sono alcuni tipi di pizze che presenta sul menù(come la pizza al baccalà) e il prezzo che al mio modesto parere un po salato."
"ui_bubble_rating bubble_50","La pizza Napoletana con fantasia ","Ottima pizzeria Napoletana nei quartieri,, con abbinamenti fantasiosi e di qualità, simpatica e buonissima la presentazione delle pizze a stella con le punte ripiene di ricotta. Da provare il crocchettone specialità della casa ! "
"ui_bubble_rating bubble_50","BELLA SCOPERTA","Siamo stati attratti da questa pizzeria nei caratteristici quartieri di Napoli, abbiamo ordinato due pizze,partendo dal fatto che a Napoli la pizza regna,ma questa e davvero la migliore,da far venir la voglia di un bis.Prezzi onesti,ci ritorneremo."
"ui_bubble_rating bubble_50","Fortissimi","Salve...Sono stato in questa pizzeria spesse volte xche propongono davvero una pizza di altissima qualità, location simpatica e molto caratteristico...Ottimo il rapporto qualità prezzo... Ve la consiglio vivamente ...."
"ui_bubble_rating bubble_30","Ordinary pizza","La pizzeria di Attilio è ospitato in un piccolo locale su una traversa di via Toledo. Le specialità, a leggere il menù, sono quelle con il bordo ricolmo di ricotta. Personalmente ho provato una pizza con salsiccia beneventana e friarielli. Buono l'impasto, ma troppo poco mozzarella. Ad oggi non è nella mia top 5 della pizza partenopea."
"ui_bubble_rating bubble_40","Ottima pizza ","Non c ero mai stato pur passandoci davanti diverse volte...la pizza veramente buona ..servizio veloce, cameriere garbati e la proprietaria super simpatica ...ci ritornerò. "
"ui_bubble_rating bubble_50","OTTIMO","Pizzeria consigliata da Gino (trattoria Nannì) non ha deluso le nostre aspettative. Abbiamo gustato la VERA pizza napoletana. Cotta alla perfezione con ingredienti di primissima qualità. Una delizia per il palato."
"ui_bubble_rating bubble_40","Pizza Leggera","Ottima pizza e servizio. Data la fama del posto, l’unica pecca è l’attesa per avere un tavolo, ma la pizza è davvero buona! "
"ui_bubble_rating bubble_40","Senza trucchi senza inganni.","Pizza di tradizione.Finalmente Il Pizzaiuolo che non deve stupire a tutti i costi.Cornicione elegante, perfettamente alveolato.Buono il fiordilatte proveniente da Vico Equense con latte di PotenzaPerfetto diametro della pizza.Esci con la Voglia di ritornare a breve..."
"ui_bubble_rating bubble_40","E' sempre lui","Ogni volta che mi trovo da quelle parti non posso mancare di mangiare una pizza come dice il nome. Con la mia famiglia e' una tappa d' obbligo e la sua caratteristica che quando entri senti l'odore vero di una pizzeria. Conosco questa pizzeria da oltre 40 anni da quando c'era il padre Attilio , nulla e' cambiato e ho letto da qualche parte che sono stati premiati, ottima la pizza, e gli sfizi di fritturine, locale sempre accogliente , e' sempre da rirornare."
"ui_bubble_rating bubble_50","Vera pizza napoletana e servizio eccellente","Tralasciando l'ambiente rustico e partenopeo fantastico della Napoli antica che ospita questa caratteristica pizzeria, siamo stati colpiti positivamente da questa pizza, profumo gradevolissimo, impasto eccellente e ingredienti di qualità. Il servizio è da 10 e lode e il rapporto qualità prezzo è davvero buono! Straconsigliato!"
"ui_bubble_rating bubble_50","La vera pizza!!! ","Impasto meraviglioso, servizio idem, anche si il posto non ne il più bello, la pizza lo è! Prezzo giusto. "
"ui_bubble_rating bubble_40","Semplicità per una buonissima pizza","A pranzo con colleghi durante la settimana davvero sorpresi in positivo. Pizza sottile, digeribile e davvero buona. Preso frittatina e crocché di grandezza media ma anche qui davvero buona qualità. Tutto al punto giusto e dopo non c'era ne sete ne senso di pesantezza. Locale un poco piccolo e servizio spartano ma può passare. In generale complimenti. Prezzo basso e ottimo data la qualità della pizza. Tornerò."
"ui_bubble_rating bubble_50","Simpatia e professionalità ","La pizza è nella tradizione napoletana....ottima! Ed anche se può sembrare pesante, è digeribilissima! Il personale attento e super efficiente"
"ui_bubble_rating bubble_50","La pizza","Da 'polentona' del Nord Italia e dopo aver provato altre pizzerie a Napoli più blasonate come Sorbillo, questa mi ha colpito particolarmente per la qualità della pizza, la cortesia del personale, il vero clima partenopeo che si respira, tempi di attesa più 'umani' (attendere un'ora o più da Sorbillo), quartiere popolare.Si raccomanda vivamente la pizza col cornicione di ricotta....meravigliosa...soffice come pannaPizza dal gusto fantastico e digeribile"
"ui_bubble_rating bubble_40","Un sabato diverso","Sabato alle due chiuso il negozio siamo venuti a mangiare la pizza. Un'attesa di circa mezz'ora, ma ne vale la pena. Abbiamo preso un po' di fritturina ed era veramente notevole, in particolare la frittatina fatta con gli stortini. Molto buono anche il crocchè gigante con salsiccia e friarielli che avevamo assaggiato la volta precedente. Abbiamo preso una campagnola e una al pesto, entrambe molto buono anche se l'origano si è fatto sentire per un po', ma probabilmente siamo noi ad avere lo stomaco delicato. Buono il servizio. Prezzi leggermente più alti della zona di via tribunali ma nella media e pizza e frittura, a mio avviso, sicuramente più buoni. Da provare assolutamente!"
"ui_bubble_rating bubble_30","Quanti erano gli spicchi?","Siamo stati in questa recentemente blasonata pizzeria in un sabato mediamente affollato, attratti dalle positive valutazioni degli esperti. L'accoglienza è stata frettolosa e piuttosto spiccia (dopo 2 minuti di orologio ci hanno già chiesto di ordinare). La pizza aveva un impasto nella media dei locali napoletani (anche meno favoriti dalle recensioni nazionali), e la pizza carnevale, con i coreografici otto spicchi ripieni di buona ricotta, non era altro che una margherita con un po' di salsiccia sbriciolata. Un po' significa che la quantità non raggiungeva nemmeno una salsiccia intera (e forse nemmeno la metà). Abbiamo provato le specialità, ma senza riconoscere gusti esaltanti, anzi, abbastanzapiatti. Non parliamo dei servizi igienici, veramente al di sotto di ogni aspettativa, quantomeno volumetrica! "
"ui_bubble_rating bubble_50","Very Good!","La pizzeria Attilio è una delle più antiche pizzerie, con sede in uno dei più popolari quartieri di Napoli: in via Pignasecca. Ieri ci sono stata a cena con delle amiche rimanendo positivamente colpita non solo dalla pizza ma dalla qualità degli ingredienti e dalle verdure usate per arricchire la versione da me scelta (l'ortolana)Nel menù: un delizioso crocchè dimensione maxy farcito con salsicce, provola e friarielli (verdura tipica locale) imperdibile!Sicuramente è un contesto molto alla buona, ma la simpatia dei camerieri e l'atmosfera tipicamente partenopea, fanno di questo posto una tappa da tenere sempre in considerazione."
"ui_bubble_rating bubble_30","Sopravvalutata","Una pizzeria che riceve 3 spicchi da gambero rosso merita una recensione accurata e obiettiva. Una pizzeria di buon Livello dovrebbe garantire sempre una buona pizza. Io vado spesso a mangiarla da attilio e non è mai uguale. L'ultima volta ho preso una semplice siciliana. Sul menù si parla di pomodoro San Marzano. Mi arriva una pizza con un poco di acqua del pomodoro pelato. 4 (contati) pezzettini di melanzane e la pizza non tanto cotta. Da napoletana sarò un po' esigente ma il voto della pizza di attilio non supera la sufficienza. "
"ui_bubble_rating bubble_10","La raccomandazione anche per mangiare una pizza!","Sono una cliente abituale di questa pizzeria perché sono convinta che faccia la migliore pizza di Napoli ma non credevo che anche per mangiare una pizza servisse la raccomandazione . Credo che ci voglia rispetto per la clientela tutta. È inconcepibile che dopo aver lasciato il proprio nominativo , aver atteso pazientemente il proprio turno per 45 min , si venga scavalcati da 4 persone , amiche di qualcuno che non ha neanche la decenza di fare con eleganza questa schifezza. Sarai anche la migliore pizzeria di Napoli ma in quanto a rispetto vali 0!!!!!!!"
"ui_bubble_rating bubble_50","Napol'è!","Non scrivo recensioni spesso e non mi piace esagerare nelle valutazioni. Ogni principio ha le sue eccezioni.Attilio e i suoi ragazzi sono una di queste. Semplicemente ottime le pizze a partire dalle pizze fritte che ci siamo divisi come antipasto. Birra alla spina fresca e spumeggiante. Servizio rapido e cortese. Prezzi concorrenziali....che volete di più?"
"ui_bubble_rating bubble_50","Pizza meravigliosa!","Oggi con i colleghi sono andata a mangiare la pizza da Attilio, quella con le punte con la ricotta e le verdure.... strepitosa. Servizio veloce e prezzi onestissimi."
"ui_bubble_rating bubble_50","Sinfonia","Mangiare la pizza di Attilio é un'esperienza unica. Un trionfo di profumi e sapori che ti inebriano i sensi, una sinfonia di gusti. Pizza più buona a Napoli non c'è. Grandissimo Attilio. "
"ui_bubble_rating bubble_50","Very good!!!","Ottima pizza napoletana cotta con forno a legna, buonissima! Io di solito ho il vizio di eliminare il cornicione ma questa volta ho mangiato tutto senza lasciare niente! "
"ui_bubble_rating bubble_50","ATTILIO SUPER STAR","22 anni di pizze mangiate da Attilio e niente mi farà mai cambiare idea sul.fatto che la sua pizza è la migliore. Gli ingredienti freschi e di ottima qualità, l'impasto soffice ed assolutente leggero da digerire. Se venite a Napoli per la prima volta e non avete mai assaggiato lapizza napoletana andate da Attilio. C'e solo un problema.........dopo averla mangiata non potrwte farne più a meno. Viva Attilio e tutto il suo staff. "
"ui_bubble_rating bubble_50","Elogio della tradizione","Nel cuore della Napoli verace e popolare c'è una pizza autentica, dal sapore inconfondibile. Qualità dei prodotti e impasto lavorato a regola d'arte danno vita a una delle Margherite più buone della città"
"ui_bubble_rating bubble_50","Altro che pizzerie chic& gourmet!","Ci mancavo da 15 anni dai tempi dell'università! Che dire, pizze top, ne abbiamo prese 4 diverse e tt buonissime.Congratulazioni x la semplicità è la bontà, questa è la base della pizza alimento della tradizione popolare che pseudo chef-pizzaioli stanno rovinando!Bravo Attilio"
"ui_bubble_rating bubble_40","Una delle migliori ","Pizza di ottimo livello Servizio veloce Consiglio di provare la semplice margherita una delle classiche ed imbattibili del suo repertorio . Si trova nella pignasecca a due passi da via toledo ( è la parallela ) "
"ui_bubble_rating bubble_50","eccezionale!","Sono stata diverse volte in questa pizzeria a pranzo e la considero la migliore tra quelle visitate nella città di Napoli. Il personale è gentile e professionale, il locale è molto carino in un vicoletto a due passi dalla stazione metro di Toledo. Nonostante la folla i tempi di attesa non sono lunghissimi e i prezzi sono in linea con quelli medi delle pizzerie Napoletane. I fritti assaggiati (crocchè e frittatine di pasta) sono buonissimi, ma che dire della pizza? Impasto soffice e molto digeribile, ingredienti saporiti e tutti di ottima qualità, se volete assaggiare la pizza Napoletana non perdetevi quella di Attilio, forse meno conosciuta di quella di tante altre pizzerie più pubblicizzate, ma sicuramente con una delle pizze più buone assaggiate in vita mia!"
"ui_bubble_rating bubble_40","Pizza super ","Sicuramente da consigliare la pizza a stella con la ricotta nella cornicione: spettacolare. Servizio veloce e informale "
"ui_bubble_rating bubble_40","ottimo","si sa, per un turista a Napoli la scelta è vasta, ma la pizza era più buona di altri posti, più conosciuti e segnalati.se poi si considera che è la pizzeria frequentata da quelli del posto.... c'è da fidarsii tavoli fuori sono un po spartani, ma la strada non è trafficata"
"ui_bubble_rating bubble_40","professionalità e cordialità","La pizza è ottima, direi una delle migliori mangiate a Napoli, particolari i crocchè di patate anche nella versione gigante, l'atmosfera è gioviale ed il locale si trova in un luogo caratteristico della città. Esperienza che ripeterei senz'altro."
"ui_bubble_rating bubble_50","Tappa fissa da Attilio!","Tappa fissa per quando torno a Napoli: la Pizza da Attilio me la devo andare a mangiare! Sempre molto buona!! Andateci!"
"ui_bubble_rating bubble_20","Igiene scarsa e pizze bruciate","Oggi siamo andati a pranzo da Attilio. Sulla tovaglia di plastica colava acqua dal condizionatore e alcune stoviglie erano sporche. Una pizza era bruciata, una salatissima. Esperienza da non ripetere"
"ui_bubble_rating bubble_50","Una pizza eccellente","Nella pizzeria Da Attilio si ha la possibilità di mangiare una pizza eccellente, dalle classiche marinara e margherita a quelle più elaborate. L'ambiente del locale è molto semplice e particolarmente accogliente e si trova in una delle zone più animate e popolari del centro storico di Napoli, almeno di giorno. In serata la stessa zona cambia completamente aspetto perchè poco frequentata. Il rapporto qualità/ prezzo è ottimo. Assolutamente consigliata!"
"ui_bubble_rating bubble_50","Tappa fissa a Napoli per una pizza che non ha rivali","La nostra tappa fissa per la pizza napoletana si chiama Attilio!Questa piccola pizzeria a conduzione familiare è un'autentica istituzione napoletana.La pizza è squisita!!!Ingredienti di prima qualità!La mia pizza preferita è la pizza a stella con I friarelli ma l'ultima volta che sono stata ho assaggiato una vera prelibatezza : la pizza con limone e alici che dire?Fresca , gustosa e molto estiva!La genuinità del posto e la sincerità delle persone che lo conducono sono gli altri ingredienti di questo straordinario posto in un quartiere della Napoli verace!Bravo Attilio, brave la mamma e la moglie di Attilio e tutto il personale simpatico e gentile."
"ui_bubble_rating bubble_50","Pizza, amore e fantasia!","Ottima pizza.....da provare anche la pizza a stella con le punte farcite con la ricotta. Consiglio vivamente questo locale, piccolo ma accogliente, dove, oltre alla vera pizza napoletana, troverete ospitalità, cortesia e professionalità."
"ui_bubble_rating bubble_50","Pizza molto buona","Abbiamo mangiato una margherita molto leggera e una pizza a stella con ottimi ingredienti, consiglio sicuramente da Attilio a chi vuole mangiare una buona pizza !"
"ui_bubble_rating bubble_40","Buona pizza!!!!","Pizza terribilmente gustosa, soprattutto quella con le punte farcite di ricotta, anche l'ambiente è piacevole, molto molto garbata la signora che ci ha accolti. Data la bontà della pizza c'è un po' di attesa ma ne vale assolutamente la pena."
"ui_bubble_rating bubble_50","A'regina delle pizze","Premetto che non avevo mai mangiato la pizza a Napoli per cui ero molto curiosa.. ci siamo fidati delle recensioni e dell'istinto e ci siamo fermati da Attilio (nonostante l'esterno non sia particolarmente accattivante)..abbiamo preso una frittatina di pasta da dividere come antipasto, una margherita doc e un cannolo. Tutto squisito,l'impasto è leggero e digeribilissimo, i pomodorini del piennolo sono super saporiti e la mozzarella buonissima.. spesa modica per la quantità e la qualità del cibo (15 euro a testa).. continuate cosi !!!"
