"Restaurant_Ratings","Restaurant_Quotes","Restaurant_Reviews"
"","",""
"ui_bubble_rating bubble_50","La vera pizza napoletana ","Ci affidiamo ai consigli di TripAdvisor per la nostra prima pizza a Napoli e devo dire che siamo rimasti pienamente soddisfatti!Vasta scelta di pizze.. Dalle classiche a quelle con il bordo ripieno di ricotta. Impasto leggero e sapore perfetto. Consigliatissimo"
"ui_bubble_rating bubble_50","Viaggio a Napoli ","Siamo andati in questa pizzeria poiché gli amici sono napoletani e non so ancora come ringraziarli. La pizza era ECCEZIONALE. Una digeribilita', un sapore, una leggerezza unica. Inoltre è praticamente a 2 passi dalla cumana di MonteSanto ed a 2 passi da spaccanapoli. RITORNERÒ sicuramente "
"ui_bubble_rating bubble_50","La pizza napoletana","Una delle pizze più buone e digeribili mai mangiate. La materia prima eccellente rende l'impasto magico e il servizio è semplice e professionale, rapporto qualità prezzo ottimo. Per la vera pizza bisogna andare a Napoli, e non altrove"
"ui_bubble_rating bubble_50","Nella Top 10 delle migliori pizzerie a Napoli.","Locale piccolo ma accogliente nel cuore della Pignasecca. Servizio veloce e personale cortese, ma soprattutto una pizza strepitosa."
"ui_bubble_rating bubble_50","Pizza buonissima ","Locale piccolo ma accogliente, personale gentilissimo e alla mano.. pizza davvero tanto buona, sia per l’impasto leggerissimo che per i condimenti gustosi, preparata con cura su ripiano a vista che garantisce attenzione ai dettagli e pulizia.. uno spettacolo per gli occhi! L’unica pecca è l’attesa: ci siamo presentati in due per cena alle 19.30 e purtroppo siamo riusciti a sederci solo alle 21 dopo un’ora e mezzo... però ne vale la pena, andateci! Rapporto qualità prezzo ottimo: due pizze, una Coca Cola e un’acqua da 75cl per 22 euro in totale!"
"ui_bubble_rating bubble_50","Ottimo ","Ottima pizza nel centro di Napoli. Oltre alle classiche di sono anche pizze particolari il cui contorno e’ stellato e la stella contiene della ricotta. Il tempo di attesa e’ variabile ma bisogna dotarsi di pazienza. Non è’ possibile eseguire la prenotazione. Non ha molti tavoli. Certamente da provare "
"ui_bubble_rating bubble_40","Pizza meravigliosa","Una pizzeria tradizionale napoletana per me straordinaria, purtroppo è molto frequentata pensate abbiamo atteso 1 ora e mezza ma ne valeva la pena, nel centro di napoli locale piccolo ma casalingo meglio andare nei giorni feriali ti godi di più la buona cucina."
"ui_bubble_rating bubble_20","per turisti","storica pizzeria nel cuore di Napoli, ma sotto lo standard delle pizzerie napoletane, infatti c'erano solo stranieri, locale piccolo e disorganizzato (vedi le ore di ATTESA), pizza buona"
"ui_bubble_rating bubble_10","Pizzeria mediocre","Sono stato in questa pizzeria oggi è non tornerò mai più i tempi di attesa sono altissimi tipo due ore e la pizza non è a livello di altre pizzerie di napoli idecisamente sconsigliata anche perché i vini sono pietosi è il locale è piccolo"
"ui_bubble_rating bubble_50","Pizza da Attilio","In questa pizzeria, ho mangiato la migliore pizza in vita mia.Il sapore è sublime.Ingredienti di altissima qualità e super veloci.I prezzi sono giusti.Ottimo, super consigliato"
"ui_bubble_rating bubble_50","Natale Naples","Consigliata dal nostro B&B , usciti soddisfatti, il piatto parla da se, pizza ottima , giocato di anticipo entrati alle 12:15, all'uscita alle.13:40 una fila impressionante.La consiglio"
"ui_bubble_rating bubble_10","L'attesa infinita ","Che errore! Abbiamo chiesto quanto avremmo dovuto attendere senza avere una risposta definita però abbiamo deciso di aspettare comunque. Abbiamo aspettato mezz'ora, un'ora, un'ora e mezza..... DUE ORE! La pizza? E chi se la ricorda"
"ui_bubble_rating bubble_50","Pienamente soddisfatta!","Già pienamente soddisfatta dalla pizza consumata a mezzogiorno, ci sono tornata anche la sera per rigustare e poter ricordare la pizza completamente appagante di Attilio!La pizzeria è inoltre in una delle zone più caratteristiche di Napoli. Consigliatissima."
"ui_bubble_rating bubble_50","Pizza ottima in zona pittoresca","Abituato alle mediocri pizze veneziane forse il mio giudizio sarà in parte influenzato ma, ho trovato la pizza ottima, l'impasto ben lievitato e digeribile.Prezzo onesto, personale schietto.Bell'ambiente."
"ui_bubble_rating bubble_30","Mi aspettavo di più'.","Da questa storica pizzeria, sinceramente, mi aspettavo molto di più'. Siamo andati un giovedì sera che pure pioveva, quindi tutto molto tranquillo con un equilibrato numero di clienti ai tavoli. Il locale è caratteristico e a mio parere anche bello nella sua genuinità'. Appena seduti ci è stato offerto un ' fagotto arrotolato con friarielli ' che dopo averlo assaggiato l'abbiamo accantonato. Passiamo alle due pizze: le classiche, margherita e marinara. Senza lode né gloria entrambe, anzi. Ho dei dubbi sul fior di latte sulla bianca, forse confermato vedendo il contenitore sul piano dei pizzaioli all'uscita ma la causa maggiore che giustifica il mio voto è stata la cottura !!! Impasto crudo nel cornicione che dopo circa 5 minuti ha assunto una gommosità equivalente al pongo.(ci ho pure giocato) Meno male non ho bevuto tutta la notte, meno male."
"ui_bubble_rating bubble_50","Napoli in bocca ","Ho conosciuto questa pizzeria passeggiando per i quartieri spagnoli è già questo ha il suo fascino entrando in questa pizzeria ho respirato l'aria di famiglia e di professionalità la pizza era buonissima tanto da fare gli applausi al maestro Attilio il prezzo poi la vera sorpresa basso per la qualità espressa ci tornerò volentieri "
"ui_bubble_rating bubble_50","A Pizza!!!!","La vera pizza Napoletana la trovate qui. Veloci, gentili, ci siamo andati apposta da Bergamo a Napoli per la loro pizza. Supercosigliato"
"ui_bubble_rating bubble_40","Una buona pizza a Napoli","Pizza molto buona, ingredienti freschi, impasto digeribile. Personale cortese. Prezzi ottimi. Ho ordinato Margherita Doc con bufala e pomodorini e sono rimasta soddisfatta. Sono stata da Attilio di sabato sera e per sedersi senza attendere e mangiare con calma consiglio di andare alle 19. Dopo le 19.40 inizia ad esserci la fila fuori."
"ui_bubble_rating bubble_20","C' era una volta.....","Servizio pessimo , pizza Margherita sotto la media come qualità degli ingredienti e lievitazione della pasta.Ripeto...c'era una volta la pizza di Attilio. "
"ui_bubble_rating bubble_50","Una Margherita da Attilio","Frequento questa pizzeria da da quasi mezzo secolo, nel tempo la qualità e la cortesia sono sempre costanti."
"ui_bubble_rating bubble_40","Meraviglia ","Dopo esserci imbattute in un clamoroso “fake” napoletano, siamo andate ad assaggiare la vera pizza napoletana.La Margherita a mio avviso era speciale, gustosa, leggera e leggermente croccante.Son riuscita a mangiarne due praticamente.Consiglio per il pranzo di andare poco dopo l’apertura così da trovar posto.Location semplice e pizza davvero speciale, nel cuore di Napoli!"
"ui_bubble_rating bubble_40","Ottimo","Una domenicale piacevole...Pizza buona leggera velocissimo il servizo. cordiali e simpatici...lo consiglio"
"ui_bubble_rating bubble_50","Cena da Attilio","Antipasto eccezionale, pizza eccellente, servizio veloce che ripaga l’attesa del tavolo. Prezzo ottimo, da non perdere"
"ui_bubble_rating bubble_40","Impossibile sbagliarsi","E' difficile trovare una pizza mediocre a Napoli, la differenza la fanno i dettagli: personale gentile, ottima l'idea di enfatizzare la provenienza delle materie prime, buona la pizza fritta (anche se l'olio andrebbe cambiato/filtrato più spesso). Come consistenza della pasta siamo dalle parti dell'eccellenza. In sintesi: un ottima pizza senza la folla (e i prezzi) di ottime ma frequentatissime eccellenze (non fatemi fare nomi ...)."
"ui_bubble_rating bubble_40","Ottima davvero!!!","Immediatamente all'interno di una laterale di via Toledo, si respira completamente l'aria dei quartieri spagnoli. Piccola ma caratteristica offre una pizza SUPERLATIVA!!!!!!! Il personale è cortese ed il prezzo è giusto. "
"ui_bubble_rating bubble_10","MAI PIÙ CI TORNEREMO!!!","Mancavamo da anni e,trovandoci in centro, ci siamo voluti andare x mangiare la loro pizza. È STATA LA PEGGIORE PIZZA CHE ABBIAMO MAI MANGIATO FIN'ORA. 1) abbiamo preso una Campagnola x mio marito e una Tiziana x me. Sulla prima appena appena, la salsa,5 acciughe e piena di origano. Sulla seconda appena la salsa, 5 pomodorini ( contati) ,3 PEZZETTI di provola e una RICOTTA ACIDISSIMA! X NON PARLARE DELLE MELANZANE FRITTE UNO SCHIFO! A finale le due erano scotte e gommose. Le abbiamo lasciate x 3/4.2) l'acqua servita in bottiglia era già aperta. Tant'è che 1. aveva sapore da fontana( noi la usiamo a casa, quindi conosciamo il sapore) 2. noi nn l' abbiamo potuta aprire: *solo il cameriere* ( già era aperta)3) quando abbiamo ricevuto il conto ci siamo resi conto, che si erano fregati 0,50€ !!! Nelle foto qui, se controllate, la somma delle pizze è di 13,50 no 14. La cassiera nn ha voluto sapere ragioni ! E nè tantomeno verificare dal menù!!! 4) nessuna ricevuta fiscale5) già ci sta la mancia x i camerieri6) personale scortese, incompetente, maleducato!!! Non sanno parlare manco l'inglese!!! Oramai è un porto turistico, EVITATELA!!!"
"ui_bubble_rating bubble_50","Pizza al top","La miglior pizza che abbia mai mangiato. Servizio impeccabile rapporto qualità/ prezzo ottimo. Non mi aspettavo di pagare cosi poco per una pizza eccezionale. Chi viene a Napoli ci deve andare "
"ui_bubble_rating bubble_50","Ottimooooo","Beh a Napoli non puoi non mangiare la storica e tanto decantata pizza napoletana. Tra le tantissime pizzerie presenti, ho scelto la Pizzeria da Attilio in Via Pignasecca, un piccolo e storico locale in zona Pignasecca nelle vicinanze della centralissima Via Toledo. E' stata una scelta eccellente perché da Attilio puoi mangiare la migliore pizza napoletana con materie prime di grandissima qualità. Impasto soffice, ben cotto e digeribilissimo. Fantastica la loro pizza Carnevale ....non dico altro perché va gustata in religioso silenzio. Come tutte le maggiori pizzerie di Napoli non accetta prenotazioni ma prende il nome per inserirlo in una sorta di lista di attesa. Poi quando giungi al locale dai il nome e se ci sono tavoli liberi ti fanno accomodare sennò ti avvertono appena se ne libera uno a seconda della lista. Io consiglio di non andare troppo tardi perché si rischierebbe di aspettare un pò troppo. Servizio veloce e prezzi nella norma.Che dire di più .....andateci e non ve ne pentirete. Consigliatissimo. Se tornerò nella spendida Napoli tornerò sicuramente da Attilio."
"ui_bubble_rating bubble_50","Una vera pizzeria","Locale che si trova nel cuore vivo di Napoli nel mercato di Pignasecca. Fritti eccellenti, così come le pizze. Prezzo onesto. Se si viene a Napoli bisogna andare in una pizzeria così, verace!!!"
"ui_bubble_rating bubble_50","La migliore ","La migliore pizza che abbia mai mangiato. Non si deve aggiungere altroLocale caratteristico nel centro storico di Napoli. Complimenti"
"ui_bubble_rating bubble_50","Ottimo ","Perfetto , ottima pizza ,personale cordiale e spiritoso , prezzo super economico!! In un’unica parola : il Vero ristorante Napoletano . "
"ui_bubble_rating bubble_30","buona pizza ma proprietaria furbetta","abbiamo mangiato 2 volte in questo locale. la prima volta tutto bene, ottima margherita. la seconda abbiamo la pizza con verdure e formaggio senza pomodoro. decisamente meglio quella col pomodoro. La CASSERIA furnbetta alla richiesta dello scontrino ci da una fattura senza averne una copia per il locale tenendo un blocco di carta sotto l'originale. siccome c'era tanta gente siamo andati via. sono di origine napoletana, e non mi piacciono i pregiudizi, ma a volte hanno un fondo di verita"
"ui_bubble_rating bubble_50","Super pizza!","Quando posso alla fine di una bella passeggiata per il centro di Napoli mi concedo una pizza. Devo dire che sono passata tante volte lungo la strada dove è collocata questa pizzeria ma non mi sono mai fermata proiettata verso pizzerie a me stranote; questa volta però ho voluto cambiare e la scelta è ricaduta sulla ''pizzeria da Attilio''.Ora di pranzo..... attesa di circa mezz'ora per gustare una pizza buona buona buona.Credevo di aver mangiato già il top della pizza ma con Attilio mi sono dovuta ricredere c'è davvero di meglio.Devo complimentarmi con i pizzaioli per l'ottimo prodotto e con i camerieri che sono molto disponibili a soddisfare le richieste del cliente. Alla prossima!!!!"
"ui_bubble_rating bubble_50","top","Sono stato ieri sera con degli amici a gustare una pizza in questa trattoria-pizzeria. Che dirvi,abbiamo mangiato ottimamente una pizza leggerissima e gustosa.La gentilissima proprietaria ci ha fatto inoltre gustare una pizza con i fiorili,una vera squisitezza. Che dire poi del famoso crocchettone di patate dal gusto deliziosissimoServizio ottimo"
"ui_bubble_rating bubble_50","Ottima lievitazione","Ho provato una pizza napoletana (pomodoro, origano e aglio). Gusto buonissimo, impasto leggero e lievitazione ottima. Unica pecca alcune parti troppo bruciate."
"ui_bubble_rating bubble_50","Pizza a pranzo","Continua il mio cercare le eccellenze nella fattura di vere Pizze Napoletane. Oggi sono stato da Attilio alla Pignasecca. Esperienza emozionante!. Pizza eccezionale (ne ho mangiate due) ovviamente Margherita. Impasto soffice, ben cotto, dello giusto spessore. Gusto paradisiaco. NULLA da appuntare. Congratulazioni al proprietario e a tutto lo staff per laa cortesia ricevuta.pse fanno lo scontrino.............."
"ui_bubble_rating bubble_50","Pizza eccellente e leggera","Locale storico nel cuore di Napoli, in una via animata e colorata. Pizza eccellente, con impasto leggero e ben cotto e ingredienti di qualità. Nei giorni e negli orari di punta bisogna mettere in conto di dover attendere per avere un tavolo, come per tutte le migliori pizzerie di Napoli"
"ui_bubble_rating bubble_40","Pizza buona e personale gentile","Ci hanno consigliato di mangiare la pizza in questo locale e...non ce ne siamo pentiti affatto! La pizza è molto buona, condita molto bene e personale gentilissimo."
"ui_bubble_rating bubble_50","Il Re della pizza","Se volete assaporare la vera pizza napoletana dovete assolutamente recarvi da Attilio in pigna secca. La pizza qui è un misto di tradizione e innovazione. Impasto leggero e materie prima di eccellente qualità, rendono la pizza di Attilio un'eccellenza della tradizione. Ogni spicchio racchiude il sapore di Napoli e della passione. Anche se in passato c'è stata qualche pecca ne servizio, ribadisco che a Napoli la pizza è Attilio."
"ui_bubble_rating bubble_30","Tanto sapore e poco garbo","L'accoglienza non è delle più gradevoli. Sarà la notorietà, sarà l'antichità o più semplicemente l'afluenza ma, di certo, occorrerebbe trattare la clientela con maggiore gentilezza. Non perché il cliente ha sempre ragione e vada blandito ma il garbo, la buona creanza dà sapore alle relazioni prima che si assapori l'alimentazione. Questa è di buona fattura con qualche punta di originalità. Il conto è sopra la media rispetto al tenore del locale e alla qualità del servizio."
"ui_bubble_rating bubble_50","Essenza di Napoli","in visita a Napoli cercavamo proprio un posto come questo: aspettato mezz'ora per entrare nonostante fossero le 14 ne è valsa totalmente la pena. Pizze eccellenti e anche particolari, se si vuole osare. posti un po stretti ma non pretende di essere un ristorante raffinato. Genuino."
"ui_bubble_rating bubble_50","Per me una delle migliori","C'è sempre da aspettare da Attilio, ma ne vale sempre la pena. La pizza è veramente eccellente sotto tutti i punti di vista: impasto innanzitutto (ne mangi due e digerisci tranquillo), gli ingredienti della farcitura di ottima qualità, la cottura perfetta (tutta cotta ma non secca e quindi evidentemente non cruda). La fantasia poi. La pizza carnevale è una poesia: creatività ma nel solco della tradizione. Grazie Attilio!"
"ui_bubble_rating bubble_50","Tradizione eccezionale ","Nel cuore del quartiere Pignasecca la pizzeria prepara pizze da ottanta anni. Poche volte ho mangiato una pizza verace napoletana così leggera, fragrante e buona.Tanti i gusti. Vi suggerisco di non farvi mancare la pizza Margherita, e anche la pizza a forma di stelle. Un vero must di Attilio. L’attesa per sedervi è ripagata abbondantemente dalla ottima cucina tradizionale e dalla pizza verace napoletana fatta con arte."
"ui_bubble_rating bubble_40","Ottimo calzone al forno!","Ho pranzato presso la Pizzeria da Attilio con amici.Personalmente ho deciso di provare il calzone al forno con scarole e provola.Impasto soffice e digeribile, verdura fresca e ben condita.Davvero un’ottima pizza, da riprovare!Ampiamente soddisfatti anche i miei commensali che hanno provato un calzone classico e una Margherita con melanzane.Prezzi in linea con quelli delle pizzerie del centro "
"ui_bubble_rating bubble_30","Primma o'crocchè. E 'ppo a'pizza!","Una pizzeria tra le più popolari e considerate a Napoli si trova qui, nella zona del mercato della Pignasecca. La pizzeria da Attilio vi apparirà molto spartana, senza fronzoli e nemmeno appariscente se visto da fuori. All'entrata, vengo invitato ad accomodarmi dove preferisco anche se dopo poco mi si chiede di prendere un tavolo più piccolo (che non avevo notato all'entrata) giacché ero solo ed accetto senza problemi, mi sentivo cmq comodo. Scelgo una frittatina, un crocché ed una pizza carnevale (cornicione con ricotta e pizza condita con salsiccia, pomodori, mozzarella, parmigiano). E risulta tutto davvero ottimo. Mi sarebbe piaciuto però, ricevere prima i fritti e poi la pizza, a me sono stati portati mentre consumavo quest'ultima, non il massimo del servizio. Il tavolo di fianco al mio è stato accontentato su questo e comunque, I fritti e la pizza si mangiano ben caldi, appena arrivano (suppongo che lo staff del locale lo sappia bene). Mi sarebbe piaciuto che questa piccola esigenza fosse stata rispettata come io ho rispettato quella del locale, cambiando tavolo. Da bere ho preso un paio di bicchieri di vino bianco della casa, senza infamia e senza lode. Senz'altro, il prezzo di 17.50 permette di mangiare bene senza svenarsi ed è caratteristica di molti locali di Napoli. Sono uscito soddisfatto con una vena di delusione. Il rapporto qualità prezzo, relativamente al cibo, mi spinge a volerci tornare."
"ui_bubble_rating bubble_40","Una delle migliori ma poca abbondanza...","Cominciamo subito col dire che il posto è piccolo! siamo nelcuore della Pignasecca! i tavoli stretti! a tagliare la pizza braccia a braccia si fa fatica. La Pizza è piccola! una vera bestemmia nella trdizione del centro storico (nota per a rot e carretto). L'impasto è sottile e morbido, davvero fatto bene gli ingredienti buoni di prima scelta ma la cosa grave è nelle dosi! (e dalle!) striminziti!! come si può notare anche dalle dalle foto! Una pizza con fiori di zucca praticamente 2 striscioline.. dai!! ingredienti piazzati solo al centro e scarni... fanno si che la parte esterna vicina al cornicione è secca! Eh lo so! sono pignolo ma non sono un turista scandinavo... la pizza per me è una cosa seria! Il prezzo buono! circa 7€ a testa per tre pizze di cui 2 margherite. Insomma buona davvero.. però pizza piccola ingredienti striminziti (forse al gambero rosso questo non interessa!), non mi consentono di dargli i voti che meriterebbe non c'è volonta di rendere questo piatto indimenticabile! Forse le mie aspettative erano troppo alte! Gambero rosso 2019 ho appena letto l'articolo che la vede tra le migliori d'Italia però secondo me manca qualche cosa per il Gotha delle pizzerie napoletane. Tenete presente che sono un recensore che spacca il capello! la pizza è la mia passione! La pizza è cmq davvero buona!"
"ui_bubble_rating bubble_50","La migliore!!","Abbiamo cenato qui seguendo il consiglio di un amico napoletano. Che dire, soddisfatti al 100%Camerieri simpatici, premurosi, hanno apparecchiato un altro tavolino apposta per noi per spostarci da una posizione un po’ scomodaIngredienti freschi, di qualità, servizio attento e rapidoRapporto qualità prezzo molto buono Ci torneremo sicuramente nel prossimo viaggio nella splendida Napoli"
"ui_bubble_rating bubble_40","Pizza doc alla Pignasecca","Forno e banco di lavoro a vista, all'ingresso. A seguire due locali, contigui, con tavoli e sedie robuste. Ma tovaglie e tovaglioli di carta. Ambiente non molto luminoso. Ci troviamo nella Pignasecca, antico quartiere popolare al centro di Napoli. Il menu é ricco e le proposte sono dettagliatamente descritte in italiano e in inglese. Numerose le varianti delle pizze, sia tradizionali sia dalle farciture più moderne. Prezzi nella media. La pizza é morbida, il cornicione è pronunciato ma non esagerato. Ben condita e ben cotta. Buono il sapore. Servizio buono. Conto: Pizza doc (bufala e pomodorino) 7 euro, birra nastro azzurro (33 cl. ) 2 euro."
"ui_bubble_rating bubble_40","Uno dei migliori","Buona scelta è tutto di una qualità ottima , situato nei quartieri spagnoli bassi , Stile caratteristico anche se un po’ strettino negli spazi . Da provare assolutamente la frittatina, è’ qualcosa di fantastico "
"ui_bubble_rating bubble_40","Una buona pizza!","Abito a pochi passi da questa pizzeria, quindi ci vado spesso e spesso la prendo anche da asporto! È una classica pizza napoletana quella che offrono, con ingredienti buoni e un buon impasto! La consiglio sicuramente a tutti quelli che vogliono una buona pizza senza troppi giri di parole, visto che il locale è un po' spartano e il serbizio molto veloce, data la molta affluenza.Do 4 stelle su 5 perché si potrebbe fare di più per rendere il locale meno arrangiato, data la fama della pizzeria si potrebbe ambire ad un servizio diverso! "
"ui_bubble_rating bubble_40","Pizza verace ","Scoperto grazie a Ugly Delicious su Netflix, siamo stati molto soddisfatti. Pizze con ingredienti vari e combinazioni che non si vedono molto spesso, il plus è stato il cornicione con ricotta. "
"ui_bubble_rating bubble_50","Fidatevi di noi . è veramente la migliore pizzeria di Napoli","E' vero questa pizzeria l'abbiamo già recensita ed è altrettanto vero che ogni volta che possiamo ci torniamo sempre con entusiasmo .L'ultima volta è stato qualche giorno fa . Ed allora perchè ne scriviamo ancora? Perchè non sopportiamo i commenti di gente ignorante, ovviamente ignorante non in senso offensivo, ma nel senso che non conosce assolutamente come deve essere una vera pizza napoletana, vale a dire sottilissima nella sua parte centrale , con un cornicione evidente ma molto ben areato, morbidissima alla masticazione e di totale digeribilità . Signori , questa è la pizza di Attilio, senza se e senza ma attualmente ( ma forse da sempre) la migliore di Napoli. Sedetevi ai tavoli spartani di questa pizzeria , assaporate con calma la Margherita( che è la vera pizza di Napoli) e quasi sicuramente converrete con noi. Se così non sarà , ribadiamo un nostro vecchio concetto: non vi piace la pizza napoletana, ma per favore evitate almeno commenti eretici."
"ui_bubble_rating bubble_30","Pizza mediocre. Pulizia ok. ","Pizzeria abbastanza frequentata.All'arrivo si lascia il proprio nome e si attende di essere chiamati sul marciapiede di fronte alla pizzeria. Il locale è forse eccessivamente vecchio nell'arredamento, personale gentile.La pizza è mediocre, per niente entusiasmante.Sottile come un'ostia, se si esclude la parte del cornicione.Bicchieri e posate pulitissimi.Dopo aver finito la pizza, si ha la sensazione di essere quasi invitati ad andar via, probabilmente per la necessità di smaltire la gente in attesa. Meno di un minuto dopo aver terminato le pizze, il nostro tavolo è stato completamente sparecchiato, compresi anche i bicchieri. Ok la coda, però...Un barbincino carinissimo gira libero nel locale e per i tavoli. Bellissimo e non fastidioso. Personalmente, ho dovuto espressamente richiedere lo scontrino che non mi era stato assolutamente fatto e di certo non si trattava di dimenticanza. "
"ui_bubble_rating bubble_40","Ottima pizza","Con un gruppo di amiche abbiamo scelto questa pizzeria consigliate dal gestore del nostro B&B. Locale piccolo ma arriviamo presto e ci danno subito il tavolo. Nel menù, oltre alle classiche pizze ci sono anche le speciali. Delizioso il cornicione con le punte ripiene di ricotta! Impasto digeribile e leggero. Camerieri disponibili anche se non brillano per simpatia. Penso che questa pizzeria non abbia niente da invidiare alle colleghe più blasonate dove si rischiano code estenuanti dopo una giornata in giro per Napoli. "
"ui_bubble_rating bubble_40","Quando dici pizza","In questa pizzeria trovi l'essenza della pizza Napoletana.Le classiche intramontabili e vere pizze.Poi le speciali.Queste uniscono vecchia conoscenza ad un nuovo approccio gustativo.Mi sono piaciute.Oltre alla velocità sua bel servizio che nell'andare.Sì perché la pizza, si guarda, si mangia, si assapora e poi via per spacca Napoli.Good"
"ui_bubble_rating bubble_50","Tipica Pizzerria napoletana doc","Nel cuore del centro storico di Napoli, raggiungibile facilmente a piedi e con la metro.Locale piccolo ma tipico, pulito ed accogliente. Durante il fine settimana c’è da attendere anche parecchio prima di sedersi. La pizza buonissima, eccellente!"
"ui_bubble_rating bubble_50","Ottima pizza!!!","Ho avuto la fortuna di andare varie volte da Attilio a mangiare una buonissima pizza, una delle mie favorite a Napoli.Lo consiglio a tutti, pizza squisita , leggera, e inimitabile.Non vedo l’ora di ritornare in questa pizzeria."
