"Restaurant_Ratings","Restaurant_Quotes","Restaurant_Reviews"
"ui_bubble_rating bubble_30","Pizza ok","La pizza è buona ma il locale è un pò troppo piccolo quindi si sta troppo ravvicinati, un consiglio o prendete un locale più grande vista l'affluenza di clienti che avete o togliete qualche tavolo perchè mentre uno sta mangiando non può alzarsi per far passare uno del tavolo dietro! Cmq la qualità della pizza è ottima ed i prezzi sono contenuti, continuate così bravi!"
"ui_bubble_rating bubble_50","Pizza sublime ed atmosfera familiare ed accogliente","Senza dubbio è una delle migliori pizzerie di Napoli, sia per la qualità e per la varietà delle pizze che per la velocità, gentilezza e simpatia del personale, in particolare Antonio e Pasqualino.Consiglio in particolare la pizza chimica e l'antipasto di fritturine leggero e gustoso.Il rapporto prezzo/qualità è ottimo.Il locale è pulito ed accogliente.Da ritornarci con amici e familiari.10 e lode."
"ui_bubble_rating bubble_50","Semplicemente spettacolare ","A due passi da dove abito ... Pizzeria senza eguali .., semplicemente fantastica: personale gentile ,pizzaioli fantastici ,camerieri cortesi , non la cambierei con nessuno "
"ui_bubble_rating bubble_50","A CHE LIVELLO? ALTISSIMO LIVELLO!!!","Il locale è molto sobrio e accogliente. Appena ti accomodi è come sentirti a casa... i fratelli Russo ed il loro staff ti mettono subito a tuo agio... Pasquale gestisce alla grande i clienti in attesa senza mai fare una piega: l'ultimo della serata per lui è sempre il primo ed è SEMPRE cordiale,garbato e sorridente. Antonio è il jolly di sala, organizza i posti a sedere (con il grande aiuto di Mario!) sempre con il sorriso, scambia con piacere quattro chiacchiere con i clienti senza mai distogliere l'attenzione dalla tempistica nel servire questi ultimi. In fine il maestro Nicola, colui che con professionalità accarezza l'impasto per far si che possiate mangiare una pizza UNICA e SPECIALE, con un impasto soffice, leggero e con ingredienti di altissima qualità! Complimenti davvero ragazzi, la vostra umiltà e la vostra professionalità vi porteranno a raggiungere prestigiosi traguardi!"
"ui_bubble_rating bubble_50","A un passo da casa una pizza stupefacente","Non è la prima volta che veniamo qui io e il mio ragazzo...siamo soliti per la vicinanza da casa sua ma anche per la qualitá che supera molte pizzerie blasonate...l'arma vincente è l impasto,la varietá e i gusti cosí sfiziosi ...di solito qui prendiamo la pizza al pistacchio e mortadella un must...ma anche qnd ho cambiato gusto non mi sono pentita mai...la consiglio e non vedo l'ora di tornarci..."
"ui_bubble_rating bubble_40","Pizza a portar via","Abbiamo ordinato 7 pizze a portar via.3 margherite, una cosacca, 2 stelle e 1 wurstel e patatine. Leggere e da mozzafiato la Stella. Le margherite erano completate da una mozzarellina al centro.Un po di fila ma con i 2 forni non abbiamo aspettato molto. Una delle pizze migliori di Napoli detto da un napoletano."
"ui_bubble_rating bubble_50","Da premio oscar<U+FFFD><U+FFFD><U+FFFD><U+FFFD><U+FFFD><U+FFFD>","Sono stata da gigino e figli 1 milione di volte....è la migliore pizzeria non solo nel mio quartiere ma in generale nella mia città.....I pizzaioli sono veloci e bravissimi, la pasta di pane è leggerissima e la cordialità di Pasquale è pari a pochi. I tempi di attesa sono quelli di tutte le pizzerie STAR.....che dire....la mia preferita è la pizza pecorino andate andate e andate!!!!!"
"ui_bubble_rating bubble_50","Pizza buonissima ","Siamo stati una sera a mangiare con la mia compagna, locale piccolo e accogliente, avevamo s elto due pizze ma il cameriere con modo garbato e gentile ci ha consigliato di provare altri tipi di pizza, che dire ottimo consiglio. Da ritornarci assolutamente ! "
"ui_bubble_rating bubble_50","pizzeria straordinaria","E' la mia pizzeria preferita, non la cambierei con nessun'altra. Fanno tantissimi tipi di pizza e sono tutte buone con ingredienti di alta qualità. Il servizio è impeccabile.sempre efficienti , gentili, cordiali e organizzati anche con il locale stracolmo. E da non sottovalutare la pulizia che nel locale fa da padrona."
"ui_bubble_rating bubble_50","Una delle migliori pizze di Napoli","Anche a Napoli ci sono pizze buone e meno buone.In questo locale, piccolo e fuori dal centro, si mangia una delle migliori pizze.Quella tipica del locale è la chimica, non so perché ha questo nome che allontana l'idea di genuino, ma invece è molto buona. uno spicchio è ripiegato e forma un calzone ripieno con mozzarella e melanzane, il resto è a spicchi, friarielli e salsiccia e margherita. nel triangolo mancante viene servito un calzone fritto ripieno ricotta e prosciutto. A dirla così sembra una bomba, ma invece è digeribile.Anche le altre pizze sono buone e fantasiose, ma io prendo sempre quella.Il locale è sempre pieno, ma il servizio è rapido e i camerieri simpatici."
"ui_bubble_rating bubble_50","La migliore pizza del quartiere e non solo","Ottima pizza, personale gentilissimo, grande varietà di gusti. Non ha niente da invidiare ad altre pizzerie più rinomate ed infatti quando voglio far assaggiare la vera pizza napoletana a qualche cliente che viene da fuori, la mia scelta sempre per questa pizzeria "
"ui_bubble_rating bubble_50","La pizza è ottima ","Ordino spesso la pizza qui e vi assicuro che è davvero buona.Il personale all interno è molto disponibile è sempre pronto ad assistere il cliente per ogni esigenza. Bravi continuate così "
"ui_bubble_rating bubble_30","Buona la pizza ma...","Sono stato con famiglia in questa pizzeria per una ricorrenza.La pizza è buona seppur con un impasto abbastanza pesante e poco digeribile.ho mangiato una ottima marinara, ma mia moglie ha preso la chimica, una loro specialità formata da 4 tipi di pizza diversi.Poca scelta fine birre e bibite in generale, il locale è piccolo e arrivano tutti gli odori della cucina.Insomma buona da mangiare non bello per mangiare sul posto."
"ui_bubble_rating bubble_50","Ottima serata","Abbiamo mangiato un'ottima pizza, accompagnata da una gentilezza e squisitezza favolose ( Mario il cameriere e Lino il proprietario sono fantastici! ). Consigliatissimo!"
"ui_bubble_rating bubble_40","LOCALE ACCOGLIENTE","Questa pizzeria è piccola ma accogliente. Ha anche la copertura esterna, ma purtroppo quando il meteo non lo permette bisogna per forza usufruire della sala interna. Le pizze sono molto buone, da provare assolutamente la KIMIKA, una vera bomba gastronomica. Ottime anche gli straccetti e la frittura in genere. Personale competente ed allegro. Prezzi nella norma. Da ritornarci sicuramente."
"ui_bubble_rating bubble_40","Buono buono","Ottima pizza ma soprattutto ottima frittura! Consiglio zeppoline!!! Fenomenali.. tantissimi gusti di pizza da poter scegliere... Pizza zucca perfetta!"
"ui_bubble_rating bubble_50","Pizzeria superlativa","Sono stata con delle amiche per festeggiare un compleanno e sono davvero rimasta positivamente sorpresa dalla gentilezze, simpatia dei ragazzi della pizzeria. Le pizze tutte ottime. Abbiamo preso una pizza chimica favolosa, una segreto, una tonino e una stella con del buon vino e ottima birra artigianale. Tutto eccellente, conviene prenotare perchè il locale non è molto grande. Ottimo rapporto qualità prezzo.Ci ritornerò per assaggiare le altre pizze."
"ui_bubble_rating bubble_50","Vera pizza","La migliore pizzeria della zona, veloce anche con i suoi ritardi...ma del resto ha moltissima clientela anche durante la settimana...poche volte ho mangiato in sala e sono tutti cordiali e disponibili...il più delle volte preferiamo il servizio a domicilio...Una cosa importante Lino fa il lavoro di 3 persone insieme.La pizza di qualsiasi gusto la fanno è sempre ottima..Auguro a questa pizzeria di avere sempre tutta questa affluenza...lo meritano..."
"ui_bubble_rating bubble_40","Grande!!","Oramai questa pizzeria è diventata tappa frequente. Un luogo dove veniamo con piacere, e dal quale poi ce ne andiamo leggeri, sazi e soddisfatti.Il locale non è molto grande, ecco perché la necessità di una veranda esterna. All'interno è ben illuminato, forse pure troppo, ma va bene così: quello che conta sono le pizze. Sono moltissime, con svariati gusti e possibilità di scelta, in più sono ottime.Personale gentile e attento ad ogni esigenza...Soprattutto Mario che, da buona forchetta (oltre che per la sua esperienza), ci consiglia sempre il meglio.Grande."
"ui_bubble_rating bubble_50","PIZZERIA A 5 STELLE","Ottima pizzeria sono rimasta particolarmente colpita dalla professionalità del personale gentile e molto orientato al cliente. In particolare gli apprezzamenti vanno a Mario. Il tutto condito da una pizza al filetto squisita."
"ui_bubble_rating bubble_50","Sorprendente","Ci rechiamo in questa pizzeria per puro caso ed a essere sincero ero un po' scettico sulla qualità della pizza.. Oltre alle pizze classiche ve ne sono tante più particolari, io ho preso la pizza chimica ed è stata davvero buona, anche gli altri che erano con me sono stati tutti della stessa opinione, la pizza era ottima. Purtroppo l'attesa per avere un tavolo è abbastanza lunga, forse perché era sabato. Ci torneremo."
"ui_bubble_rating bubble_50","Pizza","Una pizzeria super la loro forza e la pizza ottima e il servizio è la cortesia eccezionale per chi vuole mangiare la vera pizza napoletana da loro deve andare per me sono unici "
"ui_bubble_rating bubble_50","Magnifica! ","Pizza semplicemente magnifica come possibile intuire anche dalla grande fila che c'è sempre. Consigliatissima la pizza chimica. "
"ui_bubble_rating bubble_20","Deludente","Attratti da buone recensioni, siamo stati in questa pizzeria. Personale molto cortese, ma eccessivamente frettoloso. Antipasto forse buono al momento della frittura, ma freddo e unto quando è arrivato a tavola. Stessa sorte anche per la tanto decantata pizza, arrivata fredda e gommosa. Non è stata una buona esperienza"
"ui_bubble_rating bubble_40","La pizza più buona del quartiere. ","....E non solo del quartiere. Davvero una pizza ottima e anche gusti particolari come la chimica, stupenda invenzione. La sala è carina ed accogliente e pure l'esterno di sera non è male. Piccola pecca la consegna, si devono calcolare almeno 45 minuti dopo l'orario che loro indicano per la consegna. "
"ui_bubble_rating bubble_50","Visita a napoli "," Tutto ottimo, il locale , si mangia divinamente ottimo il servizio e soprattutto eccezionale gentilezza ed educazione del personale assolutamente da visitare . "
"ui_bubble_rating bubble_50","Pizzeria soddisfacente e pizza ottima","Appena posso la Domenica sera mi rifuggo nella pizzeria di Gigino & Figli: locale tranquillo, pulito e spazioso. La Pizza è la regina: buonissima, sempre ben cotta e mai bruciata ( come spesso accade in altre pizzerie) ampia scelta di pizze, io preferisco la Modo Nostro e straconsiglio La Chimica che è una vera specialità. Staff cordiale e sempre disponibile. Pizzeria consigliatissima per coppiette e famiglia."
"ui_bubble_rating bubble_50","N°1","Da asporto, o direttamente in sala, la pizza è meravigliosa!! porto sempre a mangiare da loro la vera pizza quando voglio fare bella figura.nonostante il caos generato dai molti clienti (se fanno la pizza buona è normale ci sia folla)riescono ad essere rapidi e ti accontentano sempre!! bravi ragazzi!!"
"ui_bubble_rating bubble_50","Festa di compleanno ","O festeggiato i miei 40 in famiglia ottima figura tt buono .un ottimo menu pizza fritturine bruschette prezzo contenuto io faccio lo stesso mestiere e sono rimasto molto contento ."
"ui_bubble_rating bubble_50","Eccellenti","Ottimo il servizio, ottimo il mangiare ma soprattutto sono xsone super eccellenti.. soprattutto Mario..... Ci vedremo presto "
"ui_bubble_rating bubble_50","In pizzeria come a casa tua","Fra tante pizzerie Gigino & figli merita l eccellenza per qualità pulizia e cortesiaTra le svariate pizze nn perdetevi la chimica,pizza stella,e la montanara con la genovese,per i tradizionalisti ripieno con scarole al forno."
"ui_bubble_rating bubble_50","A distanza di mesi....","Qualità, cortesia e simpatia... Tutti aggettivi che rispecchiano questa pizzeria. A distanza di mesi ho trovato l'impasto della pizza, molto più leggero e gustoso, degna di una vera pizza. Non c'è da meravigliarsi se c'è sempre molta gente!!"
"ui_bubble_rating bubble_50","E che pizza!!","Gigino&figli è una pizzeria dove appena entri ti senti a casa, i camerieri sono simpaticissimi e il locale è accogliente. Le pizze sono spettacolari, gustose e ricche. Poi il menù non è per niente banale, fanno pizze particolari e sfiziose =D"
"ui_bubble_rating bubble_50","qualità, simpatia, cortesia e professionalità!","Siamo venuti a pranzo, un tavolo di 6 persone, tutti amici appena tornati dall'Università, li ho portati qui. E' ormai diventato il mio punto di riferimento, il fiore all'occhiello della zona, questa pizza, sapientemente elaborata con impasti estremamente lavorati e leggeri, nonché condita esclusivamente con ingredienti scelti e di qualità, non fa che rendere la base, già solida, di professionalità cortesia e competenza, un posto perfetto per mangiare una delle pizze più buone di Napoli e provincia, qualità messa sempre alla prova e SEMPRE superata a pieni voti, soprattutto quando il carico di lavoro intenso può farti pressione ed indurre in errore. La pizza più buona è spesso un dato soggettivo, ma loro sono capaci di mettere d'accordo tutti, anche i titubanti. Non so se sia un bene o un male il fatto che si sparga la voce, perché altrimenti sono costretti a rinnovare nuovamente il locale per ampliarlo! scherzo, auguro il meglio ad una famiglia dedita al lavoro tutti i giorni, continuate così!"
"ui_bubble_rating bubble_40","Pizza con sedia a rotelle","E' una pizzeria non lontana da casa mia ma è piacevole andarci perché è adatta a me che sono in sedia a rotelle. Prenoto sempre per avere un servizio migliore.Mangio la pizza volentieri e non mi gonfia."
"ui_bubble_rating bubble_40","Ottima pizza","Sono stato con amici in questa pizzeria situata al Rione Traiano, abbiamo preso un antipasto fatto di fritture con verdure grigliate e crocchè, buone e friabili,ho preso una pizza contenente 4 gusti, un ripieno al forno con parmigiana, un ripieno fritto, una Margherita ed una salsiccia mozzarella e friarielli, uno spicchio abbondante per questi 4 gusti, sono riuscito a mangiarla tutta è non mi è rimasta sullo stomaco quindi leggera, grande idratazione e ingredienti di prim'ordine,personale cortese e veloce, c'è solo da ritornare! "
"ui_bubble_rating bubble_50","La mia pizzeria di fiducia","La pizzeria Gigino&Figli è la pizzeria sotto casa, una garanzia per la mia famiglia e tutti quelli che conosco. Si fa fatica a scegliere una pizza, sono tutte buonissime saporite, fatte con ingredienti di qualità e mai scadenti. Le pizze che preferisco, oltre alla classica e intramontabile margherita, sono: pizza fiocco (panna, patate schiacciate e prosciutto), pizza a modo nostro (rucola, crudo e scaglie di parmigiano), pizza mimosa e occasionalmente mi sfizio con un bel ripieno al forno ricotta e prosciutto o un saltimbocca friarielli provola e patatine. Tutto buonissimo e sempre soddisfacente, non sbagliano un colpo! Sono ormai cliente da anni, e la qualità non è mai calata, anzi. E' un ottimo punto di ritrovo per un pranzo easy fra amiche o una cena con il compagno. La consiglio vivamente a tutti, se avete la possibilità di provarne le prelibatezze, ritenetevi fortunati."
"ui_bubble_rating bubble_40","Un'alternativa ai Grandi Nomi","Questi ragazzi provano a fare la differenza, accogliendo i clienti in modo garbato e facendoli sentire a casa, a differenza di ristoranti altisonanti, che cercano di smammarti il più velocemente possibile per cedere il tuo tavolo ai prossimi nel minor tempo possibile.La pizza è di buona qualità, e l'impegno dei ragazzi è massimo, si vede dai litri di olio di gomito e sudore che producono per far sì il che servizio sia rapido e di qualità. Non metto il massimo perché purtroppo non c'è parcheggio, e non è sicuramente un ristorante dove puoi apprezzare il verde o il panorama, ma x il resto, veramente COMPLIMENTONI!"
"ui_bubble_rating bubble_50","PIZZA IN FAMIGLIA","Grazie a Dio, non esiste solo Sorbillo e 50 KALO'!A Napoli, nel mio quartiere, c'è questo localino semplice semplice che fa tante pizze di qualità.Il fiore all'occhiello è però l'atmosfera familiare che si respira e la passione dei tre fratelli Pasqualino, Nicola ed Antonio che ti accolgono con simpatia ed educazione.Anche il servizio a domicilio è raccomandato ed ogni settimana almeno una volta ne approfittiamo."
"ui_bubble_rating bubble_50","Che buona la pizza","Premetto che abito a 50mt dalla pizzeria quindi a volte per uscire andiamo altrove ed ogni volta penso... ma ho Gigino sotto casa perché sono venuto qua... I prodotti sono ottimi ed il personale è sempre cortese, l'assaggio vale l'attesa della lunga fila che sicuramente troverete!"
"ui_bubble_rating bubble_20","poca organizzazione","ci sono stato varie volte, la pizza e' ottima davvero, ma l'organizzazione va vista bene...abbiamo scelto questo posto per portarci un'amica ,ma e' stato deludente...e' vero che era pienissimo anche se solo di martedì, ma pur di far sedere piu' clienti possibili, ci siamo trovati incastrati tra i tavoli, tanto che per andare in bagno si sono alzati in 4 per farmi passare ...una cosa deludente e' vedere che insieme al piatto della frittura sono arrivate anche le pizze...non e' accettabile...non abbiamo potuto mangiare l'antipasto per non far raffreddare la pizza...il cameriere (un ragazzo molto robusto) era incurante di queste esigenze..."
"ui_bubble_rating bubble_30","Pizza buona...","Ho mangiato solo pizza, una margherita. Buona, ma ne ho mangiate di meglio. Locale piccolo e affollato, eravamo in una quindicina...troppo stretti. Sconsigliato per tavolate grandi con amici. Prezzi ottimi!"
"ui_bubble_rating bubble_50","Ottima la pizza e ottimo il servizio!","Appena usciti dalla pizzeria,ci sentiamo di consigliarla:pizza dall impasto soffice, ben lievitato e leggero,servizio cortese e molto efficiente,prezzi onesti!andate a trovarli!"
"ui_bubble_rating bubble_50","Pizze eccezionali ","Pizze eccezionali, al pari delle migliori pizzerie di Napoli! È sempre una garanzia ed il personale è molto gentile e disponibile. C'è sempre molta folla ma vale l'attesa. Prezzi nella norma"
"ui_bubble_rating bubble_50","Maestri della Pizza","Consiglio a tutti di provare la montanara al forno!!! oppure la pizza crocchè.. UNA COSA ESAGERATA. Prezzi contenutissimi qualità Garantita. Ci vado molto spesso. Unico neo: se andate troppo tardi non entrate più. Conviene anticiparvi! Mangiate subito e bene :)"
"ui_bubble_rating bubble_50","Un eccellenza sub cava","Ex bella figliola si è rinnovato, ma non nel gusto e nello spirito. Quando torno dalla toscana è uno dei miei punti fermi, che mi riporta ai sapori, profumi e suoni della mia adolescenza soccavese."
"ui_bubble_rating bubble_50","Buono buono buono","Locale molto casereccio e pizze davvero ottime. Da provare come antipasti la frittatina e la piadina con impasto di pizza. Un consiglio: lasciatevi consigliare dal personale molto cortese. Da provare il ripieno fritto salsicce e friarielli e la pizza chimica in foto"
"ui_bubble_rating bubble_50","Cena di lavoro","Pizze eccezionale. Da provare il ripieno fritto salsicce e friarielli con provola.Consiglio anche le pizze piadine con funghi e porchetta, squisito.Personale che ti mette a proprio agio, cortese e professionale.Ci ritornerò senz'altro, più volte, per provare le altre varianti di pizze."
"ui_bubble_rating bubble_50","Il trionfo della pizza","Quando vai da Gigino & Figli ti senti come a casa. Ambiente informale, semplice, tipico dell'antica pizzeria napoletana, della quale conserva anche i prezzi modici, rivisitato, in chiave moderna da Nicola, Antonio e Pasquale, tre fratelli pizzaioli che hanno ereditato l'arte di famiglia. Qui non devi aspettarti sofisticazioni ma soltanto la bontà della pizza e dei suoi elementi di base, tutti di prima scelta, selezionati con cura. Da provare la pizza chimica, suddivisa in quattro spicchi, di cui uno costituito da un ripieno fritto, la Gigino con il cornicione ripieno di ricotta in onore di papà e le ultime con mortadella e pistacchio, la genovese o le più semplici ma altrettanto deliziose, del Piennolo o la San Marzano. Buona la birra alla spina San Miguel e le ultime birre artigianali. Su ogni pizza un bocconcino di mozzarella e tanta, ma veramente tanta passione. Per tutti il caffè o l'amaro sono omaggio..."
"ui_bubble_rating bubble_50","Buonissima la pizza al pistacchio e mortadella e quella alla genovese","Una delle pizze più buone di Napoli. sebbene non sia conosciuta come altre pizzerie quali Sorbillo, Pellone o La Notizia, la qualità e la bontà della pizza di Gigino e Figli non ha nulla da invidiare. Il personale e'molto cortese ed educato. Nonostante la grande affluenza di persone il pizzaiolo è abbastanza veloce nel servire i clienti.Consiglio tutte le pizze ma credo che le più buone, che in più occasioni ho ordinato, sono queste: pizza al pistacchio e mortadella, pizza chimica, pizza stella, e soprattutto la pizza alla genovese...da leccarsi i baffi."
"ui_bubble_rating bubble_50","Impossibile non ritornarvi","Finalmente posso fare una recensione completa anche sul servizio ai tavoli. E c'è poco da dire, il personale è davvero molto cordiale e gentile, la pizza, di cui ho già parlato in una precedente recensione, si è riconfermata ottima. Il servizio è stato celeressimo nonostante fosse un sabato pomeriggio e la sala fosse prenotata per un compleanno. Inoltre visto che ho preferito cedere l'ultimo babà a mia suocera, mi è stato servito come dessert un semifreddo cioccolato e crema pieno di nutella e panna per consolarmi, grandi! Per 4 pizze (una margherita con funghi, una A modo nostro e 2 con rucola e bresaola), una bottiglia di vino e una di acqua, 2 babà e 2 semifreddi, il conto è stato di 45€! Ed è stato ovvio tornarci anche la stessa sera, anche se da asporto, come facciamo quasi sempre io e il mio fidanzato di sabato!"
"ui_bubble_rating bubble_50","OTTIMA PIZZA","Abbiamo voluto provare questa pizzeria ed è stata un' ottima scelta! Bel locale, ha pochi posti all' interno con tavoli un pò troppo ravvicinati tra loro ed altri fuori.Il menù delle pizze è ricco ed i prezzi hanno un ottimo rapporto con la qualità, margherita € 4,00 capricciosa €5,00 per fare un esempio poi ci sono delle pizze speciali che costano un pò in più. Il coperto costa € 1,00 a testa e ZERO costo servizio (che bello!)Ritorneremo di sicuro!"
"ui_bubble_rating bubble_50","La migliore pizza di Napoli","Adoro questa pizzeria!!! Ogni volta che torno a Napoli è una tappa fissa! Il locale è piccolo ma ben curato, il personale gentile e disponibile! Ottimi i fritti... Un must la margherita con mozzarella di Bufala.. Ma offre una varietà di pizze una migliore dell'altra! Buona anche la pizza provola e zucca. Un'ottima pizza assolutamente da provare! Consigliatissima."
"ui_bubble_rating bubble_50","Ottima pizza!","Moltissime varietà di pizze e di ottima qualità, non ha niente da invidiare ai nomi più prestigiosi della città. Da provare!"
"ui_bubble_rating bubble_50","Tutto ottimo","La mia pizzeria di fiducia!!! Nei periodi di ferie ho assaggiato, purtroppo, parecchie pizzerie in zona ma nessuna è al suo livello. Le pizze sono ottime ma non solo: le frittatine (fatte da loro) sono sublimi! La frittura e gli angioletti sono buonissimi.I prezzi sono nella media e la qualità è ottima. Per me Gigino viene solo dopo pizzerie famose al centro storico di Napoli. Consiglio di prendere la pizza direttamente in pizzeria o di mangiarla in sede poichè, essendo una delle pizzerie migliori, c'è sempre tanta gente che aspetta l'asporto."
"ui_bubble_rating bubble_40","Ottimo!!","Sono stato qui 3 volte e ho ordinato una ventina di asporti,è una pizzeria che dal rinnovo è diventata fantastica.pizza ottima e gustosa compimenti!!!"
"ui_bubble_rating bubble_40","Ottima pizza!","Locale a Soccavo, non molto grande ma nuovo. Ha anche spazi all'esterno. Le pizze sono tante e veramente ottime. La frittura è altrettanto buona. Ottimi gli straccetti, rustici e dolci (con la nutella). Prezzi economici. Superconsigliato!!!"
"ui_bubble_rating bubble_50","LA MIGLIORE PIZZA DI NAPOLI","Eccezionale, la pizza è meravigliosa e il personale simpaticissimo.Se volete mangiare la migliore pizza di Napoli andate da Gigino e Figli"
"ui_bubble_rating bubble_50","fantastica","Tra le migliori pizzerie di Napoli. La famiglia Russo con Gigino e i tre figli, Antonio, Nicola e Pasquale hanno fatto dell'altissima qualità degli ingredienti il loro cavallo di battaglia. Consiglio un pò tutte le specialità ma la Chimica, la Stella o la pizza fritta sono sublimi!!!!!"
"ui_bubble_rating bubble_40","Il migliore tra Soccavo e Pianura","Ci sono stato di sabato sera con amici, tempi di attesa nella media ma ne vale la pena. Forse la migliore pizza della zona, morbida, stesa bene e molto leggera. Staff veloce e gentile; molto buono il rapporto qualità/prezzo."
"ui_bubble_rating bubble_40","La migliore pizza di soccavo","Davvero un'ottima pizza... Purtroppo il sabato c'è da aspettare un po' ma l'attesa ne vale sicuramente la pena! Mi vedranno molto spesso "
"ui_bubble_rating bubble_50","C'e poco da dire!! Siete il top..","Ormai sono gia un po di anni che andiamo a mangiare la pizza in questo locale molto accogliente, dai camerieri al mitico Pasqualino..Le pizze le ho provate quasi tutte ma per me la stella e unica!! Lo consiglio vivamente sia per i prezzi ke per la qualita'.."
