"Restaurant_Ratings","Restaurant_Quotes","Restaurant_Reviews"
"","",""
"ui_bubble_rating bubble_50","Che Pizza!","Ovviamente visto che si trova a Soccavo non è un posto per turisti. La fila di napoletani per entrare fa presumere però che si tratta di una pizzeria di ottimo livello. Mi è capitato altre volte di apprezzare la vera pizza napoletana che qui a Roma non è facilissimo trovare fatta bene.La pizza di Giggino ha caratteristiche di morbidezza e di gusto che raramente mi è capitato di incontrare. A mio avviso l°impasto migliore che mi sia capitato di assaggiare.Servizio celere e cortese. Prezzo più che adeguato.5 pallini assolutamente meritati."
"ui_bubble_rating bubble_30","come al solito..cresce la fama, crescono i prezzi e calano qualità ed attenzione al servizio ed al cliente..","ho scritto una recensione eccellente nell'estate del 2015 e devo dire che di quell'avviso son rimasto per lungo tempo. Già l'estate scorsa, tuttavia, per mangiare una pizza avevo dovuto attendere oltre un'ora in piedi, senza aver potuto prenotare, e non l'avevo trovata eccezionale. Giunto la sera del 23 dicembre a Napoli, con il desiderio di una pizza, sono tornato in questo locale con cari amici che come me ne avevano una buona opinione e sono assidui frequentatori..ma siamo rimasti molto delusi: sebbene alle 23 il locale non fosse certo pieno, abbiamo atteso 40 mn le pizze: buona la napulegna (montanara fritta con polpettine poi ripassata in forno, dal prezzo francamente un tantino esagerato), e buona anche l'esplosiva (un ripieno fritto condito in superficie e ripassato in forno); molto deludente invece tanto la nonno pasquà (una classica pizza al forno con provola e filetto di pomodoro) quanto la marinara: entrambi con ampie chiazze non condite (un'abitudine da Gigino purtroppo), dal pomodoro amaro (la marinara) e dal prezzo spropositato (la nonno pasquà a 8,00€, che per Napoli é davvero un'esagerazione). Per finire abbiam chiesto un digestivo ghiacciato, ci é stato detto che l'amaro del capo era caldo e consigliato uno jegermeister che ci é stato però servito anch'esso caldo..Mi auguro si sia trattato di una serata no ma certo il prezzo quanto meno non era occasionale, ed andrebbe obiettivamente rivisto"
"ui_bubble_rating bubble_50","Ottima pizza superiore alla media","Ottima pizza...Locale carino anche se piccolino... Il che Nn dispiace...Personale cordiale e disponibile...Da provare e riprovare "
"ui_bubble_rating bubble_50","sempre più forti","Ritornare nella mia terra,nel mio quartiere,è sempre un piacere.Che sia breve,media o toccata e fuga la prima tappa è sempre la pizza da Gigino & Figli.Non esistono aggettivi per descrivere la bontà delle pizze,prodotti genuini,la passione e la cordialità che mettono i ragazzi.Da loro mi sento a casa.Il menù sempre aggiornato,e quando mi chiedono quale pizza preferisco...senza esitazione rispondo :  la prossima!!! .A presto,continuate sempre così!!!Un abbraccio da Munchen,con stima e affetto."
"ui_bubble_rating bubble_50","Pizza top","Ormai una tradizione di famiglia quando si ritorna a casa si punta diritto in pizzeria perché è il top della pizza braviii braviii"
"ui_bubble_rating bubble_50","una perla nascosta","Lontano dal flusso industriale/turistico delle pizzerie di Napoli centro, vicino alla storica Croce di Piperno si trova questa pizzeria con ben due forni a legna. Pizze di ogni natura forma e dimensione con prodotti freschissimi e non industriali , assicurano una pizza che dire di ottima qualità non rende l'idea. Prezzi contenuti tanta varietà e simpatia. Un locale tranquillo per amici e famiglia"
"ui_bubble_rating bubble_20","Pizza nella media ","Frittura non perfetta Fiore di zucca e frittella pessime Pizza nella media Conto economico Nel complesso classica pizzeria nella media "
"ui_bubble_rating bubble_50","Pizza con amici","Siamo stati di venerdì sera con amici che venivano da fuori Napoli e che volevano mangiare la vera pizza napoletana...siamo andati verso le 20 e subito ci siamo seduti all'esterno sebbene non avessimo prenotato...personale gentilissimo e simpatico, per quanto riguarda le pizze io non avevo dubbi del livello di eccellenza e ho avuto una conferma mentre i miei amici sono rimasti estasiati!!!! Inutile dire che lo consiglio e che ovviamente per me rimane il top!!!"
"ui_bubble_rating bubble_50","UNA CERTEZZA !! ","Che dire ... giggino è una garanzia , pizza OTTIMA BUONISSIMA anche nel caos del sabato quando sei pronto a giustificare le pizzerie più rinomate perché “ vabbè è sabato c’è folla” loro non hanno bisogno di giustifiche perché che sia sabato, che ci sia la partita o qualsiasi altro avvenimento la loro pizza é sempre al TOP. Molto spesso mi accorgo di non considerarla perché é molto vicino casa e ovviamente il sabato tendo ad andare nei quartieri con più movida ma poi quando ci ritorno mi dico “ cavolo ... é una delle pizze più buone di napoli e sta sotto casa “. Ebbene sì penso che sia una delle migliori pizzerie e credetemi io vado in giro a provarne di tutti i tipi dal centro al vomero e giggino occupa un posto nelle mie top tre pizzerie preferite.Non prendetela sottogamba come una qualsiasi pizzeria di quartiere , giggino é la rappresentazione della pizzeria tradizionale napoletana per eccellenza "
"ui_bubble_rating bubble_50","Pizza ottima ","Mi reco spesso in questa pizzeria con la mia famiglia, le pizze sono buonissime e molto particolari. La filetto è la migliore che abbia mai assaggiato! Unica pecca è la folla"
"ui_bubble_rating bubble_50","SUPERLATIVO!!!","Posto scoperto ieri, che dire SUPERLATIVO da 10 e lode, pizze sublimi, staff simpaticissimo, fritture leggere come anche tutto il resto, ti alzi da tavola senza la minima pesantezza, da qui si capisce la qualità degli ingredienti. Da ritornarci più e più volte."
"ui_bubble_rating bubble_40","ottimo ","se non fosse stato per le lunghissime avrei dato 5! tutto molto buono e i camerieri molto cortesi complimenti "
"ui_bubble_rating bubble_40","ci torno sempre","per me è il punto di riferimento per mangiare a Vico camerieri gentili si mangia discretamente vasta scelta per i dolci al carrello la pizza molto buona peccato che condita miseramente!"
"ui_bubble_rating bubble_40","Pizza molto buona ","Sono stata con mio marito, mio figlio e degli amici un venerdì sera a cena.Posto piccolino.Pizza molto buona e frittini sfiziosiCamerieri simpatici e disponibili"
"ui_bubble_rating bubble_40","Ottima pizza","Locale un po’ stretto con poco spazio tra i tavoli in zona Soccavo.Pizza molto buona e fritti appetitosi.Servizio un po’ lento ma camerieri simpatici e disponibili.Prezzo adeguato.Lo consiglio "
"ui_bubble_rating bubble_40","Sempre ottimo","Seconda volta seconda conferma. Pizza ottima, davvero di alto livello. Ottimo impasto e ottimi ingredienti. Non do il punteggio massimo per via della zona, ma per chi non bada a questo ma vuole mangiare una buonissima pizza sicuramente può fare affidamento a Gigino&figli"
"ui_bubble_rating bubble_50","Pizza napoletana","Una delle migliori pizze di Napoli, personale gentilissimo e attento alle esigenze dei clienti, ambiente rinnovato e pulito.Ottime le birre ed il servizio"
"ui_bubble_rating bubble_40","Ottima Pizza , pizzaiolo bravissimo , servizio non il massimo","Bisogna dare atto alla pizzeria di realizzare un buon prodotto , la pizza in tutte le sue varieta' e sempre buona , anche i fritti , prezzi nella media , unica nota negativa il servizio, il locale e' sempre pieno e bisogna attendere per accomodarsi , ma il personale non sempre disponibile è un po confusionario o diciamo stanco. Comunque un locale da visitare , pizza da assaggiare anche fritta e non dimenticate gli angioletti con il pomodoro fresco. Complimenti al propietario e pizzaiolo."
"ui_bubble_rating bubble_40","Gustosissima pizza","Si sa la pizza nel napoletano è dovunque buona ma vi assicuro che qui è eccezionale per cottura ,condimento,qualità degli ingredienti e anche per la cortesia del personale. Prezzo nella media . Consigliato"
"ui_bubble_rating bubble_40","Buona pizza!!!!","Salve...sono stato da poco in questa pizzeria, devo dire che ho mangiato una Buonissima pizza, prodotti di ottima qualità, servizio rapido e veloce, complimenti al cameriere Mario, location un po spartana, sopratutto la sala esterna...Ma ve lo consiglio.. Una pecca assurda pero' e che non accettano prenotazioni !!!!!!"
"ui_bubble_rating bubble_40","Imbarazzo della scelta","Location minimale con arredo classico da pizzeria. Menù ricchissimo con l’imbarazzo della scelta e dalle pizze con le svariate forme, quasi artistiche. Servizio discreto e cordiale. Conto medio rapportato alla qualità del prodotto reso. "
"ui_bubble_rating bubble_40","Una sola pecca ","Niente da dire sulle pizze, spettacolari e preparate con ottimi ingredienti, vado spesso da loro ,da quando ancora vendevano le margheritine a mille lire , unica pecca : il servizio in sala, a volte lascia davvero troppo a desiderare "
"ui_bubble_rating bubble_50","Pizza buonissimaa<U+0001F60B><U+0001F60B>","Tutto ottimo... pizze, locale e personale! Siamo clienti da sempre e nn ci hanno mai delusi!! È come sentiresti a casa"
"ui_bubble_rating bubble_30","Il servizio..un optional","Io ed altri tre amici ci siamo recati in questa pizzeria con molte aspettative,in tutta onestà solo in parte ripagate,andiamo in un giorno settimanale di sera e troviamo subito una bella ressa,per allietare la lunga attesa prendiamo un fritto misto,buono ma non eccellente,dopo circa un'ora ed un quarto finalmente entriamo e possiamo finalmente esaudire i nostri desideri fatti di pasta,pomodoro ed altri prodotti tipici,prendiamo 4 pizze diverse,notiamo subito una certa approssimazione nel servizio,ciò che era solo una sensazione dopo un pò si rivela subito essere una cruda realtà,vengono servite le tre pizze ad i miei amici e la mia che era una semplice Margherita si fa attendere come la più spocchiosa delle regine,i miei amici manifestano la loro solidarietà facendomi assaggiare le loro pizze ma niente la mia regina ancora si fa attendere,quando loro hanno quasi finito,arriva la mia..La qualità delle pizze è davvero ottima,niente da dire,ottimi ingredienti,buona lievitazione,solo un pazzo potrebbe dire il contrario.Ordiniamo altre due pizze più originali per assaporare gusti ancora semisconosciuti,ma niente il cameriere sbaglia ordinazione e ci porta una pizza che non avevamo richiesta,mentre quella da noi richiesta rimarrà un sogno di una notte di mezza estate tanto per citare shakespeare,comunque buone anche queste,in tutto ciò abbiamo desiderato perfino tovaglioli,posate e bevande,dovevamo chiedere sempre più volte per avere un pò di minima attenzione,alla fine uno dei camerieri si scusa del servizio promettendoci che di lì a poco ci avrebbe portato dei bei digestivi per digerire l'ottima pizza e lo scarso servizio,ma niente un'attesa vana di circa 30 minuti ci lascia l'amaro in bocca e purtroppo nn era quello Averna che ci era stato promesso,paghiamo ed andiamo via,il conto direi equo,in conclusione ottima la pizza,ma un servizio veramente scarso,non credo che torneremo."
"ui_bubble_rating bubble_10","Pessima ","Sono stata in questa pizzeria perché consigliata vivamente da un amico . Pizza di gomma , immangiabile , servizio pessimo ! E per concludere la serata .. una blatta sul tavolo !!! Mai più ...."
"ui_bubble_rating bubble_50","Napule è...Pizzeria da Gigino & Figli","Mi sono trasferito a Monaco di Baviera da un paio di anni,ed ogni volta che ritorno nella mia Città,nel mio Quartiere,il primo contatto è la pizzeria dei ragazzi.Clima familiare,pizze squisite,servizio eccellente.Insomma,non riesco a farne a meno.Pasqualino,Antonio,Nicola,vederli crescere professionalmente mi riempie di gioia.Lo dico da anni e lo ripeto all'infinito: Pizzeria da Gigino & Figli Patrimonio dell ' Unesco!!!.In bocca al lupo, alla prossima"
"ui_bubble_rating bubble_50","La Migliore pizza","È la mia pizzeria preferita, ci vado spesso con la famiglia e tra amici!! Ottima la varietà e la scelta nel menù impasto buonissimo, ottima la scelta delle birre, della serie poche ma buone, da menzionare la simpatia e la disponibilità dei tre fratelli Pasquale, Nicola e soprattutto Antonio nella gestione della sala! Rapporto qualità prezzo eccellente, consiglio tutti di provarla almeno una volta, sono sicuro che ci tornerete spesso!"
"ui_bubble_rating bubble_50","Vivamente consigliato","Bravo Pasquale,bravo Antonio, ma soprattutto eccezionale Nicola!Ottima pizza ed eccellente servizio."
"ui_bubble_rating bubble_50","Serata in famiglia","Tutto ottimo attesa nella media a tutela della freschezza e genuinità beautiful,Il personale molto cortese e gentile uno dei posti dove si mangia la vera pizza napoletana"
"ui_bubble_rating bubble_50","Tipica Pizzeria Napoletana ubicata nel cuore del quartiere di soccavo!!!!!!!","Giovedì 31 maggio 2018 ci siamo recati a cena presso questa pizzeria su consiglio di alcuni amici.Il locale appare molto carino, curato e rassicurante e gode anche di un interessante spazio all'esterno.Appena varcato l'ingresso principale della pizzeria siamo rimasti subito folgorati dall'inebriante e suadente profumo tipico delle pizzerie storiche ubicate nel cuore del centro di Napoli. Un altro elemento che ha catturato la nostra attenzione è stato il dinamismo, la vivacità e l'allegria con la quale tutto il personale svolgeva il proprio lavoro. L'affabilità, la simpatia, la cordialità e l'attenzione al cliente rappresentano gli ingredienti che, insieme a quelli genuini che guarniscono le meravigliose e variegate pizze, restano subito impressi nella memoria di ogni avventore.L'impasto leggerissimo, gli ingredienti di elevata qualità e l'imbarazzo della scelta fanno della pizzeria Gigino e Figli una delle migliori che io abbia avuto il piacere di conoscere.Consiglio la pizza chimica, un tripudio di sapori, odori e colori. Ottimo rapporto qualità prezzo, ci ritornerò sicuramente a breve.Complimenti, continuate sempre così!!!!!!!!!!!!!!!"
"ui_bubble_rating bubble_50","Sempre ottima pizza!","Che sia da asporto o consumata al tavolo, qui si gusta davvero un’ottima pizza, sia per qualità degli ingredienti che per varietà di scelta. Da una “semplice” Margherita fino ad una particolare Marechiaro, Chimica o Pecorino...sempre massima soddisfazione. La cordialità dello staff è la ciliegina...sulla pizza (ciliegina di mozzarella DOP ovviamente!).Non aggiungo foto perché se non ci venite di persona dovete soffrire e lavorare di immaginazione!"
"ui_bubble_rating bubble_50","LA VERA PIZZA NAPOLETANA...SQUISITA....A PREZZI POPOLARI...","Salve a tutti,...si, ci sono riandato......sono recidivo...ma quando si scatena la voglia di pizza, di cui sono ghiotto, proprio non riesco a non pensare alla Pizzeria Gigino e figli, dove i sapienti Nicola, Pasquale e Antonio, conducono, in modo esemplare, un’attività degna di ogni fortuna e successo...insieme ai loro garbatissimi collaboratori.Ma veniamo alle pizze....cominciando dalle fritturine,,,anche queste ben fatte e servite sulla carta paglia, da cui si rileva l’assenza di untuosità, ben cotte e variegate ....insomma un ottimo preludio.La Pizza...in questo locale...è l’anima trainante della serata...Nicola ed i suoi collaboratori, sono attentissimi. Dalla scelta delle materie prima alla modalità di cottura...una sola parola per tutto: PERFETTA....DEGNA DEI MIGLIORI PALATI.Eppoi, per finire, gli sfiziosissimi bocconcini di pasta accompagnati da una Nutella che si scioglie su di loro, appena tirati dal fuoco... insomma...chi non ci va, non sa cosa si perde....Bravi Nicola, Pasquale e Antonio...io Ci sono e ci sarò!!...A presto...."
"ui_bubble_rating bubble_50","Pizza fritta fantastica","Consiglio a tutti gli amanti della pizza fritta e non solo, una tappa in questa pizzeria d'eccellenza! Abbiamo mangiato benissimo torneremo il più presto, lo strappo alla dieta vale veramente la pena. Consiglio dinpeenotare o rischierete di non trovare posto"
"ui_bubble_rating bubble_50","Magnifica serata!","Pizzeria molto molto carina, locale molto semplice, essenziale ma delizioso!!! Ke dire della pizza STREPITOSA, buonissima non c'è altro aggettivo, frittura PULITISSIMA, x non parlare dei dolci, CONSIGLIAMO LA TORTA SNIKERS, da leccarsi il piatto!! Stupenda ma altrettanto professionale l' accoglienza del personale. Camerieri molto simpatici , cordiali, bravi e professionali , in particolare un cameriere, credo si chiamasse Mario, che ci ha serviti e rallegrati con la sua simpatia, le sue piacevoli battute ed il suo entusiasmante interessamento all'andatura della serata!!! È stata una serata davvero piacevole, qui dove potrai gustare una pizza OTTIMA, all'insegna del buon gusto, dell'allegria e SEMPLICITÀ. P. S. Io e il mio ragazzo consigliamo la pizza pistacchio e la chimica."
"ui_bubble_rating bubble_30","Molto gentili","Pizza buona e prezzi onesti.I camerieri sono semplici e gentili.Mio figlio vi ha festeggiato il compleanno con i suoi amici. Si è trovato bene.Io stessa ho apprezzato la gentilezza con cui trattano i ragazzi. Il sabato è molto affollato."
"ui_bubble_rating bubble_50","Tutto perfetto.. ","Un piccolo ristorante e pizzeria nel cuore di Napoli, gestito da persone squisite ed esperte del settore, cibo di qualità e preparato al momento. Lo consiglio vivamente "
"ui_bubble_rating bubble_30","da wow a bo","Ho mangiato diverse volte in questa pizzeria, sia prendendo d'asporto che mangiando al tavolo e devo dire che la qualità è ben sopra la media rispetto a molte pizzerie della zona . Però l'ultima volta ho preso una margherita d'asporto (di sabato) e mi è rimasta sullo stomaco sino al giorno dopo. Penso che nell'occasione di sabato purtroppo abbiano deciso per un levitazione breve e questa cosa non dovrebbe mai accadere in una pizzeria che vanta di una tale fama. Per il resto, ci tornerò, sperando mi stupisca in positivo!"
"ui_bubble_rating bubble_50","Superlativa!","Pizzeria eccellente in un locale molto accogliente e rifinito, le pizze vengono preparate a regola d’arte con l’utilizzo di ingredienti di alta qualità, non parliamo poi della frittura, asciutta e digeribile, cotta al punto giusto e abbondante! C’è pure un’ampia scelta di birre in bottiglia e alla spina, ma la qualità migliore in questa pizzeria è la cortesia, si vede chiaramente che è a conduzione familiare perché si respira affiatamento e unione, insieme ad grande impegno e professionalità per rendere questo locale tra i migliori di Napoli e hinterland! Non è un caso che sia sempre pieno e la gente attenda in fila per poter gustare una pizza di Nicola e di tutto il suo staff...è proprio così: scrivi pizza e leggi passione! Continuate così ragazzi, noi di sicuro ci rivedremo presto! "
"ui_bubble_rating bubble_50","Montanara con genovese","Ci tengo a segnalare questa pizzeria perché oltre alla famosa montanara con la genovese che bisogna assaggiare assolutamente, hanno un assortimento di pizze di altissima qualità, e un porsonale gentilissimo e attivo,il conto nella norma. "
"ui_bubble_rating bubble_50","Eccellenza e orgoglio di Napoli","Sono anni che io e la mia famiglia gustiamo la pizza da Gigino & Figli, per meglio dire da quando hanno aperto a Soccavo e notammo subito la loro bravura; poi, con il passare degli anni, hanno raggiunto l'eccellenza creando nuove pizze come la chimica e vi assicuro che è una vera delizia per il palato. Il locale è bello e accogliente e tutti sono gentilissimi e sveltissimi .Complimenti a questi giovani che hanno anche un'ottima capacità organizzativa : ragazzi mi raccomando sempre così e dimenticavo un bravo al loro papà e alla loro mamma che ricordo quando erano nel locale.Un saluto affettuoso dalla fam.Rasati."
"ui_bubble_rating bubble_40","Molto buona la pizza","Cena di sabato sera con amici! Antipasto con stuzzichini fritti molto abbondante, attesa molto lunga anche perché il locale pieno!Pizza ottima nulla da ridire.L’unica pecca: come scelta di birre il locale è scarso (riferimento alla spina)"
"ui_bubble_rating bubble_50","Una squisitezza","Mi trovavo verso fuorigrotta,volevo mangiare una pizza al volo,dopo che ho chiesto alla terza persona trovata per caso e tutti consigliavano questo stesso posto,mi sono recato!!!non ci sono parole per spiegare questa pizza!!!squisitissima!!!!3 pizze acqua e coca cola a soli 20€"
"ui_bubble_rating bubble_40","Pizza...al volo","Locale con ambiente familiare e sempre pieno, consigliabile prenotare. Pizza ottima e buonissimi anche i fritti. Peccato che tanta bontà attiri tantissima gente è quindi una volta accomodati sembra che ti voglia portare il conto per fare accomodare altri. Tutto quello che ordini ti arriva in un baleno, va bene il servizio veloce, ma se si esce fuori a cena, magari è per scambiare due chiacchiere con gli amici. Detto questo ribadisco pizze e fritti fantastici da provare per cenare al volo."
"ui_bubble_rating bubble_40","Pizza ottima","Ormai la pizza solo da loro..e anche se si attende un pochino..ne vale la pena...poi sono gentili e disponibili"
"ui_bubble_rating bubble_50","Pizza doc !!!!!","Ci vado praticamente tutte le settimane .......Pizza buonissima (tra le migliori a Napoli ) e personale cortesissimo .Per me la pizza è sempre stata solo Margherita , ma grazie a loro ho scoperto e sperimento tutte le varianti che propongono e che sono deliziose.Antonio in sala ha sempre un meraviglioso sorriso ed ha sempre una parola gentile per tutti.Eddy"
"ui_bubble_rating bubble_10","Mai e mai più ","Ci sono stato poche ore fa a cena con mio padre e mia madre devo dire oltre all’attesa lunghissima di circa un’ora e mezza ci hanno fatto accomodare in fondo la sala s sinistra in un tavolo da due ma eravamo 3 persone ,nonostante tutto questo abbiamo ordinato un antipasto di fritturina e pizze.Bene arrivano i due piattini di fritturine neanche il tempo di assaggiare es arrivano anche le pizze non avevamo neanche più spazio per appoggiare le braccia dopodiché chiediamo al cameriere di togliere le fritture visto che erano arrivate le pizze quindi non potevamo più mangiare la fritturina.Inizio a mangiare ed il cameriere apre un cassetto quindi inevitabilmente mi arriva diritto nella schiena.sposto leggermente il tavolo più avanti per evitare che altri camerieri ripetessero la stessa cosa,finIamo di mangiare chiediamo il conto 3 pizze una birra ed una coca 28€ almeno hanno avuto il buon senso di togliere le fritture dal conto. Mai e mai più ci ritornerò ne avevano parlato molto bene evidentemente sono stato sfigato."
"ui_bubble_rating bubble_40","mangi la pizza.....e subito vuoi tornarci !","Sapevamo che è sempre molto affollato, siamo arrivati di sabato prima delle 20 ed era il penultimo tavolo. Pizze ottime per impasto ed ingredienti, saporite le fritture. Servizio veloce (2 forni) e cordiale, nonostante la folla che si accalca all'esterno."
"ui_bubble_rating bubble_50","La chimica ","Ho mangiato la pizza più buona che abbia mai mangiato a Napoli . Sono Napoletana per caso capitata nella pizzeria ma davvero ho avuto la fortuna di assaggiare la pizza più buona della città. La chimica . Complimenti davvero "
"ui_bubble_rating bubble_40","Pizze di tutti i gusti","Un menu stupefacente per varietà. Non ho avuto il coraggio di osare la pizza Chimica. Per la mia prima volta ho assaggiato un ottimo ripieno classico ma mi riprometto di tornarci. Ottimo servizio."
"ui_bubble_rating bubble_50","Pizze d asporto","Pizza speciale non tengono rivali pizza stupenda prodotti eccezionali servizio ottima professionalità 10 .siete unici "
"ui_bubble_rating bubble_50","Unici in tutto","Le mie corse da Soccavo al Vomero per far arrivare ancora fumanti le uniche pizze che mangiamo, quelle di Gigino e figli, ormai le conoscono tutti i miei cari. Uniche come la loro onestà perché in una di queste mie pazze corse a fine giornata di lavoro... lascio il 'resto' sulla cassa e ....loro con le telecamere a fine serata mi individuano e mi restituiscono giorni dopo i 10 euro. Ma chi sieeteeeeeeee! <U+2764>"
"ui_bubble_rating bubble_40","Mammaaaa che pizza","Siamo stati qui a pranzo di martedì grasso e devo dire che malgrado avessi scelto una pizza fritta, la montanara alla genovese , di grasso nn c’era nulla. Squisitamente leggera e gustosa, asciutta la pasta e una genovese top. Da ritornare sicuramente per assaggiare anche la frittura dall’aspetto molto molto invitante. Bravi"
"ui_bubble_rating bubble_40","Una bella novità","Sono stato in questa pizzeria insieme ad alcuni amici napoletani habitué; ero curiosissimo di provare questa montanara con la genovese acopp; grande scoperta, si tratta di una montanara fritta, passata in forno e condita con una genovese leggera.Ho anche privato la montanara tradizionale, eccellente.da tornare sicuramente. Unico neo (ma veramente piccolissimo) il chiasso, è un locale dove mangiare ed andare via subito perché è molto rumoroso ma ne vale assolutamente la pena"
"ui_bubble_rating bubble_10","poco seri","stamattina ho prenotato su jast eat una pizza ed un saltimbocca per le 20.10..!la pizzeria era chiusa quando ho inviato la prenotazione ma come tutte le pizzerie che usano just eat,appena aprono il ristoro, la prioritá dovrebbe essere quella di dare una conferma a chi ha fatto l’ordine..e invece a me è arrivata l’email di cancellazione dell’ordine alle 20.55..in poche parole io non ho potuto piu prenotare in nessuna pizzeria perchè era tardi..e nessuno mi avrebbe portato una pizza in meno di mezz’ora!!quindi morale della favola?..ho dovuto aspettare due ore fuori ad un’altra pizzeria perchè l’email di cancellazione dell’ordine effettuato non poteva essere mandato prima da chi si occupa di controllare just eat!!e per questo dico che siete poco seri!"
