"Restaurant_Ratings","Restaurant_Quotes","Restaurant_Reviews"
"ui_bubble_rating bubble_50","COTTA E ...MANGIATA","Di ritorno ..percio' cotta e mangiata , voglio subito esprimere la mia opinione su di un locale che avevo gia' conosciuto l'anno scorso , portato da amici , e in cui mi ero ripromesso di tornare . Abbiamo trovato subito posto , nonostante una folla indescrivibile .... pizze eccezionali , molto saporite , nonostante la pasta sia di una leggerezza unica , molta varieta' di sapori e gusti ! La frittura , d'obbligo , leggera e molto gustosa .... finalmente i crocche' sanno di patata , come quelli che , sapendoli preparare , si potrebbero fare a casa nostra ! Peccato che non avevamo piu'.... posto per la zeppola ...... che di certo sarebbe stata all'altezza del resto , come ho avuto modo di vedere sbirciando gli altri tavoli . Locale nuovissimo e molto accogliente e ..... non ultimo personale molto garbato ed efficiente ... Pienamente rispettata e con i fatti .... la bellissima ed originalissima dedica presente sulle tovagliette ....... Esperienza da ripetere ..almeno una volta al mese !"
"ui_bubble_rating bubble_50","cortesia e bontà!!!!","abito in zona, è la pizzeria migliore del quartiere.L'impasto è leggero e saporito, ottimi gli ingredienti, tutto messo nelle giuste proporzioni.cortesia e disponibilità in tutto lo staff!!!grandi veramente!!!!!il menù è molto vasto, permettono anche variazioni.La frittura non sa di olio.prezzi concorrenziali.Decisamente consigliata!!!!! Ormai è fissa!"
"ui_bubble_rating bubble_50","Un appuntamento al quale non manco","E' sempre un piacere tornare a gustare una pizza veramente speciale in un locale simpatico, accogliente, dotato di schermi per assistere alle partite di campionato e coccolati da un personale giovane, gentile e disponibile.Ma la pizza è la vera protagonista, non saprei quale consigliare ma la chimica è veramente una chicca.Ci tornerò ogni volta che potrò,"
"ui_bubble_rating bubble_50","La tradizione vista con modernità ","Pizza buonissima Ripieno fritto leggero , frittura cotta al momento, ma che non sa di olio. La pizza rivisitata con la modernità ma senza andare ad intaccare i canoni della tradizione. Cortesia, prezzi modici ma qualità eccezionale. Tutto questo accompagnato da uno staff divertente e gentile, il cameriere Mario che ti accoglie , ti consiglia e ti coccola rendendo speciale questa esperienza culinaria di altri tempi."
"ui_bubble_rating bubble_40","Pizza buona servizio lento","Pizza buona ma quando ordini le pizze con consegna a domicilio ci resti sempre malissimo. Arrivano dopo 2 ore di attesa e fredde."
"ui_bubble_rating bubble_50","Altissima qualità a soccavo","Una pizzeria fantastica, la qualità dei prodotti è molto alta e i prezzi sono davvero modici. Essendo di Napoli ho mangiato pizze a volontà e posso dire che questa pizzeria si trova sul mio podio personale, il tutto accompagnato dalla cortesia dei proprietari e dalla simpatia e cordialità del cameriere Mario."
"ui_bubble_rating bubble_30","C'è di meglio","Ho avuto occasione di ordinare la pizza a questo locale. Molto puntuali per la consegna a domicilio. La pizza non è stata di mio gradimento in quanto un pò più salata del normale."
"ui_bubble_rating bubble_50","Clienti fissi","Ormai da anni io e la mia famiglia siamo clienti abituali di questa splendida pizzeria....per un'occasione o per le semplici uscite del sabato sera questa pizzeria è sempre un punto di riferimento.La pizza è SPECIALE...veramente una delle più buone mai mangiate (pizza verace e molto più buona di tante altre pizzerie più note per nome). Ampliandosi sempre di più, hanno creato un locale più bello e confortevole e il rapporto qualità prezzo non ha paragoni. Complimenti anche al personale, gentile e paziente, nonostante questo lavoro sia davvero stancante."
"ui_bubble_rating bubble_50","Fantastico!!!","Inutile fare file alle rinomate pizzerie di Napoli quando si può avere la stessa qualità da Gigino!Unica pecca: non fa consegna a domicilio in Germania (dove vivo)!TOP!!!!Grandissimi"
"ui_bubble_rating bubble_40","Locale rimodernato","Sono stata qui oggi 31 gennaio 2017. Il locale è staro ristrutturato ed ingrandito. Ho assaggiato la pizza noci e speck e devo dire che era abbastanza buona, anche se salatissima. Poi ho assaggiato la pizza con rucola e prosciutto crudo e mi è piaciuta di più anche se ho trovato pure questa molto salata. Tutti ingredienti di qualità. Il servizio lascia a desiderare e sono molto lenti."
"ui_bubble_rating bubble_50","Pizze sorprendentemente squisite","Ci sono stata già 4/5 volte ed ogni volta ho provato una pizza diversa: tutte sorprendentemente squisite!!! Quella al pesto, filetto, alla genovese, con i pomodorini gialli ed ultima quella con crocchè.... mmm fantastica!!!! Ingredienti genuini, impasto leggero. Consiglio anche gli scugnizzielli fritti con pomodori come antipasto! Ottima accoglienza, staff molto gentile e simpatico, veloci e cercano di accontentare ogni richiesta!! certo c'è un po' da attendere, come tutti soprattutto nel fine settimana, ma di recente è stato anche ampliato il locale e questo ha velocizzato di molto il servizio!! sicuramente vale la pena provare e sono sicura ke ritornerete! "
"ui_bubble_rating bubble_50","La pizzeria di fiducia","Chiamare Gigino almeno una volta a settimana è obbligo in famiglia. La pizza è buonissima e il personale molto gentile e il servizio al tavolo veloce (un po' meno se si chiama a domicilio perchè la richiesta è veramente alta!!), l'atmosfera intima e familiare. Straconsigliato!"
"ui_bubble_rating bubble_50","Ottima pizza al livello di via dei Tribunali.","Abito nella zona da sempre e l'ho sempre reputata un'ottima pizzeria anche se un po' troppo distante da casa mia per prendere le pizze da asporto e quindi non ci andavo spesso. Da quando ha rinnovato la sala interna e soprattutto negli ultimi tempi quando ha inserito nuovi tipi di pizze nel menù, la qualità è aumentata di parecchio. L'impasto ottimo, leggero e ben lievitato e gli ingredienti mi sono sembrati tutti freschi. L'ultima volta che ho preso la Diavola, la mia pizza preferita, con un salamino piccante buonissimo, sono rimasta senza parole!Complimenti davvero.Da provare!"
"ui_bubble_rating bubble_50","Eccezionale","È una pizzeria eccezionale, vi consiglio a non soffermarsi alle pizzerie al centro storico, venite anche in periferia, soccavo non ve ne pentirete... ottima pizza, personale simpatico, cortese ottimo accoglienza... io la super consiglio!!"
"ui_bubble_rating bubble_50","L'eccellenza in periferia!","Se questa pizzeria si trovasse al centro storico di Napoli avrebbe file chilometriche di turisti! Personale gentile, simpatico e disponibile! Pizza squisita!"
"ui_bubble_rating bubble_40","Garanzia di qualità e simpatia","Lavoro a Soccavo da diversi anni e, quando in questo quartiere sei alla ricerca di una buona pizza, questo locale è il primo da scegliere.Il locale è stato appena rinnovato è grazioso e sia i proprietari che i camerieri sono molto simpatici e alla mano.La selezione di pizze da scegliere è ampia e originale e la qualità degli ingredienti buona.Insomma che dire : questi ragazzi (i proprietari) hanno tirato su un'ottima attività e offrono forse la migliore pizza di Soccavo a prezzi contenuti.... bravi bravi bravi"
"ui_bubble_rating bubble_50","otima pizza anche degustata a domicilio","ho ordinato delle pizze da questa pizzeria e devo dire che sia il servizio che le pizze sono stati eccellenti, al telefono personale gentile e disponibile.Mi sono fatto portare il loro volantino cosi con il tempo le provero'tutte.Molto interessante la storia di questa pizzeria che si tramanda da generazioni questa antica arte.Da consigliare a occhi chiusi.Buon appetito"
"ui_bubble_rating bubble_50","Serata in pizzeria ","Una super pizza con tutti prodotti di prima scelta tra le tante ci sono due che mi fanno impazzire la pizza con la parmigiana di mele Zane e la chimica.Persone di una professionalità unica cortesi e gentili molto picievole per trascorrere una serata di tranquillità gustato una pizza eccezionale"
"ui_bubble_rating bubble_40","La pizza è buona, ma qualcosa va migliorato!","Premetto che quella di Gigino per me è una pizza ottima, tra le migliori mangiate....ma c'è qualcosa che va migliorato: il servizio. Mi spiego meglio: so che è una pizzeria di quartiere e questo mi va benissimo, ma non mi va bene quando mi arrivano puntualmente antipasti e pizza a distanza di un minuto. Una cosa che mi è successa più di una volta. Non so se capiti solo ai clienti meno affezionati o sia un caso....comunque, NON negando la squisitezza delle pizze, penso sia necessario avere maggiore accortezza per tutti i clienti per potergli dare una serata in pizzeria piacevole senza costringerli ad abbuffarsi."
"ui_bubble_rating bubble_50","Pizza ottima<U+0001F44D><U+0001F3FB><U+0001F44D><U+0001F3FB>","Andiamo spesso a mangiare la pizza in questo posto e ci troviamo sempre molto bene!!! I proprietari sono fortissimi, i pizzaioli bravi e anche i camerieri molto gentili e disponibili! La sala è pulita e grande e ci sono posti a sedere anche fuori!! La serata risulta sempre piacevole!"
"ui_bubble_rating bubble_50","Pizze ottime, leggere e gustose e prezzi economici","Sono stato in questa pizzeria sabato 3 dicembre, con la mia famiglia, per festeggiare il compleanno di mia figlia. In verità i miei figli c'erano già stati più volte e ne avevano sempre parlato bene, ma debbo dire che la realtà ha superato tutte le mie aspettative! Pizze grandi, buonissime, dall'impasto soffice e leggero, gustose e dagli ingredienti di alta qualità,Si tratta sicuramente di una delle migliori pizzerie di Napoli che può competere tranquillamente con le più famose Sorbillo, Di Matteo, Starita. Pellone, ecc.Anche il servizio è stato rapido ed efficiente ed i camerieri molto cordiali. simpatici e disponibili ed i prezzi economici. Consigliatissima"
"ui_bubble_rating bubble_40","Vieni qui per la Pizza!","Sono stato in questo posto come ospite, non lo conoscevo, locale non adatto per cena romantica o se si cerca qualcosa di esclusivo, ma la pizza è davvero ottima.Tante pizze tutte molto buone, in particolare quella a 4 gusti che è davvero una bomba ma ne vale la pena."
"ui_bubble_rating bubble_50","Qualità eccellente, impasto leggero, prezzi popolari","Da soccavese emigrante all'estero mi sono ritrovato stasera dopo davvero anni a sedermi di nuovo alla pizzeria Gigino&figli, totalmente rinnovata da come la ricordavo. Sono rimasto assolutamente stupito. Non mi aspettavo un impasto così leggero, un'enorme varietà di gusti e a prezzi così popolari. Ma in particolare la montanara fritta/al forno è sicuramente tra le 3 pizze più buone mangiate in vita mia!! Personale squisito quanto le pizze. Assolutamente da provare. Andateci!! "
"ui_bubble_rating bubble_50","I migliori","Per me è la mia famiglia è la miglior pizzeria di Napoli. Giriamo spesso le pizzerie 'Top' della Campania ma per noi la più buona è sempre la loro. A partire dallo staff che ti fa sentire sempre a tuo agio, all'impasto leggerissimo e digeribilissimo,agli ingredienti che sono di ottima qualità tutto questo senza dover spendere 10 euro a pizza. Super consigliata."
"ui_bubble_rating bubble_50","Pizza e birra","Con i miei amici tre gustosissime pizze tra cui la famosissima Tonino e la squisita montanara alla genovese. Non è un caso... dai fratelli Russo non sbaglio mai! Una garanzia di qualità e fantasia"
"ui_bubble_rating bubble_40","Ottima pizza!","La pizza è veramente buona, le materie prime sono di qualità e i pizzaioli e il resto dello staff eseguono il loro mestiere con passione. Ho dato 4 stelle anche perchè è una delle poche pizzerie dove c'è una scelta davvero vastissima, con pizze particolari che difficilmente puoi trovare altrove. Se fossi stato un pignolo tuttavia avrei dato forse una stella in meno per il locale che se pur curato è molto piccolo e per l'asporto. La pizza a domicilio a mio avviso non è sempre al top, talvolta forse trattata con più superficialità e fretta rispetto alle pizze per i tavoli, ma ripeto sono casi sporadici e la pizza generalmente è buonissima ;)"
"ui_bubble_rating bubble_50","Concretamente tra i migliori","Giuro di non peccare di presunzione né di saccenteria quando dico, senza la minima alterigia, che sono probabilmente tra i migliori pizzaioli di Napoli.Se ancora non avete assaggiato le loro pizze, vi consiglio di farlo prima possibile. Qualsiasi pizza prendiate, oltre che essere incredibilmente buona, sarà soffice e digeribile, e non è cosa da poco. Indica la qualità dell'impasto e delle materie prime, di cui nessun professionista esperto, che lavora questo storico e inimitabile prodotto gastronomico, dovrebbe far a meno. Ma senza remore posso dire che, tra tutti, c'è veramente un condimento speciale che arricchirà la vostra esperienza da Gigino&Figli: l'amore per il proprio mestiere, miscelato al lavoro duro, intenso, inarrestabile e instancabile, e profumato di un senso di familiarità che ti fa sentire proprio come a casa, in intima e amichevole confidenza. Forse questa è la cosa che amo di più di questo posto speciale, dopo le loro pizze ovviamente: mi sento a casa."
"ui_bubble_rating bubble_40","Pizza eccellente,servizio livello basso","Ottimo il.menu,proposte di pizze eccellenti,pizza oggettivamente buona ,molto grande con ingredienti di buon livello.Servizio scarso,il.livello comportamentale dei camerieri nn raggiunge,e di molto,la sufficenza.Mentre mangiavamo,e senza chiedere il permesso,all' improvviso ci spostano il tavolo con noi seduti ed il boccone in bocca,stavamo ,alla fine ,ancora mangiando ,ci stavano togliendo i piatti da sotto...incredibile....purtroppo se assumessero camerieri di professione,sarebbero una delle migliori pizzerie di Napoli"
"ui_bubble_rating bubble_50","Una delle pizze più buone al mondo!","Se ho mai assaggiato questa pizza? E' la tappa settimanale della mia famiglia, ne abbiamo mangiate di tutti i tipi e gusti e sono una più squisita dell'altra... Ma la vera magia è che sono digeribilissime ( e parlo anche del ripieno o della pizza con la parmigiana di melanzane..). Non la cambierei con nessuna al mondo...E il personale? Fantastico... amici!!!Sempre più in alto ragazzi!"
"ui_bubble_rating bubble_40","Una tappa da fare","Davvero buona la pizza, poca gente quindi fila più che abbordabile. La pizza Chimica è una cosa eccezionale non ti lascia gonfio nonostante le 4 fette differenti. 4 di noi con 5 pizze, 2 birre e una bottigliata d'acqua abbiamo pagato 53€"
"ui_bubble_rating bubble_50","Sei sempre una garanzia","Nonostante sia una pizzeria del mio quartiere vi torno sempre volentieri, in primis per la buonissima pizza ma anche X il team sempre gentile e cortese, specialmente Mario che c'ha intrattenuto nell'attesa. Stavolta ho provato sotto suo consiglio la pizza Tonino fatta da mozzarella, pomodoro giallo, speck e pecorino. Una vera bontà grazie Mario "
"ui_bubble_rating bubble_50","Il migliore in assoluto, ottimo il personale!","Sono parecchi anni che mi servo da questa pizzeria e posso solo dare giudizi più che positivi anche perché nel tempo non ha fatto altro che migliorare proponendo un listino pizze da invidia per molte altre pizzerie e da imbarazzo della scelta per il cliente.Le pizze sono davvero ottime così come le fritture, la pizzeria è ben allestita e le sale ben strutturate.Ci tengo a precisare che la pizzeria ha ben 2 forni e non è un caso, a chi non c'è mai stato consiglio di passarci perché sicuramente rimarrà soddisfatto.I prezzi sono molto accessibili.Ottimo il personale, sempre attivo e pronto, si nota in loro che in questo lavoro ci mettono davvero l'anima!Un ringraziamento particolare a Mario che proprio ieri ci ha proposto delle pizze straordinarie, un ragazzo davvero gentile, paziente, attento e preparato capace di far sentire i clienti come a casa propria!Bravi ragazzi, siete i migliori!!!P.s. Locale climatizzato, con TV ed accessibile a diversamente abili."
"ui_bubble_rating bubble_50","Meritano di piu'","Ormai prendiamo le pizze solo da loro ,il top del top davvero.Molto economico e impasto e ingredienti di qualita' sopraffina."
"ui_bubble_rating bubble_50","Ottimo","Una garanzia a Soccavo! Impasto leggerissimo e pizze ottime! Anche gli antipasti buoni! Personale simpatico e disponibile. Il locale è piccolo ma accogliente! Servizio a domicilio ben gestito! "
"ui_bubble_rating bubble_40","Buona ma.non strepitosa...","Con amici in.settimanaConsigliato da.cameriere che.spinge.lui.per.le.pizze da prendere( cosa.che può risultare non.sempre.vincente ed apprezzata)Abbiamo.preso una.pizza.con pelati sammarzano e provola di bufalaIl.pelato.se.pur buono non.riusciva a dare quella.cipertura.classica all'intero.disco di pasta che è rimasto scherno di salsa per un buon.spessore dal.cornicioneDel resto locale.casareccio gestito beneCeleri nel servizio prezzi nella norma , forse giusto un.pochino salati."
"ui_bubble_rating bubble_30","Servizio ","Sulla pizza non si discute. Ma non è possibile che per comprare 2 euro di fritturina bisogna aspettare la gente che ordina le pizze e decine di telefonate di ordinazioni. Si, perché il tizio alla cassa fa tutto lui. Prende gli ordini per telefono, ordini al banco, ordini della fritturina esterna e va dal pizzaiolo a descrivere le pizze che gli vengono ordinate. Insomma sul servizio mezza stella. Potrebbe mettere una cassa esterna solo per la fritturina."
"ui_bubble_rating bubble_40","Una pizza strepitosa...","Personale simpaticissimo, ottima accoglienza, locale piccolo ma accogliente, impasto ottimo.PIZZE STREPITOSE!!!Ogni volta che mi trovo a Napoli vado con tutta la famiglia. E' piaciuta molto anche quella con la zucca ma son tutte buone. Meglio prenotare e fatevi consigliare quale pizza prendere ;-)"
"ui_bubble_rating bubble_10","Pessimo ","Pessimo il servizio di consegne a domicilio. chiamiamo spesso dall'ufficio e invano abbiamo aspettato ore , continuamente presi in giro da chi rispondeva al telefono che non faceva altro che prendere tempo. .... Quando abbiamo avuto il piacere di assaggiarla la pizza è buona."
"ui_bubble_rating bubble_50","Pizzeria top in ambiente famiare","Ormai la pizzeria  da Gigino e figli è una meta fissa settimanale. Mia è della mia famiglia. Oltre alla qualità altissima del prodotto, valido per qualsiasi pizza scegliate , c'è la simpatia e la cordialità di Pasqualino, Antonio, Nicola e dei loro collaboratori. Un ambiente giovanile e cordiale in cui mangiare sia le pizze tradizionali: Margherita, Marinara, Ripieno, sia quelle da loro inventate: Segreto, Chimica, Stella, Tutte buone e che soddisfano anche i palati più esigenti. Unico neo, che però è garanzia della loro bontà, il locale sempre affollato. Ma vale la pena di aspettare. "
"ui_bubble_rating bubble_40","Ottima pizzeria!","Pizza ottima e personale davvero gentile.Prezzi bassi nonostante la buona qualità.Consiglio vivamente!"
"ui_bubble_rating bubble_30","Pizza buona ma non troppo!","Ahimè la pizza non è eccellente: un po' pesante e salsa acidula.Servizio cortese e celere, buoni gli antipasti napoletani."
"ui_bubble_rating bubble_50","L' Arte della pizza","Giovani pizzaioli gentili e simpatici con esperienza da vendere nel campo della pizza in quanto figli di pizzaioli di vecchia dataLocale climatizzato con servizio sky e wifiPizza veramente buona farcita con prodotti di qualita e dall' impasto morbido e digeribileDa assagiare assolutamente la montanara fritta cotta al forno e la pizza chimicaL' unico difetto di questa pizzeria e che c'e sempre molta folla e quindi bisogna pazientare.Tuttavia come diceva un mio caro amico dove c'e folla c'e qualita.E qui siete al posto giusto!!!"
"ui_bubble_rating bubble_50","Pizza Top","Sono tornato ad agosto con i miei figli nel mio quartiere dopo circa 4 annidi assenza e con mio favorevole stupore ho mangiato in questa pizzeria un prodotto di qualità elevatissima . Complimenti allo staff ci tornerò quanto prima nel mio prossimo viaggio a Napoli. "
"ui_bubble_rating bubble_30","Pizza buona, organizzazione pessima","Tutto buono, pizza, frittura, davvero niente da dire. Ma ti portano tutto così in fretta per fartene andare il prima possibile. Capisco che lavorate molto ma non potete praticamente cacciare la gente. La frittura e gli antipasti arrivano insieme con le pizze MAI VISTO. Ci siamo stati di mercoledì, non oso immaginare il servizio di sabato e domenica. La qualità è ottima ma servizio ed organizzazione sono pessimi. Mentre mangiavamo sentivamo il cameriere che parlava con un altro tizio e indicandoci gli diceva VABE' MO QUESTI SE NE VANNO E TI FACCIO SEDERE. Non penso di ritornarci"
"ui_bubble_rating bubble_40","Una buonissima pizzeria nel cuore di Soccavo","Ottime le pizze e le fritture cosi' come anche i contorni. Personale di sala all'altezza della situazione per accoglienza e disponibilita'. Menzione speciale per Pasquale, deus ex machina del locale, grande tifoso del Napoli. Nel complesso un ristorante che vale davvero la pena di provare e consigliare a chi desidera mangiare il piatto principe della tradizione napoletana."
"ui_bubble_rating bubble_50","Ottima pizza ","Ottima pizza e vasta scelta impasto buono e la pizza non è pesante ci torno sempre volentieri personale gentile"
"ui_bubble_rating bubble_40","Ottima pizza","Davvero una bella pizza napoletana ingredienti ottimi e soprattutto un impasto fatto a regola d'arte, soffice e voluminoso segno di una lunga e lenta lievitazione... Bravi"
"ui_bubble_rating bubble_20","Trasparenza prima di tutto","Non è la prima volta che mi servo in questo esercizio, ma ieri è capitato uno spiacevole incidente, ad una signora che è venuta dopo di me è stato dato, da Nicola, un numero precedente (il numero 8) al mio, in modo molto poco trasparente e senza motivazione alcuna, se non una evidente conoscenza personale, ed infatti è stata servita prima di me. La mancanza di onestà nelle piccole cose potrebbe essere indice di ulteriori e più gravi mancanze.La qualità della pizza non era come al solito."
"ui_bubble_rating bubble_50","Ottimo","Una pizzeria in un quartiere popolare di Napoli che non penseresti mai sua una tra le.migliori. Vale la pens aspettare.Fa anche servizio da asporto ma pecca di precisione per il sovraffollamento. La consiglio Vivamente"
"ui_bubble_rating bubble_30","Pizza nella media","Tanta voglia di pizza Napoletana.. Diciamo che questo ristorante non ci ha soddisfatto totalmente, però pizza buona e personale gentile e disponibile, dava la sensazione di una famiglia che stava dando il massimo per accontentare tutti i clienti."
"ui_bubble_rating bubble_50","Da sempre pizze speciali","Sono anni che frequento il locale, una volta un semplice locale, ora ristrutturato completamente....stravolto direi.....ma con gran gusto e funzionale.Due forni, per velocizzare il servizio, aria condizionata, vettovaglie ottime, servizi igienici al top, personale amicale e sempre disponibile e sorridente, ma rispettoso.Pizze ? Superiori a qualsiasi aspettativa, frutto di passione, tradizione familiare e innovazione con tanti varianti una più gustosa dell'altra.Prezzo ? Assolutamente giusto."
"ui_bubble_rating bubble_50","Perché andar lontano quando hai un'ottima pizzeria sotto casa","Sono andato per la prima volta in questa pizzeria che si trova nel mio quartiere Soccavo 1 anno fa. Essendo una pizzeria del quartiere ero un po restio ma dopo averla provata ormai è d'obbligo almeno 1 volta al mese. L'impatto della pizza è uno dei più buoni che io abbia assaggiato, la mia pizza preferita è la Fiocco una pizza bianca farcita con bufala prosciutto cotto, crocchè sbriciolato e panna. Di solito la divido prendendo anche una pizza più leggera, ma vi assicuro che non ve ne pentirete. Anche la frittura all'italiana è il "
"ui_bubble_rating bubble_40","Ottimo","Già ci sono stato tante volte. Pizze buonissime, così come gli antipasti. Tavoli comodi ed aria condizionata.Ci torno sempre volentieri.P.s.: non ordinate da asporto."
"ui_bubble_rating bubble_50","PIZZA CHIMICA","Presumo che il nome derivi da una bomba chimica. Incuriosito dalla descrizione avuta da un collega ho voluto provare questa pizza INCREDIBILE. La si nota nelle foto del sito ed è particolarissima . Divisa in 4 parti di cui due abbastanza normali e due incredibili una quella fritto che da un'attrattiva unica alla composizione, ma devo confessare che la parte ripiena ,che non appare dalle foto, è senz'altro il pezzo forte, in quanto e composto da parmigiana di melanzane con provola. Sono sopravvissuto alla bomba e ritornerò prestissimo per assaporare le molteplici pizze."
"ui_bubble_rating bubble_50","...","Fanno un'ottima pizza con prodotti di qualità!!! bisogna assolutamente provare la montanara con la genovese,è qualcosa di eccezionale :)"
"ui_bubble_rating bubble_50","ottima pizza una delle migliori","se un ottima pizza volete mangiare recatevi in questa pizzeria ....la conosco da circa un anno ,grazie ad un mio carissimo amico che mi ci porto' e posso assicurarvi che non hanno mai sbagliato . un impasto leggero e ingredienti di prima scelta . vi consiglio vivamente gigino e figli vai"
"ui_bubble_rating bubble_40","Pizze sempre Buone","Anche se c'è moltissima affluenza di gente la pizza e ' sempre Buona. Il personale molto efficiente e cordiale!!!!!!!!"
"ui_bubble_rating bubble_50","Sempre buona","Ormai è una certezza degli abitanti del posto tant'è che è difficile trovarne uno perché fa una pizza eccezionale senza disdegnare il resto che è formidabile (fritturine varie). L'unica pecca, se proprio bisogna trovare un difetto, sono i dolci che visto il posto possono essere di salente migliori "
