"Restaurant_Ratings","Restaurant_Quotes","Restaurant_Reviews"
"","",""
"ui_bubble_rating bubble_50","Una serata con l'Abruzzo...","Ci siamo fermati a fare cena in questo chiosco in occasione della laurea di mio fratello..tutta la famiglia compresa la nonna ultra ottantenne seduta sulla panca davanti al chiosco Stadio..la cortesia e la disponibilità delle ragazze vale davvero una nota di merito... abbiamo assaggiato piadine e crescioni, pietanze una più buona dell'altra, preparate con cura e amore .. melanzane, prosciutto cotto, salame, zucca, rucola, squacquerone, ingredienti freschissimi e di gran qualità lavorati con estrema maestria.. nonostante l'orario di chiusura imminente le ragazze si sono mostrate pronte a servirci e a illustrarci anche il loro modo di lavorare..per viziarci infine con una piadina cocco e Nutella che era la fine del mondo! Grazie per tutto ragazze e in bocca al lupo per il vostro chiosco!! Ps. Vi aspettiamo in quel paesino di quaranta abitanti..un abbraccio!"
"ui_bubble_rating bubble_40","tappa obbligata per piadina","Personale competente e molto gentile che prepara piadine e cassoni assolutamente indimenticabili.Tappa obbligata non solo per mangiare ma anche per portare a casa una buona scorta di piadine"
"ui_bubble_rating bubble_40","Pre partita e non solo!!!!!","Chiosco con una piada molto buona......che bello è quando esco di casa per andare allo stadio a mangiare la pida!!!!.I giorni della partita armatevi di molta pazienza,ma l'attesa ne vale....consigliato salsiccia e cipolla "
"ui_bubble_rating bubble_40","ho fatto il bis","all inizio di ottobre sono passata a prendere due piadine farcite con crudo formaggio e rucola per cena , dopo circa mezz'ora ne siamo andate a prendere altre due - veramente molto buone , l unica pecca è che appena diventa un pochino fredda risulta un po' dura ."
"ui_bubble_rating bubble_50","Una goduria","Punto fisso durante i giorni di prova per rockin'1000.Uno spettacolo di piada. Prezzi contenuti.Per quanto mi riguarda serberò un ricordo meraviglioso di questo posto.Fantastico!"
"ui_bubble_rating bubble_40","Buono ma...","Qui si trova una buona piadina, buoni crescioni e buoni rotoli ad un buon prezzo, ma il servizio è molto lento quindi se non avete prenotato… Da provare"
"ui_bubble_rating bubble_40","Buona piadina. Ma essere a fianco dello stadio di Cesena non premia....","La piadina è buona: calda, servita con salumi di qualità e con gentilezza. Ma essere a fianco dello stadio la penalizza, poichè ogni tanto rende il chiosco irraggiungibile...."
