"Restaurant_Ratings","Restaurant_Quotes","Restaurant_Reviews"
"ui_bubble_rating bubble_40","Locale figo e fiorentina super!","Ci siamo recati in coppia in questa trattoria, seguendo i vari suggerimenti su trip advisor e siamo stati più che soddisfatti! Abbiamo ordinato una tagliata con salumi, formaggi e prodotti tipici toscani tutti buonissimi e di ottima qualità! La Fiorentina è stata davvero spettacolare, servita su un tagliere con vari contorni altrettanto saporiti. Prezzi onestissimi! Il locale è particolare e da’ l’idea di stare a casa! Anche il servizio impeccabile, i titolari sono dei giovani ragazzi toscani molto simpatici che ci hanno seguito e dato ottimi consigli anche sul taglio della carne :) consigliamo a tutti di andare a trascorrere una serata nella piacevole atmosfera dei I’Tuscani. Unico consiglio è di prenotare prima così da evitare l’attesa anche se accompagnata da un buon bicchiere di vino ;)"
"ui_bubble_rating bubble_50","Fantastico","Consigliato da due cari amici, prenotiamo un tavolo in anticipo.Gia dall inizio il personale ci ha accolti con simpatia e gentilezza accompagnandoci durante tutti la cena.Abbiamo assaporato e apprezzato tantissimo come antipasto il tagliere misto del posto, completando poi con la favolosa fiorentina ciccia ovviamente al sangue accompagnata dalle verdure grigliate che ci hanno lasciati senza parole.Per concludere un ottimo tiramisu e una casts scelta di digestivi.Consigliamo vivamente a chiunque passi da questa favolosa citta di Fermarsi in questo posto."
"ui_bubble_rating bubble_50","Fantastico sotto ogni punto di vista","Abbiamo trovato questo locale grazie ad una ricerca con TripAdvisor e devo dire che ha avuto i sui frutti.Locale molto ben curato e accogliente, rustico nell'arredamento, pieno di scritte lasciate dagli altri clienti.Ci siamo affidati ai consigli dei ragazzi e abbiamo preso un antipasto e una grigliata, tutto ottimo.Alla fine ci hanno offerto anche gli amari.Non proprio economico, però per mangiare ottima carne non si può pagare poco."
"ui_bubble_rating bubble_50","Spettacolare","Una location davvero molto suggestiva, con un personale che incarna perfettamente la toscanità, tutto questo fa da cornice a ciò che conta di più, cioè i salumi e le carni, squisiti e di ottima qualità, io non mangio tagli grossi di carne, loro vantano il primato di avermi fatto ricredere sulla “Fiorentina”"
"ui_bubble_rating bubble_50","Ottimo ristorante ","Consigliato sia per l’ottima qualità del cibo sia per la gentilezza e professionalità dei camerieri che spiegano in maniera eccellente ogni prodotto che consigliano ... prezzo nella norma. Andateci... noi ci torneremo sicuramente "
"ui_bubble_rating bubble_50","Come sempre fantastici!","Siamo ritornati dopo alcuni anni e abbiamo fatto bene!!! Il locale è sempre caratteristico r accogliente e i ragazzi veramente fantastici. Fiorentina e vino al top. E nessun problema ad accogliere le due nostre bambine pelose!!Bravissimi!"
"ui_bubble_rating bubble_40","Fiorentina!","Il mio ragazzo mi ha portata qua a cena a mangiare una vera Fiorentina e sono rimasta più che soddisfatta (anche se ne avrei presa pure un’altra). Il locale è piccino e molto carino e moderno. Il ragazzo che ci ha serviti veramente gentile e simpatico!Dopo un antipasto fattoci da loro di prosciutto e formaggio, ho mangiato con gusto la bistecca alla fiorentina, arrivata su un tagliere di legno con verdure accanto. Veramente ottima! A parer mio però un po’ poca per due persone, perché in gran parte comunque è osso. Come dolce ho assaggiato la crema di mascarpone, che è stata di mio immenso gradimento. Per finire ci hanno offerto uno shot/amaro.Lo consiglio assolutamente!"
"ui_bubble_rating bubble_50","Come a casa!","Locale molto accogliente, personale giovane e socievole e carne fantastica! Ragazzi in gamba che ti fanno sentire come a casa. Prodotti toscani di qualità e grande attenzione al cliente. Una carne ottima, da mangiare al sangue! Prezzi onestissimi! Lo consiglio a tutti! "
"ui_bubble_rating bubble_50","Super!!!","Locale accogliente personale gentilissimo per non parlare della fiorentina mai mangiata così buona!!! Ci ritornerò sicuramente, consigliatissimo!!!!"
"ui_bubble_rating bubble_50","Vacanza a Firenze ","Consigliatissimo!!! Cena super,carne super , un grazie speciale a matte,ale e simo per la cordialità la competenza ed i consigli dati durante la cena ! Ci tornerò prima del fine vacanza e sicuramente lo consiglio agli amici e a tutte le persone che vogliono mangiare BENE "
"ui_bubble_rating bubble_50","Tutto ottimo","Locale strepitoso, ragazzi fantastici e Fiorentina squisita accompagnata da ottimi contorni. Locale squisito Torneremo sicuramente da Rimini! "
"ui_bubble_rating bubble_50","Ottimo","Ottimo locale con una filosofia particolare, solo prodotti toscani ed eco sostenibili! Merita di essere visitato "
"ui_bubble_rating bubble_50","Capodanno in allegria e con cibo squisito!","Io e mio marito abbiamo cenato qui la sera di Capodanno. Che dire.. tutto PERFETTO! abbiamo preso un tagliere misto in due e una fiorentina con verdure. carne spettacolare. Nel corso della serata i ragazzi che ci hanno servito (Gabriele e Simone mi pare di ricordare) sono stati super gentili e super simpatici; hanno stappato del vino in bottiglia da farci assaggiare, ci hanno portato del filetto da leccarsi i baffi e alla mezzanotte panettone farcito al mascarpone e spumante per tutti! e per finire i famosissimi e apprezzatissimi amari! Consiglio a tutti di provare questo ristorante e vi assicuro che non ne rimarrete delusi!Una menzione speciale vorrei farla (anzi due menzioni) sulla battuta di chianina che definirei commovente e sulle patate...abbiamo insistito per avere la ricetta segreta! io comunque patate così non ne ho mai mangiate!!Davvero complimenti. Per tutto.Elisa e Matteo di Torino."
"ui_bubble_rating bubble_40","Grande mangiata","40 euro a testa per fiorentina e vino forse non è super economico, ma si mangia davvero bene. Fiorentina un po' nervosetta, ma molto buona."
"ui_bubble_rating bubble_50","Genuinità Toscana 4.0","appena entrati eravamo rimasti un pò titubanti dalla sistemazione fugace, poi format specifico del locale.In effetti per il tipo di recensioni e di somministrazione ci saremmo aspettati un locale almeno più classico nell'approccio. Ed invece è proprio un approccio moderno alla proposta classica e genuina, il vero successo del locale.La qualità dei prodotti ben proposti e raccontati da uno staff giovane ma fantastico, Vi permetteranno di considerare la scelta azzeccata e da ripetere alla prima occasione.10 ai prodotti e 11 allo staff. Grandi ragazzi"
"ui_bubble_rating bubble_40","Nascosti in un vicolo di Firenze. CERCATELO E ANDATECI!","Firenze, la carne, i salumi e il vino. Andateci.Servizio formale, molto simpatico; locale molto particolare e curato ; adatto ad amici, coppie e famiglie.Tagli di carne molto morbidi, porzioni giuste e prezzo adeguato.Vivamente consigliato!"
"ui_bubble_rating bubble_40","Vi siete nascosti ma vi ho scovato !","Gita in una Firenze piovosa e fredda, sbircio su TripAdvisor e fra miriadi di posti più o meno consigliati , scopro questa chicca ..... Dopo20 minuti di cammino...Trovati ! Beh che bella scoperta, personale gentilissimo, locale particolare e...WOW cibo da orgasmo ! La carne top anche se alla piastra e non alla brace e conto ? ..... Accettabilissimo, ...lasciato anche la mancia per piena soddisfazione ! Veramente consigliato.......peccato solo per non poter godere a fine pasto del caffè ...unica pecca!"
"ui_bubble_rating bubble_50","La bellezza e la bontà della cucina toscana","Siamo partiti dalle marche per assaporare una vera fiorentina ed in questo locale si sono veramente superati!! Personale preparatissimo e simpaticissimo...carne ottima e prezzi adatti....siamo stati veramente bene e ci torneremo senz'altro.Da provare e riprovare assolutamente"
"ui_bubble_rating bubble_50","Verità assoluta","Abbiamo scelto questo ristorante per le ottime recensioni che confermiamo in tutto e per tutto .Locale piccolo ma simpatico, personale che è una forza della natura e che ti fa sentire speciale ( mio figlio ha chiesto una Coca Cola non disponibile nel menù e Simone, che ringraziamo ancora , si è messo la giacca ed è uscito a prenderla !!!)Taglieri e carne ottimi e abbondanti, ma nel caso non se ne avesse abbastanza e per non lasciarti nel dubbio, ti servono un fantastico filetto a completamento.Quando dici 'basta' i ragazzi arrivano con una decina di bottiglie di grappa e digestivi e mentre li descrivono ad uno ad uno, ti accompagnano nel brindisi: se l'anno inizia con tanta simpatia (abbiamo cenato il 2 Gennaio) , ci fa ben sperare !Chiosa della serata, la gradita visita di Dante che ci ha recitato un canto del Paradiso (che mai ci è mai sembrato così vicino !)"
"ui_bubble_rating bubble_30","Bella location ","Abbiamo mangiato un menu da 80€ con Fiorentina e verdure grigliate e mezzo di vino.Molto curato e carino il posto.Servizio efficiente, accogliente e simpatico. Fiorentina cotta bene, buona, ma non buonissima. La carne non è tenerissima, probabilmente non è di primissima qualità. "
"ui_bubble_rating bubble_50","Carne DOC","Carne tutta ottima, bambini super coccolati, servizio impeccabile grazie alla gentilezza di tutti. Un applauso ad Alessio che ci ha omaggiato anche di altro formaggio e dei cantuccini!rapporto qualità prezzo buono. Straconsigliato!"
"ui_bubble_rating bubble_50","Da tornarci! ","Carne ottima e atmosfera molto accogliente! Posto perfetto per passare una serata piacevole. Camerieri gentilissimi e simpatici, bravi ragazzi!! "
"ui_bubble_rating bubble_50","Bello, buono e divertente","Se avete deciso di mangiare la fiorentina andate qui! non troverete molto altro (quindi se volete spendere 20 euro non è il posto giusto) ma quello che c'è lo fanno davvero bene! Rapporto qualità prezzo ottimo e personale gentile, simpatico e coinvolgente.Localino molto piccolo ma molto familiare e piacevole!"
"ui_bubble_rating bubble_50","Sublime.","Siamo stati in questo ristoranti per consiglio di amici e soprattutto rispetto alle esperienze scritte dal forum. Che dire:servizio 5 stelle. Ragazzi gentilissimi sempre disponibili che coccolavano in continuazione attraverso omaggi dalla casa e descrizione di ogni piatto accompagnato al tavolo. Cibo:5 stelle. Antipasto misto favoloso e la classica ciccia cotta perfettamente al sangue con patate e verdure accompagnate divine. Prezzo:5 stelle. Rapporto eccellente considerando tutta la cornice credevo di pagare nettamente di più.La location è molto rustica e accogliente. Ringrazio ancora per averci omaggiato del vino (buonissimo) e dei vari liquori speciali che hanno concluso la favolosa cena.Dovessi tornare a Firenze , senza dubbio, ritorno la.Grazie e alla prossima!"
"ui_bubble_rating bubble_50","Wow","L'anno nuovo è partito alla grandissima grazie a voi. Assieme alla mia compagna ed a mio figlio siamo passati per Firenze durante i primi giorni dell'anno con l'obiettivo di mangiare una fiorentina come si deve...MISSIONE COMPIUTA...la ciccia era fantastica ed il vino servitoci era altrettanto ottimo (vi ringrazio per avermi omaggiato di una bottiglia). Mio figlio ha fatto sparire il filetto in 30 secondi, tra l'altro cotto alla perfezione per un bimbo piccolo.Che dire grazie mille per la vostra competenza e qualità delle vivande "
"ui_bubble_rating bubble_50","Ambiente e servizio da veri Top player","Locale piccolo ma molto accogliente e caloroso...I ragazzi che lavorano lì sono unici e divertentiFavolosi il cibo dagli antipasti tagliere stuzzicanti e gustosi alla carne davvero squisita! Concludiamo con il giro di amari davvero fantastici per tutti i gusti...brindando insieme agli altri ospiti e al mitico Simone (il ragazzo che ci ha seguito e servito ieri sera) Sarà un piacere vero piacere tornare la prossima volta in visita a Firenze.Riccardo e Jessica"
"ui_bubble_rating bubble_40","Spettacolare!!!","Ambiente confortevole staff preparato cibo ottimo le due uniche pecche sono la mancanza del caffè e la carta dei vini però assolutamente da non perdere"
"ui_bubble_rating bubble_50","Cena fantastica ","Locale tipico e accogliente!! Personale super gentile e informato sui prodotti.. che dire ,non ho mangiato mai una bistecca alla fiorentina così buona e succulenta !! Ragazzi siete grandi ,in particolar modo ,Simone ,per la sua simpatia e professionalità.. torneremo presto a trovarvi .."
"ui_bubble_rating bubble_50","Una cena squisita","abbiamo soggiornato 2 notti a firenze e abbiamo provato la cena ai tuscani 2 visto le ottime recensioni..cosa dire? fantasticoil cameriere gentilissimo, ci hanno offerto anche l'antipasto, la fiorentina con il loro sale e olio era meravigliosa e il vino era ottimo..il prezzo ampiamente nelle mediada provare assolutamente..bravi"
"ui_bubble_rating bubble_30","Locale caratteristico nel cuore di Firenze","Spinto dalla ottime recensioni ho deciso di provare questo ristorante nel cuore di Firenze.Il locale è disposto su due piani, con una sala più grande al piano di sotto.Dal menu è possibile scegliere tra taglieri e hamburger/bistecca fiorentina. Ci sono dei menu a costo fisso: euro 20 hamburger mentre menu fiorentina parte dai 70 euro circa, con contorno di verdure.La carne molto buona ed abbondante. Personale cortese."
"ui_bubble_rating bubble_50","Complimenti","Ho cenato in questo locale il 30 dicembre: avevo prenotato con largo anticipo sapendo che il locale non è molto grande. Siamo arrivati qualche minuto prima, abbiamo aspettato e per scusarsi che il tavolo non era pronto ci hanno offerto una bottiglia di vino e un tagliere di antipasti. Personale gentilissimo e ottima carne. "
"ui_bubble_rating bubble_50","un percorso di gusto","la prima sera a cena non c'era posto ma ho colto l'occasione per prenotare per la sera successiva. Quindi 1° consiglio: prenotate! il locale è molto particolare diviso su due piani, noi ci siamo accomodati al piano inferiore dove troviamo un ambiente intimo e informale allo stesso tempo. I piatti e in particolar modo la carne erano squisite, in generale la evito perché fatico molto a digerirla ma stavolta ho seguito i consigli dello staff ed infatti il mio filetto da 300 grammi non mi ha dato fastidio. abbiamo scelto un tagliere di antipasti e un menù da 75 € che comprendeva una bistecca e un filetto con verdure alla piastra. le verdure molto ben cucinate ed il tutto accompagnato da un buon bicchiere di vino. a fine pasto 3 giri di grappa insieme al ragazzo che ci ha seguiti nel percorso mangereccio. 90 € il conto totale e li valeva tutti! Nota di pregio i piatti e i bicchieri in materiale completamente biodegradabile."
"ui_bubble_rating bubble_50","I' CUORE DELLA FIORENTINA!","Sarò di parte perchè sono fiorentina come la sua anima, ma questo piccolo locale mi ha rubato il cuore...e la gola! In posizione strategica tra stazione e Duomo, l'atmosfera interna con luci soffuse lascia però anche spazio al colore dei proverbi scritti sui muri delle sale e all'allegria e gentilezza del personale. Apprezzata la scelta di piatti e tovagliette con materiali ecosostenibili e olio/condimenti del territorio. Ottima la soluzione dei taglieri di carne con verdure, acqua e vino inclusi. Consigliatissimi il Tuscani menu x 2 con una fiorentina da 10 e lode, ma anche il Tuscani burger. Carne di alta qualità, cottura eccellente in base alla scelta del cliente: per noi ovviamente al sangue! Graditi anche gli assaggi di affettati e salumi toscani, proposti dal personale di sala, molto preparato e sempre pronto a soddisfare ogni nostra esigenza e a spiegare provenienza e storia dei cibi. Un complimento in più al ragazzo che ci ha servito, con un'attenzione particolare per i bambini.Rapporto qualità-prezzo buono per l'alta offerta e la posizione. Un vero esempio di fiorentinità in tutto, dove è sempre un piacere tornare!"
"ui_bubble_rating bubble_50","Unico e accogliente","Siamo stati in questo locale sulla scia delle recensioni positive lette su trip e le aspettative sono state più che soddisfatte! Il locale è molto caldo e accogliente, sui muri ci sono scritte con il gessetto molto simpatiche e i ragazzi dello staff sono simpaticissimi! Abbiamo mangiato una Fiorentina favolosa! Poi nel mezzo della serata è arrivato il sommo poeta “Dante” che ci ha regalato un momento speciale, recitando l’ultimo canto della divina commedia! Serata speciale!!"
"ui_bubble_rating bubble_40","Buon cibo e armosfera particolare","Bel locale con atmosfera particolarmente piacevole soprattutto al piano inferiore dove abbiamo cenato noi, intimo e, nel suo stile, molto curato.Carne di alto livello e, a nostro gusto, le verdure di accompagnamento alla Fiorentina erano davvero squisite.Merita una ulteriore nota di merito il sale fatto in casa.Sottolineiamo infine una particolare cura del cliente da parte del ragazzo che ci ha servito.Consigliato."
"ui_bubble_rating bubble_50","#diecielode","Una cena con prodotti eccellenti, carne di ottima qualità. Personale cordiale, disponibile e simpatico in una locanda raffinata nella sua semplicità! Come si fa a non tornarci..."
"ui_bubble_rating bubble_50","La scelta giusta!!! ","Abbiamo prenotato per il pranzo e ne siamo rimasti veramente soddisfatti!!! La carne è buonissima e servita con verdure grigliate e patate. Il vino della casa è ottimo e i ragazzi sono davvero cordiali e affabili. Ci siamo sentiti a casa!!! E ci siamo divertiti molto con loro. Lo consiglio vivamente. Il conto? Giusto!!! "
"ui_bubble_rating bubble_50","Davvero eccellente!","La vera bistecca fiorentina Camerieri gentilissimi, simpatici e disponibili! Non è stata solo una cena ma una vera e propria esperienza da provare se si è a Firenze! "
"ui_bubble_rating bubble_50","Ottima scoperta","Locale accogliente, personale simpatico e disponibile a dare consigli. Ottima la carne con le verdure, buono il tiramisù. Grappe buonissime e per ogni gusto.Ottimo il rapporto qualità prezzo"
"ui_bubble_rating bubble_50","SPETTACOLARE","Già appena arrivati la location ti fa capire che il posto è bello! Bellissima anche l’accoglienza di un ragazzo molto gentile! Abbiamo pranzato con 5 taglieri, tutti con salumi e formaggi tipici toscani! Veramente ottimi, qualità super soprattutto per l’ultimo tagliere portato! Siamo stati davvero molto bene, camerieri gentilissimi che talaltro sono stati anche molto esaustivi nello spiegarci tutto ciò che riguardava la provenienza del cibo! Vino incantevole, addirittura ci hanno offerto 0,5lt di vino, oltre la grappe di tutti i tipi! Siamo stati tutti veramente bene è sicuramente torneremo per la prossima visita a Firenze! Prezzo, rispetto alla qualità del cibo, più che corretto! Straconsigliato a chi ama prodotti e sapori toscani di alta qualità!Complimenti!"
"ui_bubble_rating bubble_50","Quello che volevo!","Piccolo e caratteristico locale dove si possono assaporare prodotti tipici del territorio toscano dall'olio al vino concludendo con l'ottima ciccia. Assolutamente consigliato! E poi...vuoi per la miriade di grappe e liquori che vengono offerte a fine pasto..vuoi per l'ottimo pranzo..fatto sta che la mia ragazza si è commossa dichiarandomi amore!!! Grazie Tuscani!"
"ui_bubble_rating bubble_50","Viva la ciccia in compagnia!","Ci siamo stati a cena il 2 gennaio. Andateci con un bell'appetito, perché per gustare il loro menù con la fiorentina ci vuole -ottimo rapporto qualità-prezzo, per due fiorentina e contorni, vino e acqua compresi, 75 euro più coperto 5-! Ci ha accolti - e coccolati tutta le sera!- Simone, che rende la cena nella saletta di sotto un'esperienza di buona tavola e convivialità serena, quasi tutti i clienti raccolti ai tavoli fossero suoi amici. Dopo una fiorentina da urlo e dolci ti offre un assaggio di amari di loro produzione assolutamente deliziosi. Rispondendo ad altre recensioni, devo dire che personalmente condivido l'idea dei piatti in cellulosa bio riciclabili: la carne non è certo meno buona per questo, anzi, semmai ti senti meno in colpa nei confronti della natura -che ti fa mangiare la carne, la verdura, l'olio buono... -! Bravissimi, ragazzi, a rivederci presto!"
"ui_bubble_rating bubble_50","Una delle.migliori scelte fatte","Scegliamo questo ristorante dopo aver consultato trip per mangiare una buona fiorentina. le aspettative erano alte e sono state superate in pieno. Il personale ha dato quel tocco in piu facendoci sentire come a casa nostra, come essere a casa di amici. Possibilita di vari menu che il cameriere ci ha spiegato nel dettaglio (nota positiva l attenzione x l ambiente). Dopo i vari consigli su cosa ordinare abbiamo optato per una bistecca e un filetto che stare qua a descrivere non gli rendebbe pienamente gloria. Antipastino offerto dalla casa. Acqua e vino no limits, grappe e liquori di vari gusti in tavola. Il tocco in piu è stato l arrivo di Dante che ti delizia con l ultimo canto della divina commedia. Consigliatissimo. Menu da 75 euro, 2 dolci, coperto. Totale 90 euro!!"
"ui_bubble_rating bubble_50","Originalità ed allegria","Sono stata ieri a pranzo in questo deliziosa trattoria con i miei 2 ragazzi. Prenotate perché non si trova posto!!! Ci hanno fatto accomodare nella saletta al piano inferiore, curata con dettagli che giravano intorno ai prodotti locali di cui, i gestori, sono profondi conoscitori ed estimatori. Tutto verte sul prodotto biologico e sulla sua provenienza. I ragazzi responsabili del locale sono preparati, dinamici e stradisponibili. Ci hanno illustrato in ogni singolo dettaglio i colori ed i sapori di ogni pietanza, consigliandoci addirittura quale tipologia di olio abbinare per rendere più esaltante il prodotto al palato. Abbiamo preso taglieri di affettati ed assaggini di altri prodotti cucinati partendo dalle materie prime della zona, gustato degli ottimi hamburger di chianina al sangue accompagnati da saporitissime verdure. Uno speciale vino offerto a tutti da una bottiglia appena aperta che hanno servito ai diversi tavoli ed un giro di squisite grappe che capeggiavano sui tavoli a fine pasto. Atmosfera familiare ed intima, luci soffuse e gentilezza. Un posto consigliato a tutti, dalle famiglie alle coppie, perché a renderlo unico sono, non solo i freschi ed ottimi prodotti, ma anche l'affettuosità e la cura dei ragazzi. Ci hanno anche salutato con un pacchetto di divini bruttimabuoni. Un grazie a voi ragazzi perché riuscite a trasmettere degnamente ed allegramente quanto grande sia la passione che mettete nel vostro lavoro!"
"ui_bubble_rating bubble_50","Grande piacere","Fin da subito, il ristorante è apparso carino ed il personale disponibile, in quanto ci hanno fatto scegliere in quale sala preferissimo stare. Abbiamo ordinato dei secondi, senza antipasti, ma nell'attesa ci hanno ugualmente servito un piccolo tagliere di affettati. La carne era veramente deliziosa e squisita, accompagnata da verdure grigliate altrettanto buone e delle patate arrosto cotte davvero benissimo. Nonostante ci fosse già stato portato del vino, incluso nel prezzo del menù, uno dei camerieri ce ne ha fatto assaggiare un altro. A fine pasto abbiamo scelto quale grappa volessimo, tra una vastità di bottiglie. Molto consigliato, sia per il cibo, sia per chi ci lavora. "
"ui_bubble_rating bubble_50","Cena molto buona, il vino non ottimo","Locale piccolo e piacevole ma con pochi coperti, per cui conviene prenotare. Il cibo è molto buono, unica cosa rivedibile è il vino che ti danno, un po' troppo giovane e di basso livello, soprattutto a fronte del prezzo della cena. Oltre agli antipasti ci sono 3 o 4 piatti unici dal costo da 60 a 80 € in due. Si mangia tanto e bene, prezzo un pochino alto rapportato al vino e all'utilizzo di piatti di carta riciclata (scelta bio del locale). In ogni caso consigliato."
"ui_bubble_rating bubble_50","I miglioriiii","Fantastico il posto fantastico Gabriele molto gentile simpatico e cordiale ...beh la fiorentina e l hamburger uno spettacolo ..le verdure e gli affettati che ci hanno omaggiato nell' attesa ..che dire? Andateci andateci andateci se siete amanti del buon cibo a dimenticavo...Anche il buon vino ...grazie x l'ottima conclusione della nostra gita....SABRINA E FAM."
"ui_bubble_rating bubble_50","Spettacolare!","Ci siamo fidati delle recensioni e ci siamo ritrovati a prenotare in questo locale già per il giorno seguente! Personale e servizio cordiale, sembra di essere con amici. Il cibo non è descrivibile per la bontà! Antipasti buonissimi, carne strepitosa, vino eccezionale! Abbiamo preso il menù da 80 euro a coppia e siamo usciti sazi e in estasi! Consigliatissimo a tutti! Usciti da li già non vedevamo l'ora di tornare!"
"ui_bubble_rating bubble_50","Locale ok ","Siamo stati dopo Natale prenotando il giorno prima.Siamo stati al piano terra, per cui non possiamo dire come era la situazione in cantina, ma senza prenotazione non è potuto entrare nessuno.Buon cibo (Fiorentina, salumi e formaggi) presentato su tagliere con verdura grigliata e patate. Non moltissime scelte, ma il personale è molto disponibile ad assecondare le richieste. Tiramisù ottimo.Non fanno il caffè, ma come scritto sulla lavagna “un ce viene”.Molto coinvolgente Alessio (coni bimbi ci sa proprio fare) ed ottimo public relator Niccolò."
"ui_bubble_rating bubble_50","Il regno della carne!!","Pranzo di capodanno semplicemente perfetto. Il menù, tutto a base di carne e specialità toscane, non può non farvi innamorare di questo ristorante. Ambiente piccolo ma accogliente, curato e pieno di simpatia toscana in ogni angolo, dalle scritte sui muri alla cordialità dei camerieri. La qualità della carne non si discute, così come il conto. Vi consiglio di prenotare, soprattuto nei giorni di festa."
