"Restaurant_Ratings","Restaurant_Quotes","Restaurant_Reviews"
"ui_bubble_rating bubble_50","Eccellente cena toscana","Una sera di luglio abbiamo deciso di cenare alla toscana. In questo locale abbiamo celebrato la cucina toscana. Un ambiente molto speciale, tipo taverna. Accoglienza molto calorosa, relazione qualità/prezzo ottima! Vino locale molto buono e,grappa bianca eccellente. Un locale da visitare a Firenze.Corrado"
"ui_bubble_rating bubble_50","Cena Fiorentina in allegria","Abbiamo cenato in questa trattoria in centro a Firenze una sera di luglio.Ci hanno servito un tagliere gigante con filetto e costata di manzo con verdure grigliate e patate.Tutto fantastico sia il cibo che la simpatia dei locandieri. Mi raccomando di chiedere del RE DELLA PATATA che sarà felice di raccontarvi la sua ricetta segreta. Consigliatissimo."
"ui_bubble_rating bubble_50","Fantastico!!!!","Il ristorante è molto accogliente, il personale è capace, disponibile e sempre con il sorriso. Il cibo è sublime. È stata un’esperienza indescrivibile! Spero di poter tornare presto! "
"ui_bubble_rating bubble_50","I Tuscani 4,bravi 4","Cominciamo col fare i complimenti a chi ci lavora e ci mette la faccia. Bravi, cortesi, disponibili, simpatici e ospitali...continuate così ragazzi.Il locale è molto carino, ben curato, pulito e a due passi da ponte vecchio. La carne è davvero buona, la bistecca in particolare è straordinaria. Una chicca, potete mangiare il piatto...non è una battuta, il piatto è commestibile. Ci sono stato per la prima volta ieri ma tornerò sicuramente. Consigliato, consigliatissimo!!! "
"ui_bubble_rating bubble_50","Cortesia e ottima carne","Cena di coppia per festeggiare i nostri 10 anni.Qualità prezzo giusto (40€ a testa la carne molto buona con vino e acqua inclusi)...I ragazzi che gestivano e servivano sono stati molto cordiali e disponibili.A inizio cena anche una bella interpretazione de LA PIOGGIA NEL PINETO di un poeta/attore locale.Complimenti...bellissima serataClaudio"
"ui_bubble_rating bubble_30","Boh","Il tagliere un po' triste a mio avviso ..specialmente perché è il vostro piatto forte. Fiorentina saporita ma piena di nervi quindi nn si mangiava(ho mangiato Fiorentina migliore a Bologna addirittura) .. 91 euro il tagliere in foto,un tiramisù,acqua e vino .. potete fare di meglio ! "
"ui_bubble_rating bubble_50","Ottima atmosfera e carne","Ottimo posto per una bella cenetta. Tartare deliziosa con il mix di spezie fornito dai camerieri, la bistecca sublime per cottura (a richiesta) e qualità; ottimi anche i contorni del menu fisso ossia patate e verdure alla griglia. Compreso nel prezzo (da 75 a 80 euro in due) anche mezzo litro di Chianti e acqua. Carino il fatto che a termine serata si possa lasciare la propria firma/dedica sul muro e divertente il materiale con cui sono fatti i piatti, infatti si tratta di crusca compattata che si può anche assaggiare. Uniche note leggermente negative l'aria condizionata mancante (necessaria data la scorpacciata di carne e vino) e il tiramisù. Infine grande scelta di amari di alta qualità."
"ui_bubble_rating bubble_50","Bravi tutti","Sono stato in questo ristorante oggi verso le 20 dopo una prenotazione fatta online,,, il posto è molto accogliente e intimo, il personale molto disponibile ad accontentare ogni mia richiesta affinché possa godere al massimo la mia cena,,, ottimo rapporto qualità prezzo secondo me, Un antipasto, bistecca alla fiorentina e un calice di vino al costo di 54 euro. La carne era veramente squisita e lo era anche il taglierino di salumi. Un ringraziamento speciale a Sara, la gentilissima cameriera e tutto il resto dello staff. Bravi tutti e alla prossima. Ibra."
"ui_bubble_rating bubble_50","La Fiorentina!","Se vuoi mangiare la Fiorentina, da Tuscani 4 devi andare!le recensioni non smentiscono la nostra cena!Fiorentina ottima accompagnata con le verdure, accoglienza e intrattenimento che arricchiscono la serata. Tutto perfetto!lo consiglio a tutti!Prezzo giusto per quello che abbiamo mangiato!"
"ui_bubble_rating bubble_50","Bella serata a Firenze ","Posto fantastico, personale cordiale e simpatico, la carne eccezionale alla fine ci hanno offerto una serie di assaggi di amari di vari gusti , una piacevole serata, se passate da Firenze vi consiglio questo posto "
"ui_bubble_rating bubble_50","Grande carne","Luogo molto carino, vicinissimo agli Uffizi. Personale educato e cortese, carne di prima qualità e attenzione verso il cliente. Da provare anche i liquori a fine pasto.Sicuramente ci torneró."
"ui_bubble_rating bubble_50","Atmosfera accogliente e Fiorentina spettacolare","Siamo andati in questo posto grazie alle recensioni positive, e non siamo rimasti delusi. L’atmosfera è molto familiare, il servizio efficiente e simpatico, e la Fiorentina davvero prelibata, i prezzi sono nella norma, c’è anche un’offerta di menu già composti che comprendono piccolo aperitivo di benvenuto, la carne con verdure grigliate, il vino, pane, acqua e amari, il menu “fisso” proposto varia a seconda della carne scelta, va da € 22 a persona per hamburger a € 40 a persona per la Fiorentina.Concludendo, lo consiglierei e ci tornerò. Complimenti! Ps: i piatti sono commestibili, alla crusca! "
"ui_bubble_rating bubble_40","Che carne!","Il paradiso dei carnivori!Carne alla griglia di qualità suprema da accompagnare con verdure grigliate o taglieri.Servizio cortese ed efficiente.Apprezzata la proposta di stoviglie bio e conpostabili.Locale un pò troppo buio per i miei gusti.Non cercate primi perchè non me fanno.Prezzo medio 40€/pers."
"ui_bubble_rating bubble_30","Ristorante turistico","Atmosfera raccolta e tranquilla, personale eccellente e piatti molto variopinti. La carne non era all'altezza Delle aspettative, tenera ma poco gustosa, contorni di verdure ottime, per un turista è tutto ok ma per i veri carnivori no. Prezzo leggermente superiore alla media."
"ui_bubble_rating bubble_50","Carne di qualità","E' il posto ideale per mangiare carne di qualità in un ambiente giovanile e piacevole. La cortesia del personale e la loro completa disponibilità rendono il posto ideale sia per le famiglie che per gruppi di amici."
"ui_bubble_rating bubble_40","Una bella esperienza!","Siamo stati in questo locale che ci era stato consigliato.devo dire che è stata veramente una bella serata con una bistecca molto buona arricchita da contorni molto graditi.La ragazza che ci ha accolto è stata molto gentile e ci ha consigliato veramente bene sul tipo di carne e sul grado di cottura!Come conclusione ci sono stati offerti una serie di digestivi molto buoni e variegati.Consigliatissimo!! "
"ui_bubble_rating bubble_50","Fantastico!","Posto fantastico nel cuore di Firenze. Abbiamo preso una Fiorentina a testa cantucci e vino per dolce e amaro offerto. 40 euro ve lo consiglio "
"ui_bubble_rating bubble_40","Una nuova esperienza","Siamo andati in questi locale su suggerimento del proprietario del b&b dove eravamo appoggiati.locale curato,personale gentile,Fiorentina buona ma forse non adatta ai miei gusti...ma complimenti in ogni caso ai proprietari."
"ui_bubble_rating bubble_40","Ciccia e poesia","Locale informale con particolare riguardo ad un atteggiamento green.Buona la materia prima. Equilibrato il rapporto prezzo/qualità. Il giorno in cui abbiamo cenato un giovane attore ha gradevolmente allietato la serata declamando poesie di autori toscani.Criticabile la mancanza di una carta dei vini."
"ui_bubble_rating bubble_40","Brave......","Locale informale.....attenzione ossessiva (in senso buono) alle materie prime....notevoli e di ricerca....qualita' della carne super.....gentilezza e preparazione delle due ragazze da premiare.....da provare sicuramente se si ama la buona carne.....e se tutto ciò ve lo dice uno Chef....c'e' da crederci!!!!!"
"ui_bubble_rating bubble_50","Esperienza culinaria eccezionale","Ci ho messo qualche settimana per capire dove andare a mangiare la Fiorentina a Firenze? Per me era importante, sia perché era il mio compleanno sia perché era la prima volta a Firenze.Ai toscani 4 ho mangiato una Fiorentina e un filetto deliziosi, cottura perfetta.Ah dimenticavo (non avevamo ordinato l’antipasto) ma ci hanno portato dei caldi crostini con il lardo buonissimiHo trascorso una bellissima serata.Il simpaticissimo cameriere Gioele (palermitano) ci ha fatto sentire a nostro agio, coccolati ed offerto i digestivi.Straconsigliato."
"ui_bubble_rating bubble_50","...speciale!","Ho trovato questo posto un po’ per caso.. per una cena veloce all’uscita da un congresso. Mi ha accolto Sara, gentilissima, che mi ha coccolato tutta la sera spiegandomi il menu e indirizzandomi nella scelta anche del vino.. morale: cena deliziosa (taglieri sfiziosi; formaggi, salumi, tartare squisita) con sottofondo musicale piacevole e rilassante... what else??? Ah sì... tiramisù alle fragole ottimo! Insomma, locale consigliatissimo, tornerò sicuramente (spero presto!)"
"ui_bubble_rating bubble_50","Esperienza fantastica","Cena tra amici, che dire... un'esperienza unica. Cibo eccezionale, naturalmente abbiamo preso la fiorentina, accompagnata da bruschette di antipasto e verdure grigliate. Vino della casa ottimo accompagnatore, e per concludere una serie di assaggi di alcune grappe locali. Personale disponibile e simpatico. Consigliatissimo."
"ui_bubble_rating bubble_50","Ottima carne","Consiglio questo ristorante per gli amanti della carne. Staff gentilissimo e cordiale, ottimo cibo. Da ritornarci!"
"ui_bubble_rating bubble_40","Che pezzo di carne!","Locale carino, buona atmosfera. Personale accogliente e simpatico,preparato, ti dà informazioni sul menù. La Bistecca alla fiorentina (bisteccona) che ho ordinato non ha deluso le apettative. Ben presentata: su un tagliere con verdure alla griglia. Il locale è un po' decentrato, ma forse è un pregio , lontano dal caos di alcune zone più popolari. Conviene prenotare per non avere sorprese. Si rischia di non trovare posto! Da provare."
"ui_bubble_rating bubble_50","Tradizione e modernità!","Io e il mio compagno siamo stati a cena in questa moderna “osteria” la definirei cosí, a pochi passi dal teatro Verdi. Menù prettamente di carne come vuole la tradizione, diversi antipasti sempre tipici(formaggi, salumi..) e taglieri con verdure e carne. Tutto ottimo e di qualità. Consigliamo solo di calcolare le porzioni, noi abbiamo diviso l’antipasto e abbiamo preso un tagliere di carne a testa ma le porzioni sono generose e ci è dispiaciuto avanzare un po di cibo. Magari è meglio condividere a meno che non abbiate uno stomaco bello capiente<U+263A><U+FE0F> le ragazze dello Staff sono state entrambe davvero gentilissime, cambiandoci anche il tavolo con uno più intimo e appartato. Davvero una bella esperienza, consigliatissimo anche per compagnie di amici, magari per festeggiare un compleanno!"
"ui_bubble_rating bubble_50","Ottimo...","Un pranzo semplice, ma la carne spettacolare... da non perdere! Oltre tutti il servizio che sembra non curato è fatto a posta per inquinare il meno possibile..."
"ui_bubble_rating bubble_50","Peccato sia lontano","Senza dilungarmi troppo dico subito che il locale è carino, accogliente e green (impatto zero).Personale gentile, simpatico, preparato e disponibili ad ogni richiesta.Menù non eccessivamente vario ma composto dall' essenziale, la carne.Rapporto qualità prezzo nella media, vero i prezzi possono sembrare alti ma ne vale veramente la pena andarci. Carne morbida, saporita con contorni semplici ma saporiti.Mi manca tanto l' entrèe composto da quella lonza marinata nel vin santo, una goduria.Comunque andateci non ve ne pentirete."
"ui_bubble_rating bubble_50","Spettacolare!","La carne è buonissima, saporita e cotta alla perfezione, il locale è accogliente, i ragazzi sono simpatici e gentilissimi, i prodotti vengono tutti dal territorio e c'è un'attenzione per l'ambiente (piatti e bicchieri sono biodegradabili), il prezzo è assolutamente onesto. In 3 abbiamo speso 35 euro a testa per la fiorentina più buona di sempre! Consigliatissimo!"
"ui_bubble_rating bubble_50","I tuscani 4 merita ma Sara è davvero il top.","Ciò che ti aspetti da un ristorante non è solo il buon cibo ma soprattutto la cordialità e la pulizia. Io e il mio fidanzato abbiamo deciso di prenotare la cena del mio compleanno proprio ai Tuscani 4, grazie alle recensioni di TripAdvisor.Ottima la carne, ottimo il vino della casa, ma la “ciliegina sulla torta” è stata proprio Sara, la cameriera, che non ha appena ha saputo il motivo della cena, si è preoccupata di arrangiare una piccola torta con tanto di candelina offrendoci degli ottimi liquori. Grazie ai tuscani e grazie Sara, se dovessimo tornare a Firenze passeremo di sicuro a trovarvi"
"ui_bubble_rating bubble_50","Famiglia e tanta carne","Veramente una serata splendida.. sorpresiPer aver trovato solo carne ma poiAlla fine non ci è mancato nulla anzi.. eravamo a cena con la nostra piccola di 6 mesi e ci hanno accuditi e coccolati in modo speciale.. siamo rimasti molto molto soddisfatti.. ottima la carne con i contorni e squisiti i cantucci.. tutto molto abbondante e servito in modo splendido.. "
"ui_bubble_rating bubble_50","fiorentina fantastica","A cena con amici in questo locale molto simpatico . Siamo stati accolti da un Dante contemporaneo molto gentile e bravo che ci ha allietato con l'ultimo canto del paradiso . Molto ben recitato . La qualità del cibo davvero notevole , ottimi i taglieri con salumi particolari e poi la carne davvero notevole . Ottima la bistecca di mucco pisano , credo una delle migliori fiorentine a Firenze . Il personale molto educato ed attento . Prezzo giusto per la qualità degli alimenti. Bravi"
"ui_bubble_rating bubble_50","Ottima carne","Ottima carne, tenerissima e saporita. Eravamo in 7 e abbiamo preso carni diverse, tutte buonissime. Buonissimi anche i taglieri, sia di salumi che di tartare, forse le porzioni non abbondanti. Ottimo anche il vino e da non farsi mancare i dolci, squisiti ! Non mi ha entusiasmato l'idea dei piatti ecologici e .. dei bicchieri di plastica, idea in contraddizione tra loro, perché amo piatti di ceramica e bicchieri in vetro, ma il ristorante e la carne lo consiglio a tutti ! "
"ui_bubble_rating bubble_50","Alla grande!","Locale particolare, molto accogliente e con personale preparato, cortese e simpatico. Mangiato carne di ottimo livello. Ambiente familiare, tappa sicura per le prossime visite a Firenze, BRAVI!!! "
"ui_bubble_rating bubble_50","Magna e beva","Una bellissima serata,una cena a base di Fiorentina e verdure accompagnata dal rosso della casa.I ragazzi dello staff sono simpaticissimi e lavorano divertendosi...merita e ci ritornerò!!!!"
"ui_bubble_rating bubble_50","Perfetto","Ottimo posto.. locale tranquillo, molto belle le scritte sui muri e i vari detti in toscano sul cibo.personale meraviglioso ti mette a tuo agio e ti spiega al meglio sia i piatti sia il loro modo di essere ecosostenibili..Cibo fantastico, la carne cotta al punto giusto e con l’aggiunta dell’olio risulta fantastica. Il vino della casa in Chianti con un retrogusto di ciliegio è fantastico..Verremo sicuramente un’altra volta."
"ui_bubble_rating bubble_50","Tutto ottimo","Siamo stati con amici e bambini tre giorni fa, e siamo stati molto bene a partire dalla gestione del locale giovane e cordiale. La carne era ottima, di grande effetto l’impiattamento sul lungo tagliere. Originale l’idea dei piatti naturali in crusca, locale attento quindi al problema Ecologia. Bravi!Ottimo rapporto qualità prezzo, 40 euro a testa tutto incluso. In più ci hanno regalato un assaggio di formaggi e salumi come entrè. Alla fine un attore ci ha deliziati recitando l’ultimo canto del paradiso di Dante. Chapeau!"
"ui_bubble_rating bubble_30","Al limite","Buono il tagliere e buona la grigliata mista.Carina l’idea dell’attore (bravo, a parte il costume) che recita Dante durante i pasti, ma rischia di farlo scadere troppo verso quei ristoranti turistici alla “spaghetti Alfredo”.Peccato, perché i ragazzi che ci lavorano sono molto bravi. In particolare il personale di sala è molto accogliente e disponibile."
"ui_bubble_rating bubble_50","Tutto stupendo","Io e il mio ragazzo siamo venuti a pranzo con l’obiettivo di mangiare una buona Fiorentina. Ci hanno offerto un piccolo assaggio di salumi tipici deliziosi. 1,2 kg di carne, serviti con verdure grigliate, sublime! Acqua a volontà e mezzo litro di vino della casa erano compresi nel prezzo del menù scelto. Arrivati agli ultimi pezzi il cameriere è stato così gentile da farli riscaldare. I ragazzi che lavorano qui sono gentilissimi, ci hanno offerto un amaro e sono anche venuti a brindare con noi (cuochi compresi). Grandi sorrisi, locale carinissimo, pareti decorate con espressioni fiorentine scherzose che fanno sentire a casa. Che dire, siamo usciti dal locale con i sorrisi stampati sulle labbra! "
"ui_bubble_rating bubble_50","Che roba!!","Il locale non molto grande ma carino, curato nei dettagli e piacevole e accogliente. Ottima l'idea di mangiare su piatti biodegradabili e lo stesso vale per i bicchieri e tovaglioli...un occhio di riguardo per l'ambiente non guasta mai!Il ragazzo che ci ha accolto molto gentile, disponibile, cordiale e mai invadente. Con un pizzico di simpatia che non guasta mai...davvero i miei complimenti a lui a tutto lo staff.La carne più buona che io abbia mai mangiato! Abbondante, cotta alla perfezione e che si scioglie in bocca. Anche i salumi hanno un sapore che non smetteresti mai di mangiarli!Ottimo anche il rapporto qualità prezzo. Tornerò sicuramente ed è da consigliare a tutti. Bravi bravi bravi!!"
"ui_bubble_rating bubble_50","Da mangiarsi pure i piatti","Sono venuto in questo locale per assaggiare una Fiorentina con la mia ragazza. Siamo stati perfettamente e gentilmente seguiti da Renato per la scelta del piatto, 75€ per una bisteccona di Fiorentina con verdure grigliate e patate e 1/2 di rosso. Per l attesa ci hanno gentilmente offerto dei loro prodotti locali(salame e pancetta dai gusti raffinati). Abbiamo terminato la cena con una ampia selezione di amari e liquori della zona. Beh che dire non poteva essere cena migliore, la carne era davvero buona posto perfetto per mangiare la tradizionale Fiorentina. Vogliamo ringraziare il personale, e in particolare Renato, per la competenza e la professionalità offerta. Il ristorante aderisce ad un iniziativa biologica del tutto lodevole: utilizza forchette bicchieri ad impatto zero e i piatti sono fatti di crusca."
"ui_bubble_rating bubble_50","Una conferma di stile e qualità","Per la seconda volta con moglie e figlio abbiamo cenato in questo locale. Ambiente caldo e informale. Poche ma accurate scelte. Buoni i taglieri di sottoli o formaggi serviti come antipasto e ottima la fiorentina, anche per noi fiorentini abituati a sceglierla. Niente male il vino rosso della casa. Sonia gestisce magnificamente il tutto, consigliando, spiegando e con gli occhi sempre pronti su tutti i tavoli. Buono il rapporto prezzo/qualità. Veramente da raccomandare."
"ui_bubble_rating bubble_50","Che bontà !!","Una splendida cena , personale veramente gentile e cordiale , abbiamo provato :Un tagliere sott olio molto buono , una Fiorentina eccellente ed un entrecotte altrettanto buona . Lo consiglio vivamente "
"ui_bubble_rating bubble_50","Speciale","Siamo stati con l'intenzione di mangiare la vera fiorentina e qui l'abbiamo trovata.Ottimo il servizio, camerieri gentili e disponibili. Perfetto il cibo compreso il piatto!Interessante anche il canto di Dante recitato durante la cena, ci torneremo sicuramente.Belle e piacevoli anche la location e l'atmosfera."
"ui_bubble_rating bubble_50","Un posto che mi rimarrà nel cuore.","Abbiamo soggiornato a Firenze sabato 14 e domenica 15 aprile. Avevo già letto molte recensioni del locale e avevo prenotato un tavolo con una settimana di anticipo. Lo staff gentilissimo ci ha accolti come fossimo di casa e ci ha fatti accomodare nella saletta antistante l’ingresso, vicino alla cucina, ma questo non ha rovinato la nostra serata, anzi, il gruppo di cuochi ha animato la nostra cena con battute in fiorentino. Abbiamo scelto il super menù Tuscani (80€ in due meritatissimi) composto da Fiorentina eccezionale (da sciogliersi in bocca) verdure miste e pane toscano tostato + mezzo litro di vino rosso della casa e acqua naturale. MERAVIGLIOSAMENTE PERFETTO!!! Come dessert abbiamo voluto assaggiare la selezione di cantucci con vin santo. STREPITOSI!Inoltre la serata è stata allietata anche da “Dante” che ci ha intrattenuto recitando un passo della divina commedia. Da restare a bocca aperta per la bravura di questo ragazzo. Consiglio a tutti di fare un salto al Tuscani4, posizione ottima per chi dopo vuole farsi una passeggiata romantica lungo l’Arno! Locale davvero carino, luce soffusa e musica italiana di sottofondo. UN POSTO CHE MI RIMARRÀ NEL CUORE!"
"ui_bubble_rating bubble_50","5 stelle sono poche!","Sono andato ieri (mio compleanno) con la mia ragazza. Locale rustico, da vera trattoria, con musica soft e luci soffuse. Apprezzato tantissimo anche l’occhio all’ambiente, dato che si usavano piatti e tovaglioli biodegradibili . Il simpaticissimo e cordialissimo cameriere ci ha servito come antipasto dei salumi e formaggi locali accompagnati da marmellata di cipolle veramente succulenti. La cosa più importante, la bistecca alla fiorentina, era sugosa e si scioglieva in bocca, ed era presentata con patate e verdure grigliate. Tutto molto buono (anche il dolce e il vinello della casa) e prezzi onesti. Andateci, non ve ne pentirete."
"ui_bubble_rating bubble_50","Bistecca a 5 stelle ","Io e le mie amiche abbiamo pranzato qui dove abbiamo ricevuto un’ottima accoglienza grazie al personale molto disponibile che ci ha aiuto nella scelta del menù. Avevamo una grande aspettativa sulla famosa bistecca fiorentina e qui non ci hanno deluso. Tutto squisito, ne vale la pensa. Pensiamo di ritornarci. Non ve ne pentirete!!"
"ui_bubble_rating bubble_50","Qualità assoluta","Avevamo prenotato al TUSCANI 3 ma un’ora prima ci richiedono gentilmente lo spostamento al 4. Per farsi “perdonare” ci offrono 2 bottiglie di vino (50€).Antipasto misto ottimo, tutto di prima qualità! Favolosa la variazione con tartufo...Ordiniamo fiorentine (molto buona) e l’hamburger! Quest’ultimo era favoloso... tenero, saporito e molto abbondante...Per finire ci offrono i cantucci con vin santo! Ma i cantucci sono artigianali e di cinque gusti diversi....In generale posto bello, personale cordiale e simpatico.... cibo ottimo! Il costo non è tra i più bassi ma proporzionato alla qualità.40€ a testa... Consigliato "
"ui_bubble_rating bubble_50","Filetto indimenticabile","Non avendo trovato posto a I Tuscani 2, ci hanno indirizzato a I Tuscani 4 e non siamo rimasti per niente delusi! Locale molto accogliente, lontano dalla calca di turisti stranieri degli altri locali e, allo stesso tempo, eticamente sostenibile perché rispettoso dell'ambiente. Sarebbe bello trovare più locali di questo tipo. A parte questo, non posso tralasciare la bontà dei taglieri di salumi e formaggi e del filetto, portato su un tagliere assieme a patate e verdure grigliate che difficilmente dimentichermo. Anche i dolci, in particolare i cantucci con il vinsanto erano buonissimi. Il servizio eccellente e buono il rapporto qualità prezzo. A Firenze scegliete un locale secondo la qualità che vi offre e non solo in base al nome. Non rimarrete mai delusi! "
"ui_bubble_rating bubble_50","Davvero eccezionale","Scoperto casualmente, il locale merita davvero sotto tutti i punti di vista. Si trova in pieno centro, a due passi da Ponte Vecchio e Piazza della Signoria.L'atmosfera è caratteristica, calda e accogliente, e il personale davvero gentile alla mano! Il menù offre una scelta discreta, per chi vuole mangiare carne questo posto non lo deluderà! Ho avuto la fortuna di gustare la Fiorentina, davvero spettacolare: cottura perfetta, sapore eccezionale, servito su un tagliere con verdure e patate di contorno! Leccornia pura! Molto interessante la scelta di usare alcune vettovaglie biologiche, mi è piaciuta molto l'idea e l'ho apprezzata! Un plauso alla ragazza che mi ha saputo consigliare bene su cosa prendere (compreso il vino rosso di accompagnamento). La prossima volta che tornerò a Firenze, ci riandrò di sicuro! Grazie!"
"ui_bubble_rating bubble_50","ECCEZIONALE!","Bhe che dire..di locali che vi offrono fiorentine ne trovate a decine a Firenze, ma questa vale sicuramente la pena provarla. Non solo tutto buonissimo ma il personale è eccezionale. Disponibilissimi ad accontentare qualsiasi richiesta ma sopratutto conoscono i prodotti che ti stanno offrendo. Descrivere il sapore della carne, tenerissima, sarebbe impossibile in questa poche righe. Provare per credere!Alla prossima ragazzi! "
"ui_bubble_rating bubble_50","Carne di qualità","Locale con un atmosfera particolare, ottimo cibo e Sara è estremamente alla mano e rende la serata molto piacevole e informale."
"ui_bubble_rating bubble_50","Fantastico... .si deve provare!","Ospitalità, cibo di ottima qualità, staff cordiale, divertente e competente, rapporto qualità prezzo giusto! Sicuramente torneremo! "
"ui_bubble_rating bubble_50","Fiorentina SUBLIME","Ottimo il personale, Ottimi i cuochi, ECCELLENTE A DIR POCO IL POSTO E SOPRATTUTTO LA FIORENTINA. Il posto era molto accogliente e intimo, adatto per una coppia che vuole avere una cena romantica. Vino artigianale ottimo."
