"Restaurant_Ratings","Restaurant_Quotes","Restaurant_Reviews"
"ui_bubble_rating bubble_50","Ciccia a volontà !!!","In vacanza a Firenze cercavamo un posticino dove mangiare qualcosa di tipico ...e abbiamo fatto centro . Il locale è un posticino delizioso composto da due sale ...lo staff è disponibile e cordiale ...si può scegliere tra vari menù ...tutti deliziosi...la carne è davvero buona e tenera ...le quantità sono molto abbondanti e i prezzi senz'altro adeguati!!! A fine cena ti viene servita una varietà di distillati fatti in casa tutti buonissimi ...insomma andateci e non ve ne pentirete!!!"
"ui_bubble_rating bubble_50","Che ciccia, ragazzi!","Dopo una lunga ricerca su TripAdvisor io e mia moglie ci siamo messi alla ricerca di questo localino non molto distante da Palazzo Strozzi e devo dire che abbiamo fatto benissimo!Carne eccezionale, verdure alla griglia molto buone (le patate su tutto), vino della casa molto azzeccato.Non abbiamo nessun appunto da fare, nè sulla location, piccolina, ma che ti avvolge facendoti sentire a casa, né sul mangiare, di cui ho già brevemente detto, né tantomeno sul personale, davvero gentilissimo, simpatico, disponibile e generoso.Cena composta da menù con filetto per due, verdure grigliate, acqua e vino rosso (nominalmente mezzo litro, in realtà molto di più) per una spesa complessiva di 70€ tondi tondi, senza contare che nell'attesa della carne (altra nota positiva: la cottura, esattamente come l'avevamo richiesta), il personale ci ha offerto prima dei maltagliati con sopra una specie di sughetto di ciccia (buonissimi) e poi della mortadella al tartufo (spaziale).Io e la mia signora abbiamo fatto l'ultimo brindisi della serata ripromettendoci di tornarci appena possibile e così faremo!"
"ui_bubble_rating bubble_50","Bontà che ti lascia senza parole","Perfetto in tutto, a partire dal locale che con i suoi muri a lavagna ti tiene occupato durante l'attesa (brevissima). Il personale è fantastico, mettono a proprio agio in maniera tale che a tratti pensavo di essere a casa mia. Il cibo è senza parole, mai mangiata una carne così buona e i contorni veramente gustosissimo pur essendo molto semplici. Non è un semplice ristorante, è un'esperienza che almeno una volta nella vita va fatta.Vino buonissimo. Ristoratori cosi genuini e cibo così genuino non si trovano facilmente."
"ui_bubble_rating bubble_50","Complimenti!","Cena toscana perfetta. Crostini ai fegatini profumati, lardo che si scioglieva sul pane, insaccati di ottima qualità., miele e formaggio. Poi la carne: un trionfo di sapore, divinamente accompagnata da patate arrostite e verdure saporitissime. 7 amari, grappe e liquori offerti dalla casa. Personale gentilissimo e simpaticissimo. Bravi tutti! W la Toscana, anzi, i Tuscani 2! ;)"
"ui_bubble_rating bubble_30","Buona la carne, ottima accoglienza ma tempi di attesa lunghi","Ottimo ristorante con personale molto molto cordiale e sempre disponibile a consigliare sulle scelte. Prezzo non economico ma comunque si esce fuori soddisfatti, soprattutto per la carne, e sazi. Purtroppo abbiamo riscontrato lunghi periodi di attesa (un'ora) per l'arrivo del cibo. Il locale era comunque abbastanza pieno. Verdure grigliate un po' crude."
"ui_bubble_rating bubble_40","Prezzi modici molto gentili","Localino carino, su due piani (uno interrato) molto intimo con pochi posti a sedere, consigliamo infatti la prenotazione. Unica pecca è il fatto che non sia un menú libero ma circa 5 menú predefiniti. NON è presente alcun tipo di PASTA e NON C'E' il caffè. Viene peró offerta un ampia scelta di Grappe e digestivi. (In foto)"
"ui_bubble_rating bubble_50","Strepitoso... e non soltanto la carne!","Sono stato qui a pranzo oggi, con la mia ragazza.Simpaticissimi e giovanili, oltre che giovani, i due gestori, appassionati (ed appassionanti) nella descrizione dei piatti e delle peculiarità di quel che offre il menu......limitato [ma fossero queste, le vere limitazioni] ad un ottimo assortimento di portate predefinite, ma coinvolgenti e convincenti già dalla lettura di esse......ed ancora più travolgenti e soddisfacenti quando ci si trova di fronte la MASSA di prodotti, di qualità, buoni, dal sapore pieno, che son previsti in questo locale.Abbiamo ordinato una grigliata mista di maiale, presentata assieme a verdure grigliate assortite (abbondantissime) e servita con mezzo litro di vino, ed acqua. Vino ottimo e corposissimo, carne cotta al punto giusto, saporita ed INsaporita...Un trionfo, un trionfo, un trionfo!"
"ui_bubble_rating bubble_50","Sempre una garanzia","Sono tornato in questo locale per la quarta volta e devo dire che non si sbaglia mai. Ottima qualità degli antipasti e ottima qualità della ciccia per non parlare delle patate! Camerieri veramente gentili e alla mano. Consiglio a tutti di farci una bella mangiata ne vale veramente la pena. "
"ui_bubble_rating bubble_40","Bravissimi","I 4 pallini anziché 5 solo perché il locale è' un po' troppo piccolino. Per il resto invece avrei dato 5. Ottimi gli assaggini portati prima della carne. La pasta con il ragù eccezionale. Piatto principale costituito ovviamente dalla Fiorentina buonissimo, ben cotta e tenera la carne. Ottimo il vino della casa. Gentilissimo il proprietario che alla fine ci ha mostrato e offerto una vastita impressionante di grappe, amari e digestivi. Assolutamente consigliato. "
"ui_bubble_rating bubble_40","Piacevole serata ","Guidato da TripAdvisor ho scoperto questo locale piccolo ma gestito con professionalità e passione da giovani, molta attenzione alle materie prime e al cliente, bravi continuate così "
"ui_bubble_rating bubble_50","Boicotta l'astemio","Grande,enorme dilemma: dove mangiare la fiorentina a Firenze....Che non sia costoso,turistico e scarso..sì perché noi italiani siamo pretenziosi,specie quando si parla di cibo..e magari vogliamo anche la simpatia/cordialità tipica dei toscani,come quella che vediamo nei film di Pieraccioni..ecco,questo posto soddisfa ogni opzione;in pieno centro,ci troviamo davanti a questo posticino che,attenzione,non ha solo la sala che si vede dall'esterno (ovviamente piena) ma anche un'altra al piano di sotto..il risultato:carne/ottima,servizio/ottimo,prezzo più che adeguato,camerieri simpatici e cordiali. Alla fine abbiamo anche conosciuto il maestro della cucina il sig. Enzo, siamo uscite brille grazie a Valentina con tanto di consigli sulla lettura del simpaticissimo Mario!!indimenticabili!!"
"ui_bubble_rating bubble_40","Bella mangiata","Posto bello e ospitale con buoni piatti di carne e un eccezionale vino della casa! Ci siamo trovati benissimo. Da provare"
"ui_bubble_rating bubble_50","Una recensione o due ???","La domanda non è retorica,due giorni di relax a Firenze io e mia moglie ,a pranzo troviamo questo locale ed entriamo. A pranzo abbiamo preso un antipasto di salumi e formaggi misti ,mia moglie un antipasto di formaggi.Grande qualità dei prodotti,mai scontati ne i salumi ne i formaggi .Insomma ci alziamo contentissimi ed alla sera decidiamo di replicare e prendere una bella fiorentina.Siamo tornati senza prenotare ,il locale strapieno ma la ragazza che ci ha accolti ha trovato un tavolo. Morale una bella bottiglia di Bolgheri,una grigliata mista per mia moglie e una mega fiorentina per me .Le verdure di accompagnamento sono uno spettacolo,soprattutto le patate. Il conto è equilibrato ed il linea con la città e la qualità del cibo,la simpatia e la professionalità sono stati il valore aggiunto.Alla prossima "
"ui_bubble_rating bubble_50","Fare l'amore con il sapore ","Fiorentina spettacolare Anticipata da un antipasto di pappa al pomodoro offerto dalla casa semplice ma di effetto Carne uno spettacolo..cotta giusta accompagnata da un olio extravergine di sangiminiano super aromatico perfetto per bistecca e verdure accompagnate Personale gentilissimo E dulcis in fundo omaggio di un pezzo di filetto grigliato di almeno due o tre etti Super consigliato Ne esco strasoddisfatta e contentaGrandi "
"ui_bubble_rating bubble_50","Tutto perfetto ","Fiorentina ottima sia per cottura che per la carne. Buono il vino, personale cordialissimo e veloce, tutto perfetto! Lo consigliamo!"
"ui_bubble_rating bubble_50","Carne buonissima!","Se vi capita di essere a Firenze e non sapete dove andare questo è un posto che consiglio vivamente.Carne deliziosa,io ho preso un filetto che era tenerissimo,ottimi gli antipasti e buono anche il vino.Rapporto qualità prezzo molto buono.Personale gentilissimo e simpaticissimo.Ci ritornrò sicuramente.Unica pecca non fanno il caffè"
"ui_bubble_rating bubble_50","Eccellente!","Scoperto per caso grazie a TripAdvisor si è rilevato un posto magico! Piccolo ma indimenticabile! Personale stupendo, rapporto qualità/prezzo ottimo, carne eccellente e dolci sublimi! "
"ui_bubble_rating bubble_50","Da non perdere!!","Se si capita a Firenze non si può non fare un salto da questi ragazzi! Oltre che disponibilissimi e gentilissimi, hanno creato un ambiente molto accogliente e ben curato. Ottima selezione di vini e ben consigliati. La carne era a dir poco sublime, mai mangiato un filetto cosi ! Tornerò sicuramente e lo consiglierò! I prezzi sono ben equilibrati in rapporto alla qualità e quantità. Bravi!!"
"ui_bubble_rating bubble_50","Ci piace!!","Siamo stati qui su consiglio di alcuni colleghi, location piccola ma molto carina, personale simpatico e alla mano, un ottimo e abbondante tagliere di salumi, bistecca patate e verdure, tutto ottimo! Non amo la bistecca..ma questa l'ho mangiata volentieri! Tornerò per provare il filetto!"
"ui_bubble_rating bubble_50","Buonissimo!","Grandi, abbiamo mangiato e bevuto benissimo! Filetto, verdure e patate, tutto eccezionale. I gestori molto gentili è simpatici.Un po nascosto ma ne vale la pena!Vale&Susi"
"ui_bubble_rating bubble_40","Buono","Abbiamo optato per il loro Burger, abbondante e ben condito.Una pecca sul vino della casa e la sala inferiore chiusa senza nemeno una finestra.Il servizio e' giovanile, quindi alcune pecche possono esserci ma nel conplesso buono.Merita la sosta per il rapporto prezzo/qualità elevatissimo"
"ui_bubble_rating bubble_40","Fiorentina cotta a puntino","Sono stato in questo piccolo locale caratteristico di Firenze per una cena, buoni i salumi tipici toscani e la Fiorentina cotta a puntino. Personale gentile e servizio veloce."
"ui_bubble_rating bubble_50","Ti senti a casa! ","Accoglienza,personale gentile e attento, pronti a dare qualunque suggerimento! Bistecca fiorentina, diversi contorni, bruschette, pappa al pomodoro (tutto per 3...MOLTO ABBONDANTE) ad un prezzo accessibile Bravi! "
"ui_bubble_rating bubble_50","Ottimo in tutto","Ottimo il cibo, personale cordiale e amichevole, prezzi nella media. Tra i migliori ristoranti di Firenze. Ci torneremo sicuramente."
"ui_bubble_rating bubble_50","La miglior bistecca di Firenze","Da fiorentino appassionato di bistecca pensavo di aver provato tutti i migliori ristoranti della città. Mi sono dovuto ricredere dopo aver mangiato da I'tuscani 2! La bistecca è favolosa: tenera, saporita e cotta alla perfezione. Posso sbilanciarmi dicendo che sia la migliore mai mangiata. Anche gli antipasti, a base di una ricca selezione di prodotti di nicchia, sono di alto livello. Il servizio è attendo e cordiale. Il conto è veramente onesto viste le porzioni molto abbondanti! Ritornerò sicuramente!"
"ui_bubble_rating bubble_50","Top","Pranzo spettacolare! Ho preso il menu con la grigliata mista... non ce la facevo più per quanto ero pieno! Tutto buono!!! Ci ritornerò sicuramente se passerò un'altra volta da Firenze!"
"ui_bubble_rating bubble_50","Spettacolare ! Tutto ai massimi livelli","Puoi aver provato tutti i ristoranti di Firenze, puoi credere di sapere tutto sulla bistecca e l'accoglienza dei fiorentini ... Ma se non sei mai stato in questo locale preparati a riscrivere tutto!Cibo ottimo! Superlativo la ciccia è divina e anche semplici patate diventano uno delizia indimenticabile. Provato anche l'hamburger fatto con carni pregiate ... Eccellente!Un pranzo con amici si è trasformato in una festa! Ci torneremo!"
"ui_bubble_rating bubble_50","Veramente ottimo!","Fidandomi delle eccellenti recensioni riguardo a questo locale abbiamo deciso di andarci.Si mangia a menù fisso, con un buon assortimento (6/7 menù diversi). I prezzi sono molto adeguati, non è un locale economico, ma il rapporto qualità-prezzo è correttissimo ed onesto.Il cibo è di alta qualità, la carne buona e cotta bene.(Sconsiglio per miei gusti la degustazione di formaggi).Il personale è cortese, educato e ti coccola a dovere.Molto gentili anche nell'offrirci a fine pasto dei cantucci e del vin santo.Consiglio sicuramente!"
"ui_bubble_rating bubble_50","ottimo!!","Io e mio marito siamo stati svariate volte a mangiarci, il personale è molto cordiale e qualificato.. la carne è davvero tenera, buono il vino del chianti, locale molto carino che consiglio a chiunque passi per la zona!!Un saluto"
"ui_bubble_rating bubble_30","Cena","Posto per turisti ma buono .ottimo servizio personale molto gentile buono il cibo buone le soluzioni proposte prezzo in linea con la citta"
"ui_bubble_rating bubble_50","Ottimo","Per la cena è stato necessario prenotare, ma ne è valsa la pena! Carne ottima, vino buono, camerieri gentili. Conto nella media per quello che si è mangiato. "
"ui_bubble_rating bubble_50","I N C R E D I B I L E","Siamo assolutamente ESTASIATI. Innanzitutto per il servizio impeccabile e di altissimo livello, poi senza dubbio per la qualità della carne e il modo in cui è preparata.Siamo piuttosto abituati a mangiare bene e non è facile trovare questo livello di cucina.Da provare assolutamente il filetto arrostito con sale al lardo di colonnato e il tiramisù alle fragole. Andate!"
"ui_bubble_rating bubble_50","Squisito il cibo, l'ambiente e l'attendimento","L'ambiente è molto romantico e bello. La carne era qualcosa di magnifico e indimenticabile. I camerieri sono simpaticissimi, e ti fanno sentire a casa. Cosa dire? Vorrei tornare li ogni sera! E dopo tutto questo servizio, il conto più onesto che abbia mai pagato! Di 1 a 10, gli darei 12 e lode."
"ui_bubble_rating bubble_40","tradizione moderna","interessante locale un po alternativo ma che offre piatti di carne veramente ottimi. personale cordiale e servizio all altezza , prezzi adeguati"
"ui_bubble_rating bubble_40","molto buono","É veramente un bel localino, arredato in maniera fantasiosa, gestito da bravi ragazzi , attenti a ogni richiesta, molto disponibili.La qualità delle portate é di buon livello e i piatti sono abbondanti, la carne tenerissima e molto buona,non hanno un menù molto ampio,e non é economico,ma ne vale la pena"
"ui_bubble_rating bubble_50","DAVVERO ECCELLENTE","Ospiti di questo locale in occasione del mio 40° compleanno; che dire: la fama è meritata.Il locale resta abbastanza nascosto, dato che è fuori dalle vie della passeggiata turistica, seppur in pieno centro, ed è necessario recarsi lì su lettura di Tripadvisor o suggerimento di qualche amico.Il locale è piccolo ma caratteristico disposto su due livelli, ben arredato in stile taverna toscana.Il personale, giovane e attento, è di quella simpatia toscana squisita, senza mai eccedere però nè nell'invadenza nè nella volgarità: un posto perciò dove passare una serata di coppia come con una comitiva di amici. Vi sembrerà di essere accolti come se foste clienti storici, anche alla prima visita.Ma quello che conta di più è il cibo: eccellente.Il menù completo costa 72 euro e comprende oltre ad acqua e vino sfuso, antipasto toscano (affettati anche di selvaggina, crostini al lardo di colonnata e fegatini - strepitoso - e piccolo assaggio di formaggio con composta) e a seguire fiorentina con contorni: la migliore! Dal costo è escluso il coperto (2 euro cad), il dolce e gli amari. Conto finale in due 94 euro, ma soldi ben spesi.Molto simpatico il giro di amari portati al tavolo (almeno 10 diversi distillati da assaggiare in abbondanza) ed i brindisi con il personale (attenzione sono in tre e vi faranno fare un brindisi a testa!).Da tornarci e ritornarci ogni serata a Firenze!"
"ui_bubble_rating bubble_50","Piccolo ma ....esplosivo !","Mi sono trovato in questo posto con un collega per pranzo , avevo voglia di carne e di un antipasto alla Toscana e voilà ! Abbiamo trovato tutto e ...anche di più ! Ottimo servizio con una ragazza troppo carina e simpatica nel servirci. Ci siamo sentiti coccolati e poi abbiamo mangiato divinamente . Bravi !"
"ui_bubble_rating bubble_40","Ottimo ","Sono stato mercoledì sera 24 con mia moglie, il personale altamente qualificato e gentilissimi, abbiamo mangiato carne a due pico eccezionale lo consiglio veramente "
"ui_bubble_rating bubble_50","Ambiente e cibo squisito!!","Una delle migliori bistecche mai mangiate, ottimi vini e servizio eccezionale, molto cordiale. Sono andato per pranzo insieme a miei amici e siamo rimasti molto soddisfatti in più ci siamo anche divertiti ! Consiglio questo ristorante a tutti, turisti e non, lo considero il miglior ristorante fiorentino. Ritornerò sicuramente!!"
"ui_bubble_rating bubble_50","Eccellente a dir poco!!!!","Sono stato a mangiare in questo splendido posto, oltre a un ottimo antipasto con prodotti Toscani ho mangiato la più buona bistecca di Firenze....e sono di Firenze. Un grazie particolare a tutti i ragazzi del ristorante.....veramente eccezionale... Grazie tornerò sicuramente "
"ui_bubble_rating bubble_50","Fantastico!!!","Sono stata lunedì sera con il mio ragazzo e che dire?? Abbiamo mangiato da dio!!! Fiorentina fantastica antipasto pure.. Ovvio che il prezzo non è bassissimo ma se si vuole la qualità bisogna pagarla.Personale molto disponibile e cortese. Spero di tornarci."
"ui_bubble_rating bubble_50","Bistecca ottima","La miglior bistecca che ho mai mangiato!!Davvero squisita, molto tenera, con ottimi vini del chianti, locale molto accogliente anche se piccolo, ma tutto ben diatribuitoVeloci nel servire e molto disponibile il personale "
"ui_bubble_rating bubble_50","Strepitoso","Accogliente, semplice ma dalla cucina impeccabile e personale super...Che dire, la cena è stata piacevolissima, sia per i sapori e la qualità che per l'atmosfera... Informale ma allo stesso tempo intima... Gli antipasti buonissimi, la carne cotta alla perfezione (noi ne abbiamo chiesta metà al sangue e metà ben cotta)... E gli ammazza caffè a fine cena... Super... Così come sono super le ragazze che si sono occupate di noi al tavolo!Ci tornerò di sicuro"
"ui_bubble_rating bubble_40","Molto bene!","Siamo stati un sabato sera a cena in questo ristorantino sito in una viuzza del centro storico. Abbiamo optato per il menù: bistecca + verdure grigliate per 2 persone.Una piacevole sorpresa è stata la pappa al pomodoro gentilmente offerta dalla casa come antipastino.La bistecca buona (fosse stata un pelo meno nervosa l'avrei giudicata ottima e vi avrei dato i 5 pallini!) e cotta veramente bene e così anche le patate!Il vino della casa l'ho trovato discreto.Abbiamo chiuso la cena con una porzione di dolce da mangiare in 2.Grappine finali offerte!Prezzo 75€ mi sembra adeguato, chi lo ritiene caro tenga presente che a 2 passi vi fanno pagare 8€ per 2 palline di gelato!Il personale è gentile e simpatico, brave continuate così!Vi consiglio di prenotare perchè era decisamente pieno!Sicuramente torneremo a farvi visita nella nostra prossima gita a Firenze."
"ui_bubble_rating bubble_50","Tutto fantastico","Siamo stati accolti con gentilezza e cortesia. Il locale è piccolo ma accogliente è informale. Abbiamo mangiato al piano inferiore, serviti da una ragazza giovane coi capelli corti davvero carina, gentile e disponibile. Complimenti a tutto il personale che proponevano spontaneamente sempre un invito a sorridere. I prezzi sono medio alti ma ne vale la pena! La bistecca fiorentina che ho assaggiato mi ha letteralmente distrutto, la mangerei ogni giorno. Vino della casa buono. Consigliatissimo "
"ui_bubble_rating bubble_50","UNA PIACEVOLE GRIGLIATA!!!","Per le vie di Firenze, ci siamo trovati in questo magnifico ristorante, in cui ci siamo sentiti a nostro agio, fin dal primo momento,grazie allo splendido personale che ci ha accolto calorosamente.Noi ragazzi della provincia di Novara, ci siamo gustati una splendida grigliata con ottimo contorno, un ottimo vino della casa , e un dolce delizioso.Ottimo rapporto qualità-prezzo,menù semplice ma gustoso. Ve lo consigliamo vivamente."
"ui_bubble_rating bubble_50","Che bistecca! Consigliato da un fiorentino","Incappare in una buona bistecca in centro a Firenze non è difficile, molti locali ne fanno. Ma da fiorentino posso assicurarvi che il gusto della bistecca e del filetto dei Tuscani2 saporito e succulento, crosticina bella abbrustolita fuori e interno tenero e succoso è veramente un equilibrio difficile da trovare. Quindi è ovviamente straconsigliato! Noi siamo stati per un addio al celibato e abbiamo scelto la formula del menù Grancrue, antipasto, una bistecca/filetto da 1kg circa e verdure grigliate (speciali le patate)+vino 72€ per 2 persone. Cameriere veramente alla mano, alla fine si sono fatte un giro con noi del grande assortimento di grappe. Tornerò."
"ui_bubble_rating bubble_50","Una tappa fissa!","DA PROVARE!!!Vado spesso in questa bisteccheria..quando devo portare parenti e amici forestieri a mangiare la ciccia li porto sempre qui!Posto accogliente e spiritoso, rapporto qualità prezzo ottimo. Carne di qualità, servita al tavolo con verdure di stagione alla griglia..buonissima. Vino della casa buono. Personale favoloso.. simpatici, piena disponibilità, pronti alla chiacchiera e se capita di rimanere al tavolo fino quasi a chiusura si bevono con te un bicchierino di amaro.Grazie i'Tuscani!"
"ui_bubble_rating bubble_40","Fiorentina Toscana doc","Ambiente piccolo e soffuso, gestito totalmente da toscani.Prezzi appetibili e menù dove la ciccia prevale su tutto.Abbiamo preso la Fiorentina ed è stata ottima, contornata con patate e verdure grigliate.Come antipasto ci è stata portata la pappa al pomodoro (buonissima). Personale gentile e simpatico.Non servono il caffè ma non ho capito il motivo."
"ui_bubble_rating bubble_50","Grande ritorno ","Siamo tornati in questo splendido ristorante.. oramai non si può più fare a meno.Riconfermata la bistecca fantastica servizio impeccabile atmosfera unica..Grande Tuscani 2!!!Miglior ristorante di Firenze "
"ui_bubble_rating bubble_50","Ottima Bistecca Fiorentina","Consigliato da una ragazza che lavorava in un bar vicino, scopro per caso con la mia famiglia questo locale. Abbiamo mangiato molto bene la carne fiorentina (1,2 kg in 3) servita con verdure alla griglia e patate più i cantucci col vin santo. Alla fine ti portano anche una batteria di liquori tipici che vale la pena di assaggiare (paghi solo il primo giro!!!). Costo totale 85 euro....più che corretto !!! Una particolarità: NON FANNO IL CAFFE'....ma, credetemi, va bene lo stesso !!!"
"ui_bubble_rating bubble_50","Come a casa con gli amici! ","Numeri #1! Per la ciccia, le patate, per l'accoglienza i sorrisi e la gentilezza genuina di chi ama fare quel che fa. Andate a trovarli!!!"
"ui_bubble_rating bubble_40","filetto eccellente","Una trattoria caratteristica a due passi dalla splendida piazza di Santa Maria Novella. Abbiamo mangiato un filetto da 10 e lode con contorno di patate e verdure grigliate molto buone. Non abbiamo assaggiato il dolce( dall'aspetto molto invitante) perché non avevamo più posto nello stomaco!!.Da non sottovalutare le sei grappe artigianali che le simpaticissime ragazze ti mettono sul tavolo per assaggiare. Nel complesso molto molto buono...da consigliare sicuramente"
"ui_bubble_rating bubble_50","Eccccccezzionale!!!!!!! ","Che Firenze sarebbe senza la Fiorentina de I'Tuscani 2!!! Se un ci fossero li si dovrebbe 'nventare!!! Ospitalità da 110 e lode, qualità del cibo non da meno: fiorentina FAVOLOSA sotto ogni punto di vista, contorni perfetti, cantucci genuini, vino, vin santo, olio e altri condimenti assolutamente sublimi (e locali), grappe di fine pasto ottime (e un friulano se ne intende!). Che altro c'è da dire... Il locale è magnifico, il personale è fantastico e il conto conveniente! L'unica pecca è abitarci a 400km di distanza XD! Se potessi me li metterei tutti in valigia!!!!P.S.: do cinque stelle solo perché non posso dare di più! Firmato: quello dei due ossi :-P"
"ui_bubble_rating bubble_30","non troppo soddisfatto","Il locale mi è stato consigliato da amici, ed specializzato nella bistecca fiorentina. E' un locale piccolo e carino in pieno centro. Abbiamo preso un antipasto ed una fiorentina (ovviamente per 2 persone). L'antipasto era buonissimo, con affettati e formaggi di qualità. la bistecca invece non ha soddisfatto appieno le attese. Era bella e abbondante, ma il sapore non era ottimo. forse siamo stati sfortunati. Buone comunque le patate di contorno. Ottima anche la scelta di grappe e amari."
"ui_bubble_rating bubble_50","Top","I ragazzi sono gentilissimi e simpaticissimi, cucina !!! Posto fisso dove venire a mangiare quando ritorneremo a Firenze. "
"ui_bubble_rating bubble_50","Cena ottima, personale fantastico","Un locale in pieno centro a Firenze con assoluta assenza di fregature. Il personale è stato servizievole, gentile, e divertente. Ci siamo trovati benissimo e la Fiorentina è ottima. Rapporto qualità prezzo eccellente. Consiglio in generale: FIDATEVI DI LORO! Non chiedete cotture diverse da qualsiasi cosa vi propongano: sanno quello che fanno! "
