"Restaurant_Ratings","Restaurant_Quotes","Restaurant_Reviews"
"ui_bubble_rating bubble_40","Sentirsi a casa","Da tripadvisor abbiamo deciso di provare questo ristorante per la nostra ennesima visita a Firenze. Il titolo dice molto, Ci siamo trovati subito molto a nostro agio, il locale non è grandissimo ma poco conta quando ti ritrovi personale molto gradevole. Ragazzi simpaticissimi e sempre sorridenti. Se poi vai in un ristorante in una città d'arte come Firenze e trovi a mangiare persone del luogo dal mio punto di vista è una buona cosa. Rapporto qualità prezzo decisamente ottimo. Piacevole l'arredamento a mio modesto parere e non ci vedo niente di male nel far scrivere frasi o nomi sui muri. Non per questo da etichettare come troppo turistico (anche se non ho mai capito il senso di questo aggettivo...siamo in una delle città più belle del mondo...se non ci sono tutisti qui...) ma a parte questo tutisti o no... lo consigliamo . Unica pecca??? ci siamo alzati completamente ubriachi a causa degli ammazzacaffè ...è stata vermante dura arrivare a sera ;-) Continuate così ragazzi."
"ui_bubble_rating bubble_50","Mamma mia che mangiata","Posto carinissimo ovviamente ci sono solo due varianti di menù una girata oppure la fiorentina ( che vi consiglio) i prezzi sono in linea con la città è la qualità ottima"
"ui_bubble_rating bubble_50","Cucina tipica","Local piccolo e caratteristico, personale accogliente.Quando arrivi sono disponibili diversi menù da poter scegliere ( se volete si trovano anche sulla pagina web). Noi abbiamo provato quello completo di tutto per sentire la cucina. Tutta roba ottima. Carne veramente molto buona e antipasti molto saporiti Le porzioni sono abbondanti, di sicuro non andate via con la fame.Il prezzo che si paga è coerente con la qualità e la quantità del cibo che si mangia.Nota particolare, i piatti e bicchieri sono fatti con gli scarti che i clienti producono durante il pranzo!"
"ui_bubble_rating bubble_50","Che fiorentina","Sono un amante della fiorentina, ed ogni volta che capito a Firenze (anche se capito praticamente tutte le settimane, o quasi), pretendo di andare a mangiare una fiorentina come si deve! Ma volevo cambiare posto, quindi mi sono affidato a TripAdvisor per cercare un posto nuovo in cui poter mangiare. Beh.. che dire. Fiorentina ottima, posto accogliente quasi da sembrare di mangiare a casa propria e personale cordialissimo. Non c'è molto da dire quando trovi posticini del genere. L'unica cosa da poter fare.. è consigliarlo!"
"ui_bubble_rating bubble_50","Consigliatissimo","Ristorante piccolo ed eccezionale. Meglio prenotare. Si trova nelle vicinanze di piazza Santa M. Novella. Lo gestiscono dei ragazzi simpatici che sanno fare bene il loro lavoro anche se giovanissimi. La qualità del cibo è ottima e anche il prezzo. Hanno anche dato particolare attenzione all'ecosostenibilità delle stoviglie. Ci torneremo sicuramente."
"ui_bubble_rating bubble_50","A Firenze il Top","Cinque stelle plus! Il miglior locale di Firenze per assaporare la tradizione, tagliere spettacolare il migliore di Firenze tutto fresco e di loro produzione, la carne è buonissima come le verdure, eccezionale!! Prezzo giusto, Andateci assolutamente non ve ne pentirete "
"ui_bubble_rating bubble_50","Eccellenza ","Affidatevi alla professionalità e all'ospitalità di Matteo e Samuele, ottimi i prodotti selezionati nelle fattorie toscane, carne e salumi eccellenti. Quando territorialità e competenza di fondono per deliziare il palato.Tornerò qui tutte le volte che metterò piede a Firenze. "
"ui_bubble_rating bubble_50","Eccellente","Ottima la fiorentina cin contorno di patate e verdure (zucchine e peperoni). Buono il vino della casa. Cortese ed efficiente il servizio. Potendo sceglierei una qualità di pane meno sciapo. Prezzo ottimo."
"ui_bubble_rating bubble_40","Ottimo Ristorante","Un ottimo ristorante , ma non vi aspettate il solito ristorante , titolari attenti all'ambiente e alla qualità oltre che al rispetto per le tipicità culinarie . Non ho molto da dire mi son trovato davvero bene ho gustato un ottima fiorentina non la migliore ma molto buona . Per me è OK e sono stati anche onesti con il conto . Complimenti ."
"ui_bubble_rating bubble_50","Esci con il sorriso","Essendo in vacanza a Firenze, abbiamo cercato un buon posto da mangiare e ci siamo imbattuti in I'Tuscani 2. Siamo stati accolti in maniera impeccabile, ci siamo sentiti a nostro agio e a casa. Personale professionale, caloroso e molto preparato. La qualità della carne è indiscutibile, si scioglie in bocca. Alla fine della cena abbiamo assaggiato anche i liquori, fatti da un signore appositamente per il ristorante. Molto buoni. In poche parole, DA PROVARE ASSOLUTAMEMTE! "
"ui_bubble_rating bubble_50","Indimenticabile ","Nonostante non avessimo prenotato siamo stati accolti con estrema gentilezza e simpatia (cosa non scontata), mentre aspettavamo che si liberassero due posti ci è stato offerto un ottimo vino rosso della casa.Una volta seduti, abbiamo optato per il menù con la classica fiorentina, anche se avrei provato tutte le proposte.Per tutta la cena mi è sembrato di stare a casa con amici grazie all'atmosfera e ai due fantastici componenti dello staff.Ma la cosa migliore ed indimenticabile é stata la qualità della carne e delle verdure.. forse forse meglio del giardino dei Boboli! Prezzo perfetto per la ottima qualità, amari offerti dalla casa.Ci tornerò sicuramente, spero presto!"
"ui_bubble_rating bubble_50","Fantastico","Seguendo Trip Advisor siamo arrivati in questo piccolo ristorante: simpatia e cordialità al primo posto. Antipasto misto notevole, grigliata meravigliosa, abbiamo preso il menu completo e bevuto vino rosso: è un piacevole diversivo considerato che Firenze, come tutte le città d'arte italiane, è piena di trappole per turisti. Qui non verrete delusi!"
"ui_bubble_rating bubble_50","Un posto meraviglioso","Prenotato per sabato sera due adulti e due bambini, accoglienza calorosa e simpatica, gentilezza squisita così come gli antipasti e la carne...divina...divina come l ' intrattenimento di un Dante che durante la cena ha allietato la sala recitando a memoria un canto della Divina Commedia.Sia per il cibo ottimo che per l'atmosfera cordiale è un posto dove bisogna andare ! "
"ui_bubble_rating bubble_50","FANTASTICO!","Trovato su TripAdvisor abbiamo prenotato e siamo usciti dopo due ore dopo avere mangiato un ottima Fiorentina, ottimi antipasti e buon vino. Tanti complimenti ai ragazzi che lo gestiscono soprattutto a Samuele per la simpatia e la disponibilità. Ci torneremo!"
"ui_bubble_rating bubble_50","Stupendi","Ragazzi semplici e molto simpatici...che dire...per prima cosa molto molto attenti all'ambiente...utilizzano piatti riciclati con gli scarti prodotti da loro ..seconda cosa hanno i menù già stabiliti così non ti ritrovi sorprese quando devi pagare...la carne semplicemente stupenda cotta in modo impeccabile...gli antipasti particolari e cambiano con il cambiare dei fornitori (perchè sono ragazzi che si riforniscono da piccoli agricoltori o piccole aziende)...difficile che dia 5 punti quindi vuol dire che sono stati proprio bravi...in ultimo dolce torta di mele spettacolare (e non amo i dolci) bicchierino di vin santo offerto e poi musica di sottofondo spettacolare...Ps:è un posto diverso dai soliti ristoranti...più grezzo ma più VERO....GRAZIE RAGAZZI continuate cosi...."
"ui_bubble_rating bubble_40","Rimandati","Il posto è molto gradevole e la carne molto buona. Personalmente ho molto apprezzato anche la filosofia green del locale. Giudizio rimandato in quanto nonostante avessimo prenotato con largo anticipo, circa 2 settimane, ci hanno fatto accomodare al tavolo 40 minuti in ritardo, dopo averci ripetuto più volte che l'attesa sarebbe durata solo 5 minuti. Siamo viaggiatori molto accomodanti, ma avendo con noi un bambino ed una persona anziana, avremmo preferito ci fosse comunicato dal principio, così avremmo evitato di attendere in piedi sulla porta del locale, avremmo piuttosto approfittato per fare una passeggiata o qualunque cosa pur di non attendere intralciando il lavoro del personale e l'ingresso dei clienti. Una volta accomodati il tavolo non era stato pulito, per cui abbiamo dovuto richiamare il cameriere perché venisse fatto. Come già detto è stata una piacevole cena, rallegrata anche da una lettura di un canto dantesco. Nonostante tutto sia iniziato con il piede sbagliato, abbiamo deciso di dare una buona valutazione a questo locale per la gentilezza del personale, che accortosi del disagio procurato, ha fatto davvero di tutto per rimediare. Ci è stato offerto un piccolo aperitivo nell'attesa, un antipasto una volta accomodati, dei cantucci e un notevole sconto sul conto finale. In fondo capita a tutti di fare uno scivolone, ci auguriamo di ripassare presto da Firenze per poter trascorrere una piacevole serata in questo grazioso ristorante. A presto."
"ui_bubble_rating bubble_50","La patria della ciccia fiorentina! Consigliatissimo","Si mangia bene, si spende il giusto, e ti rubano sempre un sorriso! Ambiente accogliente, cibo ottimo. Entrando in questo posto ho abbandonato l'idea di diventar vegana. Consigliatissimo!"
"ui_bubble_rating bubble_40","BUONA BRACERIA NEL CENTRO DI FIRENZE","Gestito da ragazzi che si danno da fare, questo locale, un po difficile da individuare, a dire il vero,e un po angusto, offre ,in compenso della carne alla brace di ottima qualità accompagnata da patate e verdure ,anch'esse ottimamente grigliate, ad un prezzo non esagerato,visto che ci troviamo alcentro della città. Menù scarso, oserei dire che si limita,quasi alla carne alla brace,vino sfuso di buona qualità,cortesia dei gestori offerta in dosi abbondanti"
"ui_bubble_rating bubble_40","Aspettative rispettate","Gestito da ragazzi simpatici, specialità carne di ottima qualità. Prezzo giusto per la qualità e quantità."
"ui_bubble_rating bubble_50","Ohhhhh fiorentinaaaaa....","Abbiamo preso il menu da 70 euro (x2persone) con fiorentina da circa 1kg, patate arrosto, verdure grigliate (melanzane, peperoni e zucchine), insalata, bruschette di pane toscano, 1/2 lt di vino e acqua...tutto molto buono e personale super accogliente!!! Ci hanno offerto prosecco, antipasto di salumi e digestivi...bella la location con ottima musica italiana! Complimenti ai gestori!!! se torniamo a firenze, una sosta qui è d'obbligo! Grazie della bellissima serata!!!! "
"ui_bubble_rating bubble_50","Simpatia, cortesia...ecologia, che si può chiedere di più?","Simpatia, cortesia...ecologia, che si può chiedere di più?Aaasssi, i buoni piatti? c'erano!!!Taglieri di affettati, formaggi locali e carpaccio di carni diverse, tutti ottimi. Un filetto che si scioglieva in bocca cotto al punto giusto e gustoso.Accompagnato da saporite verdure grigliate ed un buon vino in caraffa. Locale simpatico, al limite dell'alternativo. Le due giovani ostesse (si può dire?) con simpatia e cortesia, ci hanno spiegato la filosofia del locale: uso di piatti biodegradabili, che magari fa storcere il naso ai puristi, ma che trovo intelligente, uso di carni e formaggi, di produzione locale, addirittura riutilizzo del sale usato per trattare il rigatino, espediente che arricchisce di sapidità le pietanze. Sorpresa finale, non so se occasionale, un giovane attore che recitava versi della Divina Commedia.Rapporto qualità/prezzo: ottimo. Non turistico.Ovviamente scelto con TripAdvisor!"
"ui_bubble_rating bubble_40","Altra bella realtà a Firenze","Ristorante prenotato da un collega Americano. Ci ha stupito e sorpreso positivamente<U+200B>. Locale divertente, sano , le ragazze del personale gentili e preparate cibo semplice ma ottimo e prezzo ragionevole. Da non trascurare l'impronta eco sostenibile del ristorante.Bravi continuate cosi"
"ui_bubble_rating bubble_50","Cenetta speciale","Locale molto carino, vicinissimo al centro! Il personale è stato gentile e premuroso per tutta la cena! Abbiamo mangiato un filetto tenerissimo e cotto alla perfezione..mai mangiata una carne così! Ristorante super consigliato! Qualità prezzo ottima!Ottimo anche il progetto per il coperto riciclabile! Bravi ragazzi continuate così!"
"ui_bubble_rating bubble_50","Perfetto ","Locale molto accogliente, i camerieri sempre gentili e disponibili. Menù di carne ad ottimi livelli. Ci tornerò sicuramente "
"ui_bubble_rating bubble_50","Super","Sono stato in questo ristorante e ho mangiato molto bene la carne e sublime cotta al punto giusto si scioglie in bocca ottimo il vino prezzo giusto"
"ui_bubble_rating bubble_50","Poesia","Ristorante stupendo con personale più che disponibile e abile ad intrattenere. Simpatia e cortesia prima di tutto, inoltre un grandissimo rispetto per l'ambiente e i piccoli produttori. Una volta arrivati al the wall uscirete vedendo quadruplo "
"ui_bubble_rating bubble_40","La ciccia bona!","Siamo stati a cena ai Tuscani2 in occasione di una due giorni a Firenze.Lo abbiamo scelto per le recensioni ottime e non ci ha deluso! Piccolino ma accogliente, le ragazze sono semplicemente fantastiche e ti coccolano per tutta la cena. Il menù prevede solo piatti di carne (filetto, Fiorentina e grigliata)con relativo contorno,a menù per 2. Quindi consiglio di andare solo se si ha voglia di mangiare la ciccia...che è davvero spettacolare .Servono il tutto in piatti e tovagliato green, compostabile e ti offrono l' antipasto in un piatto commestibile!Il prezzo è giusto, vista la qualità della carne, e comprende tutto, anche il bere (a noi hanno offerto anche i cantucci e liquorino). E considerando la cortesia con cui ti servono è più che meritato."
"ui_bubble_rating bubble_50","Cena fantastica","Nonostante avessi prenotato per il giorno sbagliato e il locale in quell'istante fosse abbastanza pieno siamo stati accolti con cordialità e simpatia. Grazie a questa ospitalità per nulla scontata abbiamo quindi avuto la fortuna e il piacere di cenare in questo locale. Abbiamo orbinato il menu tuscani per due con bistecca e contorno. Direi che come qualità del cibo è superiore a altri posti in centro. Ottimi anche gli antipasti, il vino della casa, il servizio e piacevole anche l'ambiente!! Ci torneremo sicuramente!"
"ui_bubble_rating bubble_50","Super, ultra, iper consigliato!","Abbiamo scelto questo locale per una cena di addio al nubilato; in questo locale abbiamo trovato non soltanto ottimo cibo ( i menù sono tutti a base di carne, le quantità abbondantissime e la qualità eccellente) ma anche un personale giovane, disponibile e più che cordiale! Insomma, tutto quel che si cerca da un ristorante toscano doc lo si può trovare qui!Inoltre, prima della cena, abbiamo potuto assistere alla rappresentazione di un canto del purgatorio interpretato da un attore davvero coinvolgente e preparato!Un successo, insomma!Consigliato a chi è alla ricerca della buona carne fiorentina e della tipica accoglienza toscana! "
"ui_bubble_rating bubble_50","La vera fiorentina ","Locale in ottima posizione, tra santa Maria Novella e piazza della signoria, abbiamo prenotato con una settimana di anticipo ma ne è valsa decisamente la pena. Il menù è composto da carne, filetto, hamburger o bistecca, ossia fiorentina. Abbiamo iniziato con un antipasto misto con salumi tipici e formaggi accompagnati da uno squisito miele alla pesca, olio toscano, bruschette con fegatini, e lardo che si scioglieva in bocca. Poi l'apoteosi: filetto e fiorentina (cottura perfetta direi) accompagnati da patate, insalata e verdure grigliate. Il tutto accompagnato da un ottimo vino rosso. Strapieni, non potevamo andarcene senza gustare dei buonissimi cantucci con vin santo. Il miglior pasto fiorentino. Prezzo leggermente sopra la media. Ottima qualità ma non regalata. "
"ui_bubble_rating bubble_50","Finalmente un locale con le palle","Finalmente uno di quei locali che non si abbassa a compromessi per accontentare tutti, insomma se ti piace cosa ti fanno mangiare bene, altrimenti Arrivederci.Nel locale infatti vigono delle regole da rispettare, una della quali per esempio riguarda l assenza del caffè non considerato tipico toscano.Non prendetelo come un atteggiamento arrogante ma piuttosto come un punto a favore della tradizione e della qualità. Hanno a disposizione 4-5 menu con vari prezzi pensati x le coppie...quello con antipasto, fiorentina o filetto, contorni di verdura grigliati vino e acqua fa 78 €( circa 35 a testa). Poi ci sono menu più economici con meno portate.Il locale è splendido, pareti ove è possibile disegnare con gessetti, atmosfera rilassante e resa allegra dall ottimo servizio delle ragazze all interno.L attesa è poca ma è QUASI OBBLIGATORIO prenotare Xchè altrimenti nn si trova posto.La qualità del cibo è eccellente."
"ui_bubble_rating bubble_50","Bellissima esperienza!!!","Ristorante carino,personale gentilissimo e attento ai dettagli. Fiorentina con contorni a dir poco da urlo, e ottimi i cantucci!!! Assolutamente consigliato se volete mangiare dell'ottima carne!!!"
"ui_bubble_rating bubble_40","Bistecca e cortesia","Personale molto giovane e cortese. La fiorentina era ottima ed accompagnata con un mix eccellente di verdure; anche gli amari offerti erano ottimi."
"ui_bubble_rating bubble_50","Vegetariano stammi lontano!","Sono stato in questo ristorante della bella Firenze in dolce compagnia. Decidemmo di andarci grazie alle buone valutazioni di Tripadvisor, e quindi ora eccomi ad aumentarne le stelle! Siamo stati da Dio, punto. Il locale è piccolino e tranquillo, ma sempre pieno di gente, ed essendo noi arrivati un poco in anticipo rispetto all'orario di prenotazione, abbiamo dovuto aspettare una decina di minuti per accomodarci. Nel mentre, ci è stato subito offerto un bicchiere di vino rosso della casa, sceso senza la benché minima storia. Il menù prevedeva una serie di piatti degustazione, dai prezzi variabili, tutti però offerenti grosse fette di carne Chianina. Spettacolare a dir poco. Ho mangiato sempre bene a Firenze, ma forse questo è il posto nel quale mi sono trovato meglio fra tutti. Camerieri giovani e simpatici ci hanno offerto un servizio impeccabile, e la cena è terminata con un liquore offerto dalla casa. Prezzi più che giusti per l'offerta data."
"ui_bubble_rating bubble_50","Promosso!","Lo abbiamo individuato tramite Tripadvisor, e una volta visto ci è piaciuto per la Sua posizione defilata e per l'ambiente piccolo e intimo; abbiamo quindi prenotato (in gioni festivi e orari di punta conviene assolutamente prenotare perché i posti non sono tantissimi) e una volta seduti ci ha colpito la particolarità simpatica delle scritte sui muri lasciate dai clienti col gessetto come segno di una cena/pranzo passati bene.Io e mia moglie lo abbiamo scelto come locale dove provare la Fiorentina per il Nostro soggiorno del 25Aprile; nonostante io non sia un grande cultore di questa tipo di Bistecca, direi che mi è piaciuta tantissimo...porzione buona anche perché preceduta dall'antipasto con tagliere di salumi molto buono! Staff cordiale ed attento, mentre parlando di prezzi sinceramente mi è sembrato in linea con tutti gli altri locali del centro di Firenze...Consigliato."
"ui_bubble_rating bubble_40","Locale unico!!!!","Siamo stati a pranzo e abbiamo scelto un menù per due persone da 75 euro che comprendeva un piccolo tagliere di salumi, una bistecca alla fiorentina , filetto di manzo, verdure grigliate vino ,acqua ed amaro.....Tutto BUONISSIMO. Complimenti al personale il quale è molto cordiale,veloce e attento ai clienti , sempre pronti ad accogliere ogni richiesta. Il locale,davvero carino è in veste Green (prodotti monouso riciclabili dove c'è tutto un progetto dietro), buona cosa anche questa. Solamente che dall'esterno è un pochino difficile identificare l'ubicazione. Un consiglio: occorrono delle insegne direzionali più efficaci altrimenti da fuori sembra che offrite solo street food. Ad Maiora."
"ui_bubble_rating bubble_50"," Favoloso","Seguendo le indicazioni di TripAdvisor ci siamo recati in questo ristorante. L'eccellente qualità dei prodotti e la cordialità e simpatia del personale, ci hanno indotti a prenotare anche per il giorno successivo. Consigliatissimo"
"ui_bubble_rating bubble_40","Consigliato ma..","Abbiamo pranzato in questo grazioso ristorante il 25 aprile. Atmosfera piacevole, locale accogliente, scelta green notevole, prezzi medio alti, personale troppo cerimonioso a tratti ansioso nel prendersi cura del cliente (ci hanno chiedete se andasse tutto bene per 5/6 volte in un' ora) . Abbiamo mangiato un menù con bistecca da 600 gr e un antipasto di salumi e formaggi ( super super consigliatooo) con un vino della casa e un tiramisù abbiamo speso 70€. Una pecca, scarsa scelta tra i menù e i dolci. Ci ritorneremo! "
"ui_bubble_rating bubble_50","Soddisfattissimi!","Il locale, nonostante sia piccino, é accogliente e l'atmosfera all'interno é intima e particolare, per tutte le scritte lasciate da turisti da tutto il mondo che riempiono le pareti. Personale molto attento al cliente durante tutta la cena, disponibile e cortese. Ci é stato offerto l'aperitivo (salumi misti e bicchiere di vino) e per cena abbiamo preso la classica fiorentina per due, servitaci con contorno di patate e verdure. La qualità del cibo era ottima, e le porzioni abbondanti! Una delle migliori bistecche mai mangiate in assoluto! Da bere un litro di rosso della casa e un dolce da dividere in due. E per concludere, prima di andare via la proprietaria ci ha regalato un sacchetto di cantuccini! 80 euro in due, e per il servizio, la cortesia, la qualità e la quantità del cibo li rispenderemmo ancora. Si esce sazi e soddisfatti. Consigliatissimo!"
"ui_bubble_rating bubble_30","a conti fatti è carissimo","Sull'onda dei commenti favorevoli siamo andati a cena io e mia moglie. Senza troppo valutare i menu, scegliamo il Tuscani x2 che consiste, ci spiegano, in un filetto e mezza fiorentina con contorno, acqua e mezzo litro di rosso della casa il tutto per 70 euro. Chiediamo di rinunciare al filetto per avere invece una fiorentina intera, che dividiamo in 2. Assaggiamo il vino della casa che non ci piace per cui chiediamo una bottiglia di un buon vino toscano consigliatoci. Risultato: paghiamo un conto di 104 euro per una buona fiorentina di un kilo con contorno (70 euro) e una bottiglia di vino (30 euro). Non ci viene neppure stornato il costo del il vino sfuso che non abbiamo bevuto. Il giorno dopo a pranzo in un bel ristorante zona Signoria, all'aperto, prendiamo una fiorentina da un kilo altrettanto buona (40 euro) e una bottiglia di buon vino toscano (20 euro), totale 60 euro. Le stesse identiche cose per 44 euro in meno."
"ui_bubble_rating bubble_40","Fiorentina ","Il posto è molto carino e particolare.. io e il mio moroso abbiamo passato Buona parte del tempo a leggere le varie targhette appese e a farci due risate!! Molto molto divertente!! Non ci sono molti menù, noi abbiamo preso la grigliata con fiorentina ed era buonissima!! Personale molto gentile e simpatico!! Ottimo posto"
"ui_bubble_rating bubble_50","bravi","Il ristorante che è gestito con passione e competenza da uno staff giovane e simpatico offre un cibo delizioso in un ambiente molto divertente. Qui si mangia carne, un'ottima carne! In due abbiamo preso un antipasto misto (formaggi, salumi e crostini toscani), un' abbondante fiorentina e un tiramisù; il tutto accompagnato con un discreto vino della casa. Conto sui 90 euro. Molto apprezzata la scelta Green per le posate e piatti e l'intrattenimento offerto da un novello Dante che ha recitato un canto della Divina commedia. Consigliatissimo."
"ui_bubble_rating bubble_50","E CHI LO AVREBBE DETTO!!","Non ho parole...un posto nel cuore della mia città straordinario piccino accogliente vissuto si respira un'aria serena e gaia il personale da 10 cibi e vini poi non ne parliamo (esorbitanti!!) insomma tappa obbligata per tutti fiorentini o no complimenti avanti così "
"ui_bubble_rating bubble_50","Cena top","Eccezionale la serata passata in questo posticino nel centro di Firenze. Antipasto e bistecca veramente buoni con la carne che si scioglieva in bocca e affettati ricercati. Nota positiva anche la gentilezza e simpatia dei camerieri"
"ui_bubble_rating bubble_40","Cena con poesia","Localino piccolo e accogliente con personale mooolto simpatico e fuori dal comune (soprattutto Matteo, Vittorio e Aurora). Menù ottimo, ma poco vario. Prezzi ridottissimi per la qualità. Antipasto a base di poesia, con un attore che recitava il 30esimo canto del purgatorio. "
"ui_bubble_rating bubble_50","Buona la ciccia","Consigliato da TripAdvisor piatti tipici buonissimi menu nn ampio ma come si dice poco ma fatto bene....ordinato menu con antipasto per 2...filetto e bistecca (fiorentina) la carne era pazzamente buona rossa e morbida una cosa favolosa...per non parlare del cameriere il top...consiglio vivamente e....buona la ciccia "
"ui_bubble_rating bubble_50","Straordinaria scoperta!","Fidandoci delle recensioni di TripAdvisor, abbiamo scelto di cenare in questo locale. Non penso ci sia da aggiungere tanto altro: carne meravigliosa, buonissima ed altrettanto tenera, accompagnata da patate e verdure grigliate. Prezzo assolutamente proporzionale all'estrema bontà. Personale simpatico ed accogliente. Lo consiglio. Torneremo sicuramente."
"ui_bubble_rating bubble_50","Simpatia ed ottimo cibo!","Possibilità di scegliere dei menù con carni tipiche del posto; utilizzano prodotti di qualità acquistati da aziende agricole locali. Sicuramente consigliato a tutti, soprattutto per una cena di coppia!"
"ui_bubble_rating bubble_50","Molto buono","Siamo stati in questo localle molto pulito e curato..lo staff gentile e professionale la carne ottima dirrei prezzo più che giusto tornerò "
