"Restaurant_Ratings","Restaurant_Quotes","Restaurant_Reviews"
"ui_bubble_rating bubble_50","Una scelta azzeccata","Non capita spesso di trovarsi nel posto dove hai sperato di trovarti. Mi immaginavo una serata in un posto che non fosse formale come un ristorante ma nemmeno la solita trattoria, ed eccomi accontentato. Caldo, accogliente, come colui il quale ci ha accolto. Poche pietanze per cui non perdi tempo a leggere, carne molto buona ed hamburger altrettanto saporito. Forse qualche cosina in più sul menu non guasterebbe così come una cantina un po' più ricca. Il tutto compensato dalla qualità di ciò che abbiamo mangiato e dalla cortesia di chi ci ha servito. Gentilezza e grappe, oltre ai cantucci, finché ne vuoi. Prezzo giusto. Mi è piaciuto proprio."
"ui_bubble_rating bubble_50","Carne ottima a Firenze ","Premetto che sono una persona difficile per la carne e difficilmente rimango soddisfatto. Da I'Tuscani la carne è fantastica, incredibilmente buona, saporita, cotta alla perfezione. Una vera sorpresa. Specialmente nella giungla di Firenze dove la trappola del ristorante turistico è sempre dietro l'angolo.A questo aggiungo un altro elemento importante quando si cena fuori: una piacevole atmosfera ed un personale gentile, disponibile e professionale.Consigliatissimo! "
"ui_bubble_rating bubble_50","Una garanzia ","Conoscevo già I’Tuscani2 e 3 e non potevo non provare anche il 4. Ristoranti giovani, dinamici, ecosostenibili e con qualità dei prodotti eccellente. Concentrati solo su carni e salumi di altissima qualità presentati da personale cordiale e attento. Ogni prodotto, di origine toscana, viene “raccontato” e descritto e, a mio parere, sapere esattamente cosa sto mangiando fa la differenza. Ottime anche le verdure grigliate e le patate che vengono servite di contorno.Ambiente accogliente e informale, i clienti possono scrivere le loro opinioni direttamente sulle pareti con i gessetti. Nel dettaglio, sabato sera con amici ci siamo sentiti coccolati da Sara, perfetta padrona di casa. Ci torneremmo sicuramente e lo consiglio vivamente a chi desidera mangiare la vera e unica bistecca alla Fiorentina. "
"ui_bubble_rating bubble_50","Tappa obbligatoria per gli amanti della carne!","Forse la miglior carne mai assaggiata! Locale carino, accogliente, personale molto cordiale e una qualità della carne nettamente superiore alla media! Una tappa obbligatoria aFirenze per chi vuole assaggiare dell’ottima carne!"
"ui_bubble_rating bubble_40","Prima volta ","Allora sono stato in questo locale con amici per la prima volta e che dire : localeCarino , molto bello il soffitto a mattoni forse un poco meno ilColore alle pareti ma é solo gusto personale . Personale gentilissimo e la mise en place essenziale ma interessante con laScelta dei piatti biodegradabili e finalmente assenza di tovagliette antiestetiche :-) . Veniamo al cibo : antipastino di assaggi buonissimo e la marmellata di fichi ottima , poi abbiamo preso un po di tutto.... dove tra hamburgher , mucco pisano e scottona tutto buonissimo con preferenza personale per la scottona cotta perfettamente e buonissima . Buono il vino un syrah . Conto direi per quello mangiato ci sta tutto . Da provare . "
"ui_bubble_rating bubble_50","10 e lode!","Locale originale e accogliente, ospitalità, gentilezza e soprattutto ottimo rapporto qualità/prezzo! Per concludere, l’arrivo e l’esibizione di Mariogesù non hanno fatto altro che confermare la già eccellente impressione sul ristorante, data dal cibo e dal servizio, rendendo la prima cena a Firenze ancora più piacevole e memorabile.Super consigliato!"
"ui_bubble_rating bubble_40","Continuate così...","Per continuità, andiamo a cena anche al Tuscani 4, visto che già si era fatto il 2 ed il 3, con tale soddisfazione. Anche questa volta siamo stati certamente bene.La simpatica Sara ci ha accompagnato durante la cena con la sua disponibilità e gentilezza. Come pure l'altra ragazza...Questa volta abbiamo preso il mucco pisano.Carne sempre ottima, anche se a dirla tutta abbiamo preferito la fiorentina classica dell'ultima volta al Tuscani 3.Come già successo al Tuscani 2 circa un anno fa, la simpatia di Sara ha fatto il resto. Ci ha offerto anche il vino:-) Brava brava!In attesa del 5, immagino che torneremo ancora entro l'anno al Tuscani.... ambarabà ciccì coccò, tre Tuscani sul comò, si andrà al 2, 3 o 4 non lo so....."
"ui_bubble_rating bubble_50","La Fiorentina...","Io e mia moglie in visita a Firenze, dopo aver girato tutto il giorno volevamo andare in ristorante e assaggiare la vera Fiorentina. Cercando per le varie vie ci imbattiamo nei Tuscani 3. Dopo aver letto i menù decidiamo di entrare. Vi premetto erano le 19.20. Appena entrati viene verso di noi il cameriere che in maniera molto cortese ci da la buona sera e ci chiede se abbiamo prenotato. Non avendo prenotato ci dice che non c'è posto. A malincuore ce ne stavamo andando, lui però ci dice che hanno un altro locare a 10 minuti a piedi e che lì avremmo trovato posto. Così è stato. Beh devo dire che ne è valsa la pena. Fiorentina strepitosa personale cordiale e attento alle esigenze e in più simpatico. In più a metà serata è entrata una special guest. Dante, un ragazzo che recitava i canti della Divina Commedia. Una serata straordinaria. Se vi trovate qui da queste parti andateci ne rimarrete soddisfatti."
"ui_bubble_rating bubble_50","Che dio salvi i tuscani","Complimenti davvero per la gestione di un locale così perfetto e funzionale,personale al di sopra della perfezione e della gentilezza è d obbligo se siete a Firenze passare da un ristorante così...è come sentirsi a casa davvero complimenti!!!!"
"ui_bubble_rating bubble_50","CONTINUA LA CATENA DELLA GARANZIA","Altra bellissima serata all'insegna della vera cucina toscana e quindi della vera Ciccia; simpatia, eccellenza della migliore carne, prezzo più che onesto, Eravamo una bella tavolata di fedelissimi dei I'Tuscani e come sempre ne usciamo illuminati. Avanti così ragazzi."
"ui_bubble_rating bubble_40","Cena con fiorentina","Ottima cena a base di fiorentina (carne molto buona), accompagnata da (purtroppo poche) verdure grigliate.Come antipasto un ottimo tagliere di formaggi tipici della zona.Tutto sommato è stata una bella esperienza. "
"ui_bubble_rating bubble_50","Che Hamburger <U+0001F60D>","Questo locale ce l'ha consigliato il gestore del B&B dove abbiamo alloggiato. Locale piccolo e accogliente, (conviene prenotare) peccato leggermente freddino vista la stagione. Per chi ama la carne il ristorante è ottimo, con scelta di vari tipi di carni e menù, nei quali sono sempre compresi vino (molto buono) e acqua. Abbiamo scelto il menù con gli hamburger, verdure grigliate e patate ai ferri. L'hamburger era favoloso, gustoso e abbondante. Abbiamo ordinato anche un antipasto misto con affettati e formaggi tipici, davvero buono e sfizioso! Per concludere abbiamo assaggiato un po' di amari/grappe offerte dalla casa. Personale simoatico, preparato e disponibile. Sicuramente da tornarci e da consigliare! "
"ui_bubble_rating bubble_50","Cena Super","Dopo il tuscani2 e il tuscani3 ieri sera abbiamo provato anche il tuscani 4....una sicurezza.Cibo veramente buono taglieri di una qualità eccezionale sevizio top (ti spiegano la provenienza dei prodotti),per la bistecca non ci sono parole troppo buona. Prezzo buono. Da fiorentino il posto è consigliato."
"ui_bubble_rating bubble_50","Fantastico ","Siamo stati in questo ristorante la prima sera del nostro soggiorno a Firenze. Cena buonissima, cameriere gentilissimo, simpatico e molto preparato; i piatti ci sono stati spiegati nei minimi dettagli. Qualità eccellente, cibo abbondante, buonissimo vino e ottimo rapporto qualità/prezzo. Un applauso alla location e in particolare alle fantastiche citazioni sui muri. Ci torneremo sicuramente. "
"ui_bubble_rating bubble_50","Qualità e professionalità ","Arriviamo in questo ristorante fiduciosi delle recensioni precedenti. L’accoglienza è davvero calorosa. Il locale si presenta davvero bene in un giusto mix tra antico e moderno. Il personale, dopo aver preso le ordinazioni ci omaggia con la famosa “pappa al pomodoro”.Ordiniamo un menù “Tuscani” con la mitica bistecca fiorentina compresa. La qualità dei cibi è davvero eccezionale! La bistecca, cotta davvero bene, è accompagnata da varie verdure e anche delle patate.Dopodiché, ordiniamo anche una cheesecake che si rivelerà eccezionale! Una menzione particolare la merita il personale, vero e proprio motore di questo ristorante. Si sono distinti per professionalità e gentilezza. Consiglio vivamente. Prezzo buono per qualità/prezzo"
"ui_bubble_rating bubble_50","EJAA..","Dalla Sardegna a Firenze per un mordi e fuggi,abbiamo trovato grazie Trip,I Tuscani 4...L’idea era di mangiare la classica Fiorentina,come dio comanda.Siamo stati più che ripagati.Carne ECCEZIONALE,così come tutto il resto,dai salumi ai formaggi al vino.La ragazza che ci ha servito è stata molto professionale e simpatica,e ci ha fatto veramente un ottima impressione.Non posso che non consigliare un salto da I Tuscani 4,perchè lo meritano per davvero.Alla prossima..."
"ui_bubble_rating bubble_50","Eccezionale ","Solo poche parole perché veramente eccezionale sia il mangiare, sia titolari. Veramente consigliato, se poi ci andate il fine settimana trovate Dante Alghieri."
"ui_bubble_rating bubble_50","Gusto e simpatia","Sono stato a cena con la mia ragazza, ambiente gioviale, i camerieri molto simpatici, Samuele e Sara si destreggiano tra i tavoli sempre con il sorriso e un attenzione che solo a casa puoi trovare, nell'attesa della carne ci è stato offerto un tagliere di salumi ricercati e rigorosamente toscani, grazie Massimiliano, la carne gustosa e tenera, nonostante la mia ragazza abbia preso il filetto ben cotto, bravo Lucio.Che dire, consigliatissimo, un gusto e una cura del cliente unica, bravi bravi bravi!"
"ui_bubble_rating bubble_40","Carne carne carne","Menù di poca scelta ma chiaro nei suoi intenti.. carne. Buona e abbondante. Prezzi nella media. Locale un po'spoglio"
"ui_bubble_rating bubble_50","Cena di lavoro","Locale non grande ma con molta atmosfera. Accoglienza ottima, Sara, la direttrice, è gentile, attenta e disponibile. Antipasto Top (consiglio il Guttus - formaggio tipo gorgonzola di origine toscana fatto secondo antica ricetta originale- e il boccone al fungo porcino - insaccato stagionato contenente nell'impasto anche il fungo porcino). Avvertimento: non esagerare con l'antipasto, perchè la bistecca alla Fiorentina è il piatto forte! Ci sono se non sbaglio tre tipi di carne. Onguna ha un sapore diveso ed una consistenza tipica. Tutte speziate nel modo ottimale e salate in tavola con un sale particolare. Vino rosso (villa Ilangi, mi pare) non conosciuto ma ottimo, rispetto al prezzo contenuto. Dolci fatti da loro ma di qualità. Prezzo per niente alto rispetto alla qualità e quantità del cibo! Da consigliare, sicuramente."
"ui_bubble_rating bubble_50","La cena perfetta ","Bistecca alla fiorentina accompagnata da verdure grigliate, pane toscano e tagliere di salumi tipici a dir poco squisita. Locale stupendo e personale molto accogliente, gentile e disponibile con i clienti. Ci siamo trovati benissimo e sicuramente torneremo. Consiglio a tutti, amici, coppie e famiglie. "
"ui_bubble_rating bubble_50","Semplicemente il top!!","Il personale super cordiale e molto preparato, la carne squisita, i prodotti territoriali buonissimi e il locale arredato nei minimi dettagli rendono questo posto sicuramente come uno dei migliori ristoranti/bisteccherie di Firenze!Consigliatissimo!!! Torneremo sicuramente!"
"ui_bubble_rating bubble_50","Tutto perfetto!","Sono stata qui al Tuscani 4 insieme a mio ragazzo sabato 10 febbraio. Devo dire che é stato tutto perfetto! Dalle luci offuscate del locale, alla carne, ai liquorini offerti (mix caffè/cioccolato la fine del mondo), alla simpatia dei camerieri. Torneremo sicuramente "
"ui_bubble_rating bubble_40","Carne spettacolare!!!","Siamo stati ieri sera al tuscani 4 perché agli altri tuscani era già tutto pieno, il che già indica la qualita' del posto! Abbiamo prima ordinato un tagliere misto con prodotti toscani e poi il tagliere supertuscani in cui ci stava 1.3 kg (sara' 1 kg netto senza osso) di fiorentina più 3 patate e un po' di verdura grigliata... La carne un vero spettacolo, ci ha portato anche a spolpare l'osso alla fine! Consigliatissimo e personale super simpatico! "
"ui_bubble_rating bubble_50","Poesia di sapori e... in persona.","È bello ormai potersi affidare a trip e sbagliarsi davvero poche volte e anche da i toscani non si è sbagliato!... chiamiamo ai Tuacani2 che sono al completo e gentilmente ordinano a mio nome ai Tuscani4. I ragazzi all'interno sono educati e gentili senza essere mai invadenti. L'allestimento del locale é carino e con una luce leggermente soffusa che riesce a creare una giusta intima atmosfera. Prendiamo un menù con bistecca, verdure miste e patate grigliate più un tagliere misto. Prima di servire le portate ci offrono della pappa al pomodoro che ha aperto, oltre che lo stomaco, un ottima cena. Il seguito è... BONO!... una buonissima bistecca cotta perfettamente, buone le patate grigliate, un po' meno le verdure ma mangiate di gusto!... il tagliere è un qualcosa di poetico come l'abbonamento del salame stagionato ai funghi porcini e il pecorino semi stagionato. Sul finire della serata arriva un ragazzo vestito come il sommo poeta che ci recita a memoria e interpreta l'ultimo canto del paradiso della Divina Commedia con apprezzabile e ammirabile capacità, un inttervallo di pochi minuti che però allieta ancor di più la serata che si concluderà con un infinita scelta di liquori gentilmente offerti dalla padrona di casa. Il conto è assolutamente proporzionato con la qualità del servizio e del cibo e comunque non elevato (60€ per due coperti, un menù da 37€, un tagliere misto, una birra artigianale, un dolce con vin santo, tanta cortesia, simpatia e una bella serata riuscita.. che altro... ahhhh il locale abbraccia la politica dell'ecosostenibilità in maniera lodevole quindi... a presto!)"
"ui_bubble_rating bubble_40","Cena","Ottima accoglienza, personale preparato, disponibile e cibo delizioso. Consigliatissimo, ritornerò con piacere. Necessario prenotare per tempo."
"ui_bubble_rating bubble_50","Serata fantastica","Sono venuto a cena con un gruppo di amici,e abbiamo trovato un locale accogliente,e personale molto preparato, e molti prodotti tradizionali toscani,bistecca che si scioglie in bocca, avevo già avuto occasione di cenare al tuscani 2, ed ero rimasto soddisfattissimo, e devo dire che anche il tuscani 4 a soddisfatto a pieno le mie aspettative. grazie ragazzi,,,"
"ui_bubble_rating bubble_50","Serata fantastica ","Siamo arrivati in questo locale per caso, gironzolando di sera, durante un fine settimana di vacanza a Firenze. L’ambiente è informale, ma molto carino. Ci hanno accolto Valentina e Massimo, entrambi gentilissimi e molto simpatici. Abbiamo ordinato della carne (Ottima, di mucco pisano) con verdure miste. In attesa della carne, Valentina ci ha offerto un delizioso tagliere di affettati e una tartare. La serata era tranquilla, abbiamo chiacchierato piacevolmente. Alla fine, ci hanno offerto anche la degustazione di almeno una decina di liquori e grappe...la serata si è conclusa con un tot di brindisi e risate. È stata una serata fantastica, un bel ricordo della nostra vacanza. Torneremo ancora a Firenze, e sicuramente torneremo da I’Tuscani4!"
"ui_bubble_rating bubble_50","Ristorante consigliatissimo!","Il top della bistecca fiorentina! Locale molto accogliente e personale molto gentile e simpatico. Sicuramente una tappa fissa a Firenze!"
"ui_bubble_rating bubble_40","Ottimo ristorante!!! ","Se sei in visita a Firenze, vi consente di provare l'esperienza da raccontare al rientro. Accoglienza e pietanze OTTIME!!!Lo consiglio... "
"ui_bubble_rating bubble_50","Delizia per il palato","Siamo stati il 30 Dicembre; locale accogliente; bistecca alla fiorentina con contorni di verdure eccellente; prezzo in linea con la qualità; personale disponibile, cortese e alla mano. A fine cena ci hanno regalato una bottiglietta di digestivo. Complimenti! Lorenzo&Cinzia"
"ui_bubble_rating bubble_40","Ottima scelta","Ristorante molto buono, camerieri cordiali e simpatici e ciccia ottima...un ringraziamento particolare alla cameriera Sara che è stata gentilissima!"
"ui_bubble_rating bubble_50","Si va sul sicuro!","Ottima esperienza come da tradizione Tuscani. Bistecca incredibile, ambiente perfetto e staff simpaticissimo. Poco altro da aggiungere, il nome Tuscani è sempre una garanzia e non delude mai."
"ui_bubble_rating bubble_40","Cena piacevole","Sono stata a cena con il mio ragazzo. Abbiamo preso il menu con la fiorentina. Prezzo onesto 37 euro con acqua e vino. Cibo davvero abbondante. Bruschette per aprire, Fiorentina da 1 kg verdure grigliate bruschette e 5 patate intere.. buonissime ma forse un po' troppo abbiamo mandato indietro parte del contorno.Molto bella l'idea dei piatti e bicchieri compostabili"
"ui_bubble_rating bubble_50","Allegria e buon cibo... la combinazione perfetta! ","Soggiornando a Firenze è d'obbligo almeno una cena a base di fiorentina e quindi non si può non fermarsi da I'Tuscani 4. Ristorante dove la risata è assicurata sia dalle varie scritte sui muri (in primis i comandamenti de I'Tuscani) che dal personale sempre gentile, allegro e disponibile ad illustrare ogni piatto.Abbiamo mangiato un tagliere di salumi e formaggi toscani squisito ed un altro tagliere a base di prodotti con al loro interno il tartufo anch'esso molto buono; certamente però il pezzo forte del locale è l'ottima Fiorentina servita, noi abbiamo potuto gustare una bistecca di scottona accompagnata da varie verdure grigliate e saporitissime patate. A fine cena inoltre ci è stata offerta la degustazione di differenti digestivi (la Sambuca alle erbe ha una marcia in più ). Segnalo inoltre l'attenzione al materiale usato per apparecchiare, piatti e bicchieri di un materiale al 100%riciclabile. Rapporto qualità/prezzo ottimo. Consigliatissimo. "
"ui_bubble_rating bubble_40","“Disse il prosciutto... io m’avvio” ","Partendo dal presupposto che 2,50€ di coperto per due piatti di carta compostabile, nonostante la generosa offerta (nostra) per le foreste, sono eccessivi il ristorante è molto semplice e carino.Abbiamo mangiato un tagliere misto fiorentino molto buono ma un po’ misero. Come portata principale abbiamo optato per gli hamburger di chianina con patate e verdure grigliate; buoni ed abbondanti! Il locale non fa caffè “perché non gli riesce” ma ci hanno lasciato delle bottiglie di amari a nostra disposizione sul tavolo, offerti da loro. Personale molto cordiale, prezzo nella media quindi tutto sommato raccomandiamo!"
"ui_bubble_rating bubble_50","Ottima carne!!!","Abbiamo cenato la sera del 29 Dicembre, 2 adulti e 2 bi,bi. Il locale aperto da pochissimo è molto carino.Si mangia praticamente solo carne (oltre a salumi e formaggi), ma la qualità della nostra Fiorentina è stata eccellente.Ottimo anche hamburger scelto per i bimbi. Abbondante che lo hanno diviso in2.Prezzi nella media per Firenze. Abbiamo speso 120€ mangiando in 4 con il menù fisso a base di Fiorentina per 2 persone, un tagliere di antipasti e l'hamburgher per i bimbi e il vino della casa.Alla fine ci sono stati offerti una gran varietà di liquori.Simpatica l'iniziativa di ospitare a iniziò serata un attore che ha recitato un canto della Divina Commedia.Lo consiglio a chiunque sia appassionato di carne!"
"ui_bubble_rating bubble_50","Cena","Abbiamo cenato il 30 dicembre 2017 eravamo in 5 siamo rimasti sbalorditi dalla ottima carne di qualità con vasta degustazione di salumi e formaggi e accoglienza molto cordiale. Qualità prezzo ottima per firenze."
"ui_bubble_rating bubble_50","Ottimo ","Mangiare ottimo..la carne si scioglie in bocca..Personale gentilissimo a dir poco.Servizio altrettanto ottimo.Consigliatissimo...Se dovessi tornare a Firenze ci tornerei ad occhi chiusi.."
"ui_bubble_rating bubble_50","Cordialità e ottima fiorentina ","Abbiamo cenato in 4 ieri sera, locale simpatico e accogliente. Personale gentile e competente ci hanno offerto piccoli stuzzichini e il vino. Le bistecche buonissime accompagnate da verdure grigliate si scioglievano in bocca, abbondante. Alla fine ci hanno offerto pure gli amari e grappa a volontà che dire meglio di così. Consigliatissimo."
"ui_bubble_rating bubble_50","Cosa chiedere di meglio??","Trovato per caso , posticino delizioso cibo ottimo . Il tutto accompagnato da un ottimo servizio . Voto 10+ e mangiate la Fiorentina!!! "
"ui_bubble_rating bubble_50","La vera Fiorentina","Ho avuto occasione di cenare in questo delisioso locale nel cuore del centro di Firenze! Avevo già avuto modo di cenare negli altri ristoranti Tuscani della città e devo affermare che lo standard è altissimo anche nel neonato!La qualità delle portate è ottima! Sapori che deliziano il palato e la vista!La location è accogliente e calorosa, se possibile ancora più delle altre... angolo degli antipasti bellissimo!!!!Consigliato a pieni voti! "
"ui_bubble_rating bubble_50","Non pensavo!","Ero stato ai Tuscani 2 e 3 ed ero un pò dubbioso a riguardo, insomma come nei film non si sa mai che direzione prendano i sequel!Sono stato invitato ai Tuscani 4 per un compleanno due sere fa, non nascondo che ero un pò scettico mentre aspettavo le portate ma ho dovuto ricredermi totalmente!La qualità era alta come gli altri due posti dove ho mangiato, sono rimasto davvero sorpreso..Se ci andate prendete la bistecca alla fiorentina, lascia senza parole dalla bontà!"
"ui_bubble_rating bubble_50","Una conferma","Che dire, dopo il tuscani 2 e il tuscani 3, il tuscani 4 non può che essere una conferma alla qualità e alla cordialità! Cena con prodotti ricercati, piatti ben curati, grigliata sublime e atmosfera incantevole. Continua anche in questo ristorante il progetto di ecosostenibilità dell'ambiente e la professionalità del personale è impeccabile! Grazie ancora a Sara e Lucio per la splendida serata! Continuate così! Torneremo presto! "
