"Restaurant_Ratings","Restaurant_Quotes","Restaurant_Reviews"
"ui_bubble_rating bubble_50","Ottimo","Ottima scoperta. Locale carino e accogliente, personale eccellente. Buona sia la bistecca che il filetto. Nell'attesa della portata ci è stato offerto un assaggio di prosciutto toscano.Prezzo nella media per essere in centro a Firenze.Consigliato"
"ui_bubble_rating bubble_50","Fiorentina Super","Location carattestica per cena a lume di candela. Abbiamo ordinato il menù Super Tuscani per due e ci hanno portato un tagliere con un tripudio di carne cotta a puntino da leccarsi anche le orecchie con contorno di patate e verdure marinate. Vino e acqua a volontà. Per finire degustazione di amari e liquori offerti dalla casa.Personale gentilissimo e affabile.Soddisfattissimi...assolutamente da ritornarci."
"ui_bubble_rating bubble_50","Che bella mangiata e che gentile il personale !!","Abbiamo cenato ieri sera in questo tipico ristorante fiorentino . Non tanto da dire oltre alla qualità eccelsa della carne vorrei sottolineare la bravura e la gentilezza dei due camerieri giovani che hanno coccolato me e la mala ragazza durante tutta la cena . Torneremo sicuramente "
"ui_bubble_rating bubble_50","Cibo ottimo ","Cibo ottimo, location caratteristica e personale davvero super. Abbiamo trascorso una bella serata mangiando davvero bene "
"ui_bubble_rating bubble_30","Bene ma non benissimo","Punti positivi:- buona la carne (sono toscano e 'appassionato' in materia)- staff simpatico, accoglienza topPunti negativi:- si paga un prezzo fisso per una sorta di menù...la carne (servita senza il filetto) non viene dunque pesata. Quindi a seconda del taglio si riceve randomicamente porzioni più o (come nel mio caso) meno abbondanti."
"ui_bubble_rating bubble_50","Bella sorpresa!","Io e il mio ragazzo siamo capitati qua per cena, avevamo voglia di una bella bistecca alla fiorentina! Beh che dire, carne eccezionale, gustosa, saporita e morbida! Il personale è stato molto gentile ed accogliente.. Durante la serata, un poeta fiorentino ci ha intrattenuto per qualche minuto..è stato emozionante tanto quanto originale!!! Quando ricapitiamo a Firenze, torneremo a trovarvi! Un bacio da Livornooooo"
"ui_bubble_rating bubble_50","MERAVIGLIA !","Location molto bella , accogliente , di casa.Personale molto gentile e disponibile . Per ogni pietanza e bevanda ci è stata fornita la spiegazione dettagliata .Carne prelibata , vino super .Insomma , è stata una cena indimenticabile .Torneremo sicuramente ! Omar e Shanon "
"ui_bubble_rating bubble_50","Fantastico!","Abbiamo mangiato benissimo e l’atmosfera merita. Personale gentilissimo e attento, sembra di trascorrere una serata in compagnia di tanti amici. Ci ritorneremo sicuramente!"
"ui_bubble_rating bubble_50","Cena sublime ","Io e le mie colleghe ieri ci siamo recate a cena in questo bellissimo locale, la cornice del ristorante é molto suggestiva e respiri la vera Toscana, personale molto professionale e gentile, abbiamo ordinato la bistecca alla fiorentina che ci ha lasciate a bocca aperta, Firenze la frequento da tanto e penso che questo é uno dei migliori locali che ci sia "
"ui_bubble_rating bubble_40","Molto buono","Un ristorante piccolo ma accogliente, il personale è cordiale e allegro e il cibo molto buono. Ho apprezzato la scelta di utilizzare piatti e bicchieri riciclabili."
"ui_bubble_rating bubble_50","Eccezionale!","Siamo capitate in questo ristorante un sabato sera. Attaccato a Ponte vecchio, sul lungarno, in una vietta quasi per niente trafficata. Abbiamo mangiato la migliore fiorentina della nostra vita, accompagnata da patate e verdure squisite. L'antipasto di una squisita finocchiona, meraviglioso vino chianti della casa. Olio e spezie tra i migliori mai assaggiati. Antipasto e dolce di cantucci e vin santo offerto dalla casa. Il personale disponibilissimo, in particolare un grazie a Sara ed Angelica per la simpatia e la professionalità.Prezzi modesti per la qualità della cena. Se ricapiteremo a Firenze torneremo senz'altro. Complimenti, consigliatissimo!"
"ui_bubble_rating bubble_50","Top!","Sono stata a cena con un’ amica di recente, volevamo trovare un locale dove si mangiasse dell’ ottima carne e non potevamo scegliere posto mgliore! Staff alla mano, giovane, disponibili e molto simpatici. Carne ottima per tutti i gusti! Locale molto particolare! Tutto perfetto... ci torneremo sicuramente e se siete a Firenze non potete non andarci!"
"ui_bubble_rating bubble_50","Eccezionale ","Posto caratteristico e staff seppur giovane molto preparato e cordiale. Ci siamo affidati per la cottura della carne e abbiamo fatto bene seguendo i consigli che ci hanno dato. Carne morbidissima e di qualità tanto da lasciare solo le ossa davvero. Vino della casa. Bravi davvero. Se torniamo a Firenze sicuramente sarà la nostra tappa. Consigliato e complimenti a tutto lo staff."
"ui_bubble_rating bubble_50","Il PARADISO della Carne!","Siamo venuti qui io ed il mio fidanzato dopo un estenuante e lungo viaggio Da Gaeta. Per fortuna ad aspettarci c'era un tripudio di sapori assolutamente eccellenti. Carne ottima e contorni eccezionali. Vino rosso locale in giarra,olio locale ottimo. Come se non bastasse ci hanno messi KO offrendoci a fine cena una enorme varietà di liquori e grappe tipiche del territorio. Un MUST di Firenze! Siamo rimasti sbalorditi!"
"ui_bubble_rating bubble_40","Tipico","Ambiente molto tipico e bello. Il personale è simpatico e attento, carne molto buona e cucinata in modo tradizionale. Buoni i contorni e anche il vino! Consigliato!"
"ui_bubble_rating bubble_40","Assolutamente si","Su consiglio di amici abbiamo provato la cucina di questo ristorante... assolutamente buonissima la fiorentina, locale caratteriatico, cortesia e servizio che rendono questo locale una tappa super consigliata! "
"ui_bubble_rating bubble_50","Ciccia!","Un locale sorprendente,molto tipico come struttura. Il personale giovane ed accogliente molto preparato! Abbiamo preso un tagliere di bistecca in due, i miei amici hanno preso un filetto ed un hamburger di chiavina, tutto contornato con verdure alla griglia, tutto buonissimo, la carne era morbidissima!!! Consiglio anche il tagliere di formaggi con le loro confetture, molto buoni!!! Poi date pure un’assaggiatina al piatto che è fatto di crusca ho assaggiato anche quello!!! Consiglio vivamente!!!"
"ui_bubble_rating bubble_50","Spettacolare","Cibo ottimo e di prima qualità, personale attento e simpatico, consifliatissimo per ogni tipo di occasione.Torneremo sicuramente !!!"
"ui_bubble_rating bubble_50","Pazzeschi","Cena di coppia decisa all ultimo minuto! I ragazzi dello staff super cordiali e gentili sempre con il sorriso in bocca! Cibo strepitoso assolutamente da provare! Amari offerti ( e che vastità di amari ).Siamo rimasti davvero contenti bravi! Alla prossima "
"ui_bubble_rating bubble_50","Non si può chiedere di più! ","Su consiglio di un amica abbiamo deciso di provare questo posto, le recensioni inoltre non mettevano dubbi! Il posto è molto accogliente, luce soffusa, la ragazza che ci ha servito molto preparata, simpatica e sorridente. La bontà del cibo? Delizioso è riduttivo, la qualità si nota tutta! Complimenti! Ho passato una serata fantastica. "
"ui_bubble_rating bubble_40","cena di coppia","Personale gentile e molto competene, ottima fiorentina e buone le patate arrosto, prezzi normali visto la qualita' del prodotto servito."
"ui_bubble_rating bubble_20","I commenti degli stranieri valgono zero","Menu' cortissimo e pertanto la carne deve essere al top...Non è così. Verdure di contorno immangiabili. Conto alto per ciò che viene offerto. Servizio invece simpatico e disponibile. Vino"
"ui_bubble_rating bubble_50","La ciccia più bona ","Inutile dire.. la ciccia più bona di Firenze è ai’tuscani ! Ormai alla quarta apertura, richiestissimo e .. Consigliatissimo.. antipastino, vino della casa, e ciccia con verdurine grigliate.. non chiedete come dev’esser cotta la ciccia perché sarà rigorosamente al sangue, da tradizione.. ottima! Taglieri dai 9/10 euro ai 15, menu da 75 euro in due con ciccia, verdurine grigliate e patate, acqua e mezzo litro di vino. "
"ui_bubble_rating bubble_50","La miglior ciccia la fanno a I'tuscani!!!!","Locale spettacolare, i ragazzi sono gentilissimi e ti fanno sentire a proprio agio come se tu fossi proprio a casa tua, ciccia e salumi di prima qualità, se vi fermate a firenze è da provare assolutamente, prezzo onestissimo, acqua, vino della casa e distillati artigianali sono illimitati. Insomma tutto perfetto, complimenti a chi ricerca i prodotti per garantire al meglio lo svolgimento di questa attività"
"ui_bubble_rating bubble_40","Cena fantastica ","Cena perfetta, ottimo cibo e personale qualificato e molto gentile. Il locale veramente accogliente e piacevole. Da tornare prestissimo. "
"ui_bubble_rating bubble_50","Tutto super fantastico ","Abbiamo prenotato per cena sabato dopo aver visto le recensioni, devo dire tutto fantastico, il locale la cortesia e simpatia dei ragazzi al cibo qualcosa di speciale , mi ha stupito molto la qualità delle stoviglie tutto materiale organico anche si può mangiare anche il piatto tutto alla crusca ,vi consiglio di provare il tagliere misto la bistecca molto buona e la salsiccia qualcosa di sublime , il sabato poi c’è l intrattenimento ,un ragazzo davvero bravo che racconta poesie di scrittori toscani, sembra di viverle ! ,d’inverno racconta la divina commedia ,grazie davvero ritorneremo senza dubbio "
"ui_bubble_rating bubble_50","La bistecca !!!","Ottima cena in compagnia di amici, scelto il menù tuscani, la carne era squisita e morbida, cotta al punto giusto, acqua e vino a volontà, piccoli antipasti offerti di salumi e formaggi tipici buonissimi , personale giovanissimo, molto preparato e simpatico !!Prezzo nella mediaSerata molto divertente, ci torneremo sicuramente"
"ui_bubble_rating bubble_50","Fantastico! ","Un ristorantino nelle vie di Firenze,siamo state a cena io ed una mia amica,abbiamo preso 2 taglieri uno di salumi e uno di formaggi,come secondo la Fiorentina servita con patate,zucchine e peperoni. Qualcosa di divino! Ottima carne e ottimi anche gli antipasti! Ottimo rapporto qualità prezzo!"
"ui_bubble_rating bubble_50","cena di famiglia","siamo venuti a cena stasera e siamo rimasti profondamente soddisfatti ed estasiati dal servizio e dal cibo. carne straordinaria e verdure super ottime,per non parlare dei dolci...un grazie speciale a giacomo!!!"
"ui_bubble_rating bubble_50","Stupefacente","Siamo stati a cena in questo locale ieri sera. Abbiamo ordinato un antipasto di salumi ed il Super tuscani menù. Entrambi le cose ordinate erano ottime, ed i prezzi sono perfettamente in linea con la qualità del cibo servito. Nel caso in cui dovessi tornare a Firenze, tornerei sicuramente qui. Veramente ottimo."
"ui_bubble_rating bubble_50","Perfezione.","La cena perfetta. Banalmente a partire dal cibo,piatto di carne completo di verdure e patate grigliate, tutto incredibilmente buono e saporito. Acqua e Chianti della casa (ottimo) illimitati inclusi. Prezzo della fiorentina onestissimo, ma diversificando i piatti si riesce a spendere davvero pochissimo. Tutti i prodotti sono del territorio, e sono ricercati e con così tanta che, per esempio, il caffè non lo fanno proprio... perché tipico fiorentino 'un si trova!Ma ciò che rende questo posto davvero speciale (non unico perché ce ne sono tre!) sono l'attenzione allo spreco di risorse e all'ambiente (bicchieri di non-plastica compostabile, piatti in crusca compostabili per ridurre l'impatto ambientale dei lavaggi) e soprattutto la bravura, preparazione, competenza, attenzione e simpatia dei ragazzi che ci lavorano. Sono delle persone bellissime che ti fanno sentire a casa....quindi grazie davvero di tutto!(nota a margine: vastissima e illimitata selezione di liquori offerti a fine cena. What else?)"
"ui_bubble_rating bubble_40","Carne Fantastica ","Menù con Fiorentina fenomenale, l’antipasto di formaggio di medio livello, vino buono. La carne resta il punto forte assolutamente da provare. Unica pecca il pane a mia vista poco salato.Servizio cortese e simpatico."
"ui_bubble_rating bubble_50","Fiorentina super!","Leggendo le recensioni siamo stati attirati da questo ristorante che ha decisamente soddisfatto le nostre aspettative. Personale cordiale e molto preparato. Abbiamo ordinato la fiorentina e un hamburger serviti insieme a verdure e patate arrosto. Super! Ottimo anche il tagliere di formaggi servito con miele al tartufo e composta di arance. Una chicca in più è stata la presenza di un attore che ha recitato La pioggia nel pineto a rendere ancora più magica questa cena!"
"ui_bubble_rating bubble_50","Per davvero ","A leggere le recensioni può sembrare strano ma cribbio, in questo posto si ha l'occasione di mangiare un'ottima fiorentina , assaggiare prelibatezze come peschette o fichi tartufati, e passare una serata come se si fosse tra amici.Oltre al cibo devo ringraziare le persone che ci hanno accolto perché i sapori sono importanti ma la cortesia e la professionalità unite alla simpatia non si comprano.Grazie Alla prossimaCiaoPaolo"
"ui_bubble_rating bubble_50","Ottima bistecca"," Viste le tante buone recensioni abbiamo deciso di andare ai tuscani 4. Abbiamo ordinato bistecca alla fiorentina e superburger serviti con verdure grigliate e patate arrosto. La carne veramente buona e tenera. Ottimo servizio e la location non è niente male. Nel complesso piacevole serata animata da un attore che recita poesie di Dante. "
"ui_bubble_rating bubble_50","Grazie tripadvisor","Rientrando dalla Puglia abbiamo deviato su Firenze per tappa culinaria. Non avendo idea di dove fermarci ci siamo affidati a tripadvisor cogliendo nel segno. Bellissima location, praticamente a due passi da piazza della Signoria. Personale cordiale e competente. Carne eccellente e qualità prezzo fantastici. Da provare."
"ui_bubble_rating bubble_50","Oltre le aspettative ","Sono stata in questo locale per una cena ed è stato tutto fantastico. Servizio cordiale, solare e veloce. Ci hanno accolto spiegandoci la filosofia del locale riguardo bicchieri e piatti, simpatico! Il locale ha anche la particolarità di avere dei muri-lavagna in cui lasciare dei messaggi col gesso, scelta davvero carina. Per la cena abbiamo preso un tagliere misto come antipasto e una bistecca come secondo, accompagnata da verdure grigliate e patate. Tutto delizioso! Ogni boccone era pura estasi. Ci siamo concessi anche dei cantucci e vino, seguiti da una vasta gamma di grappe. Alla cassa ci hanno anche fatto un regalo. Se mai tornerò a Firenze, tappa fissa da I’Tuscani! L’ho già consigliato a tutti i miei amici."
"ui_bubble_rating bubble_50","Fiorentina al top! ","Location semplice ma molto accogliente, il personale molto gentile e preparato. La fiorentina uno spettacolo buonissima. Ottimo anche il fischietto di vino offerto dalla casa, e per concludere ottima degustazione di distillati tipici Toscani. Consigliatissimo.. "
"ui_bubble_rating bubble_50","Che ciccia ragazzi!","Ambiente accogliente, l’idea di utilizzare piatti e bicchieri di materiale organico completamente riciclabile è fantastica, i ragazzi sono gentili e professionali e la qualità del cibo, tutto di provenienza esclusivamente toscana, è altissima. La carne era perfetta, lo chef a fine serata si è anche seduto con noi per raccontarci con passione cosa c’è dietro la qualità dei loro prodotti e per descriverne l’intera filiera! A conclusione della cena ti offrono una lunga selezione di liquori artigianali che ti rendono ancora più soddisfatto! Di sicuro consigliatissimo!"
"ui_bubble_rating bubble_20","Troppo sponsorizzato ","Bisteccheria a Firenze Tre ristoranti Messi molto bene su trip Cena con amici a Firenze perché no? -1 filetto troppo cotto (e siamo toscani non cinesi) - bistecca un po’ sfilacciosa (commento di chi la ha presa io ho preso il filetto )Sara sfortuna? O realtà di questo locale? Servizio un po’ approssimativo. A Firenze di ciccia se ne può mangiare di meglio. "
"ui_bubble_rating bubble_40","Vino ed acqua illimitati ","Adoro questo ristorante. Eravamo in due; 40€ a testa per fiorentina, patate e verdure , ma la cosa che più mi ha sconvolto è che l’acqua ed il vino erano illimitati così come lo erano i liquori a fine pasto; tutti artigianali e tutti offerti dalla casa! Il personale era super gentile, sembrava di essere in famiglia durante un pranzo domenicale. Ah’.. anche se si mangia Fiorentina i piatti erano bio (pura crusca) "
"ui_bubble_rating bubble_40","Ciccia di qualità! ","Il 17 agosto, a Firenze, abbiamo deciso di provare questo ristorante di carne, su consiglio di un amico.Consiglio giusto.Abbiamo scelto due differenti menu di carne, con una cottura differente.Entrambe le qualità succulente, con carne morbida e saporita.Insieme alla carne ci hanno portato verdure grigliate e delle ottime patate cotte 24 ore.Cibo accompagnato da un buon Chianti della casa.Servizio gentilissimo."
"ui_bubble_rating bubble_50","Ci torno? Assssssssolutamente SI","Il posto si presenta accogliente è caratteristico. Il servizio è decisamente buono. Accoglienti e gentili. La carne che si mangia qui è buona buona buona, ogni piatto è poi arricchito di Contorni abbondanti. Vado via sazio sazio sazio è felice di aver trascorso del tempo per la cena in un bel e buon posto. Sicuramente il costo non è dei più convenienti, ma laddove ben si mangia e cortesemente e con cura si è serviti risulta il giusto riconoscimento e compenso. Tornarci? Decisamente "
"ui_bubble_rating bubble_40","Piacevole serata","Un bellissimo weekend fiorentino con tappa in questo ristorante molto carino, accogliente e dal tipico carattere toscano. Cena veramente squisita con carne ottima, patate e verdure grigliate e un buon sangiovese della casa e acqua. Ottimi anche gli amari, nocino da provare assolutamente! "
"ui_bubble_rating bubble_50","Cena a Firenze","Locale con atmosfera calda e accogliente come tutto il personale. Se volete gustare la carne toscana è il posto giusto. Buon vino Chianti a volontà. "
"ui_bubble_rating bubble_50","Super","Sono stata con il mio fidanzato in questo bellissimo ristorantino, vicinissimo al lungarno. Personale gentilissimo e simpatico, cibo pazzesco. Fiorentina meravigliosa e grigliata di verdure saporita, assolutamente consigliato. Rapporto qualità prezzo giusto."
"ui_bubble_rating bubble_40","Buona esperienza","Buona esperienza un questo locale dove l'ospitalità toscana è di casa. Ottima cucina con buone materie prime. Carni sicuiramente di prim'ordine a prezzi nella norma per questo tipo di ristorazione."
"ui_bubble_rating bubble_50","Alla grande! ","Abbiamo prenotato su The Fork.. l’attesa è stata di circa 10 minuti nel frattempo il cameriere gentilissimo ci ha portato un bicchiere di vino..Abbiamo preso il menú da 37,50€ a testa che comprendeva una bistecca, patate, verdure, pane arrostito, acqua e vino(della casa) illimitati! La carne davvero buona.. direi consigliatissimo! "
"ui_bubble_rating bubble_50","Delizia Spettacolo Fantasia e Professionalita ","Una serata veramente bellissima grazie a quest ambiente cosi accogliente. Cibi studiati nei dettagli con proposte di menu azzeccati che uniscono una qualita elevatissima di carni all elaborazione delle stesse a regola d arte. Introdotte dalla descrizione di ognuno di questi piatti con la simpatia e la professionalità dello staff. Lo stesso ti riempie di attenzioni gradite. L ambiente è studiato bene unisce eleganza e semplicita. Il vino della casa, ammetto essere stato titubante all inizio, è molto buono. Grazie ad Angelica e Giacomo che hanno reso quest esperienza molto piacevole. 10 e lode. Saluti da M. e F."
"ui_bubble_rating bubble_50","Ottima Fiorentina e gran servizio","Sono stato con la mia ragazza in questo ristorante come ultima serata della nostra vacanza a Firenze con l'obiettivo di assaggiare, finalmente, una bella Fiorentina. Non siamo rimasti delusi. Abbiamo scelto un menu per due persone comprendente una bistecca (non ho idea del peso, ma era abbondante), verdure grigliate e pane tostato, acqua e mezzo litro di vino della casa. Sublime la bistecca, buone le verdure grigliate e ottimo anche l'antipasto di benvenuto (penso, offerto) di paté di fegatini con crostini. A causa di un disguido nella prenotazione (avevamo prenotato ai Tuscani 3, senza avere comunicazione del giorno di chiusura non segnalato sul Web), ci è stata offerta una bottiglia di Chianti al posto del mezzo litro di vino compreso nel menu, bravi! Veloce e cordiale il servizio, i ragazzi sono simpaticissimi e molto espansivi. Il clima è locale e familiare, tant'è che ci siamo fermati con altri commensali per assaggiare tutti insieme i distillati della casa. Conto giustissimo, rapporto qualità/prezzo eccellente. Andateci per una bella serata come a casa."
"ui_bubble_rating bubble_50","La prima volta non si scorda mai ","Era la prima volta che assaggiavamo la fiorentina e i ragazzi sono stati super carini perché ci hanno accompagnato in tutta la cena con suggerimenti e consigli validissimi! Siamo stati contentissimi, la carne eccezionale e anche vino e liquori. Atmosfera familiare, ottima musica di sottofondo che accompagna la serata. Bravi ragazzi torneremo e lo consiglieremo di sicuro! "
"ui_bubble_rating bubble_50","Ottimo","Luogo molto accogliente e personale simpatico e disponibile. Per quanto riguarda la cucina niente da dire, ottimo rapporto qualità/prezzo, porzioni molto abbondanti e inoltre acqua, vino ed amari no stop. Super consigliato"
"ui_bubble_rating bubble_50","Ottimo ","Il locale è moto accogliente, bello e giovanile.Il personale è molto gentile e preparato, il cibo molto buono e di qualità ed è bella l'idea di bicchieri e piatti biodegradabili. Molto soddisfatto di questa cena fiorentina.Lo Consiglio a tutti i carnivori "
"ui_bubble_rating bubble_50","Cena fiorentina","Luogo molto accogliente, il personale è gentilissimo e preparato, consigliano i piatti migliori a seconda dei gusti e accompagnano il tutto con la speigazione dei materiali 100% naturali che si utilizzano per mangiare (es. Il bicchiere dell'acqua non è in plastica, ma in amido di mais, completamente biodegradabile). Il menù non è troppo vario, ma l'unico piatto al quale non si può rinunciare è la fiorentina, accompagnata da verdure grigliate e un buon vino rosso della casa. Ci è stato offerto un paté ottimo, fatto da loro, mentre aspettavamo il piatto principale, da mangiare con dei grissini o crostini. Il capo sala è stato sempre premuroso nei confronti di tutti i clienti e ci ha offerto alla fine della cena il dolce, composto da 3 tipi diversi di cantucci e del vin santo, senza far mancare una degustazione di amari artigianali. Ottima la musica di sottofondo, ottimi il cibo e il vino, così come il locale. Assoutamente consigliato, ci ritorneremo!"
"ui_bubble_rating bubble_50","Buon cibo con un servizio molto simpatico","Siamo stati in vacanza a Firenze qualche settimana fa e ci hanno consigliato questo ristorante. Niente di male da dire.. Appena seduti è venuta una ragazza molto sorridente e simpatica (Angelica, credo fossi il suo nome)!!! ci ha consigliato una selezione di antipasti che ci hanno piacuto tantissimo!! una volta all´anno visitiamo Firenze e mi sembra che torneremo a mangiare in questo ristorante. Grazie davvero per il servizio fatto!! A presto!"
"ui_bubble_rating bubble_40","Cena!","la Fiorentina del locale e' di ottima qualita', verdure di accompagnamento all'altezza, personale di sala gentile e accogliente, conto non proprio a buon mercato!!! tornero' certamente!"
"ui_bubble_rating bubble_40","Ci piace","La qualita' della carne e' di livello superiore, il personale e' disponibile e competente pulizia impeccabile, tutto questo non e'chiaramente a buon mercato, da consigliare cmq..."
"ui_bubble_rating bubble_50","Eccellente!! ","Scoperto grazie alle recensioni su tripadvisor, cuciba a dir poco fantastica! L'ideale per chi ama la carne, porzioni abbondanti e saporite!! Super consigliato!! Prezzi adeguati all'ottima qualità della carne! "
"ui_bubble_rating bubble_50","Ottimo <U+0001F44C><U+0001F3FB>","Ottima qualità del cibo, per non parlare del personale sempre disponibile e attento alle esigenze del cliente. Siamo stati un weekend a Firenze e abbiamo scelto per entrambe le sere la cena da TUSCANI 4, e non esiteremo a ritornarci alla prima occasione utile "
"ui_bubble_rating bubble_50","Serata top","Io e il mio ragazzo abbiamo passato una bellissima serata in questo ristorante. Il locale è molto accogliente e intimo. Il personale è sempre disponibile e gentile. Abbiamo scelto il menu con la Fiorentina, accompagnata da verdure e ottimo vino. Rapporto qualità prezzo giusto."
"ui_bubble_rating bubble_50","Non delude mai!!","Ormai clienti abituali, I’ Tuscani non delude mai.Locale molto accogliente, portate molto abbondanti e sopratutto molto buone.Il personale sempre disponibile e gentile. Un ringraziamento particolare a Giacomo che ci ha consigliato benissimo!"
"ui_bubble_rating bubble_50","Sempre al top","Sono già stata più volte a questo ristorante, che dire, sempre una conferma! Assolutamente da provare la bistecca, buona esagerata! "
"ui_bubble_rating bubble_50","Bellissima serata ","Bellissima serata, bistecca e antipasto buonissimo. Progetto green interessante..Un ringraziamento speciale a Giacomo che ci ha seguito per tutta la sera, preparato e molto simpatico.Torneremo sicuramente "
"ui_bubble_rating bubble_40","Ottimo","Osteria estremamente gradevole, cibo abbondante e ben lavorato...accoglienza e cortesia al top, prezzi a mio avviso bassi in relazione a quel che si mangia...se passate da Firenze impossibile non fermarsi qui'...tornero'"
