"Restaurant_Ratings","Restaurant_Quotes","Restaurant_Reviews"
"ui_bubble_rating bubble_40","all'ombra del Duomo","Nel cuore di Firenze, a pochi passi dal Duomo, si trova questo ristorante dal tono elegante e intimo che propone cucina toscana rivisitata all'ombra della cupola del Brunelleschi. L'estrema cordialità dello staff si abbina alla particolarità dei piatti, ben presentati e molto originali. Buonissimi i festoni con lardo di Colonnata, discreti gli straccetti di chianina, eccellenti i cantucci artigianali con vin santo. Conto non particolarmente esoso, considerato il tipo di locale."
"ui_bubble_rating bubble_40","Ottima cucina dietro il Duomo","Siamo capitati qui per puro caso, e siamo rimasti piacevolmente sorpresi. L'ambiente è un po' spoglio ma piuttosto accogliente, e il personale gentile e disponibile. La cucina è tipica della zona, e davvero ottima; unica pecca è la poca scelta di dolci. Con il caffè ci sono state portate delle scorrette di arancia con cioccolato fatte in casa, il tutto per un prezzo giusto. Esperienza da ripetere!"
"ui_bubble_rating bubble_50","INEGUAGLIABILE!!!!!","Ottimo rapporto qualità prezzo. Massima professionalità e serietà di chi lavora con passione. Fortunatamente esistono ancora locali di questo livello. Consigliatissimo."
"ui_bubble_rating bubble_50","IL TOP A FIRENZE!","Sono stato a Firenze con la mia ragazza questo fine settimana...La sera, camminando per il centro, desiderosi di mangiare non nel solito ristorante turistico, ci imbattiamo in questo locale a due passi dal duomo. Una signora molto gentile ci fa accomodare...Locale molto bello, pulito e famigliare. Ma veniamo al sodo...piatti della tradizione toscana,, sapientemente cucinati anche con qualche piccola rivisitazione. Fiori di zucca ripieni di ricotta e sfumati alla birra, polenta con salsiccia e olio al tartufo, pici al ragu' di cinghiale, rigatoni alla maremmana, fiorentina da urlo...Ottima carta dei vini, in particolare grande scelta di vini toscani..Sono rimasto talmente soddisfatto da questo posto che in due giorni ci ho mangiato ben tre volte. Che dire...sicuramente quando tornero' a Firenze sarete una tappa fissa. Questo si chiama saper fare ristorazione. Prezzi in linea con la qualita' dei prodotti. Complimenti allo staff, esperienza indimenticabile!+."
"ui_bubble_rating bubble_50","Cena nella splendida Firenze","Il ristorante è a due passi dalla cattedrale quindi in pieno centro. L'ambiente è caldo e accogliente, così come le persone di sala. Abbiamo mangiato io e la mia compagna, tavolino in fondo alla sala vicino ad altre coppie, ma in un ambiente tranquillo. Antipasto abbondante con affettati di cinghiale, una tagliata di chianina, polpette fritte di chianina, patate al forno, ceci, una bottiglia di rosso Montalcino e una di acqua. 78€ il totale. La qualità del cibo è indiscutibile, la quantità è stata perfetta per uscire sazi è soddisfatti. Ottimo servizio, molto attento e cordiale. Consiglieremo sicuramente questo posto agli amici. "
"ui_bubble_rating bubble_50","Cena a lume di candela","Sabato sera a giro per la bellissima Firenze si decide di fermarsi a guardare il Duomo. Girando lo sguardo si nota un ristorante con un ingresso caratteristico molto affascinante  Il Caminetto  pensando alle temperature abbastanza freddine e il locale molto particolare si decide di entrare per cenare..... ci accoglie un personale molto qualificato e professionale ...... una sala inerna molto curata nell' arredamento e nell' apparecchiatura ..... una cameriera con una certa eleganza ci porta i cappotti al guardaroba ci accompagna al tavolo e ci mostra il menù. Personale molto preparato nella presentazione dei piatti e la scelta dei vini ...... abbiamo mangiato un menù di pesce e uno di carne entrambi ottimi. Pesce: antipasto insalata di polipo, primo di mare , secondo di branzino con verdure saltate - menù di carne: antipasto fagottini di bresaola di chianina ripieni di formaggi particolari e mostarda di pomodori verdi , tortelloni con fonduta di pecorino di fossa, filetto al chianti con patate arrosto , un ottimo vino di riserva toscano, e infine un ottimo assaggio di dolci accompagnati da un delizioso sherry invecchiato, cucina semplicemente squisita. Direi un ristorante veramente da ritornarci dove si sposa molto bene l atmosfera la professionalità e la cucina ,accompagnati da ottimi vini e la meravigliosa vista del Duomo di Firenze. Per quanto riguarda il conto molto proporzionato alla portata del posto e della cucina. Torneremo presto a trovarvi per vivere una dolce serata a lumè di candela nella bellissima Firenze ."
"ui_bubble_rating bubble_30","né caldo né freddo","Sono tornato al caminetto dopo diversi anni. Ho trovato cambiata la gestione. locale sempre pulito, accogliente, ordinato e invitante. Centralissimo. Servizio cortese. Cibi però senza personalità. Qualche innovazione (come la polenta con salsiccia e olio tartufato). I piatti della tradizione (come la ribollita),invece, mi hanno deluso: sciapi e freddi. Questa volta non ho mangiato la bistecca (una volta molto buona). Da approfondire."
"ui_bubble_rating bubble_50","Ad un passo dal Duomo, tutto ottimo tranne il prezzo (...per le nostre tasche)","In giro per Firenze, ci troviamo la sera a scegliere un posto dove fare cena. Passeggiando per i vicoli attorno al Duomo, ci troviamo all'entrata di questo ristorantino che subito attira la nostra curiosità. Ottima scelta direi. Abbiamo mangiato un'ottima fiorentina e dell'ottimo vino indicatoci dal cameriere (su mia richiesta low-budget hehehe), dei dolci superlativi ed un'accoglienza da ristorante superiore.Penso che il prezzo sia adeguato al servizio ed al cibo.Credo invece che sia un po caro il servizio 15% del totale del conto.Se dovessi tornare, si, avendo soldi ci tornerei molto volentieri."
"ui_bubble_rating bubble_50","Qualità ottima! ","Mi sono recata in questo luogo,trovato per caso camminando per le vie del centro, con mio moroso, . Siamo subito stati attratti dal menù molto invitante e caratteristico. Il locale si presenta molto accogliente, elegante e raffinato. Il personale è molto gentile e disponibile. Il servizio è stato molto veloce ed efficiente. I ravioli ricotta e spinaci con crema di pecorino romano e la Fiorentina erano semplicemente deliziosi. Consigliatissimo per la qualità dei piatti e per la posizione ottimale per visitare il centro.. Rapporto qualità prezzo leggermente superiore alla media..."
"ui_bubble_rating bubble_50","Natale a Firenze","Dopo molto tempo sono ritornata a Firenze con mia madre e il cane,siamo stati accolti molto bene e abbiamo mangiato benissimo dagli antipasti,ai primi ,alla favolosa fiorentina,ai contorni e al panforte fatto dalla casa. Ambiente accogliente ed elegante ,pulitissimo e i proprietari molto gentili.ottimo rapporto qualità prezzo.Ci rivredremo presto!!!"
"ui_bubble_rating bubble_40","Pranzo eccellente!!!","Abbiamo trovato questo ristorantino per caso e devo dire che è stata davvero una bellissima scoperta!!! Tutto buonissimo,primi ottimi!!! "
"ui_bubble_rating bubble_50","Ottimo rapporto qualità prezzo","Per amanti del cibo buono, di buona qualità, ben preparato da persone che mi vien da dire davvero conoscono e amano il cibo, prezzi più che onesti per la qualità proposta. Forse non indicato per chi è alla ricerca di tanto cibo per due soldi.Abbiamo mangiato in due e provato i crostini toscani e la vellutata di zucca (ottimi), tagliatelle e pici altrettanto buoni, buonissime patate al forno e il contorno di carciofi. Una portata meglio dell'altra, porzioni giuste.Ambiente elegante e piacevolmente rilassante, senza il vacuo snobismo di certi locali molto alla moda.. posizione centralissima, personale molto gentile. Quando mi capiterà di tornare a Firenze sarà molto in cima alla lista dei ristoranti dove sarò felice di tornare."
"ui_bubble_rating bubble_40","Fiorentina al bacio","Io e un gruppo di amici, abbiamo voluto fare capodanno a Firenze, e su consiglio di conoscenti siamo andati in questo ristorante. A due passi da piazza duomo; servizio fantastico, e fiorentina buonissima, servita con un ottimo Chianti. P.s. ci torneremo"
"ui_bubble_rating bubble_50","Mai mangiato cosí bene!","Squisito, tutto! Ci siamo stati la settimana scorsa, una giovane coppia per un anniversario, e per quanto il prezzo sia alto ne vale assolutamente la pena! La fiorentina é quello che é, favolosa ad un impatto visivo, figuriamoci per il palato... Poi i pici in ragù di cinghiale, presi perché ordinati dal nostro vicino, ed incuriositi da quel bel piatto abbiamo fatto lo stesso... Non ce ne siamo pentiti! L'antipasto, degustazione di salumi, poteva essere più abbondante per quanto lo si é pagato, ma non si può non dare il massimo dei voti per una cena come quella. Buonissimo!"
"ui_bubble_rating bubble_50","Superfiorentina ","Ristorante molto accogliente ed elegante in pieno centro. Ottimo servizio e personale gentile ma non invadente. Abbiamo preso due antipasti ottimi ed una Fiorentina per 2, eccezionale... Anche i dolci erano molto buoni. Unico consiglio di aggiungere qualche altra scelta nel menù dei dolci... Ci ritornerò "
"ui_bubble_rating bubble_40","Soft con gusto","Armonia e signorilità contraddistinguono questo locale vicino al duomo. Buona e varia la cucina, ottima la carta dei vini con scelte dai vini più accessibili ma di qualità ai più raffinati e costosi. Molto buoni alcuni piatti come le tagliatelle al tartufo o i ravioli in salsa di pecorino di fossa; tra ii secondi segnaliamo gli involtini ai carciofi e tutti i piatti di carne in genere. Buono il servizio. I tavoli sono ben distanziati. Da ritornarci per altre esperienze."
"ui_bubble_rating bubble_50","Tutto perfetto","Sono stata a cena con la mia famiglia lunedì sera e ci siamo trovati molto bene ottimo pranzo dall antipasto al dolce servizio molto buono gentili ci ritornerò nelle prossime visite a Firenze"
"ui_bubble_rating bubble_50","Un ristorante di charme con raffinata cucina fiorentina a dieci metri dal Duomo.... da non credere ma è tutto vero!","Una bomboniera calorosa, tavoli ben distanziati, servizio attento e discreto, molto accogliente il personale e i gestori. Per di più si mangia in maniera eccellente e a prezzi corretti. Consigliabile senza riserve. "
"ui_bubble_rating bubble_50","A due passi dal Duomo","Molto , molto elegante e curato nei minimi particolari è posto in zona centralissima . Il servizio è impeccabile , la gentilezza del cameriere nel riporre e poi porgere i soprabiti dopo averli accuratamente lasciati nel guardarobe da solo vale l'esperienza . Mi direte si ma veniamo al sodo ..............come si mangia ? Dire bene è poco, benissimo è altrettanto poco .....quindi dico eccellente e non temo smentita . Uno sformatino di carciofi come antipasto ed un piatto di sapori tipici toscani debitamente descritti, danno subito l'idea che ci si trovi nel posto giusto. Entrambe i piatti squisiti . Risotto rosmarino e gelatina di vino .............sublime ed altrettanto buono il rustico anelli con ceci e pancetta . Due ottimi calici di rosso completano il pranzo . Il 10% finale come costo del servizio lo reputo giusto per l'attenzione e la gentilezza ."
"ui_bubble_rating bubble_40","Fiorentina spettacolare","Ho mangiato con la mia ragazza durante un soggiorno a firenze. Ordino una fiorentina per 2 che era la fine del mondo cotta al punto giusto e un po speziata, la mia ragazza ordina polenta con salsiccia di cinghiale e olio tartufato che era buonissima servizio da ristorante di classe camerieri molto preparati non do 5 stelle perche ho chiesto un pezzetto di grana e l'ho pagato 3 € mi sembra eccessivo! "
"ui_bubble_rating bubble_40","Shopping per le vie di Firenze","Il ristorante si trova praticamente ai piedi del Duomo, molto curato negli arredi, personale cortese.Sono stato a Firenze con la mia compagna a fare un pò di acquisti per il Natale, ci siamo fermati in questo ristorante per puro caso. Appena entrati siamo stati accolti dal personale che subito ci ha portato nella sala dove ci hanno fatto scegliere il tavolo. Luogo davvero raffinato.Il cibo è molto curato e di ottima qualità, antipasti molto buoni, ho preso un primo di ravioli di pasta fatta in casa con ripieno di ricotta e spinaci il tutto ricoperto di un eccellente fonduta di formaggio pecorino D.O.P. assolutamente da provare!!!! La mia compagna ha optato per il secondo, tagliata di Chianina con patate e verdure...io non mangio carne, ma mi ha detto che era tenerissima e molto buona. Rifornitissima la lista dei vini, noi abbiamo preso un Chianti di ottima qualità. Ottimi i dolci preparati da loro e sempre freschi. Sicuramente un ristorante che val la pena di provare. Non ci si deve aspettare piatti con porzioni enormi....anzi.....ma ciò che si mangia è davvero di grande qualità e di ottimo gusto per il palato."
"ui_bubble_rating bubble_40","Buono,forse un pò caro","Di passaggio per la bella firenze per lavoro ho sostato in questo ristorante,antipasto toscano di buona qualità mentre hanno deluso un pò i fiori di zucca al pecorino con ristretta alla birra,forse troppo brodosi e amarognoli,di primo risotto con rosmarino e gelatina al chianti,discreto ma forse troppo asciutto(mancava un pò di burro e grana alla mantecazione)mentre ottime le tagliatelle al tartufo,con 2 bottiglie d' acqua,caffè e un calice di chianti 70 € in due forse sono tantini,ma il servizio è rapido e il personale gentile e pronto a fornire ogni spiegazione,nel complesso c' è di molto meglio ma firenze si sa che è cara,quindi può andare"
"ui_bubble_rating bubble_50","Tutto buono... molto buono","Abbiamo cenato qui di venerdì sera. Posto molto accogliente e tranquillo. Abbiamo mangiato un antipasto di bresaola e ricotta, molto buono (forse un po' troppa ricotta!), un crostino toscano, eccellente, fiori di zucca ripieni, molto buono; tagliatelle al ragù, buonissime; polpette con pomodoro, divine, e un'altro secondo con carne e patate veramente buono. Un tiramisù e una pannacotta squisiti. Rapporto qualità prezzo BUONO."
"ui_bubble_rating bubble_50","Sorpresa dietro l'angolo","Dietro il Duomo, in una piccola via laterale, si trova il ristorante Il caminetto, un gioiello della gastronomia toscana. Ambiente curato e raffinato. Ogni piatto è stato selezionato con accostamenti di sapori e prodotti di alta qualità. Ottimo rapporto qualità prezzo. Personale educato e discreto. Da provare i fagottini di bresaola con pecorino e salsa piccante ai pomodori verdi."
"ui_bubble_rating bubble_40","Tipica Cucina Toscana","Il locale e' raffinato, situato in una traversa di Piazza della Cattedrale Santa Maria del Fiore. Il personale molto professionale, sempre presente senza essere invadente. Ben scelta la musica di sottofondo, distensiva. Il menù e' molto ricco; con piatti tipici della cucina Toscana. Ho preso il formaggio Pecorino fritto con le pere: accostamento veramente azzeccato. Poi una buona Ribollita, tipica zuppa Fiorentina con cavolo nero, fagioli, verdure e pane. Condita con un filo di olio extravergine da agricoltura biologica della Fattoria I Veroni (un classico per veri intenditori!). Merita un aggettivo al superlativo il dessert: assortimento di cioccolatini accompagnati da Sherry Pedro Ximenez 'Toro Albala'' 1986 Gran Reserva. Unica nota bassa il pane, ma narri aspettata di meglio!"
"ui_bubble_rating bubble_50","Meraviglioso","Arrivato con il problema di dover cambiare mio figlio di due mesi, i gestori ci hanno preparato il comodissimo e pulitissimo bagno per poter cambiare il bambino sul tavolino dell'anti bagno. I gestori e la cameriera sono stupendi e mettono i clienti a proprio agio. Ci siamo fatti consigliare e abbiamo fatto benissimo. L'antipasto misto toscano era un film e il primo piatto, Pici al cinghiale, sono stati veramente ma veramente buoni. Prezzo assolutamente nella norma vista la posizione e l'eleganza del locale. Ci tornerò di sicuro."
"ui_bubble_rating bubble_40","Nella norma","Ho cenato con mia moglie in un week end di fine Ottobre,ho degustato un ottimo primo di paccheri ceci e verdura che consiglio a tutti.Qualità- prezzo non ci siamo"
"ui_bubble_rating bubble_40","Piacevole conferma","Buon ristorante di tradizione, con menù ispirato al territorio (non mancano le carni grigliate) ma, al tempo stesso, piacevolmente originale, grazie alla creatività degli chef ereditati dalla precedente gestione, che già mi aveva lasciato un ottimo ricordo (due esempi: gli involtini di bresaola con formaggio “spina di rospo” e mostarda piccante di pomodori verdi; il risotto al rosmarino con gelatina di vino e miele d’acacia). Il locale è raffinato senza incutere soggezione e il personale è accogliente e garbato. Oltre alle carni grigliate, è possibile mangiare un ottimo filetto al chianti o un abbondante ossobuco con patate in umido, oltre ad alcune portate a base di pesce.Buona carta dei vini, con possibilità di ordinazioni “al calice” sia per i bianchi sia per i rossi, con scelta, in questi casi, limitata a poche ma buone etichette.Nella carta dei dolci è presente anche un’interessante selezione di cioccolatini accompagnati da liquore e, al momento del conto, viene offerta una fettina di arancia candita bagnata nella cioccolata fondente. I prezzi sono più che ragionevoli, considerando anche la posizione del ristorante, a pochi metri dalla Cattedrale di Santa Maria del Fiore e dal Campanile di Giotto."
"ui_bubble_rating bubble_50","Qualità, gentilezza e simpatia!","Puoi scegliere quello che vuoi... Non sbagli mai! Piatti della tradizione Toscana impeccabili, ma la cucina non ha confini territoriali "
"ui_bubble_rating bubble_40","Piacevole conferma!","Sono tornato la seconda volta a novembre 2014 in questo ristorante storico di Firenze dove l'accoglienza la cortesia e la bontà del cibo fa da padrona. Abbiamo preso antipasti toscani per tutti anzi affettati misti eccellenti, come primo ho preso tagliatelle al tartufo, ottime. Il secondo prevedeva tagliata per tutti con funghi porcini anch'essa molto buona ma non potetti bere vino. Per il dolce ero già pieno.Prezzo € 50,00 che per la qualità del cibo e la location non sono troppi.Se mi capita ci ritorno."
"ui_bubble_rating bubble_50","Ottima cena","Bel locale, buoni i piatti, molto curati e gentile il personale. Buon rapporto qualità prezzo. Consigliatissimo per una cena speciale!!"
"ui_bubble_rating bubble_30","Cucina con gentilezza","Abbiamo cenato in questo locale carino in occasione di una visita alla città...situato in pieno centro, accolti con sorriso e gentilezza dalla titolare...i piatti sapientemente cucinati, solo purtroppo un brutto intoppo con il piatto ai Pici senesi ai funghi porcini......il cuoco con tutta probabilità non ha assaggiato la pasta, che è arrivata durissima e collosa in bocca, con un'esagerazione di funghi...mi è sembrato di mangiare del sugo con pasta......peccato, perchè per il resto è andato tutto bene...."
"ui_bubble_rating bubble_40","Pranzo Fiorentino!","Accoglienza calorosa da parte di colui, che io credo, esser il titolare, superato il corridoio ci fanno subito accomodare.Iniziamo con un tagliere di formaggi accompagnato da miele d’acero. Eccelsi, sette tipi diversi in scala dal gusto più delicato a quello più forte con tanto di spiegazione del cameriere. Per continuare, io prendo un piatto di Paccheri pancetta e formaggio, e lei Pappardelle con capesante il tutto accompagnato da un rosso di Montalcino. Così come prima, veloci nella preparazione ci si presentano due piatti niente male. Gusti decisi che tuttavia esaltano il tipo di pasta scelta. Ingredienti chiaramente di prima scelta. Concludiamo il pranzo con un assaggio di diversi cioccolati ed un bicchiere di vino liquoroso dolce.Soddisfatti ci avviamo a pagare.Badate bene, non dico di aver speso poco, ma per la posizione, la qualità del cibo, la quantità e la gentilezza nel servizio offerto, sono rimasto sorpreso. Molto. Un ottimo rapporto qualità prezzo. Pertanto mi sento di consigliarlo senza riserve!Complimenti allo staff!"
"ui_bubble_rating bubble_40","la tradizione","Locale tradizionale che non tradisce le aspettative.Personale cordiale e molto qualificato cosi come l'ambiente curatissimo e molto tranquillo. Piatti anche ricercati con ingredienti di primordine perlopiu locali. Curata la carta dei vini e soprattutto appropriata ai piatti serviti. Il conto finale un po sopra la media e' comunque adeguato al servizio offerto. Da consigliare per un evento speciale."
"ui_bubble_rating bubble_50","Piccola stradina, grande scoperta!","In una stradina in centro abbiamo trovato questo fantastico ristorante. Menu eccellente e cibo ancora meglio. Tutto preparato e presentato a 5 stelle. Vino consigliato alla perfezione. Dolci da morire…intendo buonissimi!! Senza dubbi la prossima volta che vado a Firenze mangerò qui!! "
"ui_bubble_rating bubble_50","ottima cena ad ottimo prezzo","ottimo servizio - le posate d'argento erano anni che non le vedevo in un ristorante-servizio eccellente-mozzarella deliziosa-pici deliziosi- il secondo lo aspettavo diverso comunque buonograzie e sicuramente tornero' ancora a gustare quei Pici meravigliosiClaudio"
"ui_bubble_rating bubble_50","Viva il buon gusto","Un posto molto tranquillo con una splendida vista dove assaporare ottimi piatti, ci tornerò sicuramente e lo consiglio a tutti"
"ui_bubble_rating bubble_40","Ottima soluzione in pieno centro","Arrivo al ristorante tramite le positive recensioni di Trip Advisor e la vicinanza al Duomo è tale che mi sembra impossibile non prendere una fregatura. Il giudizio è invece molto positivo: ero con i miei due bambini di 5 e 7 anni che hanno preso delle orecchiette al ragù davvero buone, io ho scelto una fiorentina piccola con contorno e un calice di Chianti. Servizio molto veloce in un ambiente pulito e fresco. Prezzo medio (55€) ma la posizione è davvero strategica."
"ui_bubble_rating bubble_50","Buonissimo evasione dai soliti posti turistici","Il locale è proprio dietro al duomo in posizione tranquilla. Arredamento curato e confortevole. Si mangia molto bene e il servizio è molto cortese !Consigliato !!"
"ui_bubble_rating bubble_40","Tutto buonissimo!!","Siamo stati a Firenze un weekend.. Eravamo indecisi dove andare a mangiare sabato sera..sapevamo solo che volevamo mangiare la Fiorentina..:) beh che dire.. Venendo al caminetto ci abbiamo preso!! Abbiamo preso come antipasto i fiori di zucca ripieni con la ricotta (divisi in 2), come primo le tagliatelle al tartufo (anche questo diviso in 2 e veramente squisito!) e per finire la Fiorentina per 2 persona, buonissima e tenerissima, presa ovviamente al sangue come cottura..:) siamo rimasti soddisfatti di tutto dall'antipasto al dolce..:) come rapporto qualità prezzo siamo nella norma, non aspettatevi di spendere poco se prendete tartufo e fiorentina, ma ne vale veramente la pena!!!;) personale molto cortese! Consigliamo!!!"
"ui_bubble_rating bubble_50","Sempre meglio","E' la terza volta che torno in questo ristorante, e lo apprezzo sempre di più. Ho assaggiato della pasta fresca eccellente con capesante e mandorle. Un piatto di formaggi che mi hanno colpito per la loro unicità. Come dolce ho scelto un millefoglie di ricotta, che mi ha riportato ad un mio recente soggiorno in Sicilia. Giusta anche l'offerta dei vini al calice.Il servizio come le volte precedenti è stato impeccabile. Scrivo poco su T.A. ma curiosando fra le altre recensioni, pur se di questo ristorante ne ho già fatta una, vedendo che qualcuno ha avuto il coraggio di definirlo turistico, mi è parso doveroso scriverne un'altra. Perché è giusto riconoscere la qualità, a chi, una volta tanto, davvero la propone."
"ui_bubble_rating bubble_30","Tutistico","Turistico, ma giustificato dalla posizione vista Duomo. Un po' esoso rispetto alla qualità. Servizio un po' lento. Cortese il personale."
"ui_bubble_rating bubble_50","Ottimo ","Antipasti e primi piatti ottimi, tagliata di manzo perfetta, ottimo servizio, prodotti vari (olio, pane) di qualità, prezzi congrui. "
"ui_bubble_rating bubble_30","Cenetta a firenze","ci siamo fermati in questo ristorantino molto carino e tipico del fiorentino. Siamo stati accolti molto bene con un tavolo per 2 in veranda. Servizio molto lento e primi piatti ( abbiamo preso 2 piatti di pasta ) buoni ma salatissimi. Il conto è arrivato dopo 3 - 4 volte che abbiamo sollecitato il cameriere a portarcelo e ciò non è stato il massimo del piacere."
"ui_bubble_rating bubble_50","eccellente, non turistico","Nonostante la posizione possa far credere di trovarsi davanti ad un ristorante per turisti, questo non lo è. Il cibo è realmente eccellente e ricercato, senza essere pretenzioso. Buono davvero, per dare soddisfazione ad anima e palato. Ho cenato qui il 22 giugno insieme a mio marito. Abbiamo preso pappa al pomodoro, tagliatelle al tartufo, millefoglie di vitella patate e salvia e straccetti di Chianina con funghi porcini. Tutto ottimo, ma le tagliatelle al tartufo erano veramente speciali. Un plauso al proprietario, gentile, affabile, discreto ma estremamente attento al cliente. Ci tornerò. "
"ui_bubble_rating bubble_50","Mi è piaciuto ","Posizione invidiabile. Praticamente sotto il Duomo di Firenze. Titolari simpatici e cortesi. Ambiente curato e gradevole. Non dà affatto l'impressione del locale turistico nonostante la location. A fianco al nostro tavolo c'erano dei clienti toscani (ottimo segnale di qualità del locale).Abbiamo mangiato benissimo. Lo consiglio "
