"Restaurant_Ratings","Restaurant_Quotes","Restaurant_Reviews"
"ui_bubble_rating bubble_50","Che volere di più ?","Un week end a Firenze degnamente concluso con una cena e una fiorentina eccezionali, locali o piccolo ma molto accogliente, grande cordialità, ottima qualità dei cibi e soprattutto ottimo rapporto qualità prezzo. "
"ui_bubble_rating bubble_40","Piccolo ma buonissimo!","Ci sono stato a cena con la mia ragazza,subito dopo che cel hanno consigliato. Appena entrati si notano i pochi posti ma le facce soddisfatte di chi gia sta mangiando! tutto ottimo dall'antipasto al dolce senza dimenticarci del vino! complimenti!!"
"ui_bubble_rating bubble_40","Ottima cucina- ottima cordialità","Siamo tornati a pranzo ben due volte in questa trattoria la quale ci ha sorpreso con la sua cordialità e ottima cucina.Non appena si entra è veloce notare i pochissimi coperti che può ospitare.Ottima accoglienza, Buonissima cucina.Ottimo rapporto qualità prezzola consiglio per chi ha voglia di fare un abbondante mangiata in buona compagnia e spender poco.....Grazie"
"ui_bubble_rating bubble_50","Esperienza Mistica","Racchiuderei la mia recensione in queste due semplici parole: esperienza mistica!Non solo per la carne, di ottima qualità e cotta al punto giusto, ma anche per la cortesia e la simpatia dello staff! Ambiente assolutamente informale, ma che promette piatti semplici e di alta qualità. Prezzi? Assolutamente nella media, si paga il giusto e si esce dal locale più che soddisfatti. Insomma, spero di ritornarci presto!"
"ui_bubble_rating bubble_40","Bravi","Cibo buono a prezzi economicissimi. Persone molto simpatiche e che creano un ambiente familiare. Hai la sensazione di stare a casa di amici e non in un ristorante in centro a Firenze. Spero che crescano e possano anche ingrandire un pò il locale che ora è molto piccolo, ma assolutamente decente. Bravi!"
"ui_bubble_rating bubble_50","Semplicemente fantastico!","Qui si mangia una delle migliori fiorentine di Firenze! Il locale è piccolo ma carino, molto familiare e semplice. Semplice ma estremamente gustoso anche il menù, in cui la fiorentina domina! Il personale è molto gentile e davvero simpatico.Al momento del conto...ecco la sorpresa...abbiamo speso incredibilemnte poco per aver mangiato come secondo una bistecca da 2 kg!Consigliatissimo...in pieno centro a Firenze."
"ui_bubble_rating bubble_40","ottimo","molto bene il rapporto qualità-prezzo e il menù finalmente toscano d.o.c.! personale molto cortese, tornerei sicuramente evitando questa volta il locale vicino L' Antico Mercato che nonostante molte ottime recensioni su Tripadvisor è stata una vera delusione"
"ui_bubble_rating bubble_40","Un bel mix siculo-toscano","Il locale è una piccola trattoria non lontano da San Lorenzo in una zona che in verità non è delle migliori. Ma è davvero un buona trattoria dove alla cucina tradizionale toscana si uniscono elementi della cucina siciliana, con risultati niente male. Conviene prenotare, soprattutto il sabato; il locale è sempre pieno. I cibi che abbiamo preso (antipasto siciliano, melanzane in umido, zuppa di cavolo e fagioli e ravioli con cernia e totano) erano in porzioni abbondanti e ben presentati. Il servizio è stato ottimo. I prezzi contenuti. Unica nota stonata il dolce: i profiteroles che abbiamo preso al termine non erano esattamente all'altezza del resto della cena. In ogni caso lo consigliamo e pensiamo di tornare, magari per assaggiare la carne..."
"ui_bubble_rating bubble_40","Cucina tipica!!!","Trattoria tipica, locale piccolo e semplice. Se cercate il lusso siete sicuramente nel posto sbagliato. Piatti tipici della tradizione toscana con qualche contaminazione siciliana. La fiorentina da 1.3 kg te la mostrano cruda per avere la tua approvazione. Io ho mangiato pappa al pomodoro e bollito di lingua, zampone e spalla (avevo ordinato trippa alla fiorentina ma purtroppo era finita). Tutto molto buono. Menù prevalentemente a base di carne, praticamente zero pesce. Prezzi ottimi: 30 euro totali per un antipasto, due primi, un secondo, un dolce, un'acqua da 50 e un bicchiere di chianti. Uniche piccole pecche un bagno decisamente maleodorante e una finestrella rotta da cui entrava un gran freddo."
"ui_bubble_rating bubble_40","Una vera trattoria","Rapporto qualità prezzo imbattibile.. Una porzione di crostini toscani 4 euro, crostini con il lardo 5€ e una grigliata mista per 2 20€. Gestita da ragazzi alla mano e simpatici che mentre lavorano cantano de andrè e mannarino. Consigliato vivamente! "
"ui_bubble_rating bubble_40","Mi sento a casa","Mi trovavo a Firenze per il capodanno, ho trovato posto in questa trattoria, piccolina credo neanche 50 posti, piuttosto casareccia... Ottimo cenone(misto carne e pesce) ad un prezzo accettabile, solo le lenticchie un po' scondite x i miei gusti. Cameriere simpaticissimo! Piccola pecca, il caffè bisogna prenderlo nel bar dall altra parte della strada"
"ui_bubble_rating bubble_50","ottimo","sono capitata per caso in questo ristorante con mia figlia ed è stata un'autentica sorpresa: atmosfera simpatica e casalinga, cucina ottima, personale simpaticissimo. Per me che amo gli animali vedere un avventore con cane sotto il tavolo è stato il massimo. Eravamo state per il pranzo, siamo tornate anche a cena,abbiamo trovato posto senza prenotare, ho capito dopo che eravamo state molto fortunate.Da consigliare senza alcun dubbio"
"ui_bubble_rating bubble_50","Ottimo cibo e molta cordialità","Un locale con pochi poste a sedere molto caratteristico, ci sono stato per capodanno, eravamo in 6 e con 60€ abbiamo mangiato fino a scoppiare... tra l'altro cibo ottimo! Se non fossi stato così pieno al terzo primo me la sarei gustata appieno! Anche un servizio eccezionale, il cameriere è gentilissimo ed in più simpaticissimo anche per via del meraviglioso dialetto toscano!"
"ui_bubble_rating bubble_50","CONSIGLIATISSIMO","durante il mio soggiorno a Firenze ho mangiato due volte in questo locale.l'ambiente è rustico, molto accogliente e il personale è molto gentile e simpatico.ci sono 32 posti quindi è consigliabile prenotare.il menù varia ogni giorno ma ci sono diversi piatti tra cui scegliere, anche vegetariani.le porzioni sono davvero abbondanti e il prezzo può andare dai 10 ai 20€.consigliatissimo!"
"ui_bubble_rating bubble_50","fantastico!","il patron-chef della trattoria è un siciliano di estrema simpatia e cordialità. E' lui a portare al cliente la bisteccona fiorentina da 1,3 kg ancora cruda sul tagliere in modo da mostrargli cosa gusterà dopo...E la bistecca è davvero di elevatissima qualità: carne saporitissima, frollata alla perfezione tanto da essere morbida e succulenta, cucinata come si deve. Il menù offre altri piatti tipici fiorentini e qualcosa della tradizione siciliana. Tutto quello che abbiamo provato era davvero ottimo. Eccellente nella sua semplicità la fettunta, una fetta di pane toscano abbrustolito irrorato di olio evo nuovo, con origano, aglio, sale e peperoncino...buonissima! ma poi i classici crostini toscani, la trippa, etc...e infine i dolci, con netta impronta siciliana. L'atmosfera è quello delle trattorie genuine, dove si cucina come si cucina a casa, e dove chef e camerieri creano un ambiente famigliare senza mai essere invadenti con i clienti che siedono a stretto contatto nel piccolissimo locale che conta forse 40 posti a sedere. Unica neo, la posizione non è il massimo a Firenze...consiglio di prenotare e di essere puntuali!Ottimo il rapporto qualità prezzo."
"ui_bubble_rating bubble_40","Gusto autentico","Siamo stati nella trattoria la burrasca qualche giorno fa su indicazione del gestore del nostro hotel a Firenze. Il locale e` molto piccolo ma subito ci sente a proprio agio anche se a stretto contatto con gli altri commensali. Il menu propone vari piatti della tradizione toscana semplici ma buoni. Regna sovrana la carne molto buona. Una buona scelta di rossi toscani corposi e profumati allietano l'esperienza gastronomica che sazia ma non strazia il che e'anche importante"
"ui_bubble_rating bubble_50","Tipico e gentilissimi","Ci siamo arrivati per caso cercando un locale dove cenare non volendo spendere troppo. Siamo rimasti entusiasti. Una tipica osteria con personale simpaticissimo e cortese; ci si sente a casa. Piatti ottimi ed abbondanti, bistecca superlativa. E il rapporto qualità prezzo ottimo (si è a pochi passi dal Duomo). Consigliato a tutti."
"ui_bubble_rating bubble_40","Difficile trovar posto, ma valido davvero","Senza prenotare, impensabile trovar posto. Stavolta ce l'abbiamo fatta, e ne è valsa davvero la pena: clima amichevole e cordiale, atmosfera intima e raccolta, da trattoria tipica di una volta, servizio disponibile e veloce, senza metter fretta a chi è seduto.Abbiamo preso un antipasto (crostini con lardo e toscano classico, tutti validi) e poi una bistecca da 2 kg in 3, con 2 lt di Chianti della casa: ottima la presentazione (te la fanno vedere per approvazione prima di cuocerla) e ottima davvero anche da mangiare: razza francese allevata in Italia, tenerissima, si scioglie in bocca.. alta, cotta al punto giusto (cioè poco) e molto saporita. Valida davvero!Unica pecca, il prezzo: abbiamo speso 40 Euro a testa, la carne era valida ma secondo me il prezzo consono sarebbe stato al max 35."
"ui_bubble_rating bubble_50","DA CONSIGLIARE","Veramente ineccepibile! dal servizio, alla qualità alla simpatia del proprietario. Da consigliare sicuramente a chi visiterà Firenze. Un rapporto qualità/prezzo che al centro di Firenze credo sia introvabile... Complimenti!"
"ui_bubble_rating bubble_50","Eccellente","Complimenti ad Elio, di cui conosco da anni la passione e l'esperienza per la cucina. Ed i risultati non possono che essere eccellenti, per la qualità degli ingredienti, la sapienza nel cucinarli, la simpatia nel farti sentire a casa tua. Roberto"
"ui_bubble_rating bubble_40","ottima cena sera di natale","abbiamo mangiato in questa piccola osteria la sera di Natale: crostini toscani, ribollita, fiorentina cantucci e cannolo siciliano ( parte dello staff è siciliano); tutto ottimo e staff giovane e simpatico.Per noi molto importante siamo potuti entrare con il nostro cocker Teo che dopo cena ha molto apprezzato un pò di fiorentina."
"ui_bubble_rating bubble_50","Spettacolare!","Sono rimasta incantata! L'atmosfera è molto calda, come essere a casa, l' arredamento è quello tipico di un'osteria!! Il proprietario penso sia la persona più simpatica della terra, disponibilissimo e gentile! La bistecca è squisita e ben cotta, gli antipasti tipici e ricchi! Da provare assolutamente! "
"ui_bubble_rating bubble_40","Ottime specialità toscane","Personale piacevole, servizio ottimo, menu ricco e piatti deliziosi!!!!! Da tornarci, è anche molto economico!"
"ui_bubble_rating bubble_50","Very good!!!","Complimenti per le pietanze allo CHEF CLAUDIO (trippa, spezzatino e crostoni superbi) e per il servizio, gentilezza e SIMPATIA a Thomas..... Grazie mille!! Grandi!!!"
"ui_bubble_rating bubble_50","non lo cambierei per nulla al mondo","Chi andrà alla Burrasca troverà una piccola locanda con circa 30 posti a sedere, tra l' altro non estremamente comodi, ma con la fila alla porta perchè come si mangia in questa locanda non si mangia da nessuna altra parte di Firenze centro. Il menù cambia ogni giorno e la cucina è basata su piatti semplici, stagionali e tipici fiorentini. Vado a Firenze in gita con la mia famiglia due volte l' anno e ogni volta che ho provato a cambiare ristorante, magari su consiglio di amici e conoscenti, me ne sono sempre pentito.Il rapporto prezzo/qualità non ha eguali (stiamo parlando di un ristorante nel centro di Firenze a 300 mt da piazza del Duomo) ad esempio per 4 antipasti, 4 primi, 4 secondi, 4 contorni acqua, vino e qualche dolce noi non abbiamo mai speso più di 100 euro. Come portate assolutamente da non perdere: i rigatoni con il ragù in bianco, il fegato alle cipolle, l' ossobuco, disossata al lardo e chiaramente la bistecca alla fiorentina........ricordatevi di prenotare prima o non troverete posto!!"
"ui_bubble_rating bubble_50","Tutto perfetto","Ci siamo andati per la bistecca e non siamo usciti delusi: tenera e cotta alla perfezione. Ma aggiungo la piacevolezza dell'atmosfera, la simpatia del personale e non ultima la correttenza del consigliare in abbinamento un ottimo Chianti base dal ricarico minimo (quando potevano spingere per prodotti più blasonati e costosi). Il prezzo assolutamente onesto. Da tornarci sicuramente. E' piccolo, prenotate.P.s. hanno anche la specialità della bistecca fritta, da ordinare il giorno prima. Forse un po' pesante da sola per cena, ma interessante come sfizio da dividere per un tavolo di amici."
"ui_bubble_rating bubble_50","super fiorentina in una vera osteria","la cena in questo locale all'insegna della cucina tipica toscana è stata davvero un'ottima esprienza!il locale rustico davvero molto carino,i gestori molto simpatici anche loro ovviamente fiorentini.la carne ottima e l'antipasto molto buono.i prezzi non bassissimi,ma onesti per la qualitá (un antipasto toscano, una fiorentina da 1,100 kg 1/2 l di chianti, dolce e caffè 63 ? in 2)la zona non è centralissima, ma a 10 minuti si è in centro.consigliatissima la prenotazione"
"ui_bubble_rating bubble_40","Piccolo e accogliente","Scelto da TripAdvisor, non ha tradito le nostre aspettative.Ottime fettuccine...tagliatelle...Buona la carne, ottimo rapporto qualità prezzo.Consigliato ??SI !!"
"ui_bubble_rating bubble_50","incredibile","quello che vorresti sempre trovare ! ottima la ribollita lo spezzatino il fegato. tutto concentrato in 30 mq. ma il numero di avventori fiorentini, in particolare, e stranieri e da grande ristorazione !! "
"ui_bubble_rating bubble_50","spettacolo","Siamo stati in questo piccola trattoria vicino al mercato coperto, il posto è piccolo ma molto accogliente. Il proprietario è stato subito molto cordiale e gentile, abbiamo ordinato piatti tipici fiorentini tra cui la ribollita, bistecche, bruschette, cantucci con vinsanto etc. accompagnato a dell'ottimo vino, tutto veramente molto buono e molto genuino .E' un ristorante che sento veramente di consigliare anche per l'eccellente rapporto qualità prezzo. Ragazzi andate sempre avanti così semplicità e passione per il proprio lavoro sono gli ingredienti fondamentali.Grazie per il ricordo che ci avete lasciato di Firenze."
"ui_bubble_rating bubble_50","Pranzo eccellente!!!!!!","Il locale è situato proprio nel centro di Firenze, vicino al mercato centrale...è molto carino come posto...piccolo, rustico ma accogliente!!! Il titolare è davvero gentile e cordiale e ti mette subito a tuo agio...il menù è tipicamente toscano e accontenta un po' tutti i gusti...le porzioni sono molto abbondanti e poi se si vuole assaggiare un'ottima fiorentina questo è davvero il posto giusto!!!! Buonissimo anche il vino della casa!!! Rapporto qualità prezzo davvero ottimo!!!"
"ui_bubble_rating bubble_50","che gradita BURRASCA","ieri sera (sabato 24 novembre 2012) con delle amiche abbiamo prenotato un tavolo al ristorante la burrasca a Firenze in via Panicale. Ci eravamo gia' state, per caso, l' anno scorso ed avevamo notato che non era il classico ristorante da turisti ma anche per noi fiorentini. Ieri sera ne abbiamo avuto la conferma: ottima accoglienza, tutto molto buono e genuino dagli antipasti al dolce, abbiamo anche visto passare delle discrete fiorentine e nulla da ridire per quanto riguarda qualita'/prezzo ..... che dire? ..... nessun' altra BURRASCA è stata piu' gradita!!!"
"ui_bubble_rating bubble_50","Buonissimo","Tutto molto buono, dalla semplice organizzazione ai piatti dal primo al secondo al contorno.Consiglio di provare le bruschette con il pommodoro"
"ui_bubble_rating bubble_40","Una bella scoperta!","Sono stata per caso in questa trattoria fiorentina e sono proprio rimasta soddisfatta: hanno portato dei buoni antipasti, tipici fiorentini, ma quello che mi è rimasto impresso è il pepato!Saporitissimo!e la carne era morbida. Chi era con me ha mangiato la fiorentina ed è rimasto contento. Il gestore è disponibilissimo, si è anche fermato a spiegarmi la ricetta del pepato!Il prezzo ci è sembrato giusto, non mi ricordo esattamente, ma sicuramente sotto i 50 euro in due, con antipasti, 2 secondi, dolce vino e caffè."
"ui_bubble_rating bubble_40","Mille di queste burrasche!","Ristorante piccolo ma caldo e accogliente. Il servizio è ottimo: gentilezza e cortesia. Cucina deliziosa e ottimo rapporto qualità/prezzo. Ideale per gite in giornata, vicinissimo alla stazione con la possibilità di un ultimo splendido passaggio per Santa Maria Novella. "
"ui_bubble_rating bubble_50","Fiorentina Ottima ed a buon mercato","Siamo riusciti a mangiare una fiorentina davvero ottima, gli antipasti non ci hanno entusiasmato. Il ristorante ha prezzi molto bassi, per 2 antipasti, 1 fiorentina, 2 dolci, vino della casa e acqua 50 euro totale. La zona non è delle migliori."
"ui_bubble_rating bubble_50","Fiorentina squisita !!!","Piccolo ristorante ma si mangia benissimo. Lo consiglirei Soprattutto a chi vuole gustare un 'ottima carne!"
"ui_bubble_rating bubble_50","gusto atmosfera e simpatia!","locale tipico in una via abbastanza centrale vicino al mercato nuovo.Ambiente piccolo non certo raffinato ma autentico(si è in zona storica ma meno battuta dal turismo).Ci siamo ritornati sia per la qualità del cibo che per la simpatia del personale.la prima sera con due antipasti ,due zuppe,una tagliata con i fagioli e mezza di chianti e1l di acqua abbiamo speso45 euro,la seconda sera ci siamo cimentati con una fiorentina da1,2kg (in due!), patate arrosto e verdure in umido , due generose porzioni di cantucci con un ottimo vinsanto, vino ed acqua ce la siamo cavata con 58 euro,Assolutamente da prenotare se non si vuole aspettare per ore.Unico neo:la porta che chiude male e al 3 di novembre può dare fastidio"
"ui_bubble_rating bubble_30","Una cena piacevole","Ci siamo fidati delle recensioni degli amici di tripadvisor! Abbiamo fatto bene in quanto la cena in questa piccola trattoria, occorre prenotare altrimenti si rischia di rimaneri fuori, è stata piacevole. Il locale è piccolo e non bisogna aspettarsi troppo dall'ambiente: è una trattoria dotata di una sola sala e di una dozzina di tavoli. Molti turisti ma anche molti fiorentini. Il cibo è buono ed il servizio abbastanza veloce. Il prezzo è adeguato."
"ui_bubble_rating bubble_40","Vero toscano","Ristorante tipico in centro Firenze vicino al mercato. L'interno è molto semplice ma proprio per questo promette una cucina verace. Eravamo in quattro e cercavamo una trattoria tipica, ma non di quelle troppo turistiche, e siamo rimasti completamente soddisfatti. Senza prenotazione abbiamo aspettato però una mezz'ora fuori e il tempo non era certo dei migliori. Il personale è molto gentile e ti sa ben consigliare. Abbiamo mangiato crostini toscani, antipasti misti , ribollite e soprattutto una fiorentina eccellente. Anche il conto finale è stato una piacevole sorpresa. Lo consiglio decisamente."
"ui_bubble_rating bubble_50","ECCELLENTE!!","Osteria nascosta in una via parallela a via Nazionale, da fuori non sembra niente di eccezionale, ma leggendo i commenti mi sono fatto avanti!! Decisione + che giusta!! l'ambiente è piccolo e è necessario prenotare, il personale è gentilissimo, i piatti sono preparati con grande cura nei giusti e studiati ingredienti, è uno dei pochi posti dove ho chiesto di parlare con il cuoco per complimentarmi e chiedere cosa ci avesse messo per renderlo così buono. La BISTECCA è il piatto forte, sinceramente una delle migliori mai mangiate, e vi posso garantire che sono un amante della ciccia. Ottime anche le tagliate! A fine cena parlando con il proprietario, nonchè cuoco ho capito tutto! L'amore per quello che fanno è tutto e si vede e si sente!!Consiglio a Tutti questo posto, ECCELLENTE il mio giudizio in tutto, anche nel prezzo onestissimo."
"ui_bubble_rating bubble_50","Autenticità","Classica osteria toscana, molto caratteristica.Personale cordialissimo, allegro e disponibile.Piatti saporiti.2 antipasti, 2 secondi e contorni, vino e acqua 40€ in dueA 2 passi dal mercato di San Lorenzo.Consigliatissimo!"
"ui_bubble_rating bubble_40","Week end a Firenze","Ambiente familiare e accogliente, personale gentile, affabile e disponibile. Il locale è piccolo ma l'atmosfera è tipica e piacevole, un po' d'altri tempi. Qualità del cibo ottima, piatti autentici e genuini, abbiamo mangiato una fiorentina deliziosa. Eravamo in 6 e abbiamo preso: 6 antipasti, 6 ribollite, una fiorentina da 1,5kg, 6 dolci, 2l di chianti sfuso e 2l di acqua; abbiamo speso in tutto 170 (quindi meno di 30 euro a testa).Consigliato sicuramente, comoda e suggestiva anche la posizione in pieno centro."
"ui_bubble_rating bubble_50","La semplicità dei sapori toscani","Ciao a tutti! Ho vissuto questa bellissima esperienza per il mio palato all'Osteria La Burrasca.Posti a sedere pochissimi,men di 40.Classica Osteria toscana, tavolini piccoli di legno, tovagliette di carta gialla e pietra a vista alle pareti. Il locale è frequentato anche a pranzo, da gente del posto, oltre ai turisti, e mi è parso di capire che abbia una buona clientela selezionata. Io ho preso una ribollita *** ottima *** .. l'olio utilizzato è saporito e si nota che è di matrice doc. Consiglio anche la tagliata di pollo alle erbe per chi ama stare leggero come me..una cosa sublime, saporitissima, (per essere del pollo cmq gustoso).Il mix di erbette è tanto misterioso quanto azzeccatissimo per esaltare il pollo che di per sè non è una carne particolarmente decisa. Poi abbiamo ordinato la Bistecca alla fiorentina ..ci hanno fatto scegliere il taglio (circa 8 hg, meno è difficile visto che deve essere spessa almeno 5 cm).Non vi azzardate a chiedere il tipo di cottura: è solo al sangue, quindi rimane rosa all'interno , morbidissima, e la parte esterna giustamente scottata .Il proprietario , un ragazzo giovane e affabile, ci ha dato anche consigli di cottura! Come contorno abbiamo preso patate a formaggio, discreto come contorno ma nulla di esaltante. Vino sfuso della casa, grappina offerta dalla casa che fa sempre piacere, per un pranzetto con i fiocchi e spesa modica (entro 60 € per 2 persone). Faccio notare come in cucina si abbondi particolarmente di olio (buonissimo comunque, è una piacere fare anche la scarpetta).Che dire, da tornarci per un altro bel viaggio !"
"ui_bubble_rating bubble_50","Da ritornare!","Trovato tramite tripadvisor e scelto grazie alle altre recensioni...non ha deluso le aspettative. Ambiente piccolo e familiare, tavoli molto vicini ma tipici in questo tipo di trattorie dove trovi la vera Firenze. Personale disponibile e ricco di allegria Toscana coinvolgente (Thomas). Piatti della cucina tradizionale Toscana saporiti e gustosi apprezzati anche dalla bimba di 16 mesi. In particolare la pappa al pomodoro e la ribollita. Attrezzati con seggiolone. Data la dimensione del locale, consiglio di prenotare."
"ui_bubble_rating bubble_40","come a casa","Ero a Firenze per il mio anniversario di matrimonio ed ho scoperto questo ristorante leggendo le altre recensioni su trip advisor. Serata veramente piacevole, infatti a distanza di una settimana ci sono tornato per due sere di seguito visto che ero a Firnze per lavoro. I piatti tutti veramente buoni, il servizio celere, i proprietari gentili e disponibili ed i prezzi veramente abbordabili. Con mia moglie antipasto toscano, grigliata mista di carne per due, contorni, acqua, 1/2 lt di vino della casa e un dolce, 35,00 euro. Prenotate o andate presto.Paolo"
"ui_bubble_rating bubble_40","tipico e buono","Accogliente ristorante in centro a firenze dove abbiamo mangiato (eravamo in 4) un antipasto tipico toscano, una lombata alla griglia, una fiorentina di 1,600 kg divisa in tre, un contorno di patate al pepe nero, acqua e una bottiglia di morellino di scansano con etichetta, spendendo quasi 30 euro a testa. La carne è stata buonissima, i proprietari sono simpatici, il locale piccolo ma caratteristico! Da provare aasolutamente se siete in visita a Firenze."
"ui_bubble_rating bubble_50","Ottimo","Serata bellissima,io e la mia fidanzata,in un locale dove l'attenzione per il cliente fa la differenza.Abbiamo mangiato benissimo: 2 primi,1 secondo di carne (abbondante) da dividere,dolce (torta ricotta e pere da 10 e lode!!!) digestivo: 32€.Cosa dire di più?Semplicemente consigliatissimo."
"ui_bubble_rating bubble_40","Simpatia e schiettezza","Ultimo giorno a Firenze, poco prima della partenza, consulto al volo TA, visto che siamo in una zona che abbiamo battuto poco. Trovo la Burrasca e mi ci fiondo con la famigliola. Ambiente informale, di quelli che ti rilassano appena entri; siamo un pò stanchi e non possiamo mangiar troppo, saltiamo gli antipasti e andiamo ai primi; buoni i pici alla carrettiera di mio figlio, io mi faccio prendere dalla gola e prendo pici alla carbonara...bbooniii!! Mia moglie ha apprezzato molto l'insalatona, arricchita con deliziosi pachini secchi e olive. Da un tavolo accanto arriva il profumo di uno stracotto che impegna seriamente tutto il mio autocontrollo. Discreto il vino rosso sfuso. Il fatto che per la prima volta, dopo giorni che ci si sentiva mosche bianche in altri locali, il simpatico gestore non abbia dovuto usare l'inglese con la maggior parte dei tavoli intorno a noi, -anzi erano quasi tutti fiorentini-, mi induce a pensare che mi piacerebbe approfondire la conoscenza con La Burrasca, la prossima volta che ricapito a Firenze. I posti non sono moltissimi, conviene telefonare prima."
