"Restaurant_Ratings","Restaurant_Quotes","Restaurant_Reviews"
"ui_bubble_rating bubble_50","Ottimo!","A parer mio una delle trattorie migliori di Firenze! L'ambiente è accogliente, rustico e curato, il personale disponibile e molto simpatico. I loro piatti sono fantastici, dagli antipasti agli ottimi primi prevalentemente toscani alla carne sempre di prima qualità! Ci sono stata la prima volta a pranzo per caso e tutte le volte che ci sono ritornata è stata sempre una conferma! Livello sempre altissimo e prezzi buonissimi.Stra-consigliato!"
"ui_bubble_rating bubble_50","Ottimo!","Siamo stati qui per un compleanno, posto molto raccolto ma carino e rustico.Personale disponibile e simpatico.Ottimi primi e carne, prezzo che ci sta tutto.Sicuramente un posto da consigliare!"
"ui_bubble_rating bubble_50","Cucina Tosco-Siciliana","Il posto è molto raccolto, consiglio la prenotazione, l'ospitalità fantastica e la cucina è meravigliosamente casalinga. Sono andato a mangiare varie volte da loro tutto molto buono, ma se posso permettermi di consigliarvi un piatto, sicuramente il coniglio alla griglia, vi giuro assolutamente spettacolare."
"ui_bubble_rating bubble_30","Posto simpatico, con qualche ritocco sarà validissimo","Piccola e antica trattoria in ambiente molto caratteristico, con mattoni a vista e sedie impagliate. Menu soprattutto toscano + qualche piatto classico della cucina italiana: siamo quasi all'angolo con la piazza del Mercato Centrale, nonostante questo il locale non ha subito stravolgimenti turistici. I prezzi sono contenuti escluso il vino, un po' caro senza essere eccezionale. La regolazione del sale va migliorata, ma è un peccato veniale se si confronta questa trattoria con molte altre del centro di Firenze - care e rivolte soltanto al guadagno facile."
"ui_bubble_rating bubble_40","Bontà e simpatia!","È un'osteria molto piccola che offre soprattutto piatti tipici della cucina Fiorentina. Ottimo rapporto qualità/prezzo! La simpatia del cameriere completa il tutto!! Consigliatissimo anche a noi fiorentini!"
"ui_bubble_rating bubble_40","Cucina tradizionale","Piccola scoperta di una trattoria dove si trova una cucina tradizionale toscana, realizzata in forma genuina. Soddisfatto"
"ui_bubble_rating bubble_40","Firenze in bocca","Ottimo luogo al centro di Firenze, dove mangiare un piatto velocemente. Piccolo e accogliente, servizio squisito.La carne è ottima, ho preso una tagliata di manzo, mai chiedere di cuocerla più di quanto già facciano..la carne la servono loro in un modo che potrebbe per molti essere al sangue, ma è davvero gustosa.Cameriere molto gentile e simpatico, ci ha servito in momenti diversi e per scusarsi ci ha offerto il vino.Ci tornerei!"
"ui_bubble_rating bubble_30","Bistecca buona","Leggendo i commenti sinceramente mi aspettavo meglio ma andiamo per ordine.L'ambiente è piccolo ed informale tipico da trattoria, ho contato 32 coperti, se si è in due è facile ritrovarsi distante 5 cm. da un'altra coppia perchè, visti gli spazi ristretti non fanno altro che unire o staccare tavoli da quattro,per andare al bagno bisogna passare per la cucina.Il cameriere è gentile e si adatta alla clientela formata per lo più da turisti ostentando la sua veracità toscana mentre il cuoco, che dovrebbe essere il boss di tanto in tanto passa per i tavoli a sondare l'andamento della serata.Il menù è quanto di più classico si possa trovare con i soliti 3/4 primi e secondi ma il piatto che và per la maggiore è la straclassica Fiorentina, la mia di 1,050 Kg. era buona ad un prezzo onesto per Firenze (3,5 euro/ht) per contorno ho preso dei fagioli che invece non mi sono piaciuti e delle patate che pensavo fossero al forno ed invece erano lesse e condite, per dolce un tortino pere e ricotta molto gustoso.Conto secondo me onesto (70 euro) per, 1 Fiorentina, 1 pasta al ragù, 2 contorni, 2 dolci, 1/2 litro della casa, 1 litro d'acqua, 1 coca cola (non si paga il coperto)."
"ui_bubble_rating bubble_40","simpatia","è una tappa obbligata per una cena a firenze apprezzo sempre con gusto i loro piatti serviti con gentilezza e competenza. ottima idea concludere il pasto con un bicchierino di vino santo."
"ui_bubble_rating bubble_40","Toscanità doc","Simpatia e competenza mescolati ai sapori della toscana,antipasto gradevole ma il pezzo forte è stata la fiorentina!!!!"
"ui_bubble_rating bubble_40","Ottima trattoria","A due passi da San Lorenzo, non è il solito locale per turisti ma una vera trattoria. Locale piuttosto piccolo ma l'accoglienza simpatica e informale ci fa sentire subito a nostro agio. Del menù consiglio di restare sul toscano, buoni i salumi e i primi ma le carni, dalla fiorentina alla tagliata sono veramente ottime. Da assaggiare la torta di ricotta e pere. Il vino della casa non è indimenticabile. Non c'è il caffè perché, come viene simpaticamente ribadito, trattasi di osteria. Il conto è assolutamente onesto."
"ui_bubble_rating bubble_40","la passione per i dettagli","Questa piccola Osteria nel cuore di Firenze forse non arriva a 20 coperti ma smisurata è la passione che ci mette l'Oste; sembra di entrare in un luogo d'altri tempi, un menù senza pretese come si confà ad un'Osteria ma sapori che difficilmente s'incontrano nel panorama standardizzato della ristorazione. Siamo all'ultima tappa del nostro tour gastronomico di 4 giorni in questa città bellissima di giorno e affascinante di notte, siamo un po' affaticati e saltiamo a piè pari gli antipasti per passare ad un piatto di paccheri con le melanzane ed a una fiorentina che sfiora i 1000 gr, come contorno scegliamo fagiolini all'olio e un chianti della casa dal gusto decisamente contadino; il primo è molto buono, la fiorentina è strabiliante sotto tutti i punti di vista: qualità, cottura, presentazione, è tenera, sugosa, saporita dal bordo all'osso... un orgasmo per il palato! ECCEZIONALE a dir poco l'olio che condisce i fagiolini, ma alle mie richieste di informazioni l'Oste si trincera nel segreto del Piatto, e nel fatto che comunque mai avrei potuto acquistarlo, si tratta di una prima spremitura assai ridotta destinata esclusivamente all'alta ristorazione... mi rattristo.... l'Oste attento se ne avvede e ci consola con buonissimi cantucci con il vinsanto; mi torna il buon umore. In questa Osteria non fanno il caffè, paghiamo il conto più che onesto, salutiamo e ce ne andiamo; non è un addio ma un arrivederci."
"ui_bubble_rating bubble_40","Servizio spartano ma si mangia benissimo","Trattoria toscana doc in cui poter gustare ottima carne. La disossata era davvero di qualità! Antipasti toscani tipici e vale davvero la pena provarli. La spesa non è alta e non si pagano pane e coperto (rarissimo caso a Firenze). Consiglio di prenotare per poterci andare dato che il posto è piccino e non c'è tanto spazio. Staff eccezionale e gentile."
"ui_bubble_rating bubble_40","Cercavamo una trattoria tipica ma non turistica, e l'abbiamo trovata!","Un locale piccolo ma non rumoroso, dall'atmosfera informale e piacevole, cibo ottimo, personale giovane ma esperto e simpatico, servizio veloce e prezzi stracciati. Fiorentina da urlo, dolci idem. Bonus per l'ottimo inglese del cameriere."
"ui_bubble_rating bubble_50","Autentico","Trattoria da provare se volete evitare le solite trappole per turisti. Avventori locali, personale disponibile e simpatico e soprattutto cibo buono e prezzi modici. Lasciatevi consigliare i piatti e non vi pentirete di nulla."
"ui_bubble_rating bubble_40","Grande simpatica e cibo assolutamente da provare!","Sabato sera alla ricerca di un locale che facesse la fiorentina. Ci muoviamo tardi per trovare qualcuno disponibile e dopo vari Abbiamo chiuso la griglia, consigliati da una osteria concorrente che non aveva neanche un posto libero per mangiare, ecco che andiamo alla Burrasca. Anche se non abbiamo potuto ordinare la carne, abbiamo comunque provato due primi davvero molto buoni e particolari: gnocchi con noci e gorgonzola e delle tagliatelle con il sugo di anatra! Non avevamo mai mangiato nessuno di questi due piatti, ma ne riconosciamo la bravura nella preparazione e cottura e la qualità del cibo. Il locale è abbastanza piccolo e spartano, gestito da un ragazzo molto simpatico, disponibile e alla mano; siamo stati molto bene, abbiamo speso il giusto e lo consigliamo! Peccato che per i giorni a disposizione non abbiamo potuto assaggiare la sua fiorentina per fare una recensione completa. Tuttavia non ci siamo fatti mancare le dolci leccornie proposte: una bella fetta di ricotta e pera ed una porzione di cantucci al vinsanto..mai mangiati così e davvero ottimo!Quando ritorneremo a Firenze, proveremo anche le carni ma intanto il nostro giudizio è OK!"
"ui_bubble_rating bubble_50","Ottimo!!!!!","Fiorentina OTTIMA!!! Buonissima, tenera,gustosa,una vera squisitezza!!!!! fraschetta, accogliente e in ottima posizione, facilmente raggiungibile..."
"ui_bubble_rating bubble_50","OTTIMO LOCALE","RAGAZZI .. SI MANGIA DA 10!! CONSIGLIATO ! Sono stato diverse volte , con amici , famiglia .. E ogni volta è sempre stato un successo .. "
"ui_bubble_rating bubble_50","SPETTACOLARE!! mi manca!!","Sono capitato sotto consiglio di un fiorentino in questo locale per provare la celeberrima..... FIORENTINA!!! e.... PIENAMENTE SODDISFATTO ED ENTUSIASTA DEL POSTO!! locale piccolo e accogliente, gestore molto gentile, simpatico e disponibile!! sia per una chiacchierata sia per consigli su come gustare appieno questo loro piatto!! e che dire della bistecca... una tagliata morbidissima e cotta perfettamente... un tripudio di sapori che mi han pienamente saziato e soddisfatto... qui viene sui 34 euro al kg!! qualità prezzo ottimi rispetto al resto della città!! buoni anche i contorni con cui l'abbiamo gustata!! fagioli all'uccelletto e patate al forno!! un esperienza che avrei voluto riprovare altre sere ma sfortunatamente poi ha chiuso per ferie!! se passate da firenze non potete non passarci!! prezzi onestissimi!! in 2 fiorentina da 1,2 kg+2 contorni, acqua, vino e coperto 50 euro!! 25 a testa!! un affare!! complimenti!! :D!!"
"ui_bubble_rating bubble_50","Sempre ottimo","Mangiamo in questo ristorante ogni volta che passiamo da Firenze ed è sempre ottimo!Posto piccolo e carino (prenotare se è possibile!!!), cameriere simpatico e preparato e carne sublime!"
"ui_bubble_rating bubble_50","Ritorno alla Burrasca","Questo è la terza volta che torno a Firenze ed è la terza volta che vado a mangiare alla BURRASCA ottimo cibo ed ottima accoglienza come al solito. Un saluto ad Elio e lo staff grazie."
"ui_bubble_rating bubble_40","Fiorentina da viaggio mistico","Su consiglio del proprietario del b&b dove pernottavamo, abbiamo cenato in questo ristorante assaggiando per la prima volta, la famosa bistecca alla fiorentina...esperienza sublime!!!La consigliamo a tutti accompagnata da dell'ottimo Chianti. Il proprietario simpatico. Locale da curare un po' di più e attrezzarsi per servire su richiesta il caffè, siamo pur sempre in Italia!"
"ui_bubble_rating bubble_30","cucina casereccia","siamo stati mandati in questo ristorante dall'albergatore. Cucina casereccia, prezzi accettabili. Pochi tavoli, il proprietario è cordiale.Buono il caprino fritto, buoni i pici e ravioli zucchine e caprino.esagerato il prezzo di una lattina di CocaCola...3 euro!"
"ui_bubble_rating bubble_50","Il cuore della Toscana","Ottimo locale, piccolino, nel cuore di Firenze, accogliente. Servizio cordiale gentile e massima disponibita' dei proprietari. Ottima la bistecca. Da provare !!! "
"ui_bubble_rating bubble_40","Soddisfatto a pieno... ci ritornerò","Abbiamo provato questa trattoria perché già conosciuta dagli amici con cui eravamo.Il locale è molto caratteristico: piccolino, rustico ed accogliente con cucina a vista, che non guasta mai.Il proprietario, il giovane Tomas, è molto gioviale e simpatico, estremamente apprezzabile il fatto che si intrattenga tra i tavoli con la clientela, lo stesso dicasi per il cuoco Elio, siciliano trapiantato a Firenze.La trattoria è frequentata sia da turisti che da gente del posto ed un perché ci sarà.L’antipasto che ci hanno servito non è il top, ma la FIORENTINA……la FIORENTINA!!! fantastica, ottima cottura, tenerissima e gustosissima.Il trattamento economico non mi è sembrato ingiusto (giudicate voi): in 7 di noi, di cui 2 bambine (quindi 5 adulti), abbiamo pagato Euro 165,00; Abbiamo preso: antipasto per tutti, 2 gnocchi al ragù per le bimbe, 2 bistecche Fiorentine 1 kg cadauna (2 km di carne), 1 tagliata di pollo, 2 patate alle erbe, 2 mezzi litri di Chianti “scaraffato”, svariate bottiglie da mezzo litro di acqua (forse acqua servita in vetro o almeno in bottiglie da un litro sarebbe meglio), per concludere, 4 cannoli alla Siciliana (la pasta dei cannoli troppo inumidita dalla farcitura), amaro, limoncello e grappa, il tutto in pieno centro storico di Firenze in zona San Lorenzo."
"ui_bubble_rating bubble_40","Come a casa","Siamo stati in questa piccola trattoria al centro di Firenze una domenica a pranzo. Abbiamo mangiato degli ottimi primi e una fiorentina fantastica, e per concludere cannoli siciliani (che arrivano direttamente da Palermo ) profiteroles e cantucci con il vin santo. Simpaticissimo il cameriere, e anche il cuoco/titolare che ci ha spiegato con dovizia di particolari la differenza tra la chianina e la carne che abbiamo mangiato. Ci siamo sentiti come a casa con un conto assolutamente adeguato al servizio offerto. Ci torneremo sicuramente"
"ui_bubble_rating bubble_50","Bel localino tipico nel cuore di Firenze","Ambiente accogliente , ottima la scelta di piatti del menu, tutti cucinati in modo fantastico, ma la vera specialità del posto resta la bistecca: cerne eccezionale, cucinata da Maestri. Molto gentile e attento il giovane cameriere, simpatici il proprietario ed il cuore.Ottimo il rapporto prezzo-qualità. Si respira l'atmosfera di una Firenze di una volta, dove accuratezza nel servizio , qualità del cibo , attenzione al cliente e simpatia erano indispensabili nelle Trattorie rivolte ai Fiorentini e non alla massa dei turisti di passaggio. Non vi perdete una visita in questo delizioso posticino"
"ui_bubble_rating bubble_40","Pranzo familiare","Piccola trattoria (una decina di tavoli tutti interni) in zona Mercato S.Lorenzo. Porzioni più che nella norma per classici della cucina toscana (ed italiana). La trattoria non è turistica (abbondano i fiorentini che la frequentano). Sono ormai alla settima esperienza e non mi sono mai lamentato.CONSIGLIATISSIMA. Prezzi più che onesti."
"ui_bubble_rating bubble_50","Bravissimi!","Mini trattoria con pochi tavoli, atmosfera piacevolmente rilassata, frequentata da turisti ma anche da fiorentini. Musica italiana in sottofondo. Personale svelto, molto cortese, simpatico in modo genuino. Servizio rapido nonostante tutti i tavoli fossero pieni. Abbondante l'antipasto con salumi, formaggio, crostoni, pomodori secchi, olive (tutto buono!). Nel menù anche alcuni piatti freddi ed invitanti primi piatti, ma noi abbiamo preferito andare dritti alla ciccia! Ottima la carne alla griglia, soprattutto la fiorentina era cotta alla perfezione!!! Siamo stati benone ed abbiamo speso poco: provate questo localino! Lo consiglio! Ma prenotate assolutamente con un po' d'anticipo!"
"ui_bubble_rating bubble_50","La miglior fiorentina","Sono stato consigliato dal padrone del B&B dove alloggiavo.. Avevo chiesto una trattoria non turistica dove poter mangiare qualcosa di tipico..ho provato e l'esperienza è stata unica! Locale informale, personale cordiale, accogliente e simpatico... Ma soprattutto, sanno fare una fiorentina che è spettacolare! Merito della cottura o della scelta della carne, non so, ma io una cosa così buona non l'avevo mai mangiata! Da tornarci!"
"ui_bubble_rating bubble_50","Consigliato","Buono tutto. 1 tagliere di formaggi 1 primo 1 tagliata 1 cannolo birra e acqua..40 euro..staff calabro-siciliano cortese e disponibile (abbiamo pranzato alle 4).."
"ui_bubble_rating bubble_50","La mia prima pappa al pomodoro!!","Salve a tutti. .. Oltre alla città che è magnifica e passata in ottima compagnia i miei complimenti vanno anche al ristorante la burrasca che anche se piccolo offre un'accoglienza amichevole e cortese! Il cibo buonissimo una Fiorentina ovviamente divisa in due e una pappa al pomodoro al dir poco spettacolare!! "
"ui_bubble_rating bubble_40","Piccolo ma buono","Ci è stato consigliato e siamo rimasti soddisfatti! Pochi coperti ma il locale è accogliente, personale simpatico, servizio veloce, piatti buoni e abbondanti. Per chi vuole mangiare bene e non spendere tanto.Gli amici carrarini!"
"ui_bubble_rating bubble_50","Ottima cucina fiorentina","Se volete provare la vera tipica cucina fiorentina questo posto è favoloso. Non è molto grande, ma poco importa. Il cuoco e i camerieri sono simpatici e si intrattengono con gli ospisti, il menù cambia sempre a seconda dei prodotti del giorno. Antipasto toscano doc, buonissima la bistecca alla fiorentina, cotta al punto giusto! Buoni anche i contorni! Come dolce ho provato solamente i cantuccini col vinsanto ma sono fantastici. Consigliato per chi vuol provare i classici piatti fiorentini."
"ui_bubble_rating bubble_40","Posto piccolo ma tanta tanta qualità","Ci sono stato in un paio di occasioni a cena con un amico. Il posto è abbastanza piccolo, ma la qualità dei piatti è veramente su ottimi livelli. Il servizio è veloce e i camerieri sono simpatici. Se vi trovate nei pressi della Stazione di Santa Maria Novella o nei pressi di Piazza San Lorenzo, prendetelo in considerazione, non rimarrete delusi. Ottimo rapporto qualità-prezzo!"
"ui_bubble_rating bubble_30","Carino","Ristorante tipico fiorentino non molto grande e consigliato da amici...Non molto grande, ma personale gentile...Fiorentina ottima, con prezzi molto buoni...Servizio veloce"
"ui_bubble_rating bubble_50","Buonissimo","Piccolo ristorante tipico toscano, prenotate perche facilmente potrebbe essere pieno ma da provare perche tutto buonissimo e i prezzi non sono alti! Personale molto simpatico!"
"ui_bubble_rating bubble_40","UNA PERLA NEL PIENO CENTRO.","Fermatevi senza indugio, il locale è piccolo (da preferire quindi la prenotazione) ma i piatti sono ottimi, lasciatevi tentare in particolare dai piatti del giorno, ottima qualità."
"ui_bubble_rating bubble_30","Piccola trattoria","Nel cuore di San Lorenzo questa piccola trattoria gestita con simpatia e gentilezza, propone saporiti piatti toscani del giorno a base di carne. Su tutto consiglio il loro ossobuco che è davvero ottimo e la fiorentina. Il cuoco abbonda forse un pò troppo di sale e pepe. I posti sono pochi e nelle giornate di punta c'è da fare un pò di fila. Qualità media, prezzi adeguati."
"ui_bubble_rating bubble_40","Ottimo","Una bruschetta come non ne avevo mai mangiate.Osteria/trattoria molto spartana, prezzi abbordabili e qualità ottima.Propongono piatti del giorno"
"ui_bubble_rating bubble_50","La fiorentina da 10 e lode","Siamo stati a Firenze x il ponte del primo maggio, eravamo in tre coppie di amici e siamo andati a mangiare in questa trattoria.Posto semplice ma cucina e personale eccellenti.Seguendo il loro consiglio abbiamo mangiato la fiorentina pur non adorando le carni crudeRisultato: una vera e propria goduria x il palato.Conto più che onestoSicuramente ci torneremoGli amici di Bergamo"
"ui_bubble_rating bubble_20","mi aspettavo meglio","Dai giudizi di tripadvisor mi aspettavo decisamente meglio. Il locale è piccolo e spartano. In due abbiamo preso 2 antipasti: bruschetta con lardo di colonnata piuttosto insignificante e una bruschetta con patè toscano buono. A seguire una fiorentina, che fiorentina non era, perchè era una costata. La carne piuttosto insapore, una gran delusione. Infine un contorno di melanzane, vino della casa e amari. Costo buono 65 euro in due considerando i prezzi di altri ristoranti del centro. Ad ogni modo non ci tornerei."
"ui_bubble_rating bubble_50","La miglior fiorentina di Firenze","Ormai per me è La Burrasca è un appuntamento fisso ogni volta che con amici o colleghi andiamo a mangiare la bistecca in centro.La bistecca alla fiorentina della Burrasca è in assoluto la migliore del centro di Firenze.Senza contare che in questa piccola trattoria nel quartiere del mercato di San Lorenzo si respira davvero l'aria inconfondibile della tipica cucina familiare toscana.Prezzi assolutamente contenuti, vista anche la qualità davvero alta del cibo.Da tornarci e ritornarci!!!"
"ui_bubble_rating bubble_20","Isomma...","Forse sono capitata il giorno sbagliato, però il sugo di anatra dei miei pici era poco saporito, ma troppo salato, ho fatto fatica a finirli. In ogni caso il personale è stato gentile, il vino della casa era buono e le porzioni abbondanti. Peccato."
"ui_bubble_rating bubble_40","Trattoria fiorentina","La prima sera del nostro soggiorno fiorentino abbiamo deciso di cenare in questa trattoria fiorentina, a pochi minuti dal nostro albergo.Il locale è costituito da una sala di grandezza media, con una quindicina di tavoli: il classico ambiente da trattoria, in cui generalmente si mangia la cucina tipica del posto.Veniamo fatti accomodare in un tavolino per due persone e dal menù scegliamo di prendere un antipasto toscano in due, un primo la mia ragazza e una tagliata al lardo con contorno di fagioli con salsa di pomodoro per me. Da bere abbiamo chiesto un litro di vino rosso della casa e un litro di acqua naturale.L'antipasto non era molto variegato ed era composto da una bruschetta con fegatino di pollo e qualche fetta di salame fiorentino e prosciutto crudo; i rigatoni sono piaciuti molto alla mia ragazza e la mia tagliata era gustosa e cotta nel modo giusto, leggermente al sangue. Infine il contorno di fagioli in salsa di pomodoro leggermente piccante, era davvero particolarmente buono. Il servizio è stato impeccabile, anche agevolato dal fatto che non c'era molta gente. La location, come detto è abbastanza rustica e accogliente.Il rapporto qualità/prezzo discreto, 45€ in due."
"ui_bubble_rating bubble_40","Assolutamente consigliato","Posto di poche pretese ma dove si mangia benissimo e molto conveniente. La ribollita la consiglio: la migliore da me mangiata a Firenze, ma anche il resto è molto buono. Titolare simpatico, locale nel centro di Firenze, assolutamente consigluiato."
"ui_bubble_rating bubble_50","Intimità,cortesia,bontà e oculatezza","Come spesso accade in viaggio trovi un posto famoso pieno e speri che quelli vicino siano altrettanto buoni.È quello successo a noi che siamo stati dirottati in questo locale.È stata una vera fortuna:ci siamo seduti subito,abbiamo pranzato da re(pasta strascicata al ragù,stracotto di manzo e cantucci e vino da applausi,vino della casa,un acqua e uno spezzatino di cipolle)e abbiamo pagato pochissimo:30 euro in tutto!"
"ui_bubble_rating bubble_50","Il Top del cibo e della Simpatia","Non ci sono parole per esprimere la bontà dei cibi la cortesia del personale ed il gradevolissimo locale. Inoltre il prezzo rapportato alla qualità del cibo è veramente esiguo.In poche parole mi definisco entusiata di questa piacevole scoperta tra le stradine del centro (zona San Lorenzo) di Firenze."
"ui_bubble_rating bubble_40","Fiorentina serie A","Siamo stati consigliati da un barman della zona e devo dire che siamo capitati proprio bene!! Il posto e' piccolo e rurale. Siamo capitati di sabato e nonostante la prenotazione abbiamo dovuto aspettare una decina di minuti ma ne è valsa davvero la pena....servizio veloce e il mangiare buonissimo! Abbiamo iniziato con un misto di antipasti toscani per poi dare libero spazio alla mitica fiorentina accompagnata da dei deliziosi broccoli al limone e un impeccabile Chianti. Il personale simpatico, gentile e accogliente. Dalle piccole cose ne vengono fuori delle grandi cose, complimenti!"
"ui_bubble_rating bubble_40","Davvero ammodo!","Posto davvero molto tipico, trattoria fiorentina ricavata in una stanza. Cino buonissimo e molto tipico. Personale simpatico e alla mano. Che dire? Bravi.. e poi I prezzi. Una cena completa 20€ e porzioni davvero abbondanti. Se torno a Firenze sará sicuramente tappa fissa!"
"ui_bubble_rating bubble_50","Gusto e simpatia!","Un'intima osteria di Firenze con personale gentilissimo e cibo buonissimo!Abbiamo mangiato la fiorentina....spettacolo puro!Il ragazzo che ci ha serviti molto molto simpatico e capace...ci siamo sentiti ben accolti e consigliati in modo ottimo!Il prezzo abbordabile e , considerando il cibo mangiato, giusto!Anche il nostro piccoletto ha apprezzato la pappa al pomodoro :) Torneremo sicuramente!"
"ui_bubble_rating bubble_40","Una piacevole sorpresa","Siamo capitati in questo locale per caso.E' stata una piacevolissima sorpresa. Abbiamo mangiato veramente molto bene prendendo due primi: bucatini al ragù di cinghiale e ravioli al pesto di cavolfiore nero. Di secondo polpette al ragù, ottime.Il servizio è stato veloce e l'atmosfera in generale è molto piacevole.Consigliatissimo."
"ui_bubble_rating bubble_40","Ottima fiorentina","Tipica trattoria in centro a Firenze. Piccola ma accogliente. Primi, carne e secondi, antipasti tutto di qualità e ovviamente una ottima fiorentina. Qualità prezzo buona. Consiglio: pici al cinghiale. Personale gentile e simpatica. Ma ho notato qualche elemento negativo: qualche intrusione culinaria (si fa anche cibo siciliano, fuori luogo a mio avviso) ed eccessiva salinità di cibi e fiorentina (potrebbe essere causato dal tipo di carne)."
"ui_bubble_rating bubble_50","Delizia delle delizie","locale rustico e molto alla mano, personale gentile e disponibile. prezzo giusto (per noi di milano basso!). consiglio la fiorentina!"
