"Restaurant_Ratings","Restaurant_Quotes","Restaurant_Reviews"
"ui_bubble_rating bubble_50","Ottimo!","Ho cenato alla Burrasca dopo che mi era stato consigliato come locale x cenare in maniera informale e genuina. Siamo state servite subitissimo, ci è stata mostrata la fiorentina che avevamo ordinato ed è arrivata cotta alla perfezione, ottima davvero. Ci siamo leccate i baffi! Complimenti anche x il dolce... e grazie al cameriere molto simpatico che, dopo la chiusura, ci ha parlato un po' di Firenze come se fossimo vecchi conoscenti. Apprezzato! Lo consiglierò sicuramente. Ps. Prezzi onestissimi!"
"ui_bubble_rating bubble_50","Buon cibo e simpatia","Piccola trattoria vicino al centro, in un clima molto accogliente. Cibo della tradizione fiorentina assolutamente ottimo, prezzo estremamente onesto rispetto a molti altri della zona. Personale cortese e molto alla mano. Consigliatissimo!!!"
"ui_bubble_rating bubble_50","Tanta tanta roba la fiorentina<U+0001F60D><U+0001F60D>","Se passate per Firenze è d'obbligo passare di qui a gustare la fiorentina!!Ambiente piccolo ma molto accogliente! "
"ui_bubble_rating bubble_50","Ottimo cibo","Trattoria piccola e in zona centrale. Cibo assolutamente ottimo e tradizionale, prezzo nella norma. Nessun butta-dentro travestito da cameriere. Ambiente tranquillo."
"ui_bubble_rating bubble_50","Straordinario ","Sono stata in questo locale a febbraio, non dimenticherò mai questo posto. Tutto eccellente è buonissimo, personale cordiale e gentile! Un saluto al titolare siculo proprio come me. Complimenti!"
"ui_bubble_rating bubble_50","Andateci!!","Un posto davvero molto buono e accogliente con piatti eccezionali da leccarsi i baffi. Il personale è molto gentile e il prezzo ottimo. Ve lo consiglio, non perdetevelo!!"
"ui_bubble_rating bubble_50","Ottima","Ottima cucina. Personale disponibile e cordiale. Antipasto toscano ottimo. Fiorentina tenerissiama e ben cucinata. Consigliatissimo"
"ui_bubble_rating bubble_40","Soddisfatto","Locale piccolo ma ben arredato in stile Taverna antica. Personale gentile. Servizio veloce. Bistecca fiorentina 40 euro il kg. Tenera e buonissima. Da solo ne ho mangiata una da 900 grammi! Insalata come contorno a 3 euro . Per mangiare bene e velocemente x poi tornare a visitare Firenze. Ci tornerò."
"ui_bubble_rating bubble_40","Ok, la trattoria è giusta!","Come riporta il nome nella più ampia e goliardica concezione del termine, la Burrasca è una trattoria frizzante, vivace, certamente non indicata per una cenetta a lume di candela quanto piuttosto per una serata tra amici o comunque senza troppi fronzoli.All'ombra dei Mercati Generali, locale piccolino, tavoli bonsai, tovaglie di carta, ma i piatti sono quelli della saporita cucina toscana, gustosi, tradizionali, a partire dalle bruschette per passare ai primi (ravioli ai fiori di zucchina, non eccezionali, il condimento a ns. avviso era troppo deciso per un piatto che nasce piuttosto delicato); saporita (un esplosione di gusto!) la carne alla brace (abbiamo preso la grigliata per due, volendo essere critici diciamo che la salsiccia andava lasciata cuocere ancora un paio di minuti...) il fiore all'occhiello del menu; personale sveglio e simpatico, proposta dolci un po' troppo easy (solo cannoli siciliani e cantucci col vin santo), prezzi assolutamente ok."
"ui_bubble_rating bubble_50","Eccezionale!","Sono stata con dei colleghi di lavoro, ottima cucina, abbiamo preso gli antipasti misti della casa ottimo mix toscano- siciliano, ho preso come primo farfalle all'ossobuco e che dire... ottimi! I nostri colleghi bistecca fiorentina, disossata, vitela alla pizzaiola, pollo alle erbe e vari contorni! Personale super gentile attento ad ogni richiesta del cliente. Dolci da provare la torta pere e ricotta e poi... i cañoli siciliani ripieni al momento! Una bontà. Prezzo assolutamente accessibile! Da provare e da riprovare sicuramente! Complimenti!"
"ui_bubble_rating bubble_10","Incredibile","Andato li con la mia ragazza. Arrivo alle 21:30, alle 23:00 deserts, il cameriere ci porta il conto (senza che glielo avessimo chiesto). Gli do la carta di credito. Due giorni dopo scopro che la carta e' stata clonata. Che dire ?"
"ui_bubble_rating bubble_50","Sublime!","Sublime! Inutile spiegare ciò che occorre provare di persona! Consigliata la Fiorentina con patate e per dessert il tortino di ricotta e pere. In tanti anni di viaggi e recensioni, questa è la prima volta che metto un voto massimo! Provare per credere."
"ui_bubble_rating bubble_50","Una vera trattoria","Locale molto caratteristico con foto della vecchia Firenze.Titolare davvero cordiale e disponibile.Fiorentina (immancabile) molto buona e per finire sorbetto siciliano. Da ripetere "
"ui_bubble_rating bubble_30","Nella media","Piccola trattoria tipica, buona scelta di piatti, non male la bistecca ed il vino, personale gentile ma tutto un po' nella media...unica cosa sotto la media il prezzo, e questo certamente non guasta. Diciamo che non sono malaccio"
"ui_bubble_rating bubble_50","Diventerà tappa fissa...","Signori che dire...trattoria dal gusto familiare. La FIORENTINA è buonissima, a differenza delle altre osterie che pur di venderla ti obbligano a mangiarla, qui ti consigliano...tengono molto alla qualità e alla cura.Poi Elio è fantascico...un vero amicone!Col sottofondo di Manmarino poi.....Unicoooo"
"ui_bubble_rating bubble_40","Fiorentina strepitosa","Locale piccolo e molto caratteristico. Personale gentile. La Fiorentina veramente ottima, così come il Chianti della casa. Lo consiglio "
"ui_bubble_rating bubble_50","LA Fiorentina","Mai mangiato meglio! Locale piccola ma molto carino, personale molto cortese ed educato, la fiorentina piú buona che abbia mai mangiato! Chianti ottimo. Da provare, ci torneró di certo!"
"ui_bubble_rating bubble_50","Grazie a Tripadvisor abbiamo trovato questo gioiellino","Cercavamo un ristorante in zona Mercato Centrale e Tripadvisor ci ha aiutato trovandoci questo piccolo locale che si è rivelato essere un ristorante dalla cucina ottima e ben curata e con del personale davvero gentile e simpatico.Mi sa che dobbiamo tornarci per provare la fiorentina!"
"ui_bubble_rating bubble_50","Che gustosa scoperta ","Piacevole l'ambiente, i ragazzi molto gentili hanno preso la mia famiglia numerosa pur senza aver prenotato!che dire ..alla BURRASCA ci si torna ancora per il connubio di gentilezza e di qualità in tavola!alla prossima "
"ui_bubble_rating bubble_50","La migliore fiorentina ","Trattoria in centro molto carina e tipica. Il locale è molto piccolo, quindi vi consiglio di prenotare. La fiorentina è decisamente la migliore della zona. Cottura perfetta, tenera e morbida, un vero piacere per il palato. Da provare! "
"ui_bubble_rating bubble_40","Ottima carne","Siamo venuti in questo ristorante per mangiare la fiorentina e che dire… veramente buona così come il filetto alla griglia e quello al marsala! Unica nota dolente alla fine del pasto è stato il vin santo molto leggero direi annacquato"
"ui_bubble_rating bubble_50","Da genovesi, Belin che buono!","Siamo stati due volte a pranzo, servizio e accoglienza ottimo. Cibo eccellente. Fiorentina strepitosa."
"ui_bubble_rating bubble_50","Top","Grazie a questa App abbiamo scoperto questo locale.. piccolo ma con dei piatti super. Cucina locale, la carne è il suo punto di forza, vini ottimi, gentilezza e cortesia soprattutto prezzi buoni. "
"ui_bubble_rating bubble_50","Ma che bontà","Piccola trattoria a Firenze, ambiente informale dove la semplicità nel rapporto con il cliente è di casa. Durante il pranzo si sentivano in sottofondo le canzoni di De Andrè. Abbiamo ordinato due antipasti, dei crostini toscani e delle patate al forno cucinate in una maniera diversa dal solito, mischiandole nella cottura ad altri ingredienti tra cui il formaggio, il vino della casa era molto buono. Abbiamo poi continuato con due primi ordinando due risotti ai frutti di mare, deliziosi. Abbiamo poi finito con una torta di pere al cioccolato. Il caffè non lo fanno, il tutto spendendo 48 euro in due. Per la qualità e la freschezza del cibo e per i prezzi molto onesti per me e mia moglie la Burrasca è stata una piacevole scoperta. Quando ritornerò a Firenze la Burrrasca diventerà una tappa obbligata."
"ui_bubble_rating bubble_50","Buonissimooooooo","Siamo turisti abbiamo mangiato in questo locale buonissimo a dire poco !!! Siamo stati accolti benissimo personale bravissimi gentilissimi e complimenti al cuoco !!!!! D avvero siete i migliori grazie per L accoglienza !!! Andateciiii!!"
"ui_bubble_rating bubble_50","Molto buono ","Siamo stati a pranzo scoprendo per caso questo ristorante in zona s lorenzo. I prezzi del menù ci hanno attratti in quanto un po più bassi della media senza coperto. Locale caratteristico piccolo ma cibo più che buono e proprietario disponibile alle richieste dei clienti. Da tornarci sicuramente "
"ui_bubble_rating bubble_50","Fiorentina imperdibile","Locale rustico e alla buona. È molto piccolo per cui conviene prenotare. Cucina locale davvero ottima, piatti semplici e fiorentina magnifica. Si paga il giusto. Consigliatissimo."
"ui_bubble_rating bubble_50","la vera fiorentina","tipica trattoria fiorentina, posto piuttosto piccolo ma accogliente. la fiorentina è uno spettacolo, lo stracotto una meraviglia. si mangia da dio...ho assaggiato diverse bistecche a firenze, ma quella della burrasca resta di gran lunga la migliore...cotta alla perfezione...."
"ui_bubble_rating bubble_50","fiorentina sublime","Su consiglio dell enoteca li vicino ci siamo recati in questa trattoria alla ricerca di una buona fiorentina, e devo dire che ne siamo rimasti veramente entusiasti!! Locale piccolo ma accogliente, personale molto gentile e simpatico ... se dovessimo ripassare per Firenze sicuramente sarà una tappa da non perdere!"
"ui_bubble_rating bubble_50","Che piccolo ma che grandi","Siamo andati con la famiglia ed un'altra famiglia di amici a cena durante il nostro soggiorno a Firenze. Diciamo che ci siamo andati alla cieca, ma è stata una scelta azzeccatissima.Il posto è piccolo, per non dire intimo. Il personale molto gentile e disponibile.Abbiamo mangiato benissimo ed anche i bambini hanno spazzolato tutto. Pasta fresca ed ingredienti genuini. Da provare, non si resta delusi."
"ui_bubble_rating bubble_50","Una scommessa vinta","Nella Piazza del Mercato Centrale di san Lorenzo si trova una Trattoria apparentemente come le altre: una stanzina piccina piccina, arredata con fratini e sedie in legno; attrezzi agricoli attaccati alle pareti ed al soffitto. Il personale giovane che vi accoglie è solare e preparato. Il clima è conviviale e garbato; il posto semplice e pulito. Ma il motivo per il quale dovreste preferire questa trattoria alle altre è il Cibo.Dagli antipasti ai dolci, gli ingredienti sono freschi, di stagione e cucinati in maniera semplice e attenta, come se a prepararli fosse una mamma, una mamma toscana con influenze siciliane. Il vino della casa è decisamente buono, ma anche la lista Vini è ben nutrita. Prezzi giusti e non gonfiati!E' d'obbligo la prenotazione! A meno che non vogliate fare la lunga fila rigorosamente in strada.Unico neo: niente caffè. Ma la sera il caffè non fa dormire... è molto meglio un cantuccio col vin Santo!Consigliatissimo!"
"ui_bubble_rating bubble_40","Buono","Tutto buono: prezzi onesti, personale amichevole e locale accogliente. Da provare! l'unico appunto è che ci hanno servito un risotto che in realtà era un riso bollito e il fatto che se ci si siede verso il centro della sala bisogna spostarsi di continuo per favorire il passaggio di chi lavora in sala."
"ui_bubble_rating bubble_50","Il buono della semplicita e genuinità!","Locale rustico, piccino ma accogliente, a due passi dal Mercato Centrale di San Lorenzo.Il personale è alla mano e disponibile anche a consigliare su cosa ordinare . Questo ristorante mescola curiosamente la cucina siciliana a quella toscana.Un degno esempio di questo connubio è il Gran Antipasto Burrasca.. gustosissimo!I primi semplici e ottimi. Io ho ordinato lo spaghetto alici, pomodorini e pan grattato.. una gastrobontà!Anche i secondi di carne sono buoni e abbondanti. Consigliamo come contorno le patate gratinate.Il tutto annaffiato da un buon Chianti della casa.Siamo andati via soddisfatti e con una spesa più che giusta: 47 euro in due (antipasto, primo, secondo, due contorni e vino).Consigliamo di prenotare.Ci torneremo di sicuro! Complimenti!"
"ui_bubble_rating bubble_50","Al di là di ogni più alta aspettativa","Locale piccolo e caratteristico (consiglio la prenotazione), personale disponibile e simpaticissimo, cucina tipica eseguita a regola d'arte. Noi abbiamo provato sia la fiorentina che altri piatti tipici ed erano uno più buono dell'altro. Ottimo rapporto qualità-prezzo. Assolutamente da provare"
"ui_bubble_rating bubble_20","Troppi soldi poca materia prima","In breve, accogliente sala mediamente frequentata con servizi igienici decisamente mediocri. Quanto al cibo: due vassoi ciascuno con sei fettine di salame e tre di prosciutto, 1kg e 400gr di fiorentina, 1/4 di vino (5 euro), tre bottigliette di h2o, totale 80 euro a voi la scelta se andare o meno"
"ui_bubble_rating bubble_40","HIGH QUALITY","Personale fantastico, luogo caratteristico e intimo. Prezzi accessibili rispetto alla media di Firenze. Tutto fresco, abbondante e buono. Fiorentina INDIMENTICABILE. Il cameriere odia farsi dare del lei...non lo fate! :) SUPER!P.S: unica pecca un risotto un po' troppo asciutto..."
"ui_bubble_rating bubble_50","Sublime","Ottima bistecca alla fiorentina, con il prezzo più basso che siamo riusciti a trovare in tutta la città, ma ottimo anche tutto il resto, tra contorni, primi e secondi! Considerando la media di Firenze, il rapporto qualità/prezzo è estremamente favorevole.Il titolare, soprattutto, è stato sempre disponibile con tutti!Conviene tuttavia prenotare, perché è sempre molto pieno!"
"ui_bubble_rating bubble_40","Il secondo","Siamo stati qui con la mia ragazza. Tipico fiorentino. Un buon vinello, da andarci per la carne, dal manzo alla classica fiorentina. Da andarci per l'ottima cottura. Il primo non consigliato. Prezzo ottimo. "
"ui_bubble_rating bubble_50","Solo una parola : favoloso!","Piatti tipici fatti in casa servuzio e cortesia, e prezzi onestissimi!! Da visitare assolutamente! consigliatissimo!!!"
"ui_bubble_rating bubble_50","Vale, vale la pena davvero","Piatti mooolto buoni, rapporto qualità prezzo eccellente, il cameriere parecchio simpatico. Piatti toscani ben cucinati, ottima la fiorentina, buono anche il vino rosso della casa. Consiglio vivamente. "
"ui_bubble_rating bubble_40","Gentilezza e cibo ottimi","Sono stata con amici in questa piccola trattoria dietro il mercato centrale e sono stata davvero bene,consiglio di prenotare perché il posto é piccolo..ottimo l ' antipasto burrasca ,molto buoni i primi ...e contorno (patate gratinate )gustoso"
"ui_bubble_rating bubble_50","Da andarci. Senza se,senza ma!!!","Tipica trattoria toscana in pieno centro. Locale old style, tavoli non molto grandi e vicini tra loro, ma cucina fantastica. Cameriere simpaticissimo, piatti pochi ma veramente eccezziUnali.Per gli amanti di locande e cucina tipica, questo locale è imperdibile!!!"
"ui_bubble_rating bubble_50","Merita veramente. Stra consigliato ","Sotto consiglio di un amico e conferma dal rank su TA abbiamo deciso di pranzare la domenica in questo locale. Qualità del cibo molto buona, prezzi giusti (ricordiamoci che siamo a Firenze a tre minuti dal cupolone), cameriere e cuoco molto gentili e simpatici. Il locale non è grandissimo, si mangia vicino agli altri commensali, ma è piacevole scambiare quattro chiacchiere con altre persone nell'attesa. Eravamo in 4: 1 antipasto grande, 2kg di fiorentina, 2 contorni, 1/2 chianti, acqua circa un 25€ a persona.Torneremo sicuramente. "
"ui_bubble_rating bubble_40","Cordialità e Gusto in Prima Linea","Lo troviamo quasi per caso , ambiente piccolo ma accogliente. Il titolare/cuoco (siciliano) ci accoglie e ci mette subito a nostro agio. Antipasto un bel tagliere di salumi e formaggi misti toscani , a seguire un bel piatto (abbondante!) di pici cacio e guanciale da favola . La mia Lei partecipa all'affossamento del tagliere , si fa una tagliata con patate anch'essa ottima, e per finire 2 bei dessert...il tutto ad un prezzo più che abbordabile ma, soprattutto, nessun e sottolineo nessun problema digestivo...che dire,,ci torno di sicuro..."
"ui_bubble_rating bubble_50","Ma di mooooooolto buono...","Locale molto carino, piccolo (meglio prenotare) e con pochi piatti fatti davvero come si deve. Cameriere simpaticissimo e prezzi più che onesti, merita!"
"ui_bubble_rating bubble_40","TOSCANO DOC","Trovato per caso,seminascosto da ponteggio in una stradina nei pressi della piazza mercato, è stata una bella scoperta :pietanze ottime servite con tanta simpatia (tipica toscana).Complimenti al cuoco siciliano,milanista che ricerca qualità e gusto in piatti della tradizione.Prezzi contenuti : antipasto, primo, secondo e dolce 25 euro !!!!Il locale è molto piccolo,ma caratteristico, mi ricorda le osterie di una volta....Di sicuro ci tornerò e lo consiglio caldamente."
"ui_bubble_rating bubble_50","Bontà e simpatia","Locale carino. Abbiamo cenato molto bene con una qualità/prezzo eccellente. Formaggi, carni e dolce molto buoni. Servizio molto simpatico e tempi veloci. Primi a 6-7 euro e fiorentina a 38€/kg. Menù completo e molto vario che và sulle orme della cucina toscana e siciliana.Consigliatissimo "
"ui_bubble_rating bubble_50","Bene oh","Locale piccolino e il menu servito su fotocopie per il resto molto buono. Prezzi bassi e qualità alta. Io e mia moglie con 50 euro abbiamo preso un altipasto, un primo, due grigliate, un contorno, vino, acqua e dolce. Molto alla mano ma si mangia benissimo."
"ui_bubble_rating bubble_50","Vera atmosfera toscana e vera fiorentina","Se dovete mangiare la fiorentina una volta nella vita, vi consiglio di venire qui perché vale davvero la pena.(Quello che sembra essere) il proprietario è molto gentile e simpatico, e cerca di accomodare tutti anche se il locale è molto piccolo (credo una trentina di coperti): consiglio comunque di prenotare o di cercare di arrivare molto presto (19) se non avete prenotazione. Tavoli molto vicini, non c'è grande intimità ma se ne può approfittare per fare quattro chiacchiere con gli altri avventori.Una volta assicurato il posto a tavola, chiedete una fiorentina (taglio minimo 9 etti/1kg, volendo se ne può prendere una in due) e non rimarrete delusi.La carne si scioglie in bocca e la cottura è perfetta, così come il condimento (ci vanno generosi col sale, tenetene conto). Contorni e antipasti sono buoni ed economici, i primi che ho visto passare sembravano pure molto rispettabili, ma la fiorentina è veramente fuori classifica.Il Chianti della casa è più che dignitoso.Prezzi economici per primi e contorni, forse lievemente alti per gli antipasti (che, se andate ben intenzionati per la bistecca, potete tranquillissimamente saltare), giusti per la carne (fiorentina 38 euro al chilo, tagliata di filetto 15 euro, qualità notevole).Raccomando davvero questo locale a chi voglia gustare una vera fiorentina in un'atmosfera informale e piacevole."
"ui_bubble_rating bubble_50","Cena top","Cibo di ottima qualità...cucina tipica, casalinga e per tutti i gusti. Buon vino prezzo davvero onesti e servizio ottimo...a Firenze tappa obbligata!"
"ui_bubble_rating bubble_50","Ciò che cerchereste a Firenze.","Piccola trattoria tipica nella zona del mercato centrale. Un'oasi di toscanità in mezzo a negozi e altre attività commerciali più tipiche della Turchia, del Senegal, del Bangladesh e della Cina. Tavolaccio di legno, aratro appeso al soffitto e tanta buona roba da mangiare. Tomas, cameriere simpatico quanto cortese e attento. È bastato poco per convincermi a tornarci di sicuro."
"ui_bubble_rating bubble_40","Accogliente ","In posizione centralissima, questo piccolo locale può sembrare turistico ma in realtà è ottimo; i piatti si destreggiano fra classici toscani e influenze siciliane. Il personale poi è gentilissimo, disponibile e simpatico! Ottimo rapporto qualità prezzo. Consigliata la prenotazione.."
"ui_bubble_rating bubble_50","Buona..Fino all'osso..","Locale: posto carino ubicato accanto al Mercato Centrale. Pochi coperti, conviene prenotare.Trattoria dal sapore genuinamente tradizionale.Cibo: carta toscano-sicula (provata solo cucina toscana). Antipasto toscano molto buono. Bistecca alla fiorentina tagliata e mostrata cruda dal peso di 1,1 kg che si scioglieva in bocca, non grassa, cotta al punto giusto, molto gustosa. Patate al forno per accompagnare. Dolce ricotta e pere delicato e leggero buono il contrasto con la farina di nocciole.Vino rosso della casa, 1 antipasto,1 bistecca da 1,1 kg 1 contorno e 1 dolce (tutto x due commensali) 35 euro a persona. Rapporto qualità prezzo fantastico! Da ritornare!Nota di merito a tutto lo staff molto cordiale, ci ha fatto sentire a casa!"
"ui_bubble_rating bubble_50","Bistecca alla fiorentina superlativa","Locale tutta sostanza, nel senso più stretto del termine. Avevo voglia di una bistecca alla fiorentina e me la sono tolta tutta nel migliore dei modi possibili. Staff alla mano, menù caratteristico, ci torneremo sicuramente è lo consigliamo ad occhi chiusi. Consiglio di prenotare."
"ui_bubble_rating bubble_50","Week end in Firenze","La prima cosa da fare quando si arriva a Firenze e chiedere in giro dove si mangia una bistecca fiorentina doc...eccoci con la risposta: La burrasca!! Per iniziare, l'antipasto di formaggi e salumi veramente ottimo e poi ovviamente ....la regina della serata: LA BISTECCA FIORENTINA.3.6 kg di pura bonta' unita a contorni misti ed ottimo vinoTutto rende la serata indimenticabile grazia alla grandissima compagnia di Elio e Tomas Non si dovrebbe dire parlando di bistecche ma lo diciamo lo stessoWELL DONE!!!Grazie"
"ui_bubble_rating bubble_50","Tutto ottimo!","piccola trattoria dell'ambiente casalingo abbiamo voluto provare piatti della cucina tipica toscana ed erano tutti veramente ottimi!!! il propietario é molto gentile e disponibile. Super consigliato!!! Si consiglia di prenotare"
"ui_bubble_rating bubble_40","Scoperta piacevole e gradita","Ottima tipica trattoria. Aperta anche di sera offre una adeguata varietà di piatti, ma soprattutto si distingue per le carni. Grande e impagabile bistecca trattata e cotta alla perfezione, fantastica la trippa alla fiorentina. Ottimo il chianti della casa. Preziosi e validi i consigli del personale che è giovane, cortese, disponibile. Buono il rapporto qualità prezzo. "
"ui_bubble_rating bubble_50","Grande Elio!!!!!","La ciccia più buona, la compagnia familiare fanno della Burrasca un luogo fantastico!!! Ho consigliato a tante persone questo locale, i prezzi sono ragionevoli la simpatia e il cibo fanno tutto il resto.Mi raccomando andateci "
"ui_bubble_rating bubble_50","Mamma mia che ragù! ","Premesso che tutto quello che abbiamo mangiato era buonissimo... Ma un ragù del genere e chi l'aveva mai assaggiato! A dir poco paradisiaco. Non abbiamo avuto modo di assaggiare la carne ma la prossima volta che torneremo a Firenze sarà nostra premura farlo (e comunque a detta dei nostri vicini commensali era ottima anche quella). In tutto questo non dimentichiamo un prezzo a dir poco popolare. Insomma più che consigliatissimo! "
"ui_bubble_rating bubble_50","Ottimo e buona accoglienza","Consigliato da un famoso paninaro di Firenze. Ci siamo trovati benissimo, abbiamo ordinato in 4 persone: 1 antipasto fiorentino, una fiorentina da 1,5 kg, un piatto di fegato, una porzione di fagioli all'uccielletto, due dolci. Tutto ottimo e ottimo rapporto qualità/prezzo!"
"ui_bubble_rating bubble_50","TRATTORIA TIPICA","Ambiente famigliare . Cucina molto buona ottima la carne. Personale gentile e simpatico. Ottimo rapporto qualità presso. Consigliato."
"ui_bubble_rating bubble_40","Buonissima carne, locale intimo","Buon pranzo tra amici in questo locale, ottima fiorentina e servizio veloce. Prezzi nella media. Consigliato!"
"ui_bubble_rating bubble_50","Ambiente familiare","Siamo entrati per caso, in queto locale è piccolo e accogliente ed è stata una ottima scelta.Nonostante non avessimo la prenotazione siamo stati fortunati e dopo soli 10 minuti di attesa ci hanno dato un tavolo per due (consiglio di prenotare, le coppie dopo di noi non hanno avuto la stessa fortuna). Il cibo è ottimo, in particolare la tagliata di manzo è stata la migliore mangiata nel nostro weekend a Firenze. Il cameriere è gentile e simpatico. Consigliatissimo."
"ui_bubble_rating bubble_50","Bella scoperta!","Una sera in cui tutti i ristoranti di Firenze erano chiusi o pieni capitiamo in questa trattoria verace. È stata una sorpresa per i cibi saporiti, il clima informale, la cortesia e i prezzi abbordabili!Fiorentina squisita, fettunta da 10, Sconto finale!Ci tornerò... Potrebbe diventare un must a Firenze!"
"ui_bubble_rating bubble_40","Gentilissimi","Genesis in sottofondo, cortesia, ottimo cibo e prezzi onesti cosa volere di più. Promosso 10 e lode."
"ui_bubble_rating bubble_40","Inaspettato","Gita a Firenze e' ora di pranzo e si cerca un posto dove mangiare. Vicino al mercato una piccola trattoria dall'aspetto antico mi invita ad entrare e ho avuto ragione nel trovare cortesia ma soprattutto cibi buoni pici con frutti di mare tagliata di pollo speziata alla griglia lombata alla griglia salsicce toscane il tutto con un prezzo onestissimo. Da ritornarci per i piatti tipici toscani"
