"Restaurant_Ratings","Restaurant_Quotes","Restaurant_Reviews"
"","",""
"ui_bubble_rating bubble_50","Il miglior ristorante di Firenze (e non solo!)","Semplicemente fantastico! Ottima Qualità dei piatti, dagli antipasti ai dolci. Menù con ampia scelta, Servizio veloce, efficiente e di una simpatia unica! Location rustica, in pieno centro a Firenze, a pochi passi dal Duomo. Assolutamente consigliato, scappate dalle trappole per turisti e andate a mangiar divinamente alla Burrasca!! Io sicuramente ci tornerò. Maddalena "
"ui_bubble_rating bubble_50","CONSIGLIATA E SPECIALE","Ottima trattoria che, in pieno centro in zona turistica, conserva l'atmosfera delle trattorie fiorentine di una volta. Si mangia bene e si spende ancora meglio: primi piatti sfiziosi, ottime pietanze di carne con al top la bistecca fiorentina a prezzi davvero onesti. Lo chef Elio è un personaggio simpatico ed in linea con l'atmosfera del locale in cui ci si sente a casa."
"ui_bubble_rating bubble_50","Tanti piatti da gustare","Il posto adatto per assaporare ottimi piatti della cucina toscana e siciliana nel cuore di Firenze. Qui si trovano, oltre alle prelibatezza della cucina fiorentina più caratteristica come la Fiorentina, la trippa, l'ossobuco o i tortelli, anche le sarde a beccafico."
"ui_bubble_rating bubble_40","Tradizione toscana in pieno centro a firenze","Ottima fiorentina e cucina tradizionale toscana. Siamo capitati per caso e ci siamo seduti quasi subito in due senza attendere. Il prezzo è stato corretto ed adeguato. Circa 30 euro a testa per una fiorentina di circa 1 kg con filetto cucinata benissimo, contorni e vino della casa. Pane toscano e cortesia"
"ui_bubble_rating bubble_40","Trattoria semplice, ma di gusto","Primi piatti e bistecca fiorentina OTTIMI! Ci siamo stati per 2 giorni consecutivi...Buon rapporto qualità prezzo. Personale gentile. Consiglio questa trattoria."
"ui_bubble_rating bubble_40","Cena coi baffi","Abbiamo cenato in questa piccola osteria e siamo stati più che soddisfatti!Cibo ottimo e prezzo giusto...servizio molto cordiale!Se dovessi tornare a Firenze mangerei sicuramente di nuovo qui..."
"ui_bubble_rating bubble_40","Ottimo posto ma..","ci sono stato oggi con la mia ragazza e degli amici, conoscevo il posto perché c ero stato piu volte e ci avevo portato diversi parenti e conoscenti.Spettacolare il cibo come sempre, carne favolosa, primi, dolci.. tutto ottimo. Peccato per la cameriera e i suoi modi di fare.Quando chiamo le chiedo un tavolo e mi fa: subito? Si be ma il tempo di arrivare.. se ero davanti alla porta invece di chiamare ti bussavo alla porta non ti pare? Chiedimi l orario se hai pochi tavoli. E soprattutto se succede un disguido non ci si arrabbia, non è professionale.Dov è il ragazzo rasato con gli occhiali? Se ne sente la mancanza. Cmq a parte la cameriera, ottimo posto lo consiglio."
"ui_bubble_rating bubble_50","Un posto realmente tipico","Una vera osteria nel pieno centro di Firenze. Prezzo abbordabile, non una trappola per turisti. Menù con ingredienti di stagione, ottimi primi.Una sorpresa gli ottimi dolci siciliani.Lo staff è incredibilmente gentile. Attenzione è necessario prenotare "
"ui_bubble_rating bubble_10","Un po alla buona..","Locale strettissimo con pochi coperti e distanza dei tavoli calcolati da un ingegnere, menu: fatti in copisteria e sbagliato il verso di stampa...pane insipido, i primi totalmente privi di ogni gusto oppure pieni di olio, spesa molto ritenuta, ma non ne vale proprio la pena."
"ui_bubble_rating bubble_40","Una simpatica trattoria nel cuore antico di Firenze dai retaggi siciliani.","L'ambiente è piccolo ma la simpatia del personale non manca. Vicino al mercato di San Lorenzo si può assaporare un interessante connubio tra buona cucina toscana e sapori siciliani. Buono e veloce il servizio nonostante l'incastro dei tavoli nel piccolo locale. Bistecche alla fiorentina di buon livello e i dolci da provare sicuramente. Ottimo il rapporto qualità prezzo."
"ui_bubble_rating bubble_50","Ottima qualità e personale molto simpatico","Buonasera internauti,se desiderate passare un buon momento in famiglia o con gli amici, se avete voglia di visitare un locale dove la qualità fa da padrona, siete nel posto giusto.Ogni volta che scendiamo a Firenze andiamo alla Burrasca a mangiare con mia moglie e la coppia dei nostri migliori amici.Il cibo è ottimo, il vino non ne parliamo proprio, il rapporto tra qualità e prezzo è secondo me sopra la media.Anche se sono già stato qui diverse volte, sono sicuro di tornarci."
"ui_bubble_rating bubble_20","Confusione, rumore, approssimazione in sala e , temo, anche in cucina","Tavolo talmente stretto da non potersi muovere neppure di pochi centimetri, bruschette & co. d’ordina za, primi “finiti” o non disponibili per più di due commensali (scadente il risotto), solo la Fiorentina ben cotta e ben presentata. Neppure il pane in tavola. Il cameriere si è dimenticato fi portare altre bottiglie d’acqua. Non viene servito il caffè (non c’è proprio!). Il conto non è salato, ma meglio spendere qualcosa in più, essere serviti meglio e mangiare meglio!Bella la parete decorata, ma non basta."
"ui_bubble_rating bubble_50","Piatti casarecci ECCELLENTI","Cordialità ottima, cameriere simpaticissimo, carne cotta solo al sangue(prende un punto in più) cibo ottimo, la fiorentina non è il massimo dal punto di vista del pregio ma comunque saporita e cotta in modo eccellente. Il resto della cucina è top, Patate al forno da paradiso e dolci molto buoni. Torta riccotta e pere è il top."
"ui_bubble_rating bubble_50","Cenetta deliziosa!","Sono stata a Firenze soltanto una notte per lavoro, e il proprietario dell’albergo mi ha consigliato questa osteria fantastica. Personale divertente e allegro che mi ha tenuto compagnia nonostante la cena in solitaria, le portate varie e davvero buonissime! Ho ordinato antipasto di bruschette (2, buonissime ed enormi!), una tagliata di lonza con grana e aceto balsamico con contorno di patate al forno (le patate tantissime e appena fatte), vinsanto e cantucci come dessert, acqua e un quartino di Chianti per un totale di 25€! Assolutamente da provare!!!"
"ui_bubble_rating bubble_50","OTTIMO RISTORANTE FIORENTINO !","OSSO BUCO OTTIMO !!!! Locale famigliare, alla mano, allegria vino buono e CIBO OTTIMO ! Lo consiglio vivamente !!!!"
"ui_bubble_rating bubble_40","Nostalgie siciliana","Locale piccolo ma carino e attento alla clientela.Menu ricco,bei primi piatti,l antipasto gli darei piu importanza,i secondi buoni ma ..in toscana si puo' osare di piu!!!comunque una bella cenetta"
"ui_bubble_rating bubble_40","Ottimo pranzo","Sono capitata con alcuni amici in questa trattoria di venerdì quindi abbiamo avuto la fortuna di mangiare del pesce fresco. Le penne zucchine e totani con pangrattato (8euro) sono state veramente buone, i pici allo scoglio (10euro) invece erano un pò sciapi. Buon rapporto qualità/prezzo e personale molto gentile, quindi consigliatissimo!!!"
"ui_bubble_rating bubble_50","Da visitare","Piccola trattoria in posizione centrale ma un po' defilata. Accoglienza cordiale e simpatica, piatti semplici ma curati. Buona la carne, ottima la pappa al pomodoro!!! Rapporto qualità prezzo da consigliare!!!"
"ui_bubble_rating bubble_50","Pranzo prima del calcio storico","Piccola trattoria accogliente e spartana. Ottimi gli antipasti e l ossobuco e anche lo spezzatino con le cipolle. Ottimi anche i dolci come i cannoli, servizio veloce attento con molta simpatia ;prezzi onestissimi....unica pecca non fanno i caffè. CONSIGLIATO"
"ui_bubble_rating bubble_30","La simpatia e la cordialità non bastano","Consigliati, siamo giunti in questo ristorante. Simpatica l'accoglienza, l'ambiente è informale, molto piccolo e un po' sovraffollato, il cameriere informale come il locale, quindi non disdice. Abbiamo prenotato per le 9.15 ed hanno accolto la prenotazione senza batter ciglio. Siamo arrivati puntuali e siamo stati serviti alle 9.50, va benissimo, ma alle 10.10 ci hanno detto che la cucina era chiusa. Quindi non avremmo potuto ordinare altro. Non va bene, se sapete che il cuoco se ne va alle 22, non puoi accettare prenotazioni alle 21.15. la carne era buona (la tagliata), mentre la pasta con il sugo di pomodori secchi, era piuttosto banale e, soprattutto, piuttosto salata. Come contorno abbiamo scelto delle zucchine trifolate (non c'era rimasto altro... un ulteriore motivo per non accettare prenotazioni rirardate). Un contorno triste, dal sapore sbiadito, in assoluto contrasto con la frizzantezza del servizio. Anche il vino, abbiamo dovuto prendere quello consigliato da loro, perché quello scelto da noi non c'era più. Ben accetti i cantucci offerti dalla casa. Il conto abbordabile, cobsiderando che siamo in pieno centro storico, ma le criticità restano piuttosto pesanti. Non mi sento di sconsigliarlo in maniera categorica, ma inviterei a quel minimo di attenzione in più per dei particolari che fanno la differenza tra una buona cena e una serata piuttosto incolore."
"ui_bubble_rating bubble_50","Ottimo","I piatti sono veramente buoni e il servizio è ottimo. Qualità prezzo eccellente. Consiglio vivamente"
"ui_bubble_rating bubble_30","Cena","Cena di passaggio,trattoria tipica con prezzi molto vantaggiosi,abbiamo preso 2 primi 1 secondo,molto buono l’ossobuco,buoni anche i primi,l’unica pecca è che gnocchi e tortelli sono industriali anche se conditi bene."
"ui_bubble_rating bubble_40","Consigliato da un amico ","Trattoria caratteristica, ottima per un pranzo all'altezza. Ragù strepitoso e conto più che corretto. "
"ui_bubble_rating bubble_50","T-BONE!!!!","una fiorentina da amare....sempre e comunque....immancabile, ogni volta che andiamo a cena fuori qualcuno ci chiede di assaggiare la fiorentina, la burrasca è una garanzia!!!!"
"ui_bubble_rating bubble_50","Tipica trattoria Toscana ","Sono stata a cena in questa carinissima trattoria tipica con un’amica. Il locale è molto piccolo ma, nonostante ció ci siamo sedute subito (siamo andate tardi, verso le 9.30). Il personale è stato molto cordiale e disponibile ( devo fare i complimenti ai gusti musicali ! Ottima playlist). Io ho mangiato un piatto (abbondante) di pici al ragú d’anatra veramente buonissimo ! La mia amica ha preso una tagliata di filetto ottima con patate al forno. Eccellente rapporto qualità/prezzo! Consigliatissimo per chi volesse gustare i sapori della cucina tipica toscana in un ambiente tranquillo, cordiale e accogliente! Ci torneremo sicuramente !"
"ui_bubble_rating bubble_50","Meraviglia di gusto","Abbiamo cenato in questa trattoria rimanendo estasiati dai sapori e dalla genuinità dei piatti. Prezzi modici e più bassi di tutta Firenze. Qualità alta e mantenimento della tradizione fiorentina nel piatto. Abbiamo provato una ottima pappa al pomodoro e come secondo consigliato il coniglio alla griglia servito con un filo di olio locale. Carne saporita che si scioglie in bocca. Primi sugli 8 euro, 12 euro circa i secondi. Camerieri gentilissimi e atmosfera calda.. Che ti fa sentire a casa! Bravi! "
"ui_bubble_rating bubble_50","Splendida Fiorentina ","Un'ottima fiorentina,servizio cordiale e sollecito. I prezzi sono davvero modici e la qualità invece è super! Ritornerei domani stesso "
"ui_bubble_rating bubble_50","A Firenze direbbero “ruspante “","Trattoria vera come quelle di una volta. Se cercate piatti raffinati non è il vostro posto. Ma se invece volete un locale familiare, una cucina autenticamente casalinga ma di ottima qualità, questo posto vi soddisferà appieno. Fiorentina tenerissima, crostini soffici e croccanti al tempo stesso. Il personale simpatico e attento a far sì che durante il pasto non ci si estranei guardando lo smartphone."
"ui_bubble_rating bubble_50","Osteria tipica è ottima ","Il posto è piccolo piccolo ma accogliente. Gestori simpatici e gentili. Tovagliette di carta ma servizio veloce. Piatti semplici che cambiano ogni giorno. Cucina espressa tutto fatto in casa e ottimo. I crostini ai fegatini come la migliore tradizione. Una Costata alla Fiorentina cotta alla perfezione che si scioglieva in bocca ad un prezzo accessibile. Ci tornerò anche oggi. Banditi i cellulari, ma tanto non c’è Wi-Fi e il cellulare non prende. Godetevi il cibo e la compagnia."
"ui_bubble_rating bubble_20","Un pranzo da dimenticare","10 marzo 2018. Ore 13,20 entriamo, io, mia moglie e nostro figlio di 8 anni per pranzare in questa trattoria nel centro storico di Firenze, ore 14,20 usciamo. Unico ricordo positivo, il cameriere (un ragazzo) molto gentile, al quale abbiamo lasciato volentieri la mancia."
"ui_bubble_rating bubble_50","Bistecca alla fiorentina eccezionale","Tipica trattoria Toscana, assolutamente rispettata la cottura al sangue della carne, non andate se volete solo carne ben cotta. Bistecca alla fiorentina fantastica, porzioni molto abbondanti e rapporto qualità prezzo ottimo. Assolutamente consigliato ma prenotando"
"ui_bubble_rating bubble_50","P E R F E T T O","Tutto ottimo&perfetto: accoglienza semplice e genuina di casa; locale piccolo e accogliente; personale simpatico, alla mano, preparato; cibo buonissimo: bruschette abbondanti, fiorentina UNICA ed eccellente, dolci fatti in casa squisiti, vino ottimo. Conto onesto!"
"ui_bubble_rating bubble_50","Carne al top!","Ho avuto il piacere di conoscere Enzo,ottimo conoscitore di tagli di carne.Per la fiorentina usa la limousine francese,una delizia per il palato.Complimenti!!A presto.."
"ui_bubble_rating bubble_50","Ospitale, gustoso","Posto molto tranquillo ed ospitale, cibo ottimo. Servizio in sala amichevole ed efficente. Un plauso al cuoco che cucina sulle note di De André!"
"ui_bubble_rating bubble_50","Ottimo!","Locale piccolo e intimo, cibo e vino ottimi, prezzi fantastici! Consigliata la prenotazione soprattutto nel fine settimana! "
"ui_bubble_rating bubble_50","Consigliatissimo!!","Locale piccolo ma molto accogliente, grazie soprattutto al personale!!! Eravamo solo in due ed abbiamo comunque prenotato...fortunatamente! Consigliato da un’amica che vive a Firenze e devo dire che è stato davvero un consiglio prezioso! Ottimo rapporto qualità-prezzo. Un antipasto grande (in due) siciliano e toscano, buono; tagliata di fiorentina squisita...e per finire cannolo siciliano: gioia pura per il palato! "
"ui_bubble_rating bubble_50","Cena gustosa a prezzi giusti","Sono stata in questo ristorante per una cena di lavoro. Il posto è semplice ed informale, carino e familiare, direttamente davanti san Lorenzo. Il personale è gentilissimo e si è preso cura di noi con garbo. Abbiamo preso degli affettati misti e del formaggio come antipasto, poi un'ottima bistecca t-bone morbidissima e gustosa con patate arrosto e piselli e pancetta. Ed infine abbiamo preso un dolce gustoso, nel mio caso torta ricotta e pere. Tutto accompagnato dal vino rosso della casa, nemmeno male! In totale abbiamo speso circa 35 euro a testa, un prezzo giustissimo per quanto mangiato. "
"ui_bubble_rating bubble_50","OTTIMO ","Nel cuore di Firenze.Ovviamente abbiamo optato per la GRANDISSIMA FIORENTINA.DIVINA!!!!!Piena di sapori.Squisita.Dico solo che la mia ragazza non mangia carne al sangue .Nel piatto è rimasto solo l'osso.FANTASTICO"
"ui_bubble_rating bubble_40","Tipica cucina toscana","Ci siamo capitati x caso. Locale piccolo ma, gradevole. Personale gentile.Tipica cucina toscana... primi molto buoni. Consiglio i pici e con la pasta con acciughe e pan grattato. Ancge i tortelli con le patate. Rapporto qualità prezzo buona.bisogna prenotare altrimenti nn ai mangia."
"ui_bubble_rating bubble_50","Spettacolare","Un posto piccolo piccolo e molto accogliente; proprietario gentilissimo e molto simpatico. Siamo stati accompagnati in questa trattoria da amici fiorentini e ci siamo trovati veramente benissimo: ambiente e cibo ottimi, conto pure. Se abitassi a Firenze ci tornerei spesso."
"ui_bubble_rating bubble_40","Yess!","Cena al volo con antipasto misto toscano, un antipasto di pesce, ribollita, fagioli all'uccelletto, cavolfiore e un secondo a base di pesce. Vino della casa, acqua e pane a volontà. Il team è giovane e spigliato, attento e cordiale. Il locale ti fa sentire a Firenze, ma anche un po in Sicilia.Cantucci col Vinsanto e... la prossima volta si torna per mangiare la fiorentina! Già perchè ne abbiamo viste passare proprio di belle pezzature.Prezzo pagato 43€."
"ui_bubble_rating bubble_40","Trattoria tipica toscana","Trattoria tipica toscana in Borgo san Lorenzo, quartiere molto vivo in zona Mercato Centrale.Pochissimi coperti, per cui consiglio di prenotare, pochi fronzoli, coperto essenziale ma non si paga, cameriere toscanissimo, simpatico e disponibile. Servizio veloce ed attento.Menù tipico toscano, tutto veramente ottimo, ma io su tutto consiglio i gnocchi all'ossobuco.Rapporto qualità prezzo ottimo.Appena ripasso da Firenze ci torno"
"ui_bubble_rating bubble_40","Simpatia ","Simpatico il ragazzo in sala. Ottimi i piatti tipici. Da non perdere i cantucci con il vin santo. Molto buono il rapporto qualità/prezzo."
"ui_bubble_rating bubble_50","Ottimo pranzo","Vicino al mercato di San Lorenzo, un bellissimo ambiente caldo e accogliente, carne ottima: bistecca davvero cotta alla perfezione 1,8 kg di felicità! Buoni i fegatini e ottimo anche l’osso buco. Simpatico e preparato lo staff. Lo consiglio "
"ui_bubble_rating bubble_40","Cucina tipica Toscana ","Tra le trattorie fiorentine questa è tra le migliori. Cibi caratteristici toscani, ribollita pici, formaggi, salumi e carni tutto di buona qualità. Un buon rapporto qualità prezzo è tra l'altro non si paga il coperto. Certamente una trattoria da consigliare. "
"ui_bubble_rating bubble_30","Medio","Media qualità della carne e non caro. Personale gentile. Ci sono andato un paio di volte. È piccolo e forse è bene prenotare. Troppo fiscali su gli orari di chiusura: Una volta non mi hanno fatto entrare anche se ero da solo perché la cucina avrebbe chiuso tra breve"
"ui_bubble_rating bubble_50","5 perché 6 stelle non esiste","Recensione breve. La foto parla da sé. La sognerò la notte questa Fiorentina.Ottimo tutto, dal servizio al conto ! Complimenti!! "
"ui_bubble_rating bubble_50","Spettacolo!","Sara' la mia recensione piu' breve che ho mai fatto!Cibo spettacolare.Siamo andati con amici che lo conoscevano e abbiamo assaggiato di tutto di piu' e ogni cosa che ci portava,era migliore della precedente.Io invece del dessert ho concluso con una zuppa di cipolla che il cuoco mi ha fatto gentilmente assaggiare,ed era la fine del mondo!Loro invece hanno chiuso con un cannolo che a sentirli era una bomba di bonta'!Servizio ottimo,gentilezza,prezzi bassi e un locale carinissimo e accogliente.C'e' davvero tutto!Che dire di piu'?Andateci perche' merita davvero!!!"
"ui_bubble_rating bubble_20","Vacanza","Buono il cibo ma locale troppo piccolo con troppi posti a sedere. Il mio era vicino all' entrata e le porte lasciavano passare un fastidioso spiffero. Peccato, non ho potuto gustare la cena "
"ui_bubble_rating bubble_30","Si... ma non mi ha colpito ","Siamo capitati li x caso per un pranzo alla veloce, ci siamo seduti in un angolino, (il locale è piccolo) vicino alla porta, spifferi a go-go e gente che entrava ed usciva senza chiudere bene la porta, il che non è il massimo dato che siamo a gennaio, il menù scritto a mano e male (ho fatto fatica a leggere) e fotocopiato, il menù non mi ha colpito particolarmente, abbiamo preso due antipasti e due primi, tutto buono, ma non mi ha lasciato soddisfatto, non credo tornerò "
"ui_bubble_rating bubble_40","Solo x la fiorentina","Locale piccolo con pochi posti a sedere, accetta prenotazioni che suddivide in 2 fasce orarie. Antipasto povero e caro, patate al forno solo per i fortunati e Fiorentina da 42€/kg veramente squisita!!!! "
"ui_bubble_rating bubble_40","Quando non te lo aspetti<U+0001F60D>","Nonostante sia piccolino e in un edificio un po' vecchiotto, il locale è fantastico. Siamo stati accolti calorosamente dalla staff e abbiamo potuto godere di un ottimo servizio. La Fiorentina era ottima e ad un prezzo più che ragionevole (42€ al kg, per 7 persone ne abbiamo ordinati circa 3 kg). Il coperto è già incluso e i restanti prezzi del menu corrispondono a quelli di un normale ristorante."
"ui_bubble_rating bubble_40","ottima cucina a prezzi ragionevoli","Aspetto piuttosto semplice, ma servizio rapido e cortese. Ottimi piatti soprattutto toscani a prezzi molto ragionevoli"
"ui_bubble_rating bubble_50","Ottima accoglienza , Fiorentina eccezzionale","Abbiamo mangiato in questa trattoria dal sapore antico , molto accogliente . I due camerieri o forse meglio “osti” molto simpatici . Fiorentina favolosa , abbiamo pagato il giusto rispetto alla qualità e alle porzioni. Ci siamo ritornati a capodanno ma abbiamo trovato chiuso , giustamente direi , meritano anche loro di festeggiare .Torneremo sicuramente . Consigliatissimo!!!!"
"ui_bubble_rating bubble_50","La fortuna bacia gli audaci","Dopo aver vagato nella zona di San Lorenzo, senza ormai troppe speranze, intravediamo su un palazzo una scritta un po' vintage trattoria, arriviamo lì davanti e dopo aver sbirciato dentro eccoci approdati in questa Trattoria: la scelta migliore che potessimo fare.Si respirava la vera aria fiorentina: simpatia e cordialità il biglietto da visita accompagnato da buon cibo e un prezzo onesto.Il titolare ha anche accettato che mangiassi i cantucci senza il vin santo :-D il TOP!Pici e ribollita promossi a pieni voti! Spero di tornarci, presto."
"ui_bubble_rating bubble_50","Sempre buono ","Quando vengo a Firenze per me è una tappa fissa questa osteria. Fiorentina buonissima e primi da provare! Atmosfera e professionalità! "
"ui_bubble_rating bubble_50","Consigliatissimo !!! Fiorentina da paura !","Posto molto carino camerieri simpatici e disponibili cibo genuino e di qualità!! Una Fiorentina da leccarsi i baffi !!!"
"ui_bubble_rating bubble_40","Gusto e cordialità ","Scovato per caso girando per il Borgo, abbiamo fatto una scelta assolutamente eccellente. Il personale tutto è garbato, cortese e estremamente disponibile. All'inizio l'unico tavolo disponibile era vicino alla porta, ma appena uno più grande si è liberato ci hanno fatto spostare per farci stare più comodi( cosa che apprezzo tantissimo). Noi abbiamo preso una fantastica Fiorentina di 1,200 kg veramente squisita, l'abbiamo spazzolata in due senza problemi. I contorni semplici e genuini e abbiamo concluso il pasto con i buonissimi cantucci (ma buoni buoni buoni) bagnati nel vin Santo. Il prezzo é assolutamente nella norma. Stra stra consigliato."
"ui_bubble_rating bubble_50","LA MIGLIORE FIORENTINA, FIDATEVI!","Atmosfera toscana, personale simpatico, senza affettazioni, genuino, come il cibo, ma cucinato seriamente. La bistecca te la mostrano prima da cruda, poi te la godi veramente. Ottima la qualità della carne ed ineccepibile la cottura: certo, al sangue, rossa rossa all’interno, ma il sangue non lo vedi. Condita perfettamente, una prelibatezza fino alla fine. Ho apprezzato molto anche la garbata raccomandazione di ...lasciare il cellulare in tasca x godersi la...trattoria."
"ui_bubble_rating bubble_50","Bravi a prezzi giusti","Mangiare toscano a prezzi onesti è difficile. In questa piccola trattoria, grande cortesia, tavoli spartani e poveri, odori giusti vi permettono di entrare nella magia della cucina toscana. Tutto ottimo. Tutti i prezzi giusti anche quelli del piatto più nobile, la Fiorentina. Tenera e gustosa e seppure non catta alla brace è stata una delle miglior da me mangiate. A volte spendendo il giusto si può' mangiare divinamente. Questo è il posto giusto."
"ui_bubble_rating bubble_50","Come sentirsi a casa nel centro di Firenze","Dopo aver scartato altri locali che dove proponevano pizza o pasta alla carbonara, ho scovato La Burrasca, piccolo locale dove si è serviti su tovaglie di carta. Spendendo poco, ho mangiato degli ottimi crostini, una zuppa di cipolle, del formaggio di capra arrosto e un dolce alla pera, tutto accompagnato da un onesto Chianti della casa. Il servizio è veloce e attento. Ci tornerò domani e tutte le volte che verrò in questa città."
"ui_bubble_rating bubble_40","Buono","Posto accogliente anche se piccolo. Cucina fiorentina e siciliana. Molto buono. Le paste sono ottime. Cibo di qualità e con prezzi modesti. "
"ui_bubble_rating bubble_40","Turisti qua vi troverete bene","Una piccola trattoria gestione familiare, sala piccola con pochi posti a sedere, menu tipico toscano molto buono.Tutto quanto rustico, dal menu al coperto, fiorentina d'obbligo e cotta come dev'essere.Prezzi medi, non perché è una trattoria si pensa di pagare poco, il cibo buono si paga giustamente.Trattati veramente bene dal proprietario.Complimenti "
"ui_bubble_rating bubble_50","Consigliatissimo, gentilissimi e prodotti di qualità.","Sono stato Firenze per lavoro e per 3 volte mi sono recato alla Burrasca. Veramente un posto piacevole, abbiamo mangiato della carne fantastica e cotta al punto giusto.L'ambiente è piccolo l'odore di cibo non arriva assolutamente ai commensali, è il classico posto dove ci si sente a casa.Prezzi giusti e massima gentilezza. Approvato a pieni voti."
"ui_bubble_rating bubble_40","Scoperto per caso!","Stavamo cercando una trattoria tipica fiorentina, e dopo un'ora di ricerche ci siamo imbattuti in questa! Posto molto semplice ma accogliente, proprietari simpatici e alla mano ma soprattutto cibo di qualità e in quantità che soddisfano la fame! Tornerò sicuramente!! Ah dimenticavo i prezzi davvero contenuti!!!"
