"Restaurant_Ratings","Restaurant_Quotes","Restaurant_Reviews"
"ui_bubble_rating bubble_40","Ristorante di classe","Non sono molti i ristoranti in grado di offrire un menù di carne ed uno di pesce egualmente accurati e di gran qualità. Trattoria non è , se non per il clima familiare e rilassato che vi si respira. Tradizione e modernità trovano un giusto equilibrio, anche nei prezzi che pur popolari non sono. Buona cantina , ricarichi non eccessivi. Personale gentile e professionale. Sosta consigliata. "
"ui_bubble_rating bubble_50","Esperienza culinaria da 10 e lode","Ristorante bello, arredi eleganti, raffinati.Menù con piatti di mare e terra, tutti studiati negli abbinamenti.Abbiamo mangiato: tagliolini astice e carciofi (buono), spaghetti allo smeriglio con finocchio erba cipollina e uvetta (buono con ottimi profumi), tonno al sesamo (ottimo), tonno del chianti (ottimo), filetto alla Rossini (ottimo).Buono il dolce.Servizio cordiale e puntuale.finoscchio erba cipolosmeriglio car rmogli ecc. StupendoI dolci sono sensazionali e di altissima qualità sia per l'impiattamento che per il gusto.Sicuramente un ristorante costoso, sulle 100€ a persona.Servizio veloce curato preparato.Pane eccezionale."
"ui_bubble_rating bubble_50","Eccellenza pura....","Ritorno sempre con piacere presso questo ristorante, senza dubbi di altissimo livello. L'elevatissima qualità dei prodotti, la pietanze a dir poco deliziose, la gentilezza ma soprattutto la sapienza dell'arte culinaria del personale ne fanno un posto unico a Firenze (e non solo),"
"ui_bubble_rating bubble_50","Tutto perfetto!","Come altre volte servizio impeccabile e gentilezza, caratteristica del locale. Ho mangiato tagliolini con astice e carciofi buonissimi. Complimenti."
"ui_bubble_rating bubble_50","Ottima cena , ottima qualità ","Tutto ottimo, partendo dal grande tavolo rotondo decisamente di mio gradimento, fino alle chiacchiere sull'uscio con il cameriere. Abbiamo cenato un sabato di gennaio con due antipasti (un tonno sottovuoto io e assaggi di formaggi il mio ragazzo) per poi proseguire con una bella bistecca fiorentina accompagnata da fagioli. Tutto davvero squisito. Anche il Chianti classico era ottimo. "
"ui_bubble_rating bubble_40","Bel posto","Ristorante con cucina tipica fiorentina. Molto curato il servizio, buone le pietanze. Consigliate le tagliatelle al sugo di fagiano"
"ui_bubble_rating bubble_50","per caso, a cena","Sono a Firenze e tra una cosa e l'altra faccio tardi, mi dico: Perchè non al Bronzino?. Detto fatto, dove vengo accolto con la consueta cortesia, mi sono offerto, nell'ordine:- dei crostini di fegatini alla fiorentina su fettine di pane abbrustolito, squisiti- delle fettuccine all'astice e carciofi veramente eccellenti e ben fatte, giustamente cotte e cremose, un gran piatto- una tagliata di manzo ben fatta con patate fritte, di quelle vere, riconoscibili dalla patata sbucciata e fritta a rondelle, ben calde, ormai una rarità. Preciso: la tagliata portata al tavolo intera e affettata davanti ai miei occhi, sempre calda, come bisogna fare. Se te la portano già affettata e magari anche sul piatto freddo è un'infamia, ma in giro ti capita...- crema catalana, abbrustolita all'istante. A seguire un bel caffè doppio in tazza grande.Ci ho bevuto sopra un merlot di Hofstätter che legava anche con le fettuccine astice/carciofo e per finire Umberto mi ha fatto sentire - gran finale! - del rum Bally Ambrè Agricole Martinique di 45°, fluido e aromatico comme il faut. 50€ spesi non bene, di più."
"ui_bubble_rating bubble_10","che delusione !","Anche quest'anno, come altre volte, siamo andati il 31 dicembre a cena alla taverna del bronzino. Questa volta però abbiamo mangiato malissimo: i piatti forse avrebbero voluto essere originali ma sono risultati mal cucinati e per niente appetibili. Come se non bastasse quasi tutti abbiamo avuto in seguito problemi gastroenterici anche prendendo pietanze diverse, alcune delle quali immangiabili. Peccato !!!"
"ui_bubble_rating bubble_50","Serata a tema","Ottima serata tra amici, deliziati da Umberto e dal suo staff. Serata dedicata al bollito toscano ed emiliano di pregevole livello. In attesa di altre serate a tema. Il menù alla carta e la cantina sono peraltro eccellenti. "
"ui_bubble_rating bubble_50","Ottimo pranzo!","Ho avuto un pranzo di lavoro presso questo ristorante e devo dire che il locale è elegante, pulito, con personale molto disponibile. Il cibo è ottimo così come il rapporto qualità prezzo. Non è economico, ma nemmeno carissimo. Vi consiglio di provarlo, soprattutto i piatti tipici fiorentini."
"ui_bubble_rating bubble_40","Gentili","Gentili sin dal nostro ingresso nel locale fino all'ultimo momento.Ci siamo sentiti trattati con sincero affetto.Cucina del territorio, porzioni di buona quantità. Buona qualità dei piatti, non curatissima la presentazione.Nel complesso consiglio."
"ui_bubble_rating bubble_50","Eccellenza fiorentina","E' innegabile che la Taverna del Bronzino possa essere considerata una vera e propria eccellenza fiorentina. Anche oggi, come tante volte nel passato, ho avuto modo di ospitare amici cari importanti, offrendo loro un pranzo che è stato giudicato dagli ospiti eccezionale, in particolare la specialità dei cappellacci... L'accoglienza del Sig. Umberto e di Stefano è stata come al solito vera e calorosa. Il servizio ineccepibile.Semplicemente grazie anche per l'immagine di Firenze che il Ristorante e la Vostra passione continuano a dare nel tempo!A presto.Maria Vittoria N. e Paolo B."
"ui_bubble_rating bubble_50","Ennesima cena aziendale ","Come tutti gli anni splendida cena aziendale alla taverna del bronzino. Come al solito cibo eccellente e servizio impeccabile. Un grazie a Umberto e Stefano per la calorosa accoglienza."
"ui_bubble_rating bubble_50","Da provare assolutamente!","Menù a base di pesce..tartarre di salmone con carciofi, risotto di mare e ricciola con verdure al forno..per concludere con bavarese al vinsanto!il tutto accompagnato da dell'ottimo vino bianco!personale impeccabile..cibo ottimo..una cena davvero di ottimo livello!!!"
"ui_bubble_rating bubble_50","Bollito che passione!!!!!!!!","La serata del bollito alla Taverna del Bronzino è un evento da non perdere. La prima serata risale ai primi anni '90 quando, Umberto, uno dei proprietari e oggi unico titolare della taverna decise di far conoscere le specialità della sua terra. Le sue origini sono dell'Appennino Reggiano, quindi .......bollito come si deve....., essendo la zona, patria del bollito. Normalmente la serata alla Taverna viene fatta due volte all'anno, a fine novembre e a metà febbraio. E anche quest'anno abbiamo avuto la conferma che è sempre al di sopra delle aspettative. Si inizia con un antipasto di salumi tipici e ciccioli ben caldi, il tutto annaffiato da Lambrusco reggiano. A seguire, cappelletti rigorosamente fatti a mano dalla Lucia e dalle donne del paese di Umberto. Cappelletti serviti in brodo stellato....sublimi!!E poi arriva il bello..... due carrelli carichi di ........carne. Il primo con gallina, lampredotto, coda, manzo, vitello e musetto. Il secondo con mariola, cotechino e zucco. Il tutto accompagnato da cipolline gassate e purea di patate. Una menzione speciale va alle salse di accompagnamento: salsa verde, salsa al rafano e mostarda di Cremona.Il finale da urlo.... una bavarese al vinsanto con cantucci sbriciolati e poi caffè. Se potete non vi fate mancare il Nocino. Siamo già venuti diverse volte alla serata del bollito e penso che anche a febbraio non ce la faremo sfuggire. Complimenti a tutto lo staff di cucina e di sala e soprattutto ad Umberto che continua a proporre questa serata. Chapeau"
"ui_bubble_rating bubble_50","Cena","Ristorante storico, ambiente caloroso, accogliente. Cortesi e estremamente preparati i nostri interlocutori. Cucina eccellente. Eccellente anche i vini. Lo consiglio a chiunque voglia coccolarsi e sorridere. "
"ui_bubble_rating bubble_50","Gran serata tra amici","Di ritorno da Umberto & Co questa volta con amici, abbiamo avuto l'opportunità di degustare piatti nuovi poichè ci sono state molte variazioni nel menù.Novità:- antipasto del Bronzino (filetto di pesce su cavolini di Bruxelles cotti al vapore in abbinamento con tartare di tonno);- moscardini con polenta fritta;- garganelli tarese cipolla e pomodorini;- tagliolini astice e carciofi;- orecchiette con pesto di rapa, pistacchio e alici;- raviolo di parmigiana fritto;- bistecca di smeriglio;- tre assaggi dal tirreno.Buono l'abbinamento del vino bianco Girlan 448 Cantina Kellerei (Pinot Bianco, Chardonnay, Sauvignon).Migliorabile, forse, il livello di preparazione dei dolci."
"ui_bubble_rating bubble_50","Cena tra amici","Ho scoperto questo ristorante grazie ad una cena tra amici. Il locale è storico, molto elegante e i camerieri sono gentilissimi e preparatissimi. I piatti sono molto particolari, si può scegliere tra carne e pesce e ogni portata è preparata con estrema cura dei dettagli. Nonostante le porzioni non siano grandissime, i prezzi sono molto alti, in linea con lo stile del locale. Ottimo il tonno. Forse i dolci non sono proprio all'altezza del resto del menu. Consiglio vivamente questi ristorante per occasioni speciali."
"ui_bubble_rating bubble_50","Un' esperienza unica!","Vado spesso alla taverna del bronzino e non mi annoierò mai! Il ristorante ha la ricchezza di aver ancora un' ambientazione storica tipica di Firenze! Perfetto sia per giovani che per famiglie, il ristorante è reso unico non solo dai piatti deliziosi e caratteristici ma anche dal personale, impeccabile e cordialissimo! Ottimo per una cena tipica ma anche più importante, la bella figura è assicurata!"
"ui_bubble_rating bubble_50","l'ennesima cena del bollito, da non perdere!","Con due amici siamo tornati alla mitica cena del bollito del Bronzino: sì, mitica, perchè a Firenze ed in genere in Toscana non c'è il culto del bollito come dall'Emilia in su e di conseguenza trovare un posto dove ci se ne possa levar la voglia, e come qualità e come varietà, è difficile se non impossibile (accetto volentieri suggerimenti ed informazioni).Dunque, antipasto con polenta con lardo (leggermente sciolto...), prosciutto, strolghino che altro non è che un salamino fatto con i ritagli del culatello, da farsi del male, e, sublime!, dei ciccioli caldi, scusate se è poco...A seguire dei cappelletti in brodo dove diventa difficile stabilire se siano più buoni i primi (fatti fare a mano da Umberto, patron del locale, dalle sue parti verso Reggio Emilia) o il brodo, chiaro ma saporito non di sale ma di buone carni lentamente e lungamente sobbollite e schiumate, oggettivamente un piatto sopraffino che i miai amici hanno ripreso, tanto era di loro gradimento.E infine il clou della cena, sua maestà i bolliti in due carrelli, ben caldi, il primo con carni di manzo, gallina, trippa e ...udite udite....la coda, nel secondo insaccati di maiale superbi come cotechino, mariola* e zucco**: il tutto contornato da cipolline borettane glassate e purè. Completavano l'opera della salsa verde, salsa al rafano e della mostarda di frutta tutte di produzione dei cuochi del locale: solo la ragione ci ha impedito di riprendere queste leccornie tutto più volte perchè se avessimo dato retta alla gola avremmo dovuto chiedere di restare a dormire lì, sotto il tavolo.Per finire una bavaresina con biscotti di Prato sbriciolati che ha chiuso degnamente una cena superlativa, con caffè e una scelta di whisky notevole.Su tutto questo abbiamo bevuto un lambrusco secco 'Concerto' di Ermete Medici che si sposava meravigliosamente con quello che abbiamo gustato, tant'è che ne abbiamo fatto fuori 4 (o forse 5) bottiglie senza risentirne nulla.Quanto sopra al costo di € 55 a testa che abbiamo speso molto volentieri, come sempre in questo ristorante dove si trova sempre simpatia, bravura e professionalità da parte di tutti, in sala ed in cucina.Alla prossima.P.S. La mariola e lo zucco sono due insaccati di maiale: il primo è un salamone tozzo di pasta fine aromatizzata con aglio e vino bianco, proprio della bassa parmense, mentre lo zucco, reggiano, è un cotechino più speziato e drogato con una cotenna di grasso all'interno che cuocendo diventa morbida da sfarsi.Almeno se vi capita di andare ad una di queste cene sapete quello che mangiate...."
"ui_bubble_rating bubble_30","non male ma mi aspettavo di più...","il ristorante è buono, senza dubbio, ma in funzione dei prezzi proposti sinceramente mi aspettavo di più. ammetto di non essere così informato sulla ristorazione fiorentina a 360° ma altrove ed in zone altrettanto blasonate per il cibo con lo stesso prezzo ho mangiato decisamente meglio. ricarico del vino eccessivo a mio giudizio."
"ui_bubble_rating bubble_40","Buono","Ristorante quotato con servizio eccellente. Fuori da giri turistici fiorentini. Pietanze di stagione con ottime presentazioni e piacevoli abbinamenti. Carne e pesce. Voglio segnalare un dolce. Zuccotto fiorentino. Eccellente sempre che vi piacciono gli ingredienti. Prezzi consoni al servizio ed alla qualità."
"ui_bubble_rating bubble_50","Un posto che vale un viaggio da Milano","Ottimo il cibo, ottimo il servizio, i ravioli di magro al cedro e zafferano valgono un viaggio, menzione speciale anche alla pasticceria interna... Ha tutto ciò che necessita ad un ristorante di ottimo livello..."
"ui_bubble_rating bubble_40","Un revival riuscito","Frequentavo il Bronzino nei primi anni duemila, con successo. Sono tornato nei giorni scorsi, ed ho potuto nuovamente apprezzare la cura nella preparazione dei cibi, la qualità del servizio, oltre alla presenza simpatica di due camerieri adi alta professionalità. Alla prossima!"
"ui_bubble_rating bubble_50","Fantastico","Siamo finiti qui tramite le recensioni e sicuramente non possiamo che confermare . Il locale non è sicuramente una trattoria , un locale comune ma è un ristorante di classe.La location e lo staff sono perfetti le portate servite dal carrello al tavolo fanno la loro scena e anche quelle che arrivano direttamente ai servite nei piatti hanno comunque una bella presentazione . Le porzioni sono abbondanti e la qualità è' ottima. Sicuramente lo consiglierei per una bella cena romantica ."
"ui_bubble_rating bubble_40","ottimo servizio e buoni piatti","locale accogliente e tranquillo, personale competente e discreto, capace di interloquire con clientela straniera. buoni i piatti di pesce per materia prima e presentazone. forse qualche aggiunta negli arredi ed addobbi renderebbe il locale più caldo.locale consigliato per cene d'affari"
"ui_bubble_rating bubble_50","cibo eccellente","sono tornato dopo piu' di un anno in questo ristorante ... che dire il personale attento e gentile,cibo fantastico accompagnato da ottimo vino.menu molto curato."
"ui_bubble_rating bubble_50","Lo consiglio vivamente ","Sono andato in questo ristorante con mia moglie e ci siamo trovati molto bene cibo ottimo servizioimpeccabile iinottimimoecacam"
"ui_bubble_rating bubble_40","Filetto squisito","Cucina ottima con piatti trazionali. Materie prime eccellenti. Il mio filetto al sangue era ottimo e tenerissimo. Vino consigliato dal proprietario, un Montecucco, molto buono.Antipasto tonno del chianti buono."
"ui_bubble_rating bubble_50","Serate indimenticabili con gli amici","Tutte le volte andiamo alla Taverna, usciamo sempre soddisfatti.Qualità dei prodotti, varietà e ricercatezza del menù, servizio impeccabile e al tempo stesso, se il cliente lo cerca, professionalmente amichevole. Un locale elegante dove tutto è di gran classe, anche l'intensità della luce è perfetta. Ogni portata è pensata per soddisfare non soltanto il gusto. Prestigiosa la carta dei vini. Eccellente la selezione dedicata ai vegetariani (e non solo).Alla Taverna del Bronzino si torna, e ritorna, perché Umberto e la sua equipe, ci offrono la possibilità di vivere serate indimenticabili, ritrovando il piacere di stare seduti a tavola con gli amici, come una volta, e come invece sembra che il trend abbia smarrito."
"ui_bubble_rating bubble_50","Consigliatissimo","Cena per due con menù di carne. Ottima cucina: ogni piatto molto curato, ben presentato e davvero molto molto buono. Ottimo il servizio, personale gentile e preparato. Complimenti allo chef! Merita una nuova visita a breve!"
"ui_bubble_rating bubble_50","Una tradizione che si ripete ","Andiamo abbastanza spesso con degli amici in questo ristorante diciamo classico e che ha superato il passare degli anni e delle mode con una fantastica e continua qualità. Qualità ovviamente del cibo e delle materie prime che il proprietario Umberto sceglie con cura e passione e qualità di un servizio sempre molto attento, amichevole ma mai invadente che per esempio ci fornisce Stefano.I classici salumi toscani sono super selezionati, ottimi i primi è sempre più che buona la bistecca. Per gli amanti dei dolci il finale con un superlativo carrello un po démodé ma di grande sostanza.Ottima cantina e prezzi adeguati al locale"
"ui_bubble_rating bubble_50","Ristorante di gran classe","Ristorante di grande livello, nella tradizione toscana, ma senza fronzoli e cedimenti al turismo. Le migliori pappardelle a sugo di lepre mai assaggiate, fritti di livello. ottimi vini (con cantine nuove e promettenti). Dolci da non perdere"
"ui_bubble_rating bubble_50","un gran bel ristorante....","Il bello non e' riferito alla struttura in se, siamo comunque in un immobile del '500...quindi pregno di storia, ma per l'aria che si respira, nonostante la categoria medio-alta, sembra di stare quasi a casa propria attorniato di persone che si prendoni cura dei clienti.Tutto questo ovviamente per merito del Sig. Umberto, il titolare, e dei suoi collaboratori la cui professionalita' e cordialita' sono di alto livello. I piatti sono di prima qualita': dall'antipasto al dessert, dai primi ai secondi sia di carne che di pesce....e non ultima anche la guarnitura dei piatti e' di buon effetto scenico (anche l'occhio vuole la sua parte). Inoltre c'e' da dire che per la tipologia del ristorante si ha un ottimo rapporto qualita'/prezzo. Complimenti!!!"
"ui_bubble_rating bubble_50","Il Paradiso esiste","Sì il Paradiso esiste! Ed io l'ho trovato a Firenze in un ristorante che non incontri nelle solite vie piene di turisti che estasiati dalla bellezza della città non si curano del posto dove si siedono a mangiare ;se si vuole il paradiso è necessaria una ricerca più particolareggiata, un locale che non incontri in mezzo a tanti altri ma che trovi chiedendo a veri intenditori.Sarò sempre grato a chi me lo ha consigliato.La Taverna del Bronzino si trova in via delle Ruote, in una location piena di atmosfera.Si respira aria di passato, le luci soffuse ed i colori delle pareti lo rendono caldo ed accogliente.I camerieri sono molto professionali, gentili e simpatici.Inizio con garganelli ( rigorosamente di pasta fresca ) con tonno, olive,pomodorini e pistacchi, una vera delizia per il palato .Continuo con mormore alla griglia che mi vengono spinate al tavolo con la maestria di un chirurgo, non una lisca resta nel piatto, pesce ottimo di un sapore delicato .Prendo un contorno semplice: spinaci saltati in padella e magicamente anche questo piatto ha un gusto unico.Termino con torta di mele servita calda accompagnata con un bicchierino di passito di Sicilia.Non si può partire da Firenze senza avere fatto una tappa alla Taverna del Bronzino .Posso affermare senza esitazione : il Paradiso esiste!"
"ui_bubble_rating bubble_20","Gloria passata","Sono tornato alla taverna certo di offrire la migliore opzione nel quartiere. Il locale è sempre elegante ma si nota qualche segnale di dedadenza. Scaccio il pensiero fosco e mi siedo con gli altri commensali. Ottima la flûte servita appena a tavola, premurosi i camerieri. Verrà poi il pranzo. È giorno fa caldo (fuori, qui l'aria condizionata è fin troppo forte) e scegliamo il pesce.I crudi proposti però sono troppo banali, francamente carpaccio di tonno e salmone si trovano ovunque. Il gazpacho con burrata è una cipollosa minestra fredda di pomodoro (la burrata a onor del vero è buona e fresca).La tagliata di tonno (again!) molto sponsorizzata, è troppo cotta e, quindi, poco saporita, il branzino al fornovè solo per due, trovo un partner è così posso assaggiare un pesce assolutamente insapore. L'insalata di frutta è una macedonia e il dolce di yoghurt con frutta sembra una panna cotta confezionata. Amici e colleghi delusi, conto molto salato.Mi spiace, in passato questo ristorante mi ha fatto figurare molto meglio."
"ui_bubble_rating bubble_50","cena di compleanno","uno dei ristoranti migliori, se non il migliore, nel quale ho avuto il piacere di mangiare. Raffinata location, cucina strepitosa, accoglienza impeccabile. Grazie Umberto! "
"ui_bubble_rating bubble_50","cena con babbo","locale caldo e accogliente con accorgimenti floreali sul tavolo gradevoli allo sguardo. abbiamo mangiato ottimi ravioloni giganti fatti in casa ripieni di cinghiale ricoperti di numerosi funghi squisiti , per secondo un bel filetto di manzo (superiore di peso alla media dei vari ristoranti) ai funghi tenerissimo che sembrava burro e per finire deliziose fragole con gelato e un dolce con la pesca che ci hanno descritto come una vecchia ricetta veramente buono.Ottimo vino , servizio eccellente ,rapporto qualità e quantità -prezzo superiori alla media, insomma una ottimo locale per la mia serata con il babbo parlare e mangiare insieme come non succedeva da anni. vivamente consigliato"
"ui_bubble_rating bubble_50","Il mio ristorante preferito","È' da tanti anni che mangio in questo splendido ristorante, adatto a tutte le occasioni, lo consiglio a tutti, personale qualificato, cucina ottima, per quanto mi riguarda è' il Ristorante. Ha tutto ciò' che pretendo da un ristorante, provare per credere!!!"
"ui_bubble_rating bubble_20","Peccato poche volte ho mangiato male a Firenze","Premetto che era mia intenzione cenare altrove, ma ho seguito il consiglio degli amici e mi sono lasciato trascinare alla taverna. Il locale e'elegante molto curato, il servizio buono, i camerieri premurosi e simpatici.L'unica cosa completamente carente il gusto.antipasto ho scelto una tartare di carne, ottima senza dubbio ma completamente insapore e non condita, niente acciuga, niente capperi, cipolla, prezzemolo, uovo ??? Carne cruda con senape a granello ad accompagnarla in una terrina....... Certamente mangiabile ma non appetibile. Passa ! Abbiamo poi ordinato la Fiorentina !! Non ce l'hanno presentata all'atto dell'ordinazione e nemmeno hanno chiesto la cottura. È' arrivata una bistecca alta 2 cm insapore e well done.......con patate al forno e due zucchine fritte....... Neanche una tagliata......abbiamo rinunciato al dessert, pagato il conto, circa € 50 a testa mancia inclusa e ce ne siamo andati.Non mi era successo da anni di mangiare non male ma senza gioia a Firenze ! La pancia e' piena ma senza godimento.Non credo che tornerò e sconsiglio a chi interessato di provare, troppo superiore l'offerta in zone più di charme della città con qualità molto più alta e prezzi ragionevoli. Per fortuna eravamo in buona compagnia e questo ha reso la serata comunque piacevole. Il vino per fortuna (Chianti) era buono ....... Almeno quello"
"ui_bubble_rating bubble_50","Connubio fra eleganza, raffinatezza e gusto.","Cena con amici presso la Taverna del Bronzino.Nonostante l'ampia scelta di piatti a base carne, optiamo per una cena di pesce.Spaghetti allo scoglio serviti nel tegame (buoni), cartoccio di rana pescatrice con mazzancolla e molluschi (buonissima), tagliata di tonno (eccellente ed abbondantissima), cartoccio di spigola con patate (eccellente). Vino Müller Thurgau Hofstätter.Locale accogliente ed elegante e al tempo stesso ben frequentato. Perfetto come sempre il servizio."
"ui_bubble_rating bubble_40","Locale eccellente","Locale di lunga tradizione a Firenze, privilegia una cucina internazionale, senza trascurare sia la cucina fiorentina che le altre eccellenze italiane (due volte in inverno viene organizzata la cena dei bolliti, con carni e paste emiliane e lambrusco di selezione, appuntamento di straordinaria qualità). Servizio davvero perfetto, tavoli assolutamente ben distanziati, acustica riposante. Il menu subisce piccoli e costanti aggiornamenti, l'ultimo filetto alla Rossini assaggiato era perfetto. Carta dei vini monumentale, che contiene costose eccellenze ma che lascia spazio anche a scelte più abbordabili. Selezione strepitosa di distillati. Prezzi non economici, adeguati alla cucina ed al servizio. Locale adatto a cena business o per festeggiare un evento romantico."
"ui_bubble_rating bubble_40","Accogliente!","Sono stata alla Taverna del Bronzino per una cena di lavoro.L'ambiente è abbastanza semplice ma molto accogliente, carne buonissima così come le fave con il pecorino presentate in modo molto originale. Il sig. Umberto ci ha viziato tutta la sera e si è preso cura di noi.Direi perfetto! "
"ui_bubble_rating bubble_50","ottimo","Su consiglio, sono venuto a fare un pranzo di lavoro.Ambiente confortevole e silenzioso.Pesce (antipasto e secondo) molto buono è fermamente freschissimo. Prosecco di apertura e vino bianco per pasteggiare.Prezzo congruo.Da consigliare anche per il pranzo."
"ui_bubble_rating bubble_50","Pranzo veloce","Pranzo veloce presso la Taverna del Bronzino con la novità di piatti del giorno a base di pesce.Abbiamo mangiato garganelli con tonno olive taggiasche e pistacchio; gallinella al cartoccio e San Pietro al forno con verdure. Tutto molto buono.Tortino di fragole adagiate su crema e e pera cotta con vino a seguire.Perfetto come sempre il servizio."
