"Restaurant_Ratings","Restaurant_Quotes","Restaurant_Reviews"
"","",""
"ui_bubble_rating bubble_50","Pranzo","Locale molto carino, anche se un po' nascosto. Servizio eccellente. Portate gustose e di qualità. Nulla da eccepire. Consigliato +++++"
"ui_bubble_rating bubble_50","Ogni tuo desiderio sarà realizzato ","Non posso commentare nessun piatto perché sono tutti buonissimi.Alto livello di servizio, ottima qualità dei piatti, fanno di questo ristorante un rifugio per intenditori.Assolutamente da provare e dove ritornare."
"ui_bubble_rating bubble_50","Delizioso","Abbiamo cenato al Bronzino sabato sera.Due antipasti di pesce e due secondi, uno di carne e uno di pesce.Cibo delizioso accompagnato da un ottimo vino consigliato dal titolare..Lo staff è molto gentile e sempre disponibile.Rapporto qualità prezzo ottima.In questo ambiente si respira proprio la vera passione per la ristorazuone.Consigliatissimo!!!!"
"ui_bubble_rating bubble_50","Ottima cena in Firenze","Atmosfera elegante, locale curato e spazioso, personale cortese e attento al cliente, cibo ottimo servito con abbinamenti azzeccati. I primi sono assolutamente da provare, il pezzo forte della cucina. Prezzi decisamente giusti e corretti.Assolutamente consigliato se si è nella splendida Firenze!"
"ui_bubble_rating bubble_50","Bella serata","Io e mia moglie siamo appena stati a cena in questo bel ristorante: cibo molto buono , assaggiato anatra è tagliata di manzo veramente ottimi. Personale gentilissimo, conto assolutamente giusto e in più abbiamo ricevuto un omaggio graditissimo.Ci torneremo sicuramente, super consigliato!!!!!"
"ui_bubble_rating bubble_30","Il fascino del nome","Dopo diverso tempo siamo tornati a pranzo in questo locale : il commento è rimasto positivo come il ricordo di qualche anno fa.Il personale gentilissimo e il cibo semplice ma molto curato e ben presentato. Apprezzabile per pranzi veloci e di rappresentanza e per cene più tranquille e comunque in un luogo intimo.Myri532018"
"ui_bubble_rating bubble_40","Raffinato","Abbiamo cenato in questo bellissimo ristorante vicinissimo al centro di Firenze, cibo ottimo con presentazione impeccabile, locale antico ma raffinato. Personale gentilissimo, vini di ottima qualità."
"ui_bubble_rating bubble_50","Fantastico...","Ritorno sempre volentieri presso questo eccellente ristorante di Firenze. Ambiente elegante, personale cortese e competente, cucina impeccabile. Oggi abbiamo mangiato pappardelle ai funghi porcini, bistecca alla tartara preparata al tavolo dal personale di sala, filetto con funghi porcini, il tutto accompagnato da un ottimo vino rosso umbro consigliato dall'esperto cameriere. Per concludere non poteva mancare il dolce fatto in loco, un tortino al cocco. Ci rivedremo sicuramente...."
"ui_bubble_rating bubble_50","Da Fiorentino vi dico... merita!","Venerdì sera, cena di lavoro. Piatto toscani anche rivisitati. Qualità davvero ottima. Servizio discreto. Ambiente elegante. Non ho pagato io perché ero ospite. Non so esattamente il prezzo ma dando un occhio al menu mi sembra in linea. Del resto siamo a Firenze!"
"ui_bubble_rating bubble_50","Che bella cena!","Locale dall' atmosfera sofisticata servizio molto gentile e attento alle esigenze del cliente, prezzi giusti se rapportati alla qualita' espressa, torneremo sicuramente!"
"ui_bubble_rating bubble_50","Cena prima delle ferie!!!!","Non vorrei essere ripetitiva ma ogni volta la cena è sempre una splendida cena!!!Spaghetti alla bottarga che passione, per passare alla battuta di manzo al coltello di Umberto che delizia!!!!! I dolci al carrello che dire.... non ho più parole per descrivere il piacere di stare qui con voiBuone ferie!!!!!"
"ui_bubble_rating bubble_50","Grande serata","Che dire, quando si entra nel ristorante si capisce di passare una serata unica, si viene accolti subito dal titolare o dal cameriere Stefano che fanno questo lavoro con passione e amore, il locale è un pezzo di storia di Firenze e non può non piacere.I piatti sono curati i ogni particolare, la cucina è deliziosa e la ricerca degli ingredienti è maniacale, vieni seguito per tutta la cena dal cameriere e il titolare ti aiuta se lo richiedi in ogni scelta.A me consiglia una bottiglia di vino per cui ancora ringrazio.....Da provare il cervello fritto e il piatto con animelle, fegato e rognone....Il carrello con i dolci è la ciliegina sulla torta.Rapporto qualità/prezzo ottimo.Consiglio sia per una cena in famiglia che una cena di coppia!!!Da provare assolutamente "
"ui_bubble_rating bubble_50","... un locale d'altri tempi ...","... un bel locale ... un pò nascosto ... ma questo altro non fa che aumentare il suo fascino ... piatti eccellenti dagli antipasti in poi ... personale veramente cortese ... ottima qualità a prezzi accessibili ..."
"ui_bubble_rating bubble_50","Spigola eccezionale ","Pranzo di lavoro durante la settimana con una tavolata. Il personale si è dimostrato molto disponibile nel assecondare le nostre richieste. Ci ha diviso diversi piatti in porzioni più piccole per permettere a tutti di assaggiare i piatti, in particolare la spigola l'ho ritenuta eccezionale consigliato assolutamente"
"ui_bubble_rating bubble_40","Atmosfera e qualità ","Antico palazzo Bronzino a Firenze: atmosfera molto elegante, servizio molto gentile e attento. Due antipasti : calamari alla crema di piselli, , due seppie in zimino alla livornese, due prosecchi in entrata , altro bicchiere di vino sempre prosecco, due caffè due acque minerali: totale 87 compreso lo sconto the fork del 20%. Consigliato . "
"ui_bubble_rating bubble_30","niente di che","siamo stati per una cena in famiglia, gentili ma niente di speciale. inoltre le opzioni fuori lista sono state dette al tavolo vicino e non al nostro... forse perché eravamo turisti.."
"ui_bubble_rating bubble_50","Cucina esperenziale","Magica atmosfera fatta di sapori tradizionali sapientemente cucinati. Qualità della carne magnifica! Costi delle pietanze onesti, personale servizievole preparatissimo e davvero amante del proprio mestiere. Lo consiglio!!! "
"ui_bubble_rating bubble_50","Cameriere squisito più della Fiorentina","Cucina prelibata, ma ciò che più colpisce è la gentilezza e premura del cameriere, ineccepibile sotto ogni punto di vista: ci si sente davvero coccolati.Comunque vi lascio la foto della fiorentina perché è degna di nota."
"ui_bubble_rating bubble_50","Grazie <U+0001F60A>","Potrei utilizzare frasi roboanti per descrivere un servizio impeccabile, piatti generosi e accattivanti, un'atmosfera piacevole e quieta, ma preferisco la semplicità di un discorso chiaro e diretto. Volete mangiare bene e sentirvi coccolati? Provare l'emozione dei clienti importanti nei luoghi cult? Venite qui. E magari avrete anche la fortuna di essere serviti dal Sig. Stefano, che da solo è in grado di conferire al vostro pranzo unicità ed eccellenza. Bravo, bravi. Lo chef prova in alcuni piatti inusitate note fusion e si eleva al di sopra della cucina tradizionale. Un primo piatto è un'esperienza di gusto, la carne esplode di sapore e affascina anche i palati più esigenti. Nota decisiva infine i dolci: non arrivano dalle rinomate pasticcerie fiorentine bensì sono realizzati nella cucina del ristorante, per cogliere e sottolineare quel modo di essere speciali che contraddistingue i migliori ristoranti ovunque si trovino. Grazie, è stato un piacere conoscervi e spero che in molti possano condividere e compiacersi di tanta professionalità e bravura."
"ui_bubble_rating bubble_40","Ottimo e tranquillo","Un po' decentrato esiste da anni e si mangia bene da anni. Cortesia ed efficienza fanno il resto. Ho mangiato un ottima tagliata preceduta da carciofi in insalata con scaglie di grana sopra. "
"ui_bubble_rating bubble_40","Pranzo di lavoro","Nonostante l’insegna vecchio stile appesa al palazzo storico l’ingresso è poco visibile. Una volta entrati sembra di entrare nella storia in ambienti ampi con soffitti di ampio respiro. Il menù comprende piatti storici con un tocco di moderno ed impiattamento prezioso.Ottima esperienza"
"ui_bubble_rating bubble_40","Impeccabile","Location molto elegante, forse un pò d'antan, ma decisamente piacevole.Servizio attento e professionale. Il personale, inoltre è molto cordiale e disponibile nell'illustrare i piatti, la loro realizzazione e l'eventuale storia legata alla tradizione.Menu di impronta tradizionale, con alcune rivisitazioni.Presenti anche piatti di mare come i crudi di gamberi o il salmone affumicato da loro"
"ui_bubble_rating bubble_20","Non all'altezza","Mi era stato raccomandato da un amico che ha vissuto a Firenze e poi anche le recensioni che ho letto mi hanno fatto andare pieni di speranza di mangiare bene ma non é stato così, le pappardelle al ragù semifredde e senzasapore e poi la fiorentina no con la xarne a Firenze non puoi sbagliare ma era molto al sangue quasi cruda e non di livello , ha una cosa era buona il vino che ho scelto un morellino di scansiano ottimo , per il resto servizio attento e conto in linea con il locale di prestigio."
"ui_bubble_rating bubble_50","Il miglior ristorante a Firenze ","Location incantevole, piatti deliziosi, equilibrati e innovativi e ampia scelta di vini. Personale professionale e cortese, mai eccessivo. Cura nei dettagli, dall’apparecchiatura alle pietanze. Assolutamente consigliato. "
"ui_bubble_rating bubble_50","Location elegante, professionalità cortesia e cura dei dettagli","Location molto elegante, piena di storia legata al pittore Bronzino. L'accoglienza è cortese e professionale. Il menù varia da piatti di terra a piatti di mare, con abbinamenti di ottime materie prime.Il servizio è il valore aggiunto, di quelli che altrove non si trovano più."
"ui_bubble_rating bubble_40","Fiorentina","Arrivati in questo grazioso locale ad apertura, siamo stati accolti molto bene dal personale,abbiamo mangiato bene ,ottimi i ravioloni ricotta e spinaci e ottima la bistecca fiorentina!Bravi"
"ui_bubble_rating bubble_40","Serata in un palazzo del 1200.","Ottima serata con un buon servizio. Atmosfera calma e rilassata. Menù sia di carne che di pesce. Ottimi calamari ripieni su cavolo nero, tortelli di ossobuco speciali. Tagliatelle al ragout toscano squisite è una tagliata gustosissima."
"ui_bubble_rating bubble_50","Il ristorante ","Ristorante con la R maiuscola per lavoro tavoli ben distanziati per poter parlare senza il vicino che auscul"
"ui_bubble_rating bubble_50","Magic Moments a tavola","Ciò che rende unico un Ristorante è il corredo di emozioni che trasmettono sia l'ambiente raffinato, dove nulla è affidato all'improvvisazione,sia l'arte enogastronomica assaporata a tavola. Da anni si rinnova questo rito,in occasioni svariate,per festeggiare un anniversario o per unire occasioni di lavoro a momenti gaudenti. Tutto è stato all'altezza del blasone del locale,questa volta in particolare un filetto alla Rossini semplicemente favoloso,superbo. Se voleva stupirmi con effetti speciali,ebbene ancora una volta Umberto ha fatto centro! Un plauso speciale alla simpatia ed elevata professionalità di Stefano,metronomo DOC della serata. A presto,come sempre."
"ui_bubble_rating bubble_50","aspettando la prossima....","A cena al Bronzino ai primi di Dicembre con un amico fine conoscitore di bolliti & co (è bolognese di nascita) oltre che vero buongustaio, come chi scrive.Locale pieno, profumi, facce sorridenti: nulla di meglio per accompagnare una degustazione di bolliti come si deve, e quindi si comincia:- spalla cotta di San Secondo (meravigliosa), prosciutto toscano, ciccioli tiepidi e gnocchi fritti soffici e caldi, una bontà- dei cappelletti che Umberto fa fare a mano, perfettamente cotti, semplicemente spettacolosi, con un brodo saporito, profumato e non grasso, che “accostava” alla perfezione allo stomaco. Il mio amico sostiene che valevano da soli tutta la cena tant’è che se ne è fatta una doppia abbondante porzione- primo carrello di bollito di manzo, vitella, lingua, gallina e coda (super !) con cipolline in umido (un po’ crude…)- secondo carrello di cotechino (buono), mariola (superlativa) e zucco (un po’ troppo drogato, chiodo di garofano?) con nervetti stufati e un purè di patate comme il faut, soffice e ben montato- salsa al peperone appena piccante (sciocchina), salsa verde e maionese home made, per me avevano messo anche della mostarda di Cremona, giustamente drogata - crème brûlée e un dessert al cioccolato caldo- da bere del Lambrusco di Ermete Medici secco, fresco, che andava giù che era una meraviglia, pulendo la bocca da tutti questi sapori decisi e predisponeva opportunamente al boccone successivo. A questo proposito ho apprezzato molto che il vino venisse servito a calice a volontà ad ogni commensale anziché lasciare la bottiglia ai tavoli: un buon Lambrusco è un gran vino ma in Toscana viene snobbato e non apprezzato per quello che vale a causa della sua effervescenza che accompagnata ad una bassa gradazione non “riempie” la bocca e la pancia come siamo abituati con il Chianti e simili, quindi si correva il rischio che i clienti se ne riempissero troppo lo stomaco in maniera forse inconsapevole, il che avrebbe portato ad una diminuzione nel gusto delle vivande: come dire, un bere consapevole indotto. Bravi!- caffè, liquori e 110 € sacrosanti.Commenti: che si può desiderare di più? È la conferma della conferma, in attesa della prossima."
"ui_bubble_rating bubble_50","Straordinario","Per noi è stato un momento di eccellenza. Grande cortesia e professionalità. Cibo ottimo di qualità, eccellente ed abbondante vino al bicchiere. Spazio ed eleganza in sala, davvero una cena eccellente. Abbiamo scelto una tartare splendidamente preparata davanti ai vostri occhi. Il titolare vi racconterà con discrezione la storia di queste mitiche stanze.... grande ristorazione accompagnata da un conto che non vi deluderà. Da tornarci! "
"ui_bubble_rating bubble_50","Location elegante, professionalità cortesia e cura dei dettagli","Ristorante suggerito dal nostro agente di viaggio e direi che la scelta è azzeccata. La location è elegante e ricca di storia, legata alla vita del pittore Bronzino. L'accoglienza è cortese e calda ma molto professionale. Abbiamo scelto un menù degustazione della tradizione: antipasto tonno del Chianti con fagioli, cappellacci di ricotta e spinaci in salsa al cedro, tagliata con contorno di spinaci, vino, acqua, dolce e caffè. Ogni portata è accompagnata da graditi dettagli sulla storia dei piatti e sulla scelta selle materie prime. Tutto preparato con cura, gusto e qualità, con ingredienti con prima scelta. Assolutamente da consigliare, anche se il prezzo non è per tutti (50 euro a testa) per scelta aziendale molto intelligente. Ma li vale tutti. "
"ui_bubble_rating bubble_50","come sempre eccellente","a pranzo con mia moglie ritroviamo Umberto patron e Stefano con Marc e la loro consueta professionalità. Madame inizia con della lingua salmistrata dal loro cuoco, io vado su delle più standard pappardelle al ragout toscano, a seguire due filetti alla Rossini che più morbidi e gustosi non si può, creme brulée e liquorino al miritillo made by Umberto. Da bere un Dolcetto d'Alba Bricco Bastia Conterno Fantino 2016 che legava splendidamente con i filetti, un gran vino. Per 110 € più che meritati.Una nota, cambiano i tempi e anche.....i menu dei ristoranti: trovare al Bronzino ed altrove daikon, cacao ed altri cibi esotici fanno rimpiangere i bellissimi carrelli con il gran pezzo di manzo di un tempo, evidentemente i gusti (?) della clientela - o quantomeno di certa clientela - hanno imposto questa deriva alimentare che non mi entusiasma, ma si sa, tutti i gusti sono gusti....."
"ui_bubble_rating bubble_40","Valido ma datato","Buona qualità del cibo. Servizio attento. Location elegante in palazzo storico. L’ oste Umberto ci sa fare e ti accoglie nel migliore dei modi con la sua gentilezza e professionalità. Il servizio è scenico con preparazione dei piatti al tavolo. L’unico appunto è che ho trovato il ristorante un po’ datato...sui piatti classici e collaudati non discuto ma su altri si nota un tentativo di modernizzazione che a mio avviso non ha dato i frutti sperati.La taverna del Bronzino rimane comunque un ottimo ristorante per una cena intima e speciale. I prezzi sono in linea col servizio offerto."
"ui_bubble_rating bubble_50","Ritorno al Paradiso","Ritorno in questo eccellente ristorante per la  Parmigiano Reggiano Night .Si inizia con una tartare di manzo con gelatina di vino, mostarda di peperoni e gelato al Parmigiano Reggiano,un piatto bello anche solo da vedere, originale e delizioso per il palato; a seguire: bomba di riso Reggiana, veramente una bomba di piacere!Il primo proposto è stato: paccheri ripieni di carciofi e spuma di Parmigiano Reggiano,un gusto delicato e sopraffino, un piatto che non vorresti finisse mai.A seguire: anatra, zucca, liquirizia e morbido di Parmigiano Reggiano,un secondo raffinato dal gusto unico.E per finire: pera al cioccolato,sorbetto di pera e Parmigiano reggiano, un indimenticabile momento di estasi e come se non bastasse : bruciate e bon-bon di 36 mesi al cioccolato, castagne e pezzetti di Parmigiano intinti nel cioccolato, un connubio suggerito dagli Dei!Poi: Nocino e Prugnolo: ottimi.Tutta la cena è stata accompagnatada Lambrusco Reggiano.Faccio i miei complimenti a tutto lo staff in particolar modo al cuoco Matteo che ha saputo creare piatti fantasiosi e tutti ottimi, al quale auguro una carriera luminosa e piena di successi.E' sempre un piacere tornare in Paradiso."
"ui_bubble_rating bubble_50","Spettacolare","Tappa fissa ogni volta che si viene a Firenze. Ottima cucina, professionalità, cordialità e materie prime."
"ui_bubble_rating bubble_50","Una certezza a Firenze....","Sono ritornato molto volentieri in questo storico ristorante fiorentino. Atmosfera raffinata, servizio preciso e puntuale, sempre ottime le pietanze....consiglio vivamente insalata di mare (non è questo l'esatta denominazione del piatto) e tagliolino alla cacciucco."
"ui_bubble_rating bubble_50","Una serata indimenticabile!","Semplicemente tutto perfetto. Cena di coppia, per festeggiare una giornata importante, abbiamo scelto questo ristorante sia per le ottime recensioni che per il posto, vicino al nostro albergo.L'atmosfera è decisamente raffinata, il servizio preciso e puntuale ma mai esageratamente formale, anzi il cameriere che ci ha seguiti era molto simpatico e ci ha messi imemdiatamente a nostro agio.Abbiamo provato due menu degustazione della tradizione che prevede antipasto, primo, secondo con contorno e dolce, più bottiglia di chianti.Tutto è stato ottimo, saporito ed abbondante. Assolutamente da provare i cappellacci in salsa di zafferano (veramente da fare bis e tris!) e la tagliata con spinaci all'aglio, cotta comme il faut!Dolci: un assaggio di zuccotto fiorentino e cheese cake.Il prezzo? Adeguato ad ambiente, servizio e qualità delle materie prime.Che dire: assolutamente da consigliare per un'esperienza davvero indimenticabile e fuori dai soliti circuiti turistici."
"ui_bubble_rating bubble_50","Una cena d’anniversario riuscita!","Avevamo festeggiato qui il primo anniversario di matrimonio e ci siamo tornati per il 26º anniversario di matrimonio oltre a noi è immutata la qualità e l’accuratezza del servizio lo consiglio vivamente!"
"ui_bubble_rating bubble_50","Una certezza! Sempre al top sia come qualità del cibo che come servizio","La Taverna Del Bronzino è sempre una sicurezza. Sono tornato con la famiglia dopo circa due anni ed ho trovato sempre la stessa attenzione al cliente, stessa grande qualità del cibo e della materia prima, stessa ricerca di cose nuove e particolari e difficili da assaggiare altrove. È sempre un grande ristorante che mantiene un livello altissimo ormai da tantissimo tempo. Bravi!"
"ui_bubble_rating bubble_40","Servizio eccezionale","Prenotiamo un tavolo per due con thefork e veniamo subito ricevuti dal gentilissimo staff, che ci consiglia sulla scelta dei piatti e sull'abbinamento del vino. Decidiamo di ordinare una tagliata, una tartare ed accompagnare con un contorno di verdure in pastella e patate fritte. Il tutto con due ottimi calici di morellino, eccellenti nella qualità e generosi nella qualità (cosa non scontata nei vini al calice). Abbiamo potuto apprezzare come il taglio della carne ma sopratutto la preparazione della tartare è avvenuta davanti ai nostri occhi, consentendoci di poter scegliere i condimenti più adeguati ai nostri gusti. Entrambi i piatti erano gustosi, forse la carne appena troppo cotta rispetto alle mie richieste, ma si tratta di dettagli. Nel complesso, un ristorante molto buono in un ambiente gradevole, a tema cinquecentesco."
"ui_bubble_rating bubble_50","Sempre il migliore","Per il mio compleanno mi sono voluto offrire una cena adeguata e sono andato al Bronzino a colpo sicuro: al di là della cortesia e della professionalità dimostrata come sempre da tutti ho iniziato con un bel Bitter Campari con ghiaccio, seguito da due crostini di fegatini caldi e gustosi. Come primo dei garganelli al sugo di fiori di zucca, ottima salsa ma forse un pelo al dente la pasta. Poi un bagno di gioventù, un piatto che non si trova più in lista da nessuna parte, vale a dire delle squisite scaloppine agli asparagi, ben cucinate, saporite ma non troppo in modo da assaporare il gusto dell'asparago. Cheese-cake e un assaggio di dolce di cioccolata bianca (bomba calorica!) e doppio caffè in tazza grande. Ci ho bevuto del Chanti Classico Ormanni 2012 (sic!) di buona beva e dopo il caffè un rum Agricole bianco speciale, Pére Labat 59 (sì, è la gradazione, 59°!) che mi ha riportato all'epoca dell'università (chimica) quando al 4° anno nel laboratorio di Analisi Organica ci facevamo dei gran cocktail a base di alcol etilico Carlo Erba RP 96% opportunamente diluito, bei tempi....Chiudo per una doverosa segnalazione: in considerazione del mio compleanno la cena mi è stata gentilmenta offerta da Umberto, il patron del ristorante, un gesto di signorilità che ho avuto modo di constatare anche in altre occasioni.Mi ripeto: sempre il migliore."
"ui_bubble_rating bubble_50","Anniversario sontuoso","Posto veramente bello. Servizio eccezionale dal guardaroba allo spumante di benvenuto fino al caffè, cibo di altissima qualità. Abbiamo apprezzato molto la preparazione di alcuni piatti davanti ai nostri occhi. Prezzi più che giustificati. Serata bellissima. "
"ui_bubble_rating bubble_50","alto livello","Ambiente tipico rinascimentale, siamo nel palazzo di Santi di Tito,allievo del Bronzino e noto artista del Rinascimento Toscano, arredato con gusto e di adeguato livello.Larghi gli spazi fra i tavoli con sale di ampie dimensioni.Gestore e personale della massima cordialità e cura nel servizio.Cena, su nostra scelta, a base di pesce :un antipasto di gamberi squisito,e l' altro con fagioli cannellini e bottarga di Cabras favolosa.Secondi: con Polpo e merluzzo eccezionali e insalata di carciofi e parmigiano.Verdure fritte per contorni. Ottimo Pinot grigio del Trentino Alto Adige.Ottimo Cheesecake e buone fragole nature.Abbiamo chiuso con assaggio d 'un vino tipico dolce della costa tirrenica ed un goccio di wisky scozzese di buon livello."
"ui_bubble_rating bubble_50","Eleganza, gusto e simpatia","Ambiente raffinato, servizio inappuntabile, cantina ben servita e cucina gustosa e accattivante. Nel rapporto qualità/prezzo non esito a definire questo locale fra i primissimi di Firenze."
"ui_bubble_rating bubble_50","Cena di compleanno ","Per gli amanti della carne è il posto perfetto! Abbiamo preso antipasti misti toscani e una fiorentina squisita. Anche la carta dei vini fornitissima e eccellente"
"ui_bubble_rating bubble_50","Tanta ospitalità, ottima cucina","Non solo un ottimo ristorante, cibo e bevande di altissima qualità, ma anche e soprattutto un ambiente estremamente accogliente e professionale.Uno di quei posti in cui ti senti veramente a casa. Ci sono stata più di una volta, e altrettante ci tornerei. Consiglio vivamente a chi si trova a Firenze di fermarsi in questo incantevole posto, ne vale davvero la pena."
"ui_bubble_rating bubble_50","Tutto perfetto","Locale veramente eccezionale. Tutto ottimo. Cibo gustoso, presentazione perfetta, personale simpatico e ottimo servizio. Ottimo il rapporto qualità prezzo."
"ui_bubble_rating bubble_30","Piccola delusione","Sicuramente mi aspettavo di piu da questo ristorante storico fiorentino. Ho ordinato i loro spaghetti con la botarga sarda, ma non ci siamo, portano i spaghetti cotti nella padella a tavola e continuano la preparazione davanti a noi. Risultato i spaghetti ormai sono freddi, mentre la bottarga è grattugiata tropo fine. Buono il pesce alla acqua pazza, buona anche la loro lista dei vini rossi con prezzi onesti, sopratutto nei vini del sud. Meno fornita la lista dei bianchi con etichette che non condivido per l'accoppiamento con i loro piatti."
"ui_bubble_rating bubble_50","Atmosfera, gusto e cortesia","Momento conviviale con amici.Degustazione di ottime pietanze accompagnato da un eccellente vino argentino: - affettati con pecorino;- tartare di salmone e gamberi;- scamerita affumicata;- gamberi marinati;- scaloppa di foie gras.Servizio presente e cordiale sia nell'accoglienza che nella spiegazione delle pietanze."
