"Restaurant_Ratings","Restaurant_Quotes","Restaurant_Reviews"
"","",""
"ui_bubble_rating bubble_40","Pranzo toscano","Cercate una trattoria tipica Toscana in centro o vicino alla Fortezza da basso?Eccola qui, la gratella!Ambiente pulito, camerieri veloci, menù tipico toscano e prezzi onesti. Poi se volete una Fiorentina spettacolare servita sui carboni ardenti vi verrà portata appunto sulla gratella!"
"ui_bubble_rating bubble_50","Davvero ottima","Accoglienza con un bicchiere di prosecco. Personale molto gentile e preparato che ha saputo consigliarci in tutto. Fiorentina davvero buona e gustosa ed a un prezzo onesto (vale tutti i soldi spesi), accompagnata da delle patate al forno da 10 e lode.Al termine abbiamo preso anche un amaro che ci ha offerto la casa.Non trovo alcuna critica, se non che ci eravamo trovati così bene da voler ritornarci prime di partire ma non siamo riusciti a prenotare."
"ui_bubble_rating bubble_50","F.E.N.O.M.E.N.A.L.E","Posto tipico toscano, accoglienza magnifica a partire da Antonio alle ragazze in sala (super gentilissime, )Cucina OTTIMA,tutto molto fresco pici e carbonara i miei preferiti. Carne buonissima di ottima qualità. Dolci fatti in casa freschi. Ottimo rapporto qualità/prezzo.Insomma BRAVI!"
"ui_bubble_rating bubble_50","Cena in famiglia","Piatti tipici toscani ben cucinati. La Fiorentina viene servita su un piccolo braciere che la mantiene a temperatura ottimale. Personale gentile e professionale. Location accoglienteTutto ottimo"
"ui_bubble_rating bubble_40","Tempi un po' lunghi ma..ne vale la pena!","Suggerita dal nostro albergatore, qualche via accanto, abbiamo prenotato un tavolo per cena (con cagnolino al seguito). Volendo gustare la carne, non abbiamo preso antipasti o altro. Tempo di attesa lunghissimo, nonostante il tavolo accanto (arrivato dopo di noi) ha mangiato antipasto e avuto la fiorentina prima di noi..vabbè.. il nostro momento è stato premiato con un'ottima Nobile! Unica pecca, molto vaghi sul peso della carne, che per altro non ti mostrano prima della cottura..insomma, si va a fiducia che comunque è ben riposta. Ottimo il conto, considerando che aperitivo e grappa sono stati offerti. Se volete mangiare un'ottima carne non spendendo cifre astronomiche come in centro, questo è il posto giusto."
"ui_bubble_rating bubble_30","serata da ricordare................................","Buono il primo piatto di pici con cavolo nero e pancetta, purtroppo le dolenti note arrivano dalla bistecca alla fiorentina che è servita in modo scenografico con una gratella che la mantiene calda. Qui cominciano le mie disavventure: la brace era fredda e la cameriera gentilmente ha provveduto a recuperare la gratella con la bistecca; passa il tempo e non riappare più la mia bistecca.Il proprietario si è prodigato per superare l'impasse e mi ha portato una nuova bistecca (disossata) e purtroppo cruda, ho segnalato la cosa chiedendo il conto e terminando così la cena.Molto correttamente il proprietario, che ringrazio, ha riconosciuto gli errori e non mi ha addebitato la bistecca.Ci riproverò!"
"ui_bubble_rating bubble_40","Ottima carne in centro ","Squisita la bistecca e in complesso una trattoria niente male dove mangiare cucina tipicamente fiorentina. “La Nobile”, una t-bone di scottona molto tenera e saporita, è stata la star della serata. Forse poteva essere tagliata un po’ meglio e più in grande però assolutamente consigliata per chi ama la carne. Occhio invece a confusioni facili con quella che in lista viene chiamata “Fiorentina”, che invece è un altro taglio di carne più simile a una costata.Il menu include inoltre diversi primi e secondi tipicamente fiorentini e si presta anche a preparazioni gluten free.A La Gratella ci siamo arrivati tramite le raccomandazioni del blog “braciamiancora”, che inserisce questo locale nella lista dei migliori posti dove mangiare carne a Firenze. Non posso ancora fare confronti con gli altri locali in lista però sicuramente a livello di bistecca La Gratella fissa in alto l’asticella.Uniche cose un po’ meno buone: il fumo in sala, dovuto probabilmente alle grate roventi sulle quali vengono servite le carni; inoltre la sala e i tavoli, molto stretti fra loro e un po’ spartani.Qualche accorgimento in più per migliorare di molto l’esperienza complessiva sarebbe necessario."
"ui_bubble_rating bubble_40","Cena in famiglia","Abbiamo mangiato un antipasto misto in 4 per aspettare la cottura della carne.Fiorentina La Nobile con contorni e dolceTutto buono! Prezzi nella norma di Firenze"
"ui_bubble_rating bubble_30","Buona la carne, meno il conto ","Su consiglio del nostro albergo, con la mia fidanzata sono andato a mangiare la Fiorentina alla Gratella. Molto buona la carne, anche se era disponibile per due persone solo un taglio leggermente diverso da quello della Fiorentina classica, che costava 10 euro al chilo in più rispetto a quest'ultima. Bistecca comunque molto buona, accompagnata da un tagliere di salumi come antipasto e da una insalata di contorno. Il conto finale è stata la nota più dolente: con un'acqua e un quartino di rosso della casa 85 euro totali. Buon servizio, cordiale e veloce."
"ui_bubble_rating bubble_50","OTTIMA LA GESTIONE E LA CUCINA","Sono stato alla Gratella, ed Antonio, il proprietario, si é mostrato dal primo momento cortese ed educato come tutto il suo personale. La bellissima serata e continuata con l'ottima cucina mangiando pappardelle al cinghiale e spaghetti alla carbonara, ed inoltre non poteva mancare LA FIORENTINA, veramente una squisitezza."
"ui_bubble_rating bubble_50","Tutto ottimo","Camerieri simpatici e professionali, antipasto buono, buon vino e...La Nobile spettacolare. Nulla da dire! CONSIGLIATISSIMO!"
"ui_bubble_rating bubble_50","Ottima cucina","Insieme alla mia famiglia siamo andati a mangiare di sera. Oltre agli ottimi antipasti e il personale cordialissimo sebbene la nostra terribile indecisione sui piatti e cosa prendere la fiorentina mangiata era ottima, lo consiglio vivamente."
"ui_bubble_rating bubble_50","Superlativa cucina fiorentina!","Trattoria consigliata da persone del posto. Fiorentina superlativa! Pici super buoni. Cinghiale speciale. Personale disponibile e cortese. Il tutto per un ottimo rapporto qualità/prezzo. Tornerò e lo consiglierò sicuramente!"
"ui_bubble_rating bubble_50","Consigliatissimo, opzioni Gluten free!","Opzioni Gluten free abbiamo preso:Lombata di vitella + pici con porcini + insalata + 1/2 litro di vino rosso della casa abbiamo pagato 22€ a testa.Se hai esigenze particolari come vegetariana o vegana, la cucina è disponibile nel trovare un'alternativa.Consigliatissimo!"
"ui_bubble_rating bubble_50","Ottimo consigliato","L'accoglienza e la cortesia fanno da padrone in questo locale. Il cibo squisito (consigliata la zuppa ribollita) oltre alla classica Fiorentina.Ottimo rapporto qualità prezzo.Una particolare lode al cameriere, ottimo consigliere e professionale."
"ui_bubble_rating bubble_30","Cena tipica","Un locale tranquillo per una cena con piatti tipici toscani, giuste le dosi e i prezzi. Servizio veloce e cortese."
"ui_bubble_rating bubble_50","Vera trattoria fiorentina","Quando si va in una città che non è la tua è buona norma farsi accompagnare da amici autoctoni e competenti. Un sabato a pranzo mi hanno portato alla Gratella. Il locale è una tipica trattoria anche per il tipo di avventori (la presenza di una suorina non è classificabile). Gli amici mi hanno lasciato scegliere la vivande, mentre il vino è stato ordinato da loro (un ottimo Chianti). Crostini valdarno con pane tostato a parte ed un recipiente tipo “tupin” della bagna cauda ripieno di delizia toscana. Segue una classica fiorentina (in tre solo 1.600 g.) su un apposita griglia con brace sottostante. Accompagnamento di fagioli all’uccelletto e patate al forno. Una delizia. Gran finale con cantucci e vin santo. Non conosco la spesa in quanto ospite, ma presumo non sia stata eccessiva. Una magnifica occasione con amici del cuore e cibo semplice ma celestiale."
"ui_bubble_rating bubble_40","Ottima","Ottima cena, menu chiaro, prezzi adeguati; personale disponibile e servizio celere: estremamente consigliata anche essendoci passate davanti per caso, non ci ha affatto deluse."
"ui_bubble_rating bubble_50","1.3 kg di bontà ","Un locale accogliente a due passi dal mercato di San Lorenzo. Fantastica fiorentina servita sulla brace per mantenere il calore (più di 1kg), accompagnata da un vino della casa buono ed un abbondante contorno. Personale cordiale e simpatico, a fine cena ci hanno portato un limoncello di saluto (offerto dalla casa). Consiglio vivamente inoltre anche per il rapporto qualità-prezzo, ottimo. "
"ui_bubble_rating bubble_50","Tutto perfetto! ","Personale molto cordiale e simpatico, con semplicità riescono a metterti completamente a tuo agio. I piatti uno migliore dell'altro. In particolare i fagottini di pecorino e pere e i tortelli al limone con tartufo sono un'esplosione di gusto.Il vino della casa più che valido considerato anche il prezzo! Se volete gustare qualche prelibatezza toscana a Firenze senza farvi spennare questo è decisamente il posto adatto!Sicuramente ci torneremo! "
"ui_bubble_rating bubble_50","OTTIMO!","Su consiglio della proprietaria dell'hotel dove alloggiavamo, abbiamo cenato alla trattoria la Gratella per l'Immacolata. Davvero tutto molto buono! Il locale semplice e pulito, il personale super gentile e molto simpatico. Per la prima volta ho mangiato la Fiorentina... Favolosa!!! Ma tutto davvero buono, dall'antipasto al dolce (budino di castagne superlativo!). Alla nostra prossima vacanza a Firenze ci ritorneremo sicuramente!"
"ui_bubble_rating bubble_50","cena favolosa","ristorante piccolo ma incantevole..abbiamo preso il tagliere la gratella a dir poco ottimo e la fiorentina che era ottima e di più ..il folce al mascarpone qualcosa di eccezionale..personale gentilissimo. consigliatissimo"
"ui_bubble_rating bubble_50","DA CONSIGLIARE","E' una trattoria tipica. Ci sono stato per gustare una bistecca alla fiorentina e devo dire che la scelta è stata azzeccata. La bistecca viene servita su un dispositivo per mantenerla calda (non lo avevo mai visto), già tagliata, davvero ottima e gustosa. Anche le patate e le verdure prese per contorno erano molto buone. Non ce l'ho fatta a provare altri piatti ma vedendo le portate devo dire che si presentavano molto bene. Sarà per la prossima volta. Ottimo il rapporto qualità prezzo e la cortesia del personale. Occhio al vino rosso della casa che è buono ma tosto (chi non lo regge scelga altro)."
"ui_bubble_rating bubble_50","Degno di nota","Sotto consiglio dell'abergo dove alloggiavamo, per la nostra prima notte a Firenze abbiamo scelto la Gratella. La trattoria si presenta modesta, con arredo casereccio e non ostentato, quindi accogliente. Il personale è molto disponibile e gentile, sempre col sorriso, il che mette a proprio agio; diciamo che ti fanno sentire proprio di casa. Veniamo alle pietanze: benché debba ammettere che a Firenze sia praticamente impossibile non mangiare bene, devo dire che questa piccola trattoria merita tanto. Piatti ricchi e genuini, quasi rustici; porzioni generose. Abbiamo ordinato un tagliere in due che comprendeva prodotti tipici fiorentini quali salumi del luogo, alcuni formaggi, patè di fegatini ecc. A seguire, per lui la trippa alla fiorentina e per me un entrecot di manzo accompagnato con una salsa ai funghi; cottura ottima della carne, al sangue al punto giusto come richiesto. Vino della casa che comunque era molto gradevole. Infine, per finire in bellezza, abbiamo condiviso un budino alle castange.Prezzi giusti per quello che abbiamo ordinato e sopratutto pancia piena come siamo andati via.P.s un saluto all'oste dai due ragazzi sardi!"
"ui_bubble_rating bubble_50","Carne top","Ho frequentato per ben due volte in pochi giorni questa trattoria che si trova in una via laterale del centro storico di Firenze dietro consiglio dall addetto dell albergoPersonale molto cortese, cibo squisito ,una superlativa fiorentina,una carta vini completa e centrata per il tipo di cucina che offre.Ottimo rapporto qualità prezzo Bravi"
"ui_bubble_rating bubble_50","Tappa obbligatoria ","Che dire, un ristoratore che coccola i suoi clienti. Personale attento e premuroso e che sa consigliarti. Tutto squisito, dal tagliere di affettati e prodotti tipici fino alla fiorentina che si scioglieva in bocca. Hanno regalato il dolce a mia moglie che faceva il compleanno e fatto 13 euro di sconto alla cassa!!. "
"ui_bubble_rating bubble_50","Ottima esperienza","Siamo stati in questa accogliente trattoria per festeggiare il compleanno della mia fidanzata, consiglio di prenotare perché il posto si riempie facilmente. Abbiamo mangiato degli ottimi pici al pomodoro, semplici e squisiti, la bistecca era perfetta, filetto controfiletto da 1300 g servita su una gratella con un fondo di brace. Presentazione perfetta non solo alla vista, la carne si è mantenuta calda per tutto il tempo senza continuare la cottura, l'abbiamo accompagnata alle cipolline al forno squisite anche queste. Ottima selezione di dolci home made e conto contenuto. Sevizio impeccabile e attento anche nel consigliarci le ordinazioni più appropriate. Consigliato vivamente "
"ui_bubble_rating bubble_50","Cena Fiorentina","Se volete mangiare piatti tipici fiorentini “La Gratella” è di sicuro il posto perfetto! Cibi ottimi e accompagnati da un vino rosso della casa davvero speciale.Il personale è stato gentilissimo e tutti super sorridenti! Ci tornerò sicuramente"
"ui_bubble_rating bubble_40","Ottimi primi","Purtroppo eravamo un po' di fretta e abbiamo mangiato qualche crostino al lardo per antipasto (tra l'altro deliziosi) e due primi davvero molto interessanti: pici con cavolo nero e pancetta (forse solo un po' troppo unti) e dei fagottini di pasta con pere, ricotta e salsa di parmigiano. Il locale è grazioso e tipico, con una forma allungata che porta ad un'altra sala oltre a quella all'ingresso. Prezzi giusti."
"ui_bubble_rating bubble_40","consigliatoci","Locale accogliente, personale molto gentile ed attento. Cucina casalinga e genuina con adeguata varietà di piatti. Prezzo in linea con la piazza."
"ui_bubble_rating bubble_50","Ottimo","Ristorante eccellente! Aldilà Delle porzioni che sono abbondanti, la qualità è eccezionale. Ho mangiato un filetto che si scioglieva in bocca!!! Complimenti anche per come viene fatto il servizio, veloci eparticolari."
"ui_bubble_rating bubble_50","La Fiorentina ","Abbiamo mangiato in questo locale su consiglio della struttura in cui alloggiavamo per mangiare una buona fiorentina..il risultato è che la fiorentina non era solo buona, ma ottima. Ma i complimenti vanno anche a tutto il personale capace di farti sentire a casa con la simpatia tipicamente fiorentina! Consigliatissimo!"
"ui_bubble_rating bubble_50","Ottimo ristorante!","Siamo stati qui il 3/11/2018.... c'è poco da dire: tutto ottimo! Mia figlia, celiaca, ha preso delle tagliatelle senza glutine buonissime, mio figlio della salsiccia veramente saporita. Mio marito ha preso una trippa veramente buona ed io una fantastica fiorentina, dopo aver assaggiato un'ottima ribollita... vino buono, camerieri gentilissimi e disponibili. Esperienza da ripetere!"
"ui_bubble_rating bubble_50","Soddisfatti! ","Siamo andati in questa trattoria consigliataci dall’albergo...ovviamente a Firenze abbiamo mangiato la classica Fiorentina...veramente ottima! A pensarci viene l’acquolina . Personale molto gentile e attento alle esigenze del cliente...noi siamo arrivati alle 21.45 e alle 22.15 la cucina chiude, dato il locale pieno ci avevano dato un tempo di attesa di 15 minuti invece dopo neanche 5 minuti ci avevano già fatto accomodare...il servizio è veloce ma giusto. Locale non troppo turistico. Buon rapporto qualità prezzo. Consigliato "
"ui_bubble_rating bubble_40","Osteria fuori dal centro","Un bel locale, situato al di fuori del centro, a poca distanza dalla stazione SMN.Molto accogliente, personale disponibile e simpatico.Il cibo è di ottima qualità. I dolci fatti in casa sono deliziosi.Se cercate un osteria toscana a prezzi contenuti fa al caso vostro!"
"ui_bubble_rating bubble_50","Tutto perfetto!!","Locale molto carino.. personale gentile,disponibile e molto attento all esigenze del cliente.. cibo molto buono.. ottimo il peposo..."
"ui_bubble_rating bubble_50","Decisamente soddisfatti ","Io e il mio fidanzato ci siamo trovati a cena in questa trattoria situata nelle vicinanze del mercato di San Lorenzo.La nostra intenzione era quella di mangiare la tipica Fiorentina e non ce ne siamo pentiti!!Il mio compagno ha ordinato la tradizionale ribollita toscana, io i fagottini ripieni di pecorino e pere, a dir poco strepitosi! Ovviamente come secondo la Fiorentina, motivo per il quale eravamo lì. Tutto è stato perfetto, dall'ospitalità e cordialità del personale fino alla qualità delle portate.Come dolce non potevano mancare i cantucci.Ottimo il rapporto qualità prezzo. Consigliato a chiunque voglia gustare un'ottima Fiorentina e non solo quella! "
"ui_bubble_rating bubble_50","Cena con clienti ","Locale comodo da raggiungere dalla stazione, ambiente carino e personale gentilissimo, ma cosa più importante la carne alla griglia molto buona sua il filetto che la Fiorentina. Ottimi anche i dolci!"
"ui_bubble_rating bubble_50","Cena in compagnia","Abbiamo cenato in questo locale, degustando il gran tagliere ricco di salumi, formaggi e verdure... era talmente grande che era suggerito x due persone ma abbiamo fatto l’antipasto in tre. Poi la ribollita... sapore deciso con un pizzico di piccante quanto basta, tutto molto equilibrato. Abbiamo osservato gli altri commensali divorare la vera fiorentina presentata in modo molto insolito e geniale, torneremo x degustarla. Dolci squisiti come tutto lo staff!! Inaspettato sconto alla presentazione del conto... saremo stati troppo simpatici?!?"
"ui_bubble_rating bubble_50","LA NOBILE!","Siamo stati a Firenze in viaggio di nozze e volevo provare la vera fiorentina ( ma quella vera ) non pallide ed economiche imitazioni e così dopo attente valutazioni, siamo approdati in questa topica trattoria toscana. Ricorderò per sempre questa splendida esperienza culinaria e la gentilezza e professionalità del personale. La nobile è la migliore carne che io abbia mai mangiato, e me ne intendo, vino del contadino ...ma tutto era buonissimo, i pici , i tortellini...fantastico. Consiglio di cuore questo ristorante vero e accogliente. I prezzi sono adeguati alla qualità...."
"ui_bubble_rating bubble_50","Cortesia e qualità ","Ragazzi veramente gentili, anche nel consigliare cosa fosse meglio ordinare.Fiorentina ottima tra tutto e prezzo giusto.Da consigliare "
"ui_bubble_rating bubble_40","Eccellente","Non sono in grado di fare la classifica delle bistecche della città. So solo che quella che ho mangiato qui era meravigliosa. Ambiente molto carino, gestito da ragazzi giovani e molto gentili, con il sorriso sulle labbra.Corretti anche nel consigliare come comportarsi con altre ordinazioni che avevamo in mente in presenza di una bistecca di un peso importante per due persone.In due, con bistecca da 1 chilo e 500 grammi, un dolce, vino, acqua speso circa 100 euro. Per me, costo corretto e denari ben spesi.Straconsigliato."
"ui_bubble_rating bubble_50","La gratella","Ottimo cibo fiorentina super personale molto gentile e disponibile. Prosecco di benvenuto e grappetta digestiva offerti. Il risotto al pomodoro x il nostro bimbo non ci è stato fatto pagare. Consigliatissima"
"ui_bubble_rating bubble_50","Un nome.... una garanzia!!","Di questa trattoria non si può che parlare strabene!! La carne è una delizia!! Personale gentilissimo ed educato, e sa consigliare molto bene, disponibile nel spiegare i piatti!! Una fiorentina da leccarsi non solo le dita, ma anche i gomiti e le braccia!! Un filetto ai funghi che dir buono è poco!! Consiglio assolutamente questo posto. Se volete mangiare veramente bene andate alla Gratella!!"
"ui_bubble_rating bubble_40","Fiorentina speciale ","Bel locale, servizio ottimo fiorentina speciale servita in maniera originale prezzi nella norma forse un po' alto per il sorbetto ma nel complesso onesti! Molto consigliato"
"ui_bubble_rating bubble_50","Ottimo cibo e tanta gentilezza","La trattoria ci è stata consigliata dall'albergo in cui alloggiavamo. Ci siamo trovati così bene sia come cibo sia per il servizio (in particolare la ragazza gentilissima che ci ha serviti), che la sera successiva ci siamo tornati prenotando alle 19.30 per poter prendere il treno prima del rientro nella nostra città.Consigliatissimo."
"ui_bubble_rating bubble_50","Voto diesci...","Voto...diesci....cena con mia moglie...bellissima location (come si dice ora....)...servizio eccellente e Fiorentina non buona....di più...infatti abbiamo prenotato per la sera successiva."
"ui_bubble_rating bubble_50","Fiorentina speciale","Consigliati dal titolare del nostro B&B siamo riusciti grazie al treno tardi a non farci mancare la fiorentina di questo posto1E' davvero speciale! Consiglio di provarla... personale davvero cortesissimo!"
"ui_bubble_rating bubble_50","Fiorentina e sorpresa","Siamo stati piacevolmente accolti in un sabato sera molto affollato. Subito ci è stato offerto (gratis) del prosecco. Abbiamo diviso in due una Fiorentina da 1.4kg che si è rilevata sublime, così come le ottime patate di contorno. Ottimo anche il Sangiovese. Per finire, un limoncello, offerto dalla casa. Il tutto per una spesa di 40 euro a persona. Consigliato!"
"ui_bubble_rating bubble_30","Ottimo ma.... ","Cibo qualitativamente molto buono, ma non si può aspettare un ora e 15 minuti, con la trattoria con poche persone (ora ordine 19:30 arrivo cibo 20:25) servizio da migliorare "
"ui_bubble_rating bubble_50","Eccellenti su tutto","Finalmente mi sono recato con amici in questa famosa tipica trattoria fiorentina e sono rimasto davvero molto soddisfatto,sia per il servizio che per i piatti che erano davvero come mi era stato detto. Io ho preso i tortelli con limone,crema di tartufo e noci e il peposo, ma dovrò tornarci per prendere la bistecca perchè credo proprio sia da provare!"
"ui_bubble_rating bubble_50","Già mi manca.. ","Che dire... Complimenti! Per un turista che non conosce la città, mangiare bene a Firenze non è, fortunatamente, troppo difficile, e l'esperienza culinaria in questo ristorantino oltre a confermare pienamente questo aspetto, la ricorderò certamente a lungo! Ambiente alla mano e cibo da dieci e lode, servizio cortese, celere e amabile per la simpatia del (credo sia lui) giovane proprietario! Prezzi del menù onesti e davvero apprezzato lo sconto sul totale. Vorrei aver avuto più giorni da spendere in questa magnifica città per poter assaggiare l'intero menù! Chissà, magari in futuro! "
"ui_bubble_rating bubble_40","Consigliato dalla reception dell'hotel, ci siamo trovati bene.","Buona cucina, servizio e prezzi nella media.Dato che avevamo preso una camera in un albergo nelle vicinanze è stato anche comodo trovarlo. Consigliato."
"ui_bubble_rating bubble_40","Carne favolosa","Il 99% dei ristoranti hanno dei piatti forti e/o delle specialità dove sono particolarmente bravi (almeno rispetto al resto del menù) e alla Gratella è con la ciccia che sono particolarmente bravi.Buoni i crostini e le patate, la bistecca è favolosa; saporita e cotta alla perfezione il suo segreto - di pulcinella - sta sia nella qualità (qui usano limousine) e tantissimo nella frollatura. La carne che viene servita è frollata a lungo, anche due mesi, una rarità, specialmente a questi prezzi. Provate il grasso per sentire la frollatura. Noterete inoltre che la carne non butta sangue (acqua/siero) e che il fondo del piatto rimane praticamente asciutto.Per gli amanti della bistecca la Gratella è assolutamente raccomandato."
"ui_bubble_rating bubble_50","Fenomenale","Trattoria vicino alla stazione di Firenze, piatti tipici fiorentini, abbiamo mangiato una fiorentina ottima, personale simpatico e locale accogliente, prezzi modici.. sicuramente se ripassiamo a Firenze torneremo a mangiare da voi grazie ad Antonio, mamma e tutto il personale, punteggio al top... ciao a presto dagli 8 di Treviso"
"ui_bubble_rating bubble_40","Bell’ambiente ottima carne","Locale che propone una cucina tipica fiorentina mi carne ottima e servizio piacevole e professionale piatti abbondanti e prezzi sicuramente ottimi per il rapporto qualità prezzo "
"ui_bubble_rating bubble_50","Tre cene impeccabili","Siamo stati indirizzati in questo locale da alcuni amici e devo dire che non potevano consigliarci meglio! Camerieri simpatici e molto preparati su carni e vini! Abbiamo provato la Fiorentina classica e la Nobile ed entrambe erano deliziose! Anche la braciola e il filetto non erano da meno. Ottimo rapporto qualità prezzo! Provate il dolce alle castagne!"
"ui_bubble_rating bubble_50","Buonissima la Carne Fiorentina eccellente servizio","Abbiamo pranzato io e il mio ragazzo in questa trattoria ovviamente non potevamo non ordinare la Fiorentina a Firenze ottima qualità si scioglieva in bocca poi contorno e dolce tutto di qualità con ingredienti freschi dalle verdure alle patate al forno ai dolci buonissimi , personale cordiale e simpatico !! Prezzi onesti (abbiamo ricevuto anche uno sconto ) consiglio a tutti !!!"
"ui_bubble_rating bubble_40","Buona la prima","La mia prima cena a Firenze ha avuto luogo in questo bel locale piuttosto vicino sia alla stazione sia al centro storico.Portate ampie e gustose. Atmosfera cordiale. Personale molto cortese e disponibile.Consigliato!"
