"Restaurant_Ratings","Restaurant_Quotes","Restaurant_Reviews"
"ui_bubble_rating bubble_40","Buono e affidabile, fiorentina ok","Cena con amici e 2 bambini, all'interno di un we a Firenze. Il locale è bello e si trova a 10 minuti a piedi dal Duomo di Firenze, quindi è fuori dalla marea di posti acchiappa-turisti. Infatti si mangia benino senza spendere eccessivamente (ca. 40 a testa, vino e dolce inclusi). Molto buona la fiorentina e i dolci, antipasti invece non indimenticabili.Servizio ok"
"ui_bubble_rating bubble_50","Aspettative soddisfatte!","Aspettative soddisfatte!È verissimo! Siamo tornati dopo 4 anni circa e... abbiamo ritrovato i vecchi sapori Locale pulito.Personale attento alle esigenze dei clienti.Tutto ottimo!"
"ui_bubble_rating bubble_30","Ottima Fiorentina, da provare!","Appena pochi giorni fa ci siamo recati, dietro consiglio , in questo locale per provare la loro bistecca fiorentina. Così , senza aver prenotato, giungiamo presso il locale verso le ore 21:30. Nonostante l'ora ci hanno fatto subito accomodare e seguendo i consigli della ragazza che prendeva gli ordini facciamo le nostre scelte e ordiniamo una bella fiorentina di oltre 1,5 kg . Non appena arrivato questa bistecca l'aspetto era appetitoso e il suo sapore ancora di più. Cotta al punto giusto, servita ben calda con un ottimo contorno di patate. Davvero ottima. Il personale è stato cortese e sempre presente. Il conto è stato altino , ma la qualità va pagata. In compenso però il titolare, ci ha fatto uno sconto del 10% senza nemmeno conoscerci. Da provare veramente."
"ui_bubble_rating bubble_40","Buono","Su consiglio dell'hotel siamo stati a mangiare in questa trattoria... sicuramente meno turistica di tante altre.. prezzi accettabili... abbiamo mangiato una buona fiorentina...molto grande per 2 persone....1 antipasto 1 fiorentina da 1.2 e 1 bottiglia d'acqua 70 euro. "
"ui_bubble_rating bubble_10","Ampiamente al di sotto delle aspettative","Arriviamo in questo locale su suggerimento di alcuni amici.Le portate nel complesso non male, anche se metá delle pietanze richieste non erano disponibili (ore 21).Servizio dozzinale (contorni arrivati a secondo ormai finito), coperto allestito in ritardo e con stoviglie differenti tra loro (finiti i bicchieri dell'acqua, hanno apparecchiato metá tavola con quelli per la Coca Cola).Un conto finale salato ampiamente fuoriluogo.Non consigliato."
"ui_bubble_rating bubble_50","Ottima esperienza","Fiorentina perfetta!!! Ottimo primi, personale disponibile e cortese. Locale pulito. Prezzi onesti. Da ritornarci sicuramente"
"ui_bubble_rating bubble_50","Veramente buono!!","Consigliato dalla proprietaria dell albergo in cui ho soggiornato. Prezzi nella norma, qualità molto buona! Io ho preso un antipasto misto , gnocchi ripieni di ricotta e spinaci conditi con burro e salvia e per finire torta al cioccolato con farina gialla... Veramente tutto buonissimo!!!"
"ui_bubble_rating bubble_40","Buonissimo","Personale gentilissimo, che si prende cura del cliente e che se ne ricorda. Il cibo è ottimo, da non poter togliere dalla bocca. Unica pecca porzioni piccole soprattutto paragonandole al prezzo"
"ui_bubble_rating bubble_50","Da provare assolutamente","Sono stato a cena il 21/4/2017 e devo dire che siamo rimasti entusiasti della qualità del cibo. Abbiamo mangiato gnocchi al gorgonzola e noci, pici al cavolo verde e pancetta e tagliata con rucola parmigiano e pomodorini. Tutto eccezionale, anche Antonio e la mamma che hanno una cordialità ed un'attenzione particolare per il cliente.Il rapporto qualità/prezzo è per quanto mi riguarda, giusto, e si nota chiaramente la differenza con esercizi di tipo economico(la sera precedente ero stato proprio in un altro ristorante di tale tipologia).Complimenti ancora ad Antonio e mamma.Angelo, Maria ed Alessandra da Nettuno"
"ui_bubble_rating bubble_50","Il ricordo culinario più bello di Firenze","Mi sono recata alla Gratella sotto suggerimento del mio albergatore per mangiare una buona Fiorentina in un posto non turistico e devo dire che ci ha suggerito alla grande! Carne ottima e un prezzo ragionevole (43 al kg), accompagnata da delle patate al forno squisite! Incuriositi dalle pietanze che abbiamo letto nel menù, il mio ragazzo ed io abbiamo deciso di ritornarci a pranzo e ci siamo innamorati dei primi piatti che abbiamo assaggiato (pici al cavolo nero e pancetta e fagottini di pecorino e pere con fonduta di formaggio) e, per concludere, vin santo con cantuccini (molto buoni) e cheesecake fatta in casa (anch’essa molto gustosa). Il personale molto cordiale, inoltre, ha reso il tutto ancora più piacevole. Se dovessi tornare a Firenze La Gratella sarà senza dubbio una tappa obbligata!"
"ui_bubble_rating bubble_50","Pasqua alla Gratella","Siamo stati in questo ristorante qualche giorno fa per il pranzo di Pasqua io e il mio fidanzato. Veramente un'ottima esperienza! Piatti buonissimi, personale gentile e molto disponibile, e ottima qualità prezzo. Il dolce colomba con crema chantilly e crema al cioccolato la chicca finale! Da provare assolutamente!! "
"ui_bubble_rating bubble_40","Pranzo di Pasqua","Abbiamo scelto questo locale dietro consiglio della receptionist dell’albergo e dopo aver controllato le recensioni su Trip. Carina e un po’ spartana la location (non aspettatevi le tovaglie in stoffa), ma personale attento e particolarmente gentile.Ottimo il tagliere con le specialità di salumi e formaggi, ma un po’ salate le pappardelle al ragù di cinghiale. Buona la fiorentina e davvero originale l’idea di servirla su un braciere così da non freddarsi velocemente. Lo consiglio!"
"ui_bubble_rating bubble_50","Ottima carne","La carne davvero ottima, dolce con uvetta e ricotta molto buono. Servizio gentile anche se un po' lento (ma ci avevano avvisato prima). Assolutamente da consigliare. "
"ui_bubble_rating bubble_40","Tutto buonissimo","Ristorante consigliato dalla reception dell'albergo.Tagliere misto di grande qualità, salumi spettacolari. Primi piatti ottimi.Poi si è passati alle cose serie... Fiorentina! Ottima anche se paragonata alla qualità del resto perde un po'...Dolci fantastici fatti in casa.buona selezione di vini.Da tornare sicuramente."
"ui_bubble_rating bubble_50","Semplicemente genuino","Sono stato a Firenze con dei colleghi e passando davanti il locale ci siamo incuriositi vedendo tanta gente seduta. Non ce ne siamo pentiti affatto.Il cameriere è stato molto simpatico e cordiale e ci ha consigliato dei piatti di cui abbiamo anche fatto la scarpetta. Il peposo con la polenta è stata una vera e propria leccornia, tenero che si scioglieva in bocca..."
"ui_bubble_rating bubble_40","Tutto buono tranne le patate","Personale molto gentile e simpatico e anche il cibo era buoni. Unica pecca le patate che non erano nulla di speciale."
"ui_bubble_rating bubble_40","Scelta giusta","Consigliato da personale del hotel dove alloggiavamo é stata la nostra meta fissa per pranzare e cenare accolti da personale molto preparato e gentile la gratella ha deliziato il nostro palato con i suoi piatti ne sono più che soddisfatto, alla prossima.consiglio di provare."
"ui_bubble_rating bubble_50","Tutto ottimo a prezzi onesti","Sono stato oggi a mangiare in questo posto, su indicazione di un amico. In 4 abbiamo preso: antipasto misto (crostini + salumi + formaggi), 1 tortellone e 1,4 kg di bistecca con patate arrosto. Il tutto condito con il vino della casa che è veramente buono. L'antipasto è stato buono ma soprattutto abbondante, così come la bistecca: veramente ottima, servita sulla famosa gratella che consente alla carne di rimanere calda. Chi ha preso i tortelli a suo dire erano buonissimi. Il prezzo super onesto per la quantità e qualità. Locale carino e personale gentilissimo. CONSIGLIATO A PIENI VOTI!!!!!!"
"ui_bubble_rating bubble_20","Tuttemo bene ma....","Il locale si presenta bene e il personale è gentile, cordiale e veloce. Abbiamo mangiato la bistecca con la gratella specialità della casa. La carne sinceramente non mi è parsa un granché. ..ne ho assaggiate di superiori e poi la gratella non fa altro che continuare in un certo senso a cuocerla e di conseguenza peggiora, a mio avviso, la cottura. Prezzo alto in relazione alla qualità di ciò che abbiamo mangiato. "
"ui_bubble_rating bubble_50","Ci voleva davvero!!!","Ho passato due giorni in trasferta per lavoro tra Roma e Napoli. L'esperienza romana è stata veramente da dimenticare e avevo davvero bisogno di un weekend di relax. Tappa a Firenze e cena alla Gratella....esattamente quello che mi serviva! Ho preso tris di crostini, trippa e budino alle castagne....uno più buono dell'altro. Personale estremamente cordiale. Consiglio vivamente a tutti! Già prenotato anche per domani sera!"
"ui_bubble_rating bubble_40","Un buon Ristorante fortunatamente anche Senza Glutine","La trattoria si trova nel centro storico di Firenze, non lontano dalla Fortezza da Basso.È un ambiente pulito, caldo e accogliente ospitato in quella che senza dubbio era una casa o una bottega medievale. Propone piatti della tradizionale cucina popolare toscanaricchi di sapore e personalità, anche senza glutine. Particolarmente gustoso il peposo, una sorta di incrocio tra il brasato e lo spezzatino, dal sapore rustico e deciso.Il servizio è rapido, il personale gentile ed il conto è commisurato alle aspettative."
"ui_bubble_rating bubble_50","Fiorentina da urlo! ","Consiglio vivamente questa tipica trattoria Fiorentina! Io e il mio ragazzo abbiamo mangiato da favola,soprattutto da buona toscana ho apprezzato nel menù alcuni tipici piatti della tradizione che non si trovano più in giro come il peposo.Abbiamo assaggiato un misto di antipasti con pecorini e salumi freschi, ottima l'idea di servire il paté per crostini su un portacandela per tenerlo caldo e morbido.Piatto centrale è la bistecca alla Fiorentina cotta perfettamente e servita su una gratella per mantenere calda la carne esternamente. Dentro è tenera e la qualità esce fuori.Di contorno abbiamo preso una porzione di patate e una di bietola.Dolci fatti in casa buonissimi.Conto soddisfacente in rapporto alla qualità del cibo.Staff cordiale e gentilissimo attento e pronto.Tutto positivissimo!Ci ritorneremo!!Grazie a tutti, non tutti lo dicono ma...si vede che il vostro lavoro lo fate in maniera ECCELLENTE! Continuate cosi! Alla prossima!"
"ui_bubble_rating bubble_40","Ottima soluzione ","Leggo con stupore alcune recensioni negative e mi dissocio totalmente . Sono stato , su indicazione di un amico fiorentino , a la gratella per cena stasera sabato 18 marzo 2017. Abbiamo prenotato . Locale confortevole e pulito . Appena fuori dalla zona turistica , in via guelfa non lontano da san Lorenzo . Personale rapido e gentile . Ho mangiato una ribollita meravigliosa e venendo spesso a Firenze ( io sono di verona ) posso dire che è la migliore che io abbia mai mangiato . Molto buone anche le altre pietanze scelte dal nostro gruppo quali crostini al fegato , pappardelle , salsiccia , pecorino locale , salsiccia . Il rapporto qualità prezzo è assolutamente buono . Non sono lo consiglio ma ci tornerò sicuramente . Guido verona "
"ui_bubble_rating bubble_20","scarsino","forse perche era sabato sera ma nella trattoria la gratella abbiamo mangiato cibo di scarssissima qualità, la cameriera che insiste oltremisura sui piatti che devi mangiare.buoni gli affettati di antipasto e i crostoni con cavolo nero e con i fagioli. ma purtroppo quando arriviamo alla bistecca c'è la sorpresa amara il filetto non c'è forse lo hanno servito a un'altro tavolo ma non interessa questo ma quanto la cottura che è praticamente una soletta , noi l'abbiamo chiesta con una cottura media ma sembra che se la siano dimenticata sul fuoco. buoni i dolci. se mangiare una fiorentina deve essere un piacere da ricordare in questa trattoria ordinate qualcosa di diverso. il conto giusto se la portata principale fosse stata di qualità."
"ui_bubble_rating bubble_30","Dalla gratella alla brace.. o ciò che non uccide, fortifica.. ","Fiorentina buona, ma cheese cake palesemente acidula e color verde muffa, spacciata per fresca? Mi dispiace dover sbandierare questo genere di cose.. ma non posso ancora crederci. Lo chef di tutta fretta diceva di averla fatta il giorno prima, mentre il gestore assicurava di averla sfornata il giorno stesso. Mmmm beh.. io non mi azzarderei mai a servire una cosa così.."
"ui_bubble_rating bubble_40","Cena","Cenato in questo locale, che propone un menù ricco di specialità tipicamente fiorentine, abbiamo mangiato una buonissima bistecca fiorentina . Da non perdere anche i buonissimi dessert fatti in casa. Personale cordiale. ve lo consiglio!"
"ui_bubble_rating bubble_10","Peggior fiorentina della mia vita! evitate come la peste.","Era da tempo che non davo recensioni così negative su TripAdvisor, ma questa volta, in questa trattoria La Gratella abbiamo proprio superato il limite dell'indecenza.Io e i miei amici siamo incappati in questa trattoria su consiglio del nostro hotel.Abbiamo ordinato una fiorentina da 1 kg, una fettina di manzo , 2 porzioni di patate, 2 bottiglie d'acqua e un'insalata.La fiorentina era per 3/4 osso e troppo cotta, addirittura era bruciacchiata in superficie, non capisco come sia possibile trovare una fiorentina (definirla così è un insulto) del genere a Firenze, una vergogna, ho trovato fiorentine migliori a Valletri.La fettina di manzo era sottile quanto un'ostia, talmente sottile che un altro pò neanche si vedeva nel piatto.L'insalata l'hanno portata praticamente scondita e l'abbiamo dovuta condire noi.Per quanto riguarda le patate ci hanno portato una porzione striminzita che quando abbiamo chiesto dove fosse l'altra ci hanno risposto che quella che avevamo era per due persone ... ASSURDO!E per finire ci hanno sparato 90 euro di conto, per fortuna ci hanno fatto una sconto striminzito in quanto mandati dal nostro hotel, veramente un affare! Faccio presente che quella buonissima fiorentina è costata roba come 45 euro!Tornati in Hotel ci siamo messi a mangiare i pavesini comprati la mattina prima talmente eravamo sazi, ovviamente sono sartcastico.L'unica nota positiva è la disponibilità e la professionalità dei camerieri che ci hanno servito, molto cordiali e veloci.Non capisco come faccia un hotel a consigliare un posto del genere, EVITATELO COME LA PESTE, meglio un Fast food che questa pseudo locale.Tra tutti i ristoranti/trattorie e via dicendo che abbiamo visitato a Firenze questo è stato il peggiore. Voto conclusivo 1/5, da evitare."
"ui_bubble_rating bubble_50","Ottimo anche per celiaci","Ho cenato in questo ristorante sabato sera insieme al mio ragazzo; nonostante fosse pieno (per questo consiglio di prenotare) il servizio è stato molto rapido. Nel menù è quasi tutto disponibile senza glutine; per quanto riguarda i primi piatti i sughi vanno bene ma ci sono solo alcuni tipi di pasta (come tagliatelle o penne) da poter abbinarci. L'antipasto misto molto buono... ma ovviamente straordinaria la fiorentina, che viene portata sulla gratella!!! Costo fiorentina: 43 euro al kilo. Viene abbinato del pane SG. I dolci SG disponibili sono un budino di castagna caramellato e panna cotta con frutta/cioccolato/caramello. Io ho ordinato una panna cotta e per me era davvero buona."
"ui_bubble_rating bubble_30","mangi veloce e bene","andiamo spesso alal gratella si mangia bene e veloce unica pecca se vieni servito dalla cameriera bionda aspettati il muso lungo fino ai piedi,ti lancia il piatto come se fosse un frisbee,non sorride mai,scortese e sgarbata ogni giorno che ci vado a pranzo! la morettina con la coda sempre molto gentile !il cibo è buono peccato la scortesia della cameriera bionda che sembra abbia sempre un diavolo per capello!"
"ui_bubble_rating bubble_30","Cortesia, ottimo servizio, cibo medio peró","Il locale è carino e i ragazzi sono veramente gentili con un servizio molto preciso e attento. Peccato che i piatti, anche quelli tipici e che dovrebbero essere molto saporiti come il cinghiale e la trippa, avessero sapori poco incisivi, per non parlare dei ravioli burro e salvia del tutto insipidi e non fatti a mano. Fantastica invece la torta di mascarpone con pinoli. Ottimo limoncello e buone grappe. Conto da centro a Firenze. "
"ui_bubble_rating bubble_40","SPENDIDA","alla sera appena arrivati ci fanno accomodare a un tavoloil locale era pieno personale molto preparato e gentilecibo ottimo x finire cantucci con vin santoservizio ottimo prezzo ottimoci ritornerò"
"ui_bubble_rating bubble_50","Assolutamente si!","Siamo state in questa trattoria un martedì a pranzo, attirate dalle numerose persone che vedevamo entrare... piatti tradizionali della cucina toscana, abbondanti e davvero buoni. Vorrei sottolineare soprattutto la gentilezza del personale, ragazzi giovani molto cordiali. Quando tornerò a Firenze riverrò sicuramente!!!!!!"
"ui_bubble_rating bubble_50","Pranzo stupendo!!!","Bellissimo pranzo in famiglia... abbimo trovato per caso questo posto e il menù ci è piaciuto subito.. il personale è troppo gentile, le portate sono arrivate veramente veloci nonostante ci sia stata abbastanza gente... I prezzi sono veramente ottimi rapportati alla qualità del servizio e del cibo... se torno a firenze sicuramente è un posto che rivisiterò! Consigliatissimi la zuppa di cipolle, risotto al lampredotto e gnocchi con gorgonzola e noci! E la pasta è fatta a mano tra l'altro.. "
"ui_bubble_rating bubble_50","Indimenticabile Fiorentina","Siamo stati in vacanza a Firenze tanto per visitarne le meraviglie culturali quanto per gustare la rinomata Fiorentina...non essendo del posto tra le tante ricerche su tripadvisor e liste di trattorie su google ci è stato consigliato dall'albergatore questa trattoria con ottime recensioni anche qui su trip. Le aspettative erano alte e non sono state deluse...antipasto di salumi e formaggi freschi, vino della casa molto buono e soprattutto una Fiorentina da 1,3kg indimenticabile!!! Cottura sapore e presentazione lodevoli ,consigliati da un bravissimo caposala. Consiglio a pieni voti! Un saluto dalla coppia di Salerno"
"ui_bubble_rating bubble_50","OTTIMO TUTTO!!!!!!!!","Attirati dalle recensioni abbiamo deciso di entrare in questa trattoria che si presenta rustica ma allo stesso tempo dall atmosfera calda.Ci sono stati consigliati degli antipasti tipici e la bistecca alla fiorentina.....abbiamo seguito il consiglio e non ce ne siamo pentiti.Ottimi i crostini di fegato di pollo e la bistecca che viene servita al tavolo con una sorta di bracere, dalla cottura e gusto divini. Buono anche il vino della casa e i dolci.Servizio cordiale e rapido.Ottimo rapporto qualità/prezzo.Consigliatissimo!!!!!!!!!!!!!!!!"
"ui_bubble_rating bubble_50","Cena","Sono stato a cena perchè intrigato dal menu, infatti mi sono trovato benissimo con il personale molto cordiale e simpatico.Il cibo è stato delizioso, davvero andateci."
"ui_bubble_rating bubble_30","Buona la fiorentina ma....","Locale semplice ma piacevole e camerieri cordiali. I piatti che abbiamo mangiato tutti soddisfacenti, la fiorentina servita su una gratella per mantenerla calda è un'ottima idea. Ma perché non viene mostrata da cruda al cliente prima di cuocerla? Generalmente si fa così! "
"ui_bubble_rating bubble_50","Cucina tipica!!!","Una graziosa trattoria nel pieno centro storico a due passi dall Accademia. Consigliati dal propritario di un bar non tanto distante siamo entrati e abbiamo dovuto attendere 5 minuti perchè il locale era gia pieno. Attesa ripagata in pieno. Ribollita e crostini ottimi. Pappardelle e fagottini deliziosi. I Dolci sono fatti in casa ed erano veramente buoni. Qualita prezzo ok. Servizio cordiale e attento! Da consigliare !!!"
"ui_bubble_rating bubble_20","Che fregatura!!","Siamo stati in questo ristorante incoraggiati dalle recensioni positive purtroppo è stata una vera fregatura. Ordiniamo come antipasto un tagliere toscano che si presenta con salumi industriali e porzioni alquanto scarse soprattutto a fronte del prezzo di 17€ seguito da una fiorentina. Chiediamo un taglio da un kg la cameriera ci consiglia per due un taglio di almeno 1,2kg restiamo della nostra idea e ci viene servita una fiorentina decurtata del filetto quindi una costata. Fattolo notare al proprietario questi tenta giustificazioni fantasiose cercando di convincerci che la fiorentina può avere o no il filetto e che se volevamo la certezza del filetto dovevamo ordinare una t-bone tra l'altro non presente a menú e in definitiva ci viene fornito il filetto a parte....come se questo non bastasse la carne é cotta malissimo bruciata fuori e ben cotta dentro, la carne grassa almeno un etto di scarto, non ho dato il punteggio minimo unicamente per come si presenta il locale curato e pulito. Anche il prezzo totalmente inadeguato al servito. Non consiglierei questo locale a nessuno perché un buon ristorante si valuta principalmente dal cibo e qui nulla è degno di nota."
"ui_bubble_rating bubble_40","Roba fiorentina;) ","Cucina tipica fiorentina ad un prezzo consono. Mi aspettavo una 'trappola da turisti', invece i piatti, tipici (trippa, etc.) erano buoni e non troppo esosi. "
"ui_bubble_rating bubble_50","Cena ","Cena eccezionale a base di carne, staff cortese e specialmente Claudia veramente gentile e professionale. Consigliatissimo! "
"ui_bubble_rating bubble_30","...peccato..","Staff gentile, ambiente così così e ottimo antipasto toscano di crostoni e paté di fegato....peccato per la bistecca da 1,2kg troppo bruciata e fredda."
"ui_bubble_rating bubble_40","Un'ottima cena in centro","Sono stata quia cena con un cliente straniero che desiderava provare la cucina toscana tipica: è stato un successo! Il locale è centrale (zona stazione, Via Nazionale) e curato...me lo aspettavo un po' più caldo anche nell'arredamento (tipo osteria) ma nel complesso va benissimo. Ma il vero punto forte è il cibo: antipasto toscano misto ottimo con affettati di qualità e abbondante. Il vino (un Chianti), seppur a basso prezzo si è rivelato strepitoso...e questo è un plus! Poi abbiamo chiesto un tris di primi fuori menù e la ragazza è stata davvero gentile nell'accordarci questa cosa! Quindi abbiamo preso pappardelle al cinghiale, tortello toscano e dici con cavolo nero e pancetta. Nel complesso i pici erano mondiali, i tortelli molto buoni ...ma le pappardelle erano un po' troppo pomodorose. Infine 3 dolci e un caffè: prezzo totale 70 euro..che per essere 3 in centro è davvero niente!! Quindi davvero un successo; e poi anche il personale parla inglese!!"
"ui_bubble_rating bubble_50","Cena a base di Fiorentina ","Ottima trattoria, personale gentilissimo, abbiamo preso 1kg di fiorentina, patate al forno, fagioli bianchi, 1/4 di vino rosso e un dolce al prezzo di €60.....quindi prezzo giusto, da consigliare "
"ui_bubble_rating bubble_50","Buona cucina e staff gentilissimo","Avevo la trattoria di fronte all'hotel, durante il mio soggiorno a Firenze, e tutta la settimana sono tornato a cenare piacevolmente alla trattoria La Gratella!"
"ui_bubble_rating bubble_50","Ottima cucina","Sono stato qui con mia moglie, un piccolo locale entrando, ma arredato con gusto. Abbiamo ordinato crostini con paté di fegatini, un primo di pasta fatta a forma di caramelle e poi la Fioretina servita su un piccolo braciere per tenerla calda. Tutto buono. "
"ui_bubble_rating bubble_30","Buono e migliorabile ","Uniti ad amici, ceniamo in questo locale, che si presenta in una prema stanza piccolina, è una seconda in fondo. Grossa pecca, poca aspirazione in cucina, poiché esci con gli odori del cibo sui vestiti. Ci lasciamo consigliare da un commensale che ha cenato altre volte in questo ristorante, quindi ordiniamo fegatini e crostini, tagliere di salumi, fagiolini con lardo. Tutto molto buono, anche se il tagliere un po' poverino, mancava di qualche formaggio. Vino della casa, passabile. Saltiamo i primi e prendiamo la fiorentina. Viene servita in una griglia su un braciere, per tenerla calda. Carne molto buona, anche se, credo che in cucina l'abbiano fatta bruciare in alcuni punti sull'esterno . Finiamo la cena con cantucci e vin Santo. Qualità prezzo: buono. "
"ui_bubble_rating bubble_50","Fantastico","Il ristorante si trova in pieno centro di Firenze, in prossimità di molti alberghi. Giudizio super positivo,dal personale alla location. Abbiamo cenato divinamente, la carne è il loro forte, consiglio lo spezzatino pepato,ottimo. Rapporto qualità prezzo perfetta, anzi per la qualità del prodotto potrebbero permettersi di aumentare, ne vale la pena.Voto 10 e lode!!!"
"ui_bubble_rating bubble_50","INCANTEVOLE!!!!!!!!!!","Personale molto cortese,ambiente accogliente,buoni i primi prodotti di qualità.Abbiamo mangiato la bistecca Fiorentina e veramente f a n t a s t i c a.Devo ammettere che abbiamo mangiato benissimo.,prezzo onesto.Complimenti davvero.Consiglio vivamente di andarci:Complimenti ragazzi,tornerò presto!!!"
"ui_bubble_rating bubble_40","ottima location con cucina tipica","Siamo stati di domenica a pranzo. Abbiamo prenotato tramite internet. PerfettoLocale molto accogliente. Cucina tipica fiorentina. Abbiamo apprezzato molto il menù.Personale molto cortese e ospitale. Cucina molto gustosaBuono il prezzo. Ottima la presentazione dei piatti e molto saporitiLocale centrale a pochi passi dalla Stazione ferroviaria"
