"Restaurant_Ratings","Restaurant_Quotes","Restaurant_Reviews"
"ui_bubble_rating bubble_50","Un posto da tornare!","Consigliato dall’Hotel dove soggiornavamo per la scelta di cibi senza glutine, abbiamo deciso di cenare alla trattoria La Gratella. Che sorpresa! Il posto, molto carino, non è proprio attaccato al Duomo, ma in cinque minuti a piedi ci si arriva. La proprietaria è molto cordiale e disponibile – si vede che il suo lavoro lo fa anche con passione. Da classici turisti abbiamo ordinato la fiorentina, che era particolarmente gustosa. Questo vale anche per le patate al forno prese come contorno. Come dolce ho scelto il cheesecake alla Nutella – il nome mi ha incuriosito – dal nome ci si doveva aspettare una cosa piuttosto ruffiana – un assemblaggio anonimo di grasso, zucchero e sale. Cogliendo il messaggio di sottile ironia ho intuito bene e mi sono trovato in tavola un concentrato di gusti che con la Nutella aveva veramente poco da fare. Eccellente! La sera dopo siamo tornati con degli amici. Anche loro sono rimasti molto contenti. Non ultimo per l’ottimo rapporto qualità/prezzo."
"ui_bubble_rating bubble_50","Ottima atmosfera, ottimo cibo","Atmosfera molto carina e rilassante, io e la mia fidanzata eravamo seduti nel cortile interno. Entrambi abbiamo mangiato una tagliata con rucola, grana e pomodorini. Ottima, forse un pó troppo scarso il contorno. I prezzi sono assolutamente onesti e il cibo si sente che è genuino, cosa non scontata nei ristoranti e nelle trattorie in voga, e nel centro, di città come Firenze. Buono il vino della casa. Il servizio veloce, efficiente, e lo staff sorridente e cordiale. Un ottimo posto dove trascorrere una bella serata e dove gustare buon cibo. Consigliato!"
"ui_bubble_rating bubble_50","Un buon pranzo assieme alla figlia","Sono già stata qualche anno fa in questo ristorante e oggi, forti del bigliettino che mia madre aveva salvato allora, siamo ritornati.Già la volta scorsa abbiamo mangiato tanto e bene e il tutto si è ripetuto oggi.Il servizio è stato rapido e ci hanno portato anche il seggiolone per la bimba.I fagottini ai formaggi e alla pera erano molto buoni e anche i pici con cavolo nero e pancetta (che la mia bimba di 13 mesi ha mangiato a non finire). Il melone con il prosciutto era fresco e maturo al punto giusto e anche i dolci non sono stati male.A differenza della prima volta, però, siamo stati all'esterno. L'ambiente è raccolto ma protetto dal sole e ci stavano 4-5 tavoli (siamo stati sfortunati che al tavolo vicino al nostro fumavano come ciminiere :-( ma questo non è imputabile al ristoratore essendo pure l'area esterna ^_^ )."
"ui_bubble_rating bubble_40","Ottima cena","Ci sono andato di giovedì sera per una cena di colleghi. Buoni gli antipasti e gli assaggi di primi. Ottima la bistecca fiorentina servita in una gratella ancora calda. Dolce, amari e caffè. buono anche il prezzo.Da consigliare!!!!!"
"ui_bubble_rating bubble_30","La vera non fiorentina","Ordinato Fiorentina (41€al kg. giusto prezzo) arrivata costata senza filetto nessuna contestazione ma per i titolari sappiate che la fiorentina si conosce in tutta Italia come è' fatta Roberto"
"ui_bubble_rating bubble_40","Consigliato","Ci sono andato per caso e ho mangiato benissimo! Buon cibo, ottimo servizio, porzioni abbondanti e prezzo giusto! Consiglio"
"ui_bubble_rating bubble_40","Consigliato","Cibo buono, forse un pó troppo per turisti, ma prezzi assolutamente abbordabili. Veloci nel servizio. Consigliato il tris di crostoni!"
"ui_bubble_rating bubble_50","La Ciccia alla Gratella","Ambiente gradevole e trattamento da vecchi conoscenti, abbiamo pranzato su segnalazione di amici e ci siamo trovati veramente bene, la fiorentina era superba ed anche le pappardelle al cinghiale il tutto accompagnato da un buon chianti.... qualità/prezzo ottimi nonostante il locale sia quasi in centro....."
"ui_bubble_rating bubble_40","Piacevole ed inaspettat sorpresa","Nonostante non avessimo prenotato, ci hanno accolto subito cercando di darci un tavolo appena liberato. Servizio veloce e cortese, cibo buono e servito velocemente, consigliata la carne alla brace veramente di qualità. Prezzo ottimo"
"ui_bubble_rating bubble_50","Mangiare bene!!!!","Straconsigliato per qualita' e giusto prezzo! abbiamo fatto la piu bella mangiata a firenze con una super fiorentina strabuona, crostoni di polenta ai porcini come antipasto e del buon vino, per poi non parlare del dolce. Consiglio torta cioccolato e pera!!!! se ci torneremo sicuramente ritorneremo a mangiare la! "
"ui_bubble_rating bubble_40","Molto buono","La Gratella è davvero un posto molto carino. Daniela (la proprietaria) è davvero cordiale e diponibile, le ragazze che servono ai tavoli sempre sorridenti. il cibo molto buono, da provare come primo i fagottini pera e pecorino e i pici. per secondo io ho preso la tagliata ed è davvero morbida e gustosa. Prezzi nella media fiorentina.Da provare! e sicuramente quando tornerò a Firenze ci riandrò"
"ui_bubble_rating bubble_50","Una certezza! ","Ci andiamo spesso con gli amici! Il locale è ampio, il servizio è eccellente, la qualità dei piatti è ottima. Il mio piccolino ama fare confusione in questa trattoria! Inoltre, abbiamo organizzato anche il pranzo del battesimo... ed i miei genitori sono ancora entusiasti della riuscita! Continuate così! "
"ui_bubble_rating bubble_30","Nella media","Ci sono stato a cena con amici: piatti mediamente buoni e menù vario ma principalmente a base di carne. Certo la fiorentina a 39€ al chilo non è proprio conveniente... Servizio nella media. Il locale è posizionato in una via non proprio bellissima la sera."
"ui_bubble_rating bubble_50","La vera fiorentina","Ogni volta che mi trovo a Firenze cenare in questa trattoria e' d'obbligo. Non esiste fiorentina migliore: saporita tenera e cotta alla perfezione. Ottima la ribollita e i pici ripieni. Cordialissima la titolare servizio veloce e soprattutto locale pulitissimo. Prezzi non elevatissimi e comunque molto ben spesi. Complimenti."
"ui_bubble_rating bubble_40","Fiorentina eccellente","Abbiamo cenato in questa trattoria sotto consiglio dell'hotel nel quale soggiornavamo che ci ha garantito la qualità della carne. Ascoltando il consiglio abbiamo ordinato una Fiorentina da circa 800 grammi e devo dire che la qualità, la bontà e la presentazione erano veramente impeccabili. Consiglio a tutti questa trattoria con ottimo rapporto qualità/prezzo e di sicuro consiglio di prendervi una bella fiorentina e non rimarrete delusi."
"ui_bubble_rating bubble_20","Poco professionali, molto cari","ci sono stato per due sere di fila, per pura disperazione, visto che il mio hotel si trovava in zona e le serate erano fredde e piovose.La prima sera ho preso la classica fiorentina. Beh che dire, 39€ per 1KG di carne tra virgolette perchè 600grammi era solo l'osso. Abbastanza tenera la carne, il problema era l'ordinazione che non c'entrava nulla con quello che avevo chiesto, anzichè le bruschette mi fu portato un insalata e il dolce che doveva esser servito caldo, mi è stato servito freddo e con un sapore disgustoso. (ho saputo successivamente che doveva essere servito caldo, dal cameriere stesso, pensate un pò).La sera successiva ho ordinato 2 piatti di maccheroni al ragù bolognese, ovviamente me ne fu portato solo uno, perchè la ragazza aveva confuso l'ordinazione(immaginate, siamo in 2, uno mangia e l'altro aspetta che arrivi l'altro piatto, portato 10minuti dopo). come secondo, il maiale al limone(si sentiva solo il sapore del limone, poichè il maiale si era disciolto nel sugo). In poche parole, non consiglio il locale, poco attenti, e moooooooooolto cari, troppo per quello che offrono."
"ui_bubble_rating bubble_40","Cucina toscana","Sono stata ieri a pranzo in questo ristorante consigliato da amici che vivono a Firenze, in effetti il posto è fuori dai soliti giri turistici. Fiorentina ottima e carino il fatto che è servita su questa tipica gratella, fagioli all'uccelletto buonissimi e pappa al pomodoro super! Il tutto con ottimo vino a poco più di 20€ a testa, da consigliare!"
"ui_bubble_rating bubble_10","presi per i fondelli","tramite alcuni consigli siamo andati in questo locale a cenare,io ed il mio compagno ( per cambiare locale). accoglienza e cordialità limitata, ......diciamo poco professionale. ordiniamo 2 braciole di manzo al sangue sottolineo AL SANGUE e ci arrivano 2 fettine o suole di scarpe BEN COTTE E FREDDE.......... ancora ad oggi ci chiediamo se il cameriere parla e capisce l'italiano.reclamiamo subito spiegando l'accaduto e la cameriera si scusa x l'inconveniente( la fame ci era GIà PASSATA) se nel menù è scritto braciola di manzo ci si aspetta quanto è scritto nel menù,risposta:a Firenze la braciola di manzo si serve senza osso. ci può star bene ma nn una normalissima fettina di carne che si mangia ovunque......e poi se viene ordinata al sangue perchè ci arriva stracotta e fredda? ci viene da pensare che quelle 2 fettine erano ritornate in cucina per uno sbaglio precedente di ordinazione e ci sono state rifilate.alla fine della fiera ordiniamo 2 braciole con l'osso di circa 300/350 gr al pezzo al sangue e queste arrivano giuste.dopo un pò ordiniamo un dessert ,2 caffè.......e a questo punto arriva la sorpresa? si spegne la musica , le luci iniziano ad abbassarsi nn ci viene detto nulla ma è lampante che ci stanno facendo capire che dobbiamo andare fuori dai........in più il personale a turno si era già messo in borghese e sottolineiamo che nn erano le 2 di notte ma BENSI LE 23,30. chiediamo il conto e ci rendiamo conto che quelle 2 braciole ci sono state addebitate come 2 fiorentine. il dessert e i caffè sono offerti ma avevamo capito subito dall'importo che nn era vero ma che per una seconda volta ci hanno preso per i fondelli. siamo sicuri che nn lo consiglieremo a nessuno e ne faremo anche una pubblicità negativa visto che la pubblicità è l'anima del commercio. ci permettiamo di consigliare ai gestori del locale di scrivere nel menù i piatti con i loro veri nomi....e poi nelle ricevute di essere + espliciti e nn dire vi facciamo questo .... e poi in fattura 10,00 euro in più. buon lavoro Luigi e Luca"
"ui_bubble_rating bubble_20","Niente di speciale","Siamo andati in questo locale dopo aver letto le recensioni su tripadvisor, sinceramente mi aspettavo di più, il rapporto qualità prezzo non era ottimale, non c'è birra alla spina, il servizio lascia un po' a desiderare, alcune cameriere nervose e frettolose, tavolini troppo vicini a discapito dell' intimità.Forse non era serata, peccato che era San Valentino."
"ui_bubble_rating bubble_40","Ottima fiorentina","Ogni volta che vado a Firenze torno a mangiare in questo locale e non solo per assaporare la gustosa fiorentina ma anche per la ribollita! Consigliato"
"ui_bubble_rating bubble_50","Super!!!!!","Assolutamente se siete da quelle parti e avete voglia di mangiare qualcosa di veramente buono ANDATECI!!! SQUISITO, una cucina che punta davvero sulla qualità, su tutte le portate.. piatti pure belli abbondanti, personale cordiale e posticino carino. Provare per credere"
"ui_bubble_rating bubble_50","La miglior fiorentina","Siamo stati alla trattoria La Gratella e devo dire che lo consiglio a tutti coloro che vogliono mangiare qualcosa di tipico e veramente gustoso a Firenze!! Il locale è veramente carino,piccolo ma molto confortevole(è consigliata la prenotazione!!). Noi abbiamo gustato la tipica fiorentina toscana Da 1,2kg ,portata in tavola su una gratella perché rimanesse calda. Ci sono stati portati insalata mista e patate al forno di contorno(ottime). Due dolci,acqua,caffe al prezzo di 58€ in due( 29€ a testa). Se dovessi tornare a Firenze sarà un ristorante in cui tornerò!! Molto soddisfatti!!"
"ui_bubble_rating bubble_50","viva la gratella","Bello trovare un ristorante dove la cucina senza glutine è rispettata e trattata esattamente come quella normale. Bello trovare disponibilità e sorrisi da chi ti accoglie a chi ti serve...bello essere seguiti con attenzione e mangiare veramente bene..peccato per quella bellissima fiorentina che mi guardava dal tavolo accanto e di cui ho potuto solo gustare l'odore....bello!!!!!!!"
"ui_bubble_rating bubble_40","Molto buono","Siamo stati in questo ristorante la scorsa settimana. Abbiamo preso un primo semplicissimo ma buono e un secondo a base di cinghiale e polenta anche questo buono. Meritano anche i contorni.Buona e bella sua maestà la fiorentina che praticamente è il piatto forte, presentato in maniera molto carina.Il tutto è condito da un'atmosfera familiare e accogliente, il personale è molto gentile e il locale carino.I prezzi sono nella norma. Ristorantino da provare"
"ui_bubble_rating bubble_50","Capitati per caso e piacevolmente sorpresi","Lo consiglio vivamente .Eccellente la cucina e il personale è adorabile e veloce.Io e il mio ragazzo siamo entrati per caso senza prenotare di sabato sera e nonostante le numerosi prenotazioni ci hanno accolto splendidamente consigliandoci alla fine un budino di castagna da leccarsi i baffi . E' uno dei pochi ristoranti dove ritornerei immediatamente. Ottimo il rapporto qualità prezzo. Non ve ne pentirete."
"ui_bubble_rating bubble_50","Una bella fiorentina","Alloggiati alla locanda dei poeti abbiamo cenato di fronte. Una bella fiorentina, buona e ben servita. Vino della casa onesto. Ottimi i dolci con cantucci e vin santo e mascarpone ad accompagnarci a letto. Siamo stati bene. Se dovessi tornare andrei a pranzo, la bisteccona da 1,2 kg alle 9 di sera pesa anche per me. Comunque bene, benissimo. Bella serata."
"ui_bubble_rating bubble_40","Ottima cucina Senza Glutine","Siamo stati in questa accogliente Trattoria a cena, durante il nostro soggiorno a Firenze.Purtroppo essendo in gravidanza non ho potuto assaggiare i loro piatti forte, ovvero Costate e Tagliate, servite direttamente sulla Gratella...Mi sono accontentata, si fa per dire, di un piatto di Tagliatelle (Senza Glutine) al sugo di Cinghiale...che erano buonissime e molto ricche di carne di Cinghiale, praticamente per me un piatto unico.Consiglio a tutti i celiaci una puntatina."
"ui_bubble_rating bubble_50","Buon rapporto qualità / prezzo","Personale gentile, locale carino. Pizza molto buona e ottimi antipasti. Prezzi nella media. Da consigliare"
"ui_bubble_rating bubble_40","Ottima cena","Abbiamo cenato in questo ristorante perchè vicino al nostro hotel e consigliato dal sito e la scelta è stata ottima, buona cena a buon prezzo 3 antipasti 3 primi vino caffe a 66€Se volete cenare prenotate era pieno"
"ui_bubble_rating bubble_50","Ottima fiorentina e i primi. Conto onesto!! Consigliato","E' piuttosto in centro e se andate in auto parcheggiare è complicato, meglio lasciare l'auto nelle due piazze nei paraggi, circa 250-300m a piedi. Affettati nella norma, ma vi consiglio i primi: ottimi ed abbondanti e soprattutto la fiorentina!!La carne è ottima e la portano appunto su una gratella con un pochina di brace sotto, giusto per tenerla calda. Meglio se si prende almeno 1,2 kg ogni due persone, così vi portano il taglio col filetto. Nota positiva: il conto! Uno dei rapporti qualità prezzo migliori di Firenze. In fondo per mangiare una buona fiorentina non è necessario farsi spennare!! Bravi e onesti!"
"ui_bubble_rating bubble_40","Fiorentina, un classico","Siamo stati alla Gratella su consiglio di amici per assaggiare la tipicità che prende il nome dalla città, la Fiorentina. Il locale è piccolo ma accogliente, con i tavoli disposti in lunga fila e posti molto assiepati. Il personale e la padrona di casa sono disponibili e attenti alle esigenze dei clienti: nonostante il passeggino e le difficoltà di un bimbo piccolo ci siamo goduti in pieno la nostra Fiorentina che era particolarmente buona e tenera. Prezzi commisurati alla qualità. Sicuramente un locale da consigliare."
"ui_bubble_rating bubble_20","Non all'altezza","Mi sono recato in questa trattoria con la mia fidanzata su consiglio dell'albergo. Ovviamente abbiamo preso una fiorentina. Ci hanno detto essere 1,2 kg, ma ad occhio e croce erano si e no 750 g e aveva un bruttissimo sapore. Il dolce, una torta di pinoli, non era un granchè. Totale delusione."
"ui_bubble_rating bubble_50","OUTSTANDING","Bellissimo ristorante non molto lontano dal centro di Firenze (inteso come Duomo e Palazzo Vecchio), benissimo il sevizio, eccezionale la carne.... Penso uno dei migliori posti dove poter mangiare la fiorentina a Firenze e con un rapporto qualità-prezzo invidiabile!!!! Se siete a Firenze non potete non andarci..."
"ui_bubble_rating bubble_40","Tornare vale la pena","Sono tornato in questo ristorante dopo un po' che mancavo.Sempre positivo! Daniela simpatica e cortese come lo sono altrettanto tutte le persone che servono ai tavoli. I crostini misti sono deliziosi. Deliziosi anche i secondi. Non parlo dei primi solo perchè io non li prendo. Un antipasto di crostini ed una bistecca, o il cinghiale o la grigliata mista servita sulla griglia calda, bastano ed avanzano. Ogni giorno presenta un menù diverso per la giornata, ma i piatti classici sono una garanzia.Consigliatissimo anche in estate in quanto ha un suo piccolo spazio interno, ma aperto. Anche i fumatori possono quindi togliersi il loro sfizio cenando."
"ui_bubble_rating bubble_50","ECCELLENTE!!!","Bistecca alla Fiorentina da 10 e lode, servita con contorno di insalata fresca e patate arrosto, ad un ottimo rapporto qualità-prezzo!Anche il vino della casa non delude.A questo è doveroso aggiungere l'accoglienza cordialissima e la gentilezza del personale.Tappa obbligata alla prossima visita a Firenze!"
"ui_bubble_rating bubble_50","Superlativo!!!!","Basta questo aggettivo per descrivere questa trattoria tipica fiorentina. Ottima la tagliata servita calda grazie alla gratella, ottimi i pici al sugo e di ottima qualità anche o salumi tipici toscani. Gentilezza e cortesia sono il valore aggiunto di questo locale. Consigliatissimo"
"ui_bubble_rating bubble_50","Tappa obbligatoria","Vado da anni in questa tipica trattoria fiorentina. Personale gentile e simpatico, pronto sempre a soddisfare il cliente!!Primi fantastici e abbondanti, tagliata da urlo, per non parlare dei dolci tutti fatti in casa!!!D'estate consiglio la veranda fuori, fresca e romantica!!"
"ui_bubble_rating bubble_30","come migliorare","sabato sera, cena per gustare la cucina toscana e spt la fiorentina, ci sediamo in questa trattoria sembrava di essere dei polli in batteria, tra un tavolo e l'altro c'era forse 15cm, sembrava cena tra colleghi, privacy nulla, partecipavamo ai discorsi dei vicini, ps, per i celiaci... speravo di assaggiare i famosi crostini....che tristezza ci hanno portato 3 gallette di riso e un panino,(almeno era caldo), (meno male avevamo i ns grissini)..tagliatelle dal sapore buona ma molto scotte erano tutte a pezzetti.. dovrebbe essere un ristorante sulla guida del s.g. ma abbiamo mangiato come fossimo in ristorante qualunque,xkè ho trovato tagliatelle s.g.anche in rist non sulla guida........ possibile che non si possa tenere un filoncino o fette di pane in frizer al bisogno...penso che ci voglia poco...e non credo sia il cliente adover chiedere ma il ristorante ad offrire"
"ui_bubble_rating bubble_50","Menù fiorentina.. Straconsigliato!","Fiorentina da 1,2 kg in due. Contorno di patate arrosto con rosmarino e pane toscano e olio freschissimi! Quarto di vino rosso della casa e il tutto per 50€ (in due).. Tutto buonissimo! In particolare la fiorentina servita al sangue e sulla gratella tipica! Gentilissima la proprietaria che ci ha fatto i compimenti, stupendosi che due ragazze riuscissero a ripulire tutto quanto :)) ma che bontà!! "
"ui_bubble_rating bubble_40","Buona fiorentina , prezzo economico","Eravamo in otto: ribollita, 4 fiorentine da 1 kg e 200g , contorni, dolce e caffè a trenta euro a testa! Posto semplice ma carino, cucina a vista, personale gentilissimo e molto disponibile! Lo consiglio veramente a chi dovesse passare per firenze! Bravi!"
"ui_bubble_rating bubble_50","FIORENTINA SUPER","Ecco un posto a Firenze dove si può mangiare una Fiorentina veramente super. Servizio Ottimo e veloce, gli antipasti toscani squisiti con le salse mantenute calde. La Fiorentine è servita su una specie di griglia portatile con la brace sotto: rimane calda e morbida fino all'ultimo boccone. Prezzi eccezionali: Antipasto Toscano per 4, due Fiorentine (1/2 per uno), dolce al cioccolato squisito, chianti docg per 35€ a persona. DA PROVARE!"
"ui_bubble_rating bubble_40","pulito, ordinato, con menu del giorno economico","un bel posto. tranquillo in un via traversa, si mangia bene ed il servizio è stato eccellente, io ho provato un menu del giorno ( a pranzo) con primo di ragu bianco e secondo di carpaccio di bresaola.....più dolce e caffe 20€buono"
"ui_bubble_rating bubble_50","la vera cucina toscana","Quando penso a Firenze, penso sempre che non andare a cena a La Gratella sia davvero uno spreco!La fiorentina è da Oscar, e la tagliata davvero non ha rivali!L'ambiente e lo staff contribuiscono a regalare un atmosfera che è davvero difficile lasciare.Consiglio la cheescake con cioccolato caldo per terminare in dolcezza!"
"ui_bubble_rating bubble_50","Splendido posto, personale gentilissimo, cibo ottimo!","Da celiaca, mi sono trovata benissimo! Cibo ottimo, dolci freschi! La proprietaria della trattoria è davvero gentile e cordiale, disponibile con la clientela, così come il resto del personale!Continuo a consigliarlo a tutti coloro che vanno a Firenze!Ci ritornerò sicuramente..."
"ui_bubble_rating bubble_40","CHE FIORENTINA!!!!","La cucina toscana ben fatta è spettacolare..Ci siamo deliziati con crostini toscani (con fegato, funghi e pomodoro) ....complimenti per la presentazione davvero originale.Poi fiorentina perfetta e ottimo vino rosso della casa!!!Per concludere in bellezza torta di mascarpone e pinoli con cioccolata calda...Rapporto Qualià prezzo molto buono.Complimenti.. torneremo di sicuro!"
"ui_bubble_rating bubble_20","Mah","Ero venuta in questa trattoria la prima volta qualche anno fa con i miei genitori quando ero piccola e avevo mangiato veramente benissimo, anche perché sono celiaca ed erano stati attentissimi. Sono tornata quest'anno perché avevo un ottimo ricordo e sono stata davvero delusa...il servizio molto scadente perché appena finivamo un piatto non ci lasciavano neanche il tempo di respirare che i camerieri erano subito li ad assillarci per chiederci cosa volevano dopo. Il cibo niente di che, ho preso un risotto ed era riscaldato e inoltre non ho più notato l'attenzione alla Celiachia...decisamente scaduto "
"ui_bubble_rating bubble_40","Un buon pranzetto","Capitato per caso, di ritorno all'albergo, mi sono soffermato davanti alla vetrina che presentava un locale tipico e caratteristico fiorentino. Sono stato ben accolto...e ho deciso di fermarmi. Ottima la scelta, porzioni abbondanti e soprattutto una cucina tradizionale, pur semplice....ma ottima.Rapporto qualità-prezzo, davvero buona. Consiglio assolutamente la Trattoria e appena tornerò a Firenze ritornerò."
"ui_bubble_rating bubble_50","Fiorentina !!!!","Dopo aver letto le recensioni positive su TA io e la mia ragazza abbiamo approfittato di una giornata di ferie a Firenze per provare la fiorentina della Gratella e di certo non ce ne siamo pentiti! Appena fuori San Lorenzo, sempre in centro ma fuori dalle rotte dei turisti giapponesi questo delizioso locale ci ha colpito per il fatto che fosse frequentato soprattutto da fiorentini (buon segno!). L'obiettivo era la fiorentina e quindi non abbiamo ordinato null'altro che questa splendida bistecca da kg 1,3 servita sul suo braciere ed accompagnata con delle ottime patate arrosto; cottura perfetta, filetto tenerissimo, non è rimasto nulla ! Con la pancia piena ma l'occhio ancora vispo ci siamo fatti tentare dallo zuppotto, crema con scaglie di cioccolato fondente, pavesini e spolverata di cacao...spettacolo! Una bottiglia d'acqua, un bicchiere di vino rosso e 2 caffè x un totale di 57euro... nulla da aggiungere se non... complimenti !!!"
"ui_bubble_rating bubble_50","Complimenti!!!!","Siamo stati a cena grazie al consiglio del nostro albergatore, accoglienza ottima e locale molto carino. cucina eccellente, la fiorentina squisita accompagnata con delle buonissime patate al forno. Personale molto gentile ed attento. Torta al mascarpone ricoperta di cioccolata calda perfetta e ottimo rapporto qualità prezzo. Se torniamo a Firenze torniamo sicuramente anche qui!!!"
"ui_bubble_rating bubble_40","Ottimo posto","L'abbiamo scelto perchè consigliati dall'albergo dove eravamo in quanto cercavamo un ristorante per celiaci. Su questo punto si può stare tranquilli, non solo è affiliato all'AIC ma tutto il menu è per Celiaci ed è tutto molto buono.Il resto del menu prevede piatti toscani, come da tradizione, più qualche ricercatezza (es. fagottini pecorino e pera) e ovviamente a farla da padrona c'è la carne. Abbiamo inoltre assaggiato un budino alle castagne spettacolare. Il locale è spazioso ma conviene prenotare, il personale è gentilissimo e preparato, la cucina è a vista e in ultimo il prezzo. Rapporto qualità / prezzo davvero molto conveniente.Buon appetito"
"ui_bubble_rating bubble_40","Ottima Fiorentina! ","Abbiamo provato il menu Fiorentina che per 50 euro a coppia comprende 1,200 grammi di Fiorentina, patate, insalata, acqua e caffè. Tutto ottimo! La carne viene servita su questo particolare braciere dotato di una grossa pinza! Siamo rimasti molto soddisfatti! Sicuramente consigliato :-)"
